板块名,标题,作者,日期,新闻内容
银行,工行员工挪用500万炒股、200多万投资期货均巨亏 潜逃27年后落网,中央纪委国家监委网站,2022年03月17日 14:04,以案为鉴|潜逃27载终落天网“这27年来，我随时都感觉会被抓，曾想过投案自首，却一直没有勇气，心存侥幸，过一天算一天。”这是中国湖北省分行营业部原营业员谢双燕接受讯问时最常表达的感慨，也是他潜逃期间最真实的心理写照。2021年10月29日下午4时30分许，一辆警车从龚家岭收费站驶入武汉城区。车上押解的就是谢双燕，此时距他携款潜逃外地，已经过去了整整27年。1994年9月，谢双燕侵吞公款人民币734万元并携部分赃款潜逃。1995年1月，武汉市武昌区人民检察院对谢双燕立案侦查。此后27年，谢双燕一直下落不明。十年寒窗“跳龙门”一夕邪念毁终生谢双燕出生在湖北省云梦县一个农民家庭，1988年湖北金融专科学校毕业后被分配到中国工商银行湖北省分行工作，用谢双燕自己的话形容，这好比“鲤鱼跳龙门”。因工作出色，谢双燕被安排到省分行营业部证券代办处工作，负责国库券销售和资金放贷业务。然而，在发放的一笔贷款无法收回后，谢双燕害怕大好前程毁于一旦，产生了“利用公款赚钱补上贷款”的邪念。他先是将目光投向了股市。1994年1月，谢双燕利用职务便利和财务漏洞将营业部一笔200万元资金，直接转到自己的股票账户中用于炒股，但没过多久就亏得只剩20多万元。第一次失手，不甘心的谢双燕决定再赌一把。当年4月，他又挪用了一笔300万元的资金进行炒股，结果还是亏损惨重。谢双燕抱着再搏一回的赌徒心态，于当年5月又挪用了200多万元资金用于期货交易，结果仍然亏得一塌糊涂。在不到半年时间里，谢双燕先后侵占公款700多万元。此时，谢双燕开始恐惧起来，认为一旦事情败露，这辈子就彻底完了。他不敢面对即将到来的惩罚，当年9月，带着仅剩的30余万元畏罪潜逃。四处躲藏备受煎熬隐姓埋名苟且偷生因担心身份暴露，谢双燕销毁了自己的身份证和所有照片，办了一张变更姓名的假身份证。他先后潜逃至江苏省徐州市和浙江省义乌、温州等地，1995年又逃窜到了江西省南昌市并承接了一家小餐馆开始经营，想以此为生、长期躲藏。在此期间，谢双燕结识了吉安市一名女性并产生感情，为避免暴露，他以“父母早亡，没有兄弟姐妹，与亲戚早无联系”的说辞来掩盖真实身份。1997年，谢双燕用假身份“邹某某”与该女性登记结婚。婚后的谢双燕仍然心神不宁，担心在省会城市久居会被人发现逃犯身份，便说服妻子到人口较少的县城定居。2002年开始，谢双燕用妻子的身份证开设了股票账户，想重新在股市上大显身手，这一次他成功了。股市上的成功不仅无法让谢双燕感受到喜悦，反而激起了他无限的悔恨：“如果不是犯了错误，以我的才能，我在金融系统应该会有比较好的发展，赚了钱也不用担惊受怕。”谢双燕深知大数据会给带来暴露的风险，他不敢照相，不敢坐火车、飞机。在家庭生活中，他是个典型的“两面人”，在妻子面前他是个“合格”的丈夫，尽心尽力照顾家庭，而在夜深人静时，他不得不独自承受着负罪感。“达摩克利斯之剑”高悬在谢双燕头上，恐惧、焦虑和负罪感每时每刻都在折磨他。密布天网久久为功持续攻坚斩获战果谢双燕潜逃后，办案机关一直对其开展追逃工作。“天网”行动全面展开后，武汉市委迅速成立反腐败协调小组追逃追赃工作办公室（以下简称“武汉市追逃办”）。武汉市追逃办将谢双燕案件列为挂牌督办案件并指定武昌区纪委监委和武昌区公安分局承办，全力开展追逃工作。因案发年代久远，知情人或已亡故、或难寻踪迹，追逃工作几乎从“零”开始。为实现突破，武汉市追逃办每周召开案件督办会，督促专案组通过实地走访等方式全方位搜寻谢双燕踪迹。在湖北省内，专案组逐个走访谢双燕亲友，但谢双燕出逃后断绝了与所有亲友的联系；在省外，对谢双燕可能藏匿地进行扩线调查，派出近10个工作组先后赴27个省市区，调查可疑线索180余条、排查可疑人员600余人，不放过任何蛛丝马迹。为进一步加大追逃力度，2021年9月，武汉市追逃办对谢双燕等7名涉嫌重大职务犯罪的在逃犯罪嫌疑人再次发布悬赏公告并提高悬赏金额，鼓励群众积极检举揭发。悬赏通告发布后，专案组收到群众反映谢双燕藏匿在江西的线索较多。专案组即刻赶赴江西，在当地纪检监察机关和公安机关的支持下，根据举报线索进行地毯式排查，最终于2021年10月在某小区内将谢双燕抓获。“听到有人叫谢双燕，我有一种瞬间触电的感觉，该来的终于来了。”谢双燕被押解上车时说。武汉市追逃办成立以来，在中央追逃办和省追逃办的指导下，先后从境内外追回38名涉嫌职务犯罪的在逃人员，其中“百名红通人员”2名、“红通人员”3名，并追缴了大量涉案资产，营造了“天罗地网、无处可逃”的高压态势。谢双燕潜逃27年后被缉拿归案再一次证明，在逃人员无论跑到哪里、跑多久终将被缉拿归案，只有及时认清形势，彻底放弃幻想，主动投案自首，争取宽大处理，才是唯一正确出路。（武汉市纪委监委||责任编辑王小宁）责任编辑：赵般娇
二手市场泡泡玛特从万元跌至千元,商品变盲盒一切似乎变了味 管管越来越不像话的盲盒,北京晚报,2022年03月17日 14:00,原标题：管管越来越不像话的盲盒普通的一支笔一旦成了指定隐藏款，价格涨至原来的10倍；为了集齐整套玩偶，有人一次性花上万元吃快餐……所有的商品，一旦装入一个不透明的盒子让消费者凭运气抽取，一切似乎都变了味儿。盲盒经济迅速崛起，乱象也随之不断衍生。记者调查发现，盲盒因监管标准不明，已从最初的观赏玩乐，渐渐开始有了攀比、炒作甚至浪费之嫌。今年初，上海发布首个盲盒经营活动合规指引，开始对盲盒的野蛮生长说“不”。监管“盲点”①盲盒瞄准未成年人一份未成年人盲盒消费调查报告提出，相较于成年人，未成年人更易购买盲盒成瘾。记者发现，目前，北京市面上出售的盲盒产品，似乎并没有设定严格的“适用年龄”。在融悦汇商场的一家九木杂物社店铺内，货架上摆满了各式各样的盲盒，引得不少孩子缠着家长非要买一款才肯善罢甘休。记者随机拿起一款晨光推出的自动铅笔盲盒。从外包装上看，这款产品共有12种常规图案和两种隐藏图案，每个盲盒的售价为10元。这也就意味着，想要集齐一套含14种图案的盲盒，最少也要花费140元，购买14根自动铅笔。包装盒上明确标示“本产品适合14周岁以下（含14周岁）的学生使用，14周岁以上人群也可使用”。盲盒的目标客户主要是未成年人。在百万庄图书大厦二楼，聚集了不少正在选购图书的孩子。文具专区内摆放着不同款式的盲盒以及文具盲袋。一款Nanci囡茜造型的运动会主题盲盒单价59元，共有11种常规造型和1种隐藏造型，集齐一套至少要花708元。查看包装盒上的说明后，记者发现，这款玩具类盲盒设定的消费人群年龄为“14岁以上”，并标明3岁以下禁止使用。显然，这款摆放在文具区的盲盒并不是为孩子们准备的。但记者发现，无论是家长还是图书大厦的工作人员，都对孩子选购这类“非儿童款”盲盒不管不问，孩子可以自由选购。监管“盲点”②小猫小狗过期食品都往里装各行各业发现盲盒市场有利可图，都希望来分一杯羹。除最初的玩具外，餐饮、美妆、文具、图书、机票甚至宠物销售等诸多消费领域都刮起了“盲盒风”。花费不到百元，就能买到一张指定出发地、随机目的地的国内单程机票。2021年，航空公司推出的白菜价“机票盲盒”，因价格优惠、玩法新奇受到年轻人的追捧。只不过，很多人抽中的“机票盲盒”目的地是一些冷门的地方，考虑到食宿、景点门票、返程机票都得自己购买，不少人最终选择放弃、退款。还有的盲盒把惊喜变成了惊吓。成都一家快递网点被曝违规将160余只猫狗装入盲盒，引发社会热议。“宠物盲盒”一时被推上了舆论的风口浪尖。更有甚者利用盲盒作为噱头，将过期、临期、滞销商品重新包装出售，侵害消费者权益。市民张先生带孙女在儿童游乐场玩耍时，购买了两款名为“萌宠驾到”的惊喜盲选幸运礼盒。简陋的包装纸盒内没有任何商品信息，只有一张邮票大小的抽奖卡和一个捏上去软绵绵的黏胶玩具，凑近闻一闻，一股刺激性的气味立刻扑鼻而来。外包装上，既无生产厂家，也无产品材质等信息，俨然是“三无产品”。监管“盲点”③成了指定款身价涨十倍在价格方面，部分商家刻意营造盲盒的稀缺性，搞饥饿营销进行炒作。二级市场趁机跟进，将高溢价的盲盒炒得火热。以电商平台销售的一款“梦境下午茶”系列中性笔盲盒为例，随机发货的销售单价为6.8元，如果想要指定隐藏人物款，价格会涨至68.8元。花近70元买支中性笔，值吗？记者在淘宝网上搜索Nanci囡茜造型运动会主题盲盒发现，一款稀有的隐藏款盲盒，竟被标出了328元的高价。在餐饮领域，今年1月，某快消餐饮企业与盲盒销售商泡泡玛特联合推出“DIMOO联名款盲盒套餐”，一份“DIMOO家庭桶套餐”的售价为99元。按照销售规则，集齐整套玩偶至少需要购买6份套餐，稀有隐藏款的出现概率是1比72。为了获得联名款盲盒，有消费者不惜一次性花费10494元购买106份套餐。时隔两个月后，记者在某电商平台搜索后发现，该联名款盲盒已在部分网店上架销售。在一家主打盲盒销售的网店内，此款联名盲盒的单价不等，最低价为94元，隐藏款的售价高达738元，整套盲盒的售价为838元。他山之石上海划出盲盒监管“红线”今年初，上海市市场监管局印发《上海市盲盒经营活动合规指引》，首次为盲盒定下规矩，为盲盒经营划出红线。指引明确提出，法律法规明确规定禁止销售、流通的商品，不得以盲盒形式进行销售。对销售资质、存储运输、使用条件等方面有严格要求的商品，不得以盲盒形式进行销售，如特殊食品、药品、医疗器械、有毒有害物品、易燃易爆物品、活体动物等。除此之外，指引还特别限定了盲盒的价格。盲盒内商品实际价值应与其售卖价格基本相当，单个盲盒的售价一般不超过200元。不得以盲盒形式抬高普通商品价格。盲盒的抽取规则也有了明确规定。盲盒经营者应公示商品种类、抽盒规则、商品投放数量、隐藏款抽取概率等信息，充分告知消费者，并保留完整的概率设定、抽取结果、发放情况记录以备查。指引鼓励盲盒经营者公示标准，当同一消费者在抽取同一系列盲盒商品支付达到金额或者抽取达到一定次数时，提供合理的途径使其可以获得隐藏款商品或者整套系列商品。但非强制性要求。同时，盲盒经营者应当建立便捷、有效的投诉处理机制，公开投诉方式、处理流程、退换货标准等信息，不得推诿、拖延、拒绝处理消费者投诉【进入黑猫投诉】。为了加强对未成年人保护，指引要求，盲盒经营者不得向8周岁以下的未成年人销售盲盒。向8周岁以上未成年人销售盲盒商品，应通过等不同方式确认监护人同意。不仅如此，在今年全国“两会”上，不少代表委员也纷纷为如何规范盲盒市场出谋划策。全国人大代表杨雪梅提出了《关于加强盲盒市场监管力度的建议》，呼吁加快出台规范盲盒市场行为的管理办法，明确盲盒的认定标准，建立盲盒产品清单。她还建议市场监管部门加强对盲盒市场的监管力度，让盲盒的监管不再“盲”。消协提醒盲盒消费应少点冲动防沉迷无论盲盒是按照正品销售还是附属品销售，盲盒本身都是商品，经营者都必须承担法定的质量担保责任。对于目前市面上的“盲盒乱象”，中消协提出，如果经营者不把精力放在提升主营产品和服务的质量上，过度依靠盲盒营销的噱头误导消费者冲动购买，用一些粗制滥造的产品糊弄消费者，只能产生短期的吸引力，会很快消耗消费者的信任感，损害自身商业信誉，企业也难以获得长久稳定的发展。因此，一方面，商家要保证产品来源可靠、链条完整，杜绝“三无”产品和仿冒品；另一方面，要积极履行退货、更换、修理等经营者义务，不得以“附赠品”“抽奖品”等借口免除应当承担的质量保证和售后服务义务。中消协也提醒消费者，要认识到盲盒具有不确定性的本质，认清并防范商家过度营销的套路，拆开盲盒既有可能因高于预期而惊喜，也有可能因低于预期而失望，不能只抱着投机或者中彩票的心理购买盲盒，不应过分沉迷，切勿跟风与攀比，要结合自身经济能力、消费需求和兴趣爱好等，理性消费、量力而行，多一点理智和冷静，少一点盲目与冲动。本报记者张楠责任编辑：王蒙
银行,中行六盘水分行原行长王强因贪污公共财产、受贿被终身禁业,澎湃新闻,2022年03月17日 13:29,澎湃新闻记者侯嘉成一分行因案防管理不到位被罚款20万元，该分行原行长王强被禁止终身从事银行业工作。3月15日，六盘水银保监分局行政处罚信息公开表（六银保监罚决字〔2022〕1号）显示，中国银行六盘水分行因案防管理不到位问题，被银保监会罚款20万元。此外还有两名相关责任人收到罚单，王强、任晓根因利用职务上的便利贪污公共财产、收受贿赂被禁止终身从事银行业工作。值得一提的是，王强曾是中国银行六盘水分行行长。2020年6月，据六盘水市人民检察院消息，中国银行六盘水分行原行长王强涉嫌贪污罪、受贿罪、行贿罪一案，由六盘水市监察委员会调查终结，移送六盘水市人民检察院审查起诉。经六盘水市人民检察院指定，由水城县人民检察院审查起诉。日前，水城县人民检察院依法以涉嫌贪污罪、受贿罪、行贿罪对王强作出逮捕决定，案件正在进一步办理中。责任编辑：李琳琳
银行,阿拉善左旗黄河村镇银行因违规使用信贷资金等被罚70万元,金融一线,2022年03月17日 10:23,3月17日消息，据阿拉善银保监分局行政处罚信息公开表显示，阿拉善左旗黄河村镇银行因未执行统一授信制度导致单一集团客户集中度超比例、未按信贷合同约定用途使用信贷资金，被罚款70万元。责任编辑：张文
2022年金融315曝光台,惊呆！800多万元买下29只太平洋保险！上海爷叔掏空积蓄，贷款370万元！,市场资讯,2022年03月17日 10:06,9年多里，买下29种人寿保险产品，总计支付保费800多万元，其中贷款370万元。买了保险却“背债”数百万元，这件事就发生在上海退休市民章先生身上。“保险公司业务员诱导贷款，导致我背上巨债，日子都快过不下去了。”如今，家中积蓄用光。夫妻俩每年退休金仅有11万元，但370万元的“负债”每年利息却超20万元。“债务”如滚雪球般压向退休的章先生夫妇，让他们喘不过气来。记者调查到，部分保单可能还涉嫌伪造被保险人签名、虚构投保人与被保人父子关系等。在当事人投诉后，目前，太平洋寿险上海分公司已申请银保监会介入调查。掏空积蓄背负巨债“希望能帮帮我，停止贷款，退还保费。”走投无路之下，章先生夫妇焦急万分地来到新民晚报向“帮侬忙”求助。夫妇二人带着一摞厚厚的保险合同，记者看到，这些保单来自中国太平洋人寿保险股份有限公司，投保人均为章先生，签订时间从2011年至2019年，总计29种保险品种。办理这些保单和“引导”贷款的是同一人，名叫周某梅。据了解，2020年，此人已从太平洋寿险公司离职。贷款买新的保险、用贷款付保费，接着碰到付不出保费，抵押保单继续“透支”……如此恶性循环下，章先生的退休工资和养老积蓄全部“投进”了保险连环套中，还背负了巨额“债务”。这是一种保单质押贷款，指投保人把所持有的保单直接质押给保险公司，按照保单现金价值的一定比例获得资金的一种融资方式。据章先生的妻子曹女士初步统计，截至2022年3月5日，已交款835.44万元保费及相关费用，贷款金额370.37万元。也就是说，章先生不光动用家中积蓄“投入”400多万元，还“背债”370万元，现在贷款一分钱都还不出。“我算了一下，仅仅贷款利息就付掉78万元！家里所有积蓄都花光了，怎么办啊？”谈到这笔保险公司的“巨债”，曹女士越说越激动，眼泪止不住地往下掉。贷款150万元买保险那么持续贷款买保险，是投保人章先生自己同意，还是存在“被贷款”？章先生自述，2011年到2013年，这期间没有办理贷款。而从2014年开始，他踏上了贷款买保险之路，现在涉及贷款的保单已有20多张。他回忆，当时业务员周某梅说，可以使用贷款方式交付保费和购买新的保险，他耳根子一软，觉得未尝不可，便开始了一次次的抵押贷款。至于为何要购买如此多的保险，章先生坦言道，业务员花言巧语，告诉他购买保险收益丰厚，“3年交150万，5年后能拿200多万”“购买这份保险，以后能免费入住太保养老社区”……在这些话术的诱导下，章先生瞒着妻子不停买买买，竟然还背负巨额贷款买保险。记者在一份名为“聚宝盆年金保险（分红型）”的保单上看到，这份保险要3年连续交费，3年交清，按年付每期保险费50万元/年，保险期自2018年1月1日零时起至终身止，签订时间为2017年12月29日。保单投保份数写着“50份”，即1年1万元，50份叠加后，每年要支付50万元保费。章先生的妻子曹女士告诉记者，这份分红保险已交清3年保费150万元，这150万元全部是贷款而来的。“相同产品同时投保多份，还是借的钱。”曹女士说，为了查清所有保费和贷款金额，她一遍遍拨打太平洋保险客服热线询问，以及前往银行拉流水账单。在一张流水明细单上，“太保人寿”给章先生打了保单质押贷款58万元，交易时间为2017年11月28日，到了同年11月29日，就是打款次日，“太保人寿”账户扣掉章先生一笔50万元的款项。“前脚刚贷好58万元，后脚就忽悠买保险。”曹女士表示，账户中扣除的50万元，随即被业务员“投入”到了上述聚宝盆年金保险中，支付了第一年保费。但让人感到蹊跷的是，在不少贷款单上，贷款用途或为“公司经营”，或为“装修”，并非“买保险”。已申请银保监会调查曹女士反映，除了有诱导贷款，太平洋寿险涉事业务员周某梅还涉嫌伪造“被保险人”签名。有的保单上，“被保险人”为曹女士或他们的女儿，但母女二人却对这一切全不知情。“你看，字迹都跟我不一样，全是代签的。”曹女士当场写下自己的名字，与保险合同上的签名，笔迹特征完全不一致。另外，有2份保单比较特殊，章先生作为投保人，把“被保险人”定为一名曹某某的男性。保单上显示，章先生与曹某某是父子关系，实际情况是什么呢？出生于2002年的曹某某其实是章先生妻子曹女士的侄子。为了诱导用户持续购买，涉事业务员可能编造了虚假的“父子”关系。记者与太平洋人寿保险上海分公司取得联系。相关负责人回应，章先生夫妇曾来过太保上海分公司处投诉，针对退还保费和停止贷款的诉求，双方分歧较大，没有达成一致。至于“代签名”一事，对方表示，早前做过相关调查，但结论是“没有代签名事实”。目前，公司已正式申请银保监会介入调查。3月16日，太平洋寿险方面向记者发来章先生的保单明细。保险公司明细表显示，已交保费总计833.9万元，但是章先生夫妇自己计算的数额是835.44万元。双方报的数额存在偏差。据了解，贷款和贷款利息等具体金额，尚在统计中。章先生夫妇希望，相关主管部门能及时介入，查清事实真相，让他们不要再被“保险连环套”深套了。对于此事，新民晚报记者将继续关注。新民晚报记者夏韵钱绿明责任编辑：李琳琳
保险,巴彦淖尔河套农商行被罚15万：流动资金违规流向房地产,金融一线,2022年03月17日 10:04,3月17日消息，据巴彦淖尔银保监分局行政处罚信息公开表显示，巴彦淖尔河套农村商业银行股份有限公司因对关联方的贷款条件优于对非关联方同类贷款条件、流动资金违规流向房地产，3名相关人员被罚共计15万元。责任编辑：张文
保险,太平财险巴彦淖尔中心支公司被罚28万：编制虚假资料套取费用,金融一线,2022年03月17日 10:02,3月17日消息，据巴彦淖尔银保监分局行政处罚信息公开表显示，太平财产保险有限公司巴彦淖尔中心支公司因编制虚假资料套取费用被罚28万元。责任编辑：张文
银行,农行深圳市分行被罚90万：贷款“三查”不尽职、贷款资金被挪用,金融一线,2022年03月17日 10:00,3月17日消息，据保险监督管理委员会深圳监管局行政处罚信息公开表显示，中国责任编辑：张文
新浪科技,零跑科技赴港IPO：2021年总收益31.32亿元,新浪科技,2022年03月17日 22:11,新浪科技讯3月17日晚间消息，浙江零跑科技股份有限公司向港交所提交上市申请书，中金公司、花旗、、建银国际为联席保荐人。招股书显示，2019年、2020年、2021年总收益分别为1.169亿元、6.313亿元和31.32亿元，近三年公司权益持有人应占年内亏损分别为9.01亿元、11亿元和28.457亿元。2021年全年，零跑合计交付43748辆电动汽车，同比增长443.5%。零跑计划以每年一到三款车型的速度，于2025年底前推出八款新车型，涵盖各种尺寸的轿车、SUV及MPV。我们计划于2022年第二季度推出一款智能纯电动中大型轿车C01，并于2022年第三季度开始交付。C01基于C11同一平台打造，车身长超过五米。C01配备LeapmotorPor及90千瓦时的电池，NEDC续航里程约为700公里，百公里加速时间在四秒以内。招股书显示，朱江明、吴保军、曹力任执行董事；金宇峰任非执行董事；付于武、黄文礼、万家乐任独立非执行董事。根据招股书，朱江明持股9.15%，万载明昭持股1.07%；杭州芯图持股0.4%；宁波景航持股1.27%；傅利泉持股9.01%；宁波华暘持股2.37%；宁波顾麟持股2.15%；宁波华绫持股5.59%；其他51名股东持股68.99%。
银行,民生银行：股东泛海集团所持18亿股被冻结 涉及与前海人寿债券交易纠纷,上海证券报 ,2022年03月17日 21:18,上证报中国证券网讯3月17日，公告称，公司股东中国泛海集团持有的民生银行18亿股A股无限售流通股被司法冻结、司法标记及轮候冻结，占该行总股本的4.11%。公告称，该事项不会导致第一大股东及其一致行动人发生变更，不会对日常经营、公司治理产生重大影响。公告显示，因前海人寿保险股份有限公司与股份有限公司、泛海集团发生公司债券交易纠纷，涉及案件债权金额及执行费用总额为53750万元人民币，北京金融法院对泛海集团持有民生银行的18亿股进行司法冻结、司法标记及轮候冻结。截至本公告日，泛海集团及其一致行动人持有民生银行25.54亿股无限售流通股，占总股本比例为5.83%，其中，质押股份25.51亿股，占泛海集团及其一致行动人持有比例为99.86%；本次司法冻结、司法标记及轮候冻结18亿股，占泛海集团及其一致行动人持有本行股份比例为70.46%。（马慜）责任编辑：王婉莹
