板块名,标题,作者,日期,新闻内容
产经,又一平台“拔网线”，股价暴跌40%！百亿巨头破产，Meta也将关闭这一项目,中证报,2022年07月03日 13:58,虚拟货币市场持续低迷，币圈近日“雷声阵阵”，又有一家平台陷入危机。北京时间7月2日，加密货币经纪商VoyagerDigital宣布，从纽约时间7月1日下午两点起，暂停所有交易、存入、提取和持币奖励。“这是一个极其艰难的决定，但在当前的市场环境下，我们认为这是正确的决定，”Voyager的CEOStephenEhrlich在声明中表示。他还表示，暂停平台交易活动是为了“与多个利益相关方一起探索战略性替代选项”寻求时间，并将在“合适的时间”提供更多的信息。知名虚拟货币平台“拔网线”VoyagerDigital是一家2018年在美国上市的虚拟货币资产经纪商，提供订单执行、市场数据、钱包和托管服务等业务。截至3月31日，公司一季度总营收为1.027亿美元，净利润亏损6144万美元，注册验证用户总数达到约350万。公司的主营业务是为客户提供购买、出售或执行加密资产订单的服务委托订单成交，因此主要的营业收入是交易手续费收入。由于今年虚拟货币市场的持续下行，VoyagerDigital在一季度交易量低迷，交易收入显著减少。一季度交易收入仅为3339万美元，同比下降38%。公司声称，后续将加强和拓展钱包支付业务，并收购了Coinify钱包以配合商户支付系统的能力。公司的第二大业务便是虚拟货币资产贷款的利息收入。这些贷款协议大多是无抵押贷款，可有少于一年的固定期限和无限期贷款两种选择。一季度利息收入为3103万美元，同比增长了3.6倍，该业务正在逐渐取代交易业务。此次VoyagerDigital暂停业务与三箭资本（ThreeArrowsCapital）的违约密切相关。6月27日，Voyager宣布已向三箭资本发出违约通知，原因是三箭资本未能按期偿还价值约6.75亿美元的稳定币USDC及比特币贷款。但VoyagerDigital当时表示，仍将继续运营和履行客户的订单和取款。截至6月24日，Voyager手头拥有约1.37亿美元现金并拥有加密资产。公司还可以从AlamedaVenturesLtd处获得先前宣布的2亿美元现金和15000个比特币。VoyagerDigital的暂停交易早有预兆。早在10天前（6月23日），该公司曾宣布，将每日（24小时）提款限额从2.5万美元降至1万美元，在24小时内最多可提款20次。平台暂停交易的消息爆出后，7月1日，VoyagerDigital美股跌幅一度高达43%，最终收跌30.68%，报0.31美元/股。该公司主要上市地加拿大由于放假未进行交易，今年以来，该公司股价已经跌去超97%。百亿资产管理巨头三箭资本爆雷公开资料显示，三箭资本是一家提供风险调整回报的对冲基金管理公司，由对冲基金经理ZhuSu和KyleDavies创立。该公司于2017年开始全面转型为加密对冲基金管理公司。三箭资本在过去两年的虚拟货币牛市中声名鹊起。市场人士预计，高峰期时，其管理的资产在100亿-180亿美元之间。然而，最近Terra（Luna）和UST稳定币的崩盘，对该机构造成了重大打击。在上个月加密货币Luna崩盘之前，三箭资本曾斥资5.6亿美元接盘。而现在，这些虚拟货币价值仅为670美元。自2021年11月开始，虚拟货币市场低迷，包括比特币、以太坊等知名加密货币出现持续下跌，三箭资本所投资的项目几乎都处于亏损状态。当地时间7月2日，三箭资本已根据美国破产法第15章向纽约法院申请破产保护，以在英属维尔京群岛执行清算期间保护其美国资产。法庭文件显示，三箭的代表周五在纽约提交了破产申请。根据破产法第15章，债权人不得扣押一家公司在美国的资产。据媒体此前报道，英属维尔京群岛的一家法院已下令清算总部位于新加坡的三箭资本。三箭资本债权人Blockchain.com表示，正在配合法院对这家陷入困境的加密对冲基金进行的调查。Meta宣布将关闭虚拟货币项目NoviMeta的虚拟货币项目曾经令公司创始人马克·扎克伯格在美国国会饱受攻击。如今，该项目的剩余部分也将正式关闭。7月2日，Meta在虚拟货币测试项目Novi网站上表示，将于9月1日停止服务。Novi此前为Meta自己的虚拟货币提供转账等服务。该公司表示，Novi应用程序和WhatsApp上的Novi都将不再使用。从7月21日开始，用户将无法再向他们的账户充值，建议尽快提取余额。在试点结束后，用户将无法访问其交易历史记录或其他数据。去年10月，Meta推出Novi试点，Novi让用户使用USDP稳定币来进行交易，而不是Meta曾经支持的Diem代币。而在去年12月，美国金融改革和需求进步组织和开放市场研究所曾呼吁美国司法部和其他监管机构调查Novi数字钱包，查看Meta是否在没有货币主计长办公室批准的银行执照的情况下接受存款。责任编辑：李思阳
国内财经,药品“回扣式”销售、套取医保资金……严查靠医吃医套路,中央纪委国家监委,2022年07月03日 13:42,中央纪委国家监委网站沈东方报道近日，多名医疗卫生领域党员干部被通报受到处分。哈尔滨医科大学附属第一医院原党委委员、院长周晋被开除党籍，其在岗位调整、职务晋升、医疗设备销售、工程项目承揽等方面为他人谋取利益；重庆市中医院原党委书记、副院长王守富被“双开”，其为他人在药品销售、工程承接、岗位调整等方面谋取利益。记者梳理相关案例发现，与以往收受红包等方式相比，在医药购销环节做手脚、拿回扣的形式更为隐秘。“药品‘回扣式’销售是个公开的秘密。部分医药商每隔一段时间会派专人来医院，给医生、科室负责人、相关分管领导送信封装好的现金，金额根据受贿者职务从几万到十几万不等。而且他们一般混在患者队伍里面，很难被辨别出来，因而监管也成了难题。”一位医药领域的专业人士告诉记者。在医疗器械设备、耗材采购上攫取私利，医院多付的成本最终会转嫁给患者，加重了患者就医负担，侵害了群众切身利益。而在实际操作中，瓜分医药购销回扣这块“蛋糕”的利益群体，远不止临床业务医生和相关负责人。江苏省响水县人民医院财务科原科长刘某荣主要负责医院各种收入、支出、预算等财务管理活动，尤其在供应商的发票入账、对账、回款上，他是不可缺少的一环。为了能尽快拿到“回款”、回笼资金，供应商千方百计地巴结讨好刘某荣，准时准点地在中秋、春节等重要节点奉上“诚意”，少则几千，多则上万。在2015年至2021年期间，他非法收受供应商等人贿送的现金和购物卡等财物，合计48万余元。从业务部门到综合部门，医药购销领域的腐败利益链条较长，往往“查处一个带出一串”。究其原因，很重要的一点是“关键少数”没有管好自己，把医院管理权异化为谋取私利的工具，成为医药企业的“主攻对象”。针对重点人群，浙江省衢州市柯城区纪委监委成立专项督查组，探索建立“双约谈、双签字”机制。“双约谈”，即对医疗卫生监管部门和医疗机构中层干部集中约谈，对药品器械采购、财务管理等关键岗位干部进行个别约谈，提醒廉洁履职。“双签字”，即与各级党组织签订党风廉政建设责任书，层层压实责任；与医疗卫生监管部门和医疗机构党员干部签订廉政承诺书，立下“军令状”。与其他行业相比，医疗行业由于专业性很强，信息不对称的情况更为明显。部分医生通过比患者拥有更多疾病信息的优势，提供昂贵而不必要的医疗服务，甚至以多种方式套取医保资金，侵吞群众的“救命钱”。县中医院原院长陶文洪帮助朋友陈某先后承揽县中医院5个工程项目，套用他人医保账号购买价值27450元的冬虫夏草和特级白燕窝，并挂账在其他病人名下；县荷源乡资福村卫生所原所长余水旺通过分解处方、合并处方、未按规定加价率加价等套取医保基金8092元——这两起都是江西省黎川县纪委监委近段时间查处的套取医保资金案例。“套取医保资金的方式包括虚假病历、冒名顶替、过度治疗、不合理用药等。”黎川县纪委监委驻县卫健委纪检监察组组长全新敏告诉记者，具体“套路”表现为：量身定做“假病历”，通过挂床住院、虚记医疗服务费用套取医保基金；擅自篡改病种，把不能补偿的病种改为补偿范围内的病种，“违规”住院；·故意把病情讲得非常严重，开大处方，将只需门诊的病开成需要住院的病，把小手术改成大手术等。如何有效分辨医疗腐败行为和由于工作原因引起的失误？这对监管人员的专业素养提出了很高的要求。针对这一问题，江苏省常熟市纪委监委驻市卫健委纪检监察组督促市卫健委开发运用“智慧医疗合理用药在线审方系统”，并在该市部分医疗卫生服务机构全面上线。系统涵盖了门急诊处方及住院医嘱，智能审核单个处方或住院医嘱平均用时只需0.2秒，不适宜的处方或医嘱在医师开具的同时即被拦截提醒。“为确保审核的准确性和科学性，智能审核只是为进一步的专业评估提供了基础，卫健委邀请专家针对发现的不适宜处方医嘱在适应症、用法用量等方面进行规范性和合理性点评。”该纪检监察组相关负责人介绍，专家组在严谨评估基础上将汇总出的不合理处方提交给市卫健委，作为对医师进行不良执业行为计分的依据。截至目前，已有32名有不良执业行为的医师被记分。责任编辑：李思阳
国内新闻,单日新增288例感染 安徽泗县这座小城怎么了？,新浪新闻综合,2022年07月03日 13:35,
国内财经,安徽泗县，这座皖北小城怎么了？,市场资讯,2022年07月03日 13:35,中国新闻网目前，泗县单日新增的感染者中，仍有较大比例是在风险人群的核酸检测中发现。安徽泗县的全县封控已经进入第五天。过去一周，这座人口近百万的皖北县城新增感染者（确诊病例+无症状感染者）已经超过500例，疫情还外溢多地。安徽泗县单日新增288例感染者2日，31省份新增本土确诊病例75例，新增本土无症状感染者310例，此前已持续多日单日新增两位数的全国疫情数据再度抬升。2日这天，安徽泗县的新增感染者就高达288例。安徽泗县的本轮疫情首次报告于6月26日，当天，泗县通报，在重点人群核酸检测中发现无症状感染者，此后一周，泗县疫情数据快速上升。按照安徽省卫健委发布会的数据，泗县在6月26日新增3例感染者，6月27日新增3例感染者，6月28日新增13例感染者，6月29日新增13例感染者，6月30日新增104例感染者，7月1日新增134例感染者，7月2日新增288例感染者。截至7月2日，泗县在本轮疫情中已经进行5轮核酸检测，目前，泗县单日新增的感染者中，仍有较大比例是在风险人群的核酸检测中发现。例如，2日，泗县新增确诊病例60例（轻型），新增无症状感染者228例。其中，187例在隔离观察的人员排查中发现，101例在中高风险区核酸筛查中发现。资料图：工作人员正在对核酸检测样本进行检测。殷立勤摄总体可控，疫情处置仍处关键期据人民日报客户端安徽频道的报道，安徽省疫情防控应急综合指挥部办公室负责人介绍，从目前看，本轮疫情总体可控。鉴于泗县疫情初期源头不清、底数不明，为阻断传播链，当地已第一时间实施社会面管控，全县静态管理、人员足不出户，6月26日发现疫情并管控后未出现外溢。对涉及外地的密接、次密接者等风险人员，第一时间发出协查函。他介绍，到7月2日上午，泗县已进行了5轮全员核酸检测。从前四轮检测结果和2日已出的初筛结果看，阳性人数较前几轮呈现下降。不过，指挥部相关负责人提醒，因初筛结果还需进行复核，数据发布会延迟，预计未来一两天新增病例在数字上还会有增长，但很快就会出现明显下降。该负责人还表示，在高中风险区及在隔密接者中检出一定数量的阳性人员，表明疫情处置仍处于关键期。江苏多地报告泗县关联疫情泗县所在的安徽省宿州市地处安徽最北部，位处苏、鲁、豫、皖四省交界。本轮泗县疫情首次报告以来，江苏南京、徐州、无锡均明确报告出现泗县关联疫情。例如，与泗县毗邻的江苏徐州睢宁县，6月27日，当地在集中隔离点发现的1名核酸检测异常人员经诊断为无症状感染者。徐州疾控6月28日通报称，“近期，安徽省宿州市泗县、合肥市瑶海区、淮北市濉溪县等地报告阳性检测人员，行程轨迹涉及南京市鼓楼区、秦淮区、六合区、我市睢宁县等地。目前南京市和我市均发现外地阳性检测人员的密切接触者核酸检测结果异常，疫情传播风险较大，疫情防控形势严峻。”6月28日，南京通报排查出4名阳性病例，均为相关泗县核酸阳性人员的家人。在无锡，6月29日和30日，无锡市分别新增9例和24例本土感染者，均关联2位泗县来无锡人员。前两名感染者的基因测序结果显示，与泗县本次疫情病例基因组序列高度同源。截至7月3日1时，无锡本轮疫情累计发现103名阳性感染者，此前，无锡已呼吁全体居民非必要不离开无锡。7月1日，江苏盐城市滨海县发现1例有无锡市旅居史返盐人员核酸检测阳性，盐城市新冠肺炎疫情联防联控指挥部发布通知，有6月21日以来安徽泗县、6月24日以来无锡市旅居史，已经在盐的人员要主动向所在地社区（村）、单位、酒店报告，配合落实隔离观察、核酸检测、健康监测等健康管理措施。在安徽省内，毗邻泗县的宿州市灵璧县，7月1日通告，鉴于当前周边地区疫情防控形势和灵璧县现有关联病例情况，1日16时起，全县范围内实施足不出户管控措施。安徽省委书记：1周内社会面清零、零死亡、不外溢泗县疫情发生后，7月1日晚，宿州市在泗县召开新闻发布会，发布会透露，国家卫健委副主任雷海潮已率工作组来泗县现场指导处置。7月3日，《安徽日报》报道称，近日，安徽省委书记郑栅洁在省委相关会议上强调，从目前看，本轮疫情总体可控，但疫情处置仍处关键期。要突出以快制快，对已经发生疫情的地区要快速核酸筛查、及时流调溯源、彻底转运隔离、严密社区管控，做到应查尽查、应检尽检、应隔尽隔、应治尽治，坚决阻断疫情传播渠道，做到一周内实现社会面清零、零死亡、不外溢。3日，泗县部分区域开展第六轮核酸检测。根据安排，当日核酸检测工作自6时开始，集中采用人员分时段有序采用，实行10合1混采；对高风险区人员实行单采单检或1户1管，采样人员逐户上门采样；对部分人员增加抗原检测，包含混管阳性人员，从事快递、环卫、酒店服务等人员，中高风险地区从事抗疫人员和志愿者，被隔离的企业、工地等重点场所人员，上午开展核酸检测，下午居家自行开展抗原检测。责任编辑：李思阳
新浪科技,特斯拉：在中国大陆已建设开放1200多座超级充电站,新浪科技,2022年07月03日 13:34,新浪科技讯7月3日下午消息，中国充电团队消息称，截至目前，特斯拉在中国大陆已建设开放1200多座超级充电站，700多座目的地充电站，覆盖370多个城市及地区。
