板块名,标题,作者,日期,新闻内容
证券,中秋假期本地游市场“量价齐升” 上市旅企全年业绩或将分化,市场资讯,2022年09月12日 21:02,来源：证券日报之声今年中秋节假期的旅游市场仍然是属于本地游的。经文化和旅游部数据中心测算，2022年中秋节假期，全国国内游出游7340.9万人次，同比下降16.7%，按可比口径恢复至2019年同期的72.6%；实现国内旅游收入286.8亿元，同比下降22.8%，恢复至2019年同期的60.6%。在此期间，本地游迎来高峰。据来自携程的数据显示，今年中秋旅游热度达到今年小长假顶峰，日均订单量较端午呈双位数增长、较清明和五一增长一倍以上。在多地倡导就地过节背景下，出游人群主要由本地、周边客群构成，占比超过六成。据《证券日报》记者多方了解，今年中秋假期期间，在本地游大行其道的背景下，部分本地景区迎来了近两年内最好的行情，无论是客流量还是营业收入，都超过今年端午假期以及去年中秋假期的水平。有民宿业主亦表示，中秋假期期间，民宿价格创下近几年新高，目前十一假期的订单已满。本地游市场量价齐升“当下古北水镇差不多迎来了近两年最好的情况。”新闻发言人徐晓磊告诉《证券日报》记者，“今年7、8月，古北水镇的客流量以及营收一直恢复良好，9月初，中秋节和教师节连在一起，又创造了一个小高峰。”古北水镇销售公司总经理周建红亦对记者证实，从中秋假期前两天的数据来看，古北水镇的客流量以及整体营收均高于去年同期。古北水镇并非孤例，延庆地区亲子民宿“熙熙宪宪de乐园”主理人刘添文亦告诉记者，他所管理的民宿在中秋节期间出现爆满，身为民宿主理人的他为了满足客人整租需求，将自家留房腾给游客，目前十一期间的房间已经被订光。量价齐升成为本地游市场火爆期间的常见现象。据周建红介绍，中秋假期期间，古北水镇景区酒店平均房价同比去年有所增长；刘添文则表示由于周边游火热，京郊优质民宿一房难求，整栋民宿的每晚价格由去年同期的五千元左右涨至六千元。谈及价格变化，徐晓磊表示，一方面来看，价格仍然由市场驱动，鉴于疫情反复，旅客谨慎外出，本地游市场经常会出现供不应求的态势；另一方面来看，疫情期间，超大城市周边的旅游产业升级很快，更加精细化、高端化的设施亦推动了本地游相关产品量价齐升。“例如，过去大家谈起京郊，能够想起的民宿还是相对平价的农家院，中高端住宿场所缺，但近十年来，京郊中高端民宿增量较大，旺季时动辄数千元一晚的民宿产品比比皆是。”中国社会科学院财经战略研究院教授魏翔分析，未来本地游还能为旅游市场提供30%至50%的市场增量。一方面来看，旅游产业融入内循环的程度在加深，短时间内以体验休闲为主的短途游仍将为主流；另一方面，本地游的中高端基础建设填补了市场空白，有望在未来带来持续的市场增量；同时与长线观光游的规模效应不同，本地游未来的盈利模式将主要体现在纵深化、高附加值的产品，以及周边生态的打造上。此外，在本地游资源相对有限的情况下，游客对于旅游的需求让更精细化的“玩法”开始出现。据飞猪数据显示，今年中秋假期期间，露营订单量环比增超4倍；同程数据显示，今年中秋假期，赏月活动带动了各地夜游市场的热潮；去哪数据显示，中秋酒店热门搜索词汇中，赏月、星空、温泉、湖景、露营热度最高。上市旅企全年业绩或将分化中秋假期刚刚结束，就已有游客开始筹备十一假期的出行计划。据来自去哪儿的数据显示，截至9月12日，一些热门目的地的优质房源被抢先预订，目前房量已紧张；部分网红民宿已订满。途家民宿的数据亦显示，当前国庆期间的民宿预订量已经与中秋持平，理想状态下，国庆假期的民宿预订量对比中秋有望翻番。去哪儿方面同时表示，随着临近国庆长假，开始规划小长线出游的游客增多，广州、宜昌、恩施、等旅游胜地长线游旅游产品预订增加明显。另据不愿具名的OTA工作人员透露，其实中秋期间的长线游占比较端午假期的有所提升。中秋假期市场的恢复再次提振了市场信心。“今年一季度，中青旅业务恢复较好，压力主要来自二季度疫情扩散导致的亏损。目前三季度恢复势头不错，如果十一假期符合预期，我们有信心在全年争取更好的业绩。”徐晓磊表示。魏翔告诉记者，尽管上半年19家上市旅企全线亏损，但随着下半年市场的恢复，预计部分度假目的地型企业能够在2022年度财报中呈现减亏，甚至扭亏为盈的趋势，同时未来看好入境旅游市场有望恢复所带来的机会。在徐晓磊看来，目前上市旅企全年的业绩变化趋势仍然难以判断，但从上市旅企过去的业绩表现来看，单一服务商相对承受更大的压力，综合服务商或具有本地旅游资源的企业能够有更多亏损收窄甚至扭亏为盈的机会。责任编辑：杨红卜
证券,机构：节后A股市场板块轮动将加快，下有支撑上有天花板,市场资讯,2022年09月12日 21:01,来源：证券日报之声上周，A股市场震荡回升，三大股指周线均出现上涨，沪指最强，北向资金略净流出，周合计净流出2.21亿元。A股后市趋势如何？投资机会在哪里？对于未来A股的趋势，表示，当前内外因素对A股风险偏好扰动仍存。海外方面，美联储加息预期上调，强美元下外资流向波动或加大；国内方面，内外需求承压使得目前经济复苏力度偏弱。同时，稳增长政策加码发力下，宏观资金面仍充裕，在房住不炒的大背景下，“资产荒”对A股估值形成有力支撑。节后的A股市场，“板块轮动加快，向下有支撑，向上有天花板”，操作上“不追高，不恐慌性杀跌”将成为最主要的特征。对于后市的投资机会，民生证券表示，市场焦点在转移，面向阻力最小的方向：（1）对通胀格局下的旧能源+组合顺序调整为：铝、油、煤炭、油运、铜、黄金和火电。（2）看好上证50跑赢中证1000，对中国需求预期修复可以关注房地产、白酒、纯碱。（3）成长领域关注通胀下的解决路径：国防军工、元宇宙。1、股票市场A股市场：上周（9月5日-9月9日，下同），A股三大股指全线上扬。上证指数周涨幅达2.37%，报3262.05点；深证成指周涨幅达1.50%，报11877.79点；创业板指周涨幅达0.60%，报2548.22点。从31类申万一级行业涨幅来看，上周有25类行业实现上涨，其中，房地产行业周涨幅居首达7.51%，紧随其后的是煤炭和有色金属，涨幅分别为6.63%和6.02%。跌幅最深的是传媒，周跌幅达3.80%。资金方面，北向资金上周累计净买入金额达-2.21亿元，其中，沪股通净买入51.14亿元，深股通净买入-53.35亿元。从大单资金流向看，申万一级行业中有9类呈净买入态势，其中，有色金属净买入额达40.83亿元，居首；净流出额最高的行业是电子，净流出额达84.50亿元。从解禁看，本周将有60只股票面临限售股解禁，合计解禁量为17.82亿股；按最新收盘价计算，合计解禁市值为422.65亿元。表：本周解禁金额前十位（上周收盘价计算）制表：赵子强新股方面，根据发行安排，A股市场本周（9月13日-9月16日）将有10只新股申购。港股市场：总结全周，恒生指数累计跌0.46%，收报19362.25点；国企指数累计跌0.66%，收报6628.14点；恒生科技指数跌1.60%，9日收市报4077.32点。中泰国际策略分析师颜招骏表示，目前港股大盘很难出现全面上涨，以结构性行情为主。在国内疫情局部反复及外部海外紧缩压力等因素的扰动下，9月份港股大盘仍将面对上行阻力，更多以板块行情为主，更大的机会将来自四季度。但另一方面，包括来自政策面支撑，科技股优于预期的业绩，大型蓝筹上市公司重启回购以及相对较低的估值，都给予港股下行保护，使港股能够先于外围股市率先调整下来，缓冲了海外收紧流动性的冲击。海外市场：上周美股三大指数上涨，道指周涨2.66%；标普500指数周涨3.65%；纳指周涨4.14%。欧洲方面，三大股指周线上涨，英国富时100指数周累计涨0.96%，德国DAX30指数周累计涨0.29%，法国CAC40指数周累计涨0.73%。亚太股市，日经225指数周累计涨2.04%；韩国KOSPI指数周累计跌1.04%。华西证券表示，经历了连续三周的明显下跌，上周美股大盘出现了反弹。值得注意的是，标普500席勒市盈率为30.43，仍处于历史估值的偏高区间。考虑到美股估值仍有一定压力，叠加美国经济处于较为疲软的阶段，且现阶段美联储流动性收紧较快，预计未来一段时间美股大盘还将出现回调。经历了连续三周的明显回调以及美股反弹的联动影响，本周欧洲多数市场继续出现反弹，由于地缘问题、疫情影响、能源问题以及欧洲经济存在一定下行压力，叠加欧洲央行流动性收紧，预计未来一段时间欧洲市场还将出现回调。此外，加拿大、澳大利亚、新西兰、日本等发达市场还将出现波动。2、债券市场华创固收表示，8月份CPI和PPI均低于预期，后续年内CPI破3的风险降低，PPI仍处于下行通道中，通胀对债市的扰动将进一步降低。而不及预期的通胀数据背后凸显整体需求低迷，这是目前宏观经济和债券市场的主要关注点，随着稳增长政策有所加码，后续需要关注政策效果，包括信贷数据以及经济数据的改善情况。3、外汇市场（汇率数据截至17：50）华泰期货表示，美联储紧缩计价本周有望见顶，上周美联储主席鲍威尔继续释放鹰派信号，甚至表示“准备根据经济需要调整缩表规模”，全年基准利率预期正迅速向3.75%-4%靠拢。但节奏上，我们认为9月13日美国8月份CPI公布前后可能将迎来本轮美联储紧缩计价打满的契机，具体可以观察10年期美债利率见顶回落（预计在3.5%左右），或者衍生品加息计价回落的关键信号，上轮加息周期也呈现“买预期卖事实”的规律；年内来讲，我们也认为随着经济下行压力的加大以及通胀持续回落，届时风险资产将迎来反弹的时间窗口。基于上述判断，以及外部欧洲央行紧缩步伐的提速，结合7月份以来CFTC的美元指数非商业净多头和美元指数走势明显背离，我们认为本轮美元指数有望逐步见顶。4、大宗商品华泰期货表示，商品分板块来看，尽管近期原油价格持续走低，但全球原油仍在持续去库存，俄乌局势紧张的背景下，全球原油供给格局仍然偏紧，给予原油价格一定支撑。有色金属短期迎来一定反弹契机，一方面是宏观情绪逐步转暖，并且美元指数有望逐步见顶回落，对美元指数敏感的有色金属相对受益；另一方是欧洲能源危机从成本端对价格仍有支撑，目前欧洲电价和天然气价格仍居高不下。的看涨逻辑最为顺畅，在此前干旱和高温天气的影响下，部分农产品减产的预期逐渐发酵，长期农产品基于供应瓶颈、成本传导的看涨逻辑也对价格提供支撑。贵金属短期需要警惕美债利率走高以及缩表的冲击。责任编辑：杨红卜
浙江义乌等多地要求商家下架槟榔,36岁男歌手因口腔癌去世，曾劝网友远离槟榔,环球时报,2022年09月12日 20:59,2007年，傅松因参加湖南卫视《快乐男声》并获得长沙赛区20强正式出道，第二年他发行了自己的首张EP《白雪公主》，之后凭借歌曲《一边唱歌一边哭》获广州市流行音乐年度最受欢迎男歌手奖。遗憾的是，就在9月10日，傅松因口腔癌去世，终年36岁。他的朋友在悼念他时说：“愿他一路走好，愿他在另外一个世界，再没有槟榔，没有痛苦，没有癌症。”据了解，傅松出生于湖南常德，平时很爱嚼槟榔。2021年，傅松因脸部长肿瘤就医，被确诊为口腔癌，之后便入院进行治疗，他也发Vlog分享自己的抗癌经历，未料经过一年的医治，仍未好转。他痛苦地表示，自己最大的幸福是希望夜晚的时候伤口不疼，这样他就能睡个好觉。此外，他的影片还劝喜欢嚼槟榔的网友不要抱着侥幸的心理，要远离槟榔。“我只是想以我的经历来告诉大家，槟榔真的很可怕。”广电总局要求：早前，2021年9月17日，国家广播电视总局办公厅发布通知，要求停止利用广播电视和网络视听节目宣传推销槟榔及其制品。通知原文如下：各省、自治区、直辖市广播电视局，新疆生产建设兵团文化体育广电和旅游局，中央广播电视总台办公厅、电影频道节目中心、中国教育电视台：广电总局决定，自即日起，停止利用广播电视和网络视听节目宣传推销槟榔及其制品。各广播电视和网络视听机构要高度重视，增强“四个意识”、坚定“四个自信”、做到“两个维护”，严格落实意识形态工作责任制和广告宣传也要讲导向的要求，抓紧组织进行核查清理，确保上述要求落到实处，维护人民群众利益，营造良好传播环境。长期嚼槟榔为何会致癌？嚼槟榔是不少人的爱好，然而，槟榔早被世卫组织列为一级致癌物。据中新经纬消息，公开报道显示，早在2003年，国际癌症研究中心就把槟榔列入“黑名单”，为一级致癌物。至于致癌原因，一是槟榔里的化学物质经咀嚼后，形成的亚硝基，是明确致癌的化合物；二是槟榔较硬，咀嚼时易对口腔黏膜造成机械创伤。原国家食药监总局在2017年公布致癌物清单时，已将槟榔果列入一级致癌物。2017年，中南大学湘雅医院口腔颌面科在《中国牙科研究杂志》发表了一篇关于湖南口腔癌患者数量的研究论文，文中对长沙当地五所医院口腔癌患者进行统计，发现从2006年到2016年，十年间因槟榔导致的口腔癌患者所占比例从23.94%飙升至85.53%，人数则翻了将近20倍。2019年，国家卫健委在《健康口腔行动方案（2019-2025年）》的解读中提到，要对长期咀嚼槟榔等高危行为进行干预等，促进群众养成健康的行为和生活方式。在中国，厦门是较早对槟榔进行地方监管的城市，早在1996年该市就禁止在当地生产、销售槟榔。今年，广州也开展了对槟榔广告的清理工作，自3月18日起，全市媒体、户外广告均已停止发布槟榔广告，广州还加强了槟榔广告的日常监测，从源头上管控槟榔广告的发布活动。2019年3月，湖南槟榔食品行业协会也曾要求成员单位停止国内全部广告宣传，在报纸、电视等媒介不允许发布槟榔广告。责任编辑：梁斌SF055
证券,上市猪企加速出栏，牧原股份8月或实现“日赚一亿”,市场资讯,2022年09月12日 20:56,一财网下半年，猪价仍难跌。上市猪企的8月销售简报披露完毕。尽管国家发改委投放3.77万吨冻猪肉储备，以缓解猪价上涨幅度，但伴随着中秋与国庆传统假期、秋季开学季，猪肉终端消费大幅提振，猪价逆势走强。中国养猪网数据显示，截至9月12日，全国外三元生猪价格报23.6元/公斤，较8月同期涨价约2元/公斤，涨幅约10%。整体看上市猪企8月销售简报，近2个月猪价相对高位支撑，上市猪企的收入呈现明显增长，部分出栏量亦环比实现不俗提升。目前，机构对上市猪企的调研频率颇高，头部猪企均预计下半年整体猪价或好于上半年，上市猪企能否在全年最后四个月实现业绩扭亏，备受市场关注。8月份猪企加速出栏根据上市猪企披露的8月份生猪销售简报，大部分猪企均在有序加快出栏速度，冲刺全年目标，受益于猪价持续运行于20元/公斤上方，大小市值猪企的销售收入均录得不同程度增长。数据显示，主流15家上市猪企共出栏生猪976万头，（002714.SZ）占比一半，销售生猪488.7万头；（300498.SZ）出栏150.41万头；（000876.SZ）8月出栏几乎与7月持平，销售生猪94.28万头。“猪茅”牧原股份的三季度盈利情况备受市场关注。上半年，公司归母净利润亏损66.84亿元，几乎亏掉去年全年利润（69.04亿元），领亏板块。8月份销售简报显示，牧原股份创下年内单月销售收入新高，或实现单月日赚一亿。牧原股份8月销售生猪488.7万头，环比增长6.4%，同比增长89.8%，实现销售收入116.6亿元。1~8月份，牧原股份的生猪出栏量合计达4076.2万头，已超2021年全年水准（4026.3万头）。牧原股份在9月2日的机构调研中表示，近两个月公司完全成本在15.5元/公斤左右，若按每头猪均重100公斤~110公斤计算，8月牧原股份盈利约33.28亿元~40.9亿元，或已实现日赚一亿。温氏股份的养猪业务也在8月扭亏为盈。今年8月，公司销售肉猪150.41万头（含毛猪和鲜品），销量仅次于今年1月，实现收入38.89亿元，出栏量环比、同比分别增长13.58%、14.76%。从8月份的销售情况来看，相比大市值猪企，小市值猪企的出栏提速更快。（002840.SZ）8月份出栏12.95万头，增速最高，同比涨幅高达惊人的24倍，推动单月生猪销售收入同比增长2966.74%，为3.21亿元。（002100.SZ）、（002385.SZ）分别出栏20.6万头、34.03万头，同比增速均超20%，分别为24.17%、25.9%；（603363.SH）出栏48.36万头，出栏量环比上升比例为12.67%。同为小市值猪企的8月出栏量出现下滑，但较为理想的猪价仍支撑公司收入实现增长。唐人神8月生猪销量8.71万头，环比下降5.49%；销售收入合计3.7亿元，同比上升209.74%，环比上升8.77%。（002157.SZ）仍被现金流压得喘不过气，公司8月份出栏生猪环比、同比均继续下滑，且出栏均重偏低，为75.66公斤。猪价表现强势，三季度业绩可期从猪价及上市猪企的出栏情况来看，本轮猪周期底部已过，上市猪企的盈利有望伴随猪价逐步得到修复。中秋假期前，发改委再次要求国储节前释放储备猪肉缓解猪价上涨幅度，即将投放3.77万吨冻肉，以缓解猪价上涨幅度。但从肉价走势来看，受中秋、学生返校需求刺激，终端消费支撑肉价难跌。中国养猪网数据显示，截至9月12日，全国外三元生猪价格报23.6元/公斤，较8月同期涨价约2元/公斤，涨幅约10%。而自7月以来，全国生猪价格一直位于20元/公斤上方。猪价后市怎么走，关系到上市猪企三季度能否实现单季度盈利。近期，机构对上市猪企的调研幅度明显提升。9月1日~2日，牧原股份接受了、博时基金、中欧基金、嘉实基金等头部机构调研，公司预计下半年猪价将好于上半年情况。对于新增产能建设情况，牧原股份称，上半年，公司资本开支主要用于支付已完工工程款项，不涉及新增产能建设，预计今年年底公司生猪养殖产能可达7500万头左右。温氏股份于8月30日~9月1日连续参加、和广发证券秋季策略会（线下），共计8场次，天风证券、长江证券和广发证券等61家机构共102位投资者参与。温氏股份也表示，按照历史经验，下半年需求一般比上半年好，主要原因是下半年天气转凉，有利于猪肉食品消费，同时下半年传统节假日较多，中秋、国庆和元旦等节假日备货需求提高以及过年部分地区有腌腊需求。“目前暂未有明确的2024年肉猪出栏规划。”温氏股份称，公司全年资本开支计划约40亿~50亿元，类型上聚焦于猪业养殖小区、生猪屠宰项目和养鸡项目等，其中，上半年累计固定资产投资约15亿元。基金配置方面，小市值猪企更是成了公募基金二季度调仓换股的“宠儿”。以（维权）（002548.SZ）9月9日发布的定增报告书为例，公司确定此次发行价格为5.98元/股，发行股数1.17亿股，募集资金总额约7亿元，实际募集资金净额为6.89亿元。本次发行对象最终确定为7位，包括资管机构、险资、券商以及公募基金。基金方面，财通基金本次定增认购金额最多，达到2.21亿元，获配3693.98万股；诺德基金次之，为1.92亿元，获配3214.88万股。二季度，4只基金对傲农生物进行了增持，上投摩根远见、财通优势行业轮动、华安宝利3只基金，新晋成为傲农生物的前十大流通股股东。7~8月份出栏加速显著的天康生物，获得了社保基金与多家公募基金的增持。二季度，全国社保基金106组合、银河证券新晋成为公司第六、第七大流通股股东。财通基金与鹏华基金旗下共计4只产品均是大手笔买入天康生物。“目前看，能繁母猪有所反复，本轮猪周期尚未反转，尽管市场各方对反转的分歧仍然较大，但从目前板块估值来看，各家上司猪企的头均市值明显处于低位。短期看，国庆假期在即，猪肉价格或难出现较大幅度下跌，进而对上市猪企下半年业绩形成支撑。中期看，我们认为，全年猪价仍是易涨难跌，周期反转大概率将在明年上半年出现。”某养殖行业分析师对第一财经记者说。责任编辑：卫晓丹
国际财经,中国代表：中方呼吁三国三思而后行，放弃对抗行径,环球网,2022年09月12日 20:54,国际原子能机构九月理事会会议将于12日举行。中国常驻维也纳联合国代表王群当天在会议召开前接受记者采访时表示，此次会议如何处理美英澳核潜艇合作问题，是检验国际原子能机构（以下称“机构”）防扩散职能的试金石。王群说，中方已要求本次理事会会议继续设置“美英澳核潜艇合作所涉核材料转让及其保障监督等影响《不扩散核武器条约》（NPT）各方面的问题”这一由理事会三次协商一致通过的议题，保持对三国核潜艇合作的政府间讨论。王群表示，经过前三次理事会会议讨论，机构广大成员国更为深入地认识到三国核潜艇合作的严重负面影响、特别是其防扩散风险和隐患，有的国家还在NPT第十次审议大会上散发了工作文件，广大成员国也对相关工作文件对三国合作所表达的关切表示支持。中方将在12日提交相关工作文件，阐述有关看法和立场。王群指出，美英澳三国核潜艇合作超出了现有国际核不扩散体系，也超出了机构秘书处的职责范围，不是三国可以私自处理的事情，必须由机构成员国来管。根据机构《规约》和理事会、大会议事规则，机构秘书处应该、也只能按照成员国的授权行事。王群表示，如果美英澳三国搞政治操弄，胁迫秘书处越俎代庖、无视成员国职责，擅自就核潜艇合作提出保障监督建议，同时利用“小圈子”和理事会成员构成方面的缺陷，强行推动上述建议，不仅缺乏法理依据，是无效的，同时也将严重破坏机构团结、瘫痪机构职能，使机构分崩离析。为此，中方呼吁三国三思而后行，放弃上述对抗行径。王群最后强调，中方希望国际原子能机构继续秉持中立，为解决三国核潜艇合作对核不扩散体系的影响提供平台。希望机构成员国继续在三次协商一致通过的议题下展开政府间讨论，聚焦三国核潜艇合作的本质和真相，以实际行动共同捍卫《不扩散核武器条约》，维护国际和平与安全。（总台记者朱赫）责任编辑：梁斌SF055
美股,欧洲央行Schnabel：通胀率近期可能进一步上升,环球市场播报,2022年09月12日 20:52,欧洲央行执委IsabelSchnabel在一个研究会议上说，央行当前的评估显示，“在管理委员会接下来的几次会议上，我们预计将进一步加息”以确保通胀回到2%的目标。责任编辑：王茂桦
