板块名,标题,作者,日期,新闻内容
新浪科技,扒开Kindle大面积缺货表象：亚马逊在华业务持续收缩,媒体滚动,2022年01月04日 21:17,来源：华夏时报记者/闫晓寒卢晓作为的明星产品，Kindle此次缺货备受关注。1月4日，Kindle因国内官方自营店的产品大面积缺货，被外界认为是国内Kindle产品线出现异常情况、亚马逊电子书业务要退出中国市场的信号。当天，《华夏时报》记者就此问题致电亚马逊官方客服。该客服对记者表示，“目前收到的消息是Kindle部分机型在中国市场热销导致缺货，与退出中国市场没有关联，Kindle一切业务正常运营。”他还表示，此次缺货可能是仓库库存或亚马逊供货链的问题，亚马逊官方处于观望状态。进入中国市场近十年来，亚马逊的Kindle业务曾在中国市场快速增长，而随着越来越多竞争对手的加入，这一产品正逐渐“失宠”。记者发现，在Kindle京东自营店旗舰店中，仅有一款入门级Kindle产品在售，其它商品均显示缺货。该店客服对《华夏时报》记者表示，“商品没货是因为厂家缺少芯片，且部分商品热销。”他还表示，此次缺货并非下架，后续产品会陆续到货，但具体到货时间暂无法确定。京东是Kindle在中国大陆市场唯一的线上销售渠道。上述亚马逊客服对《华夏时报》记者表示，2019年亚马逊就已经不再销售Kindle设备，当时亚马逊将Kindle设备的线上经销权全权授予淘宝和京东。目前Kindle设备线上只授权给京东售卖，所以亚马逊中国官方网站设备无法下单是正常情况。需要提及的是，就在去年9月份，亚马逊还发布了零售价为1068元的第五代KindlePaperwhite，但京东自营店显示已没有该设备出售。盘古智库高级研究员江瀚对《华夏时报》记者分析认为，对于亚马逊来说，Kindle业务是个比较有影响的业务，但占比并不算高。“这个业务不排除退出中国市场的可能，因为包括Kindle在内的整个墨水屏、电子书阅读器行业，这些年在中国市场的发展都处于不温不火的状态。”互联网分析师葛甲对《华夏时报》记者表示，Kindle在同类产品中具有先发优势，但随着智能手机的普及、阅读习惯的变化、竞争对手的崛起，多年来它在中国发展得并不顺利，其盈利模式也受到挑战。他认为，Kindle以低于成本的价格销售设备，盈利主要通过后续销售数字版权。但在中国市场数字版权交易并不活跃，这一盈利模式也随之失效，而持续已久的缺芯加重了它的成本压力。2007年，亚马逊推出第一款Kindle电子阅读器。2013年，Kindle正式进入中国市场，六个月后它传出已在中国实现盈利。进入中国五年时间里，Kindle在中国市场累计销售数量达到数百万台。2017年，亚马逊还和中国移动咪咕公司联合推出了专为中国市场定制的全球首款联合品牌Kindle。当时，亚马逊方面称，中国已经成为Kindle全球最大的市场，并且该市场每年都以两位数的速度增长。不过，近年来除了科大讯飞、掌阅以及海信等企业纷纷推出电子阅读器外，微信读书、QQ阅读等活跃用户高于Kindle的电子阅读App，这些竞争对手的出现正逐渐挤压Kindle的生存空间。目前，亚马逊在中国市场业务包括海外购、亚马逊全球开店、Kindle和亚马逊云计算业务。作为亚马逊在中国市场为数不多的业务之一，此次被外界认为它要退出中国市场的背景是，2019年7月，进入中国市场15年的亚马逊宣布不再运营中国国内市场业务并停止向商户提供服务。这意味着亚马逊不再在中国市场开展自营电商业务。此前的2018年8月，亚马逊还停止了为中国第三方卖家提供亚马逊物流卖家服务，在国内的运营中心由最早的15个缩减至只剩上海运营中心和若干保税仓。葛甲认为，亚马逊在中国发展了多年，策略出现了重大问题。过去由于亚马逊的战略保守，没有跟进国内电商的“价格战”，导致它在中国市场未能站稳脚跟。他对《华夏时报》记者表示，“中国市场对于亚马逊来说是一个比较重要的市场，但在整个市场的竞争过程中，亚马逊在中国市场的竞争水平比不上阿里、京东、等企业，所以一些业务的收缩或者是预期下降是很正常的。”但亚马逊此前在中国业务的收缩并不影响全球资本市场对它的看好，截至1月4日，亚马逊市值达到1.73万亿美元，是的5倍、京东的16倍。
新浪科技,宿华离开后，快手的“组织震荡”与“业务洗牌”,雷锋网,2022年01月04日 21:05,作者/二维马编辑/王亚峰宿华卸任，程一笑上台，一场权力震荡的余波正在快手蔓延开来。尽管坊间关于宿华之妻唐宇煜要成为快手经管委成员的消息层出不穷，但在快手内部，员工们还没有收到关于新一届经管委的通知。一位内部人事的观点是，目前来看，快手应该没有谁需要被邀请进入经管委。喧嚣背后，此次风波的主角，快手投资部和快手游戏的领导者唐宇煜，则是一如既往的安静又低调。作为宿华的妻子，唐宇煜的一些可能的职位变化，在宿华离职后被解读为了宿华对于快手影响力的延续。而这种影响力，又正好撞上了现任CEO的意志，发出了一声沉闷的声响，在快手内外蔓延开来。权力的震荡不一定是斗争的结果，但是权力的变更一定会带来不安和变化。把快手这段时间所有的消息汇总起来，追本溯源，才能看清这头房间内的大象究竟面临着什么样的困境，又在应对什么样的问题。被称为“女王”，唐宇煜这个名号或许过于夸张。不少人认为，由于没有足够多的“战功”，她在快手内部的地位并没有外界所想像得那么重，但她的名气与她的地位可是完全不相匹配。这个名气可能来自于她的丈夫，这种特殊之处令她在内部备受侧目。一方面，总有人认为这个身份帮助她在职场上不断前进，甚至能够做到神挡杀神，另一方面，这个身份也令她的每一个动作都被无限放大，从而引来无数争议。从2018年开始，宿华在公司开始主要负责商业化、国际化和职能部门。而程一笑负责主站产品、运营、游戏、电商等部门，唐宇煜则是一直负责快手的游戏业务。唐宇煜的北京是在开心网做过社交小游戏，2013年离职后，她先是与宿华共同创业，之后随着宿华加入快手。在快手唐先是负责创新团队，后来创新团队孵化出了快手游戏对战小平台快手电丸，唐宇煜又接手了快手游戏。近两年唐宇煜又成为了快手投资的负责人，成绩不算好，分管范围却在不断扩大，成为了她在快手内部受到质疑的原因。快手游戏怎么样呢？公认的看法是，快手游戏业务并不出色，不论是在自研、联运还是发行、渠道上都无甚亮点，乃至于已经成为了边缘业务。但在2018年的时候，快手的游戏业务一度有冲到快手业务核心的机会。一切都与当时的游戏行业大变局有关。2016年，在《王者荣耀》彻底统领MOBA手游后，围绕大逃杀模式，和在FPS游戏方面开始了又一轮的较量。网易自研团队在第一时间开发了搭载2016年才发布的Messiah引擎的FPS游戏《荒野行动》；而腾讯方面则与韩国蓝洞工作室合作开发端游PUBG的正统手游续作《绝地求生》，蓝洞负责美术和端游版的全套体系，腾讯负责手游版的技术支持和体验优化，以及手游的代理发行与运营。由于腾讯再次动用了赛马制，天美和光子两个工作是分别上线《全军出击》和《刺激战场》两个版本，导致网易的《荒野行动》抢先上线公测，比腾讯早了整整104天。这一次落后让腾讯非常恐慌，为了稳住局势，腾讯充分发挥腾讯的渠道优势。当时中国所有主流电竞直播平台上关于《荒野行动》的评测，疑似在第一时间都被做了一轮降权处理，所在专区的名字被改成“吃鸡手游”；而腾讯《绝地求生》上线后，这些专区又被改名为“绝地求生”，然后单独给《荒野行动》开了一个专区以示公平；《荒野行动》的直播间一旦超过10万人，就会触发“黑屏机制”。这场争斗激烈到什么程度呢，举个例子，当时网易找到熊猫直播，要包下未来两个月的所有广告位。腾讯得知后，直接以两倍的价格把熊猫的广告位抢了回来。之所游戏直播对于腾讯和网易来说如此重要，是因为大部分C端用户，还是通过看游戏赛事的方式进入游戏的。吃鸡是个新鲜的手游类型，大部分玩家都没体验过，那么直播可以用最小的成本给他们带来身临其境的体验感，不少人就此入坑。所以游戏直播最大的作用是，可以快速吸引聚拢垂直玩家，因为成为了二者的必争之地。当时的国内几大游戏直播平台中，苏宁收购了龙珠直播，熊猫直播市场份额萎缩。腾讯在2018年3月以4.6亿美元投资了上市前夕的，6.3亿美元投资了。腾讯在“扫货”市面上的电竞直播平台之时，快手的游戏直播业务也曾一度进入了腾讯的视野。至于腾讯为什么会看上快手，除了要联合快手打压字节跳动外，快手用户与用户重叠度高也是一个原因。正巧快手也想要发展一下游戏业务，从直播入手也是条路。这两家关系一度非常亲近，讨论过很多投资和合作方案，腾讯一度要求要占快手3~4成以上的股份。但是两者之间的合作并未取得最终的成功。值得注意的是，快手和虎牙、斗鱼不一样，快手有自己的游戏自研和渠道业务，而且没有放弃的打算。它与腾讯之间不可能永远处于游戏直播产业链的上下游。等到了《刺激战场》横扫全网的时候，腾讯的“吃鸡”焦虑已经大为缓解。大数据显示，2018年第二季度，该游戏活跃用户突破1480万人。快手对于腾讯的作用已经没那么大了。二者之间无法调和的业务冲突，加上腾讯对游戏直播的依赖度大幅下降，这些成为了横亘在快手游戏路上的两大障碍。任宇昕亲自出面否决了腾讯大规模投资快手并深度合作的建议。最终双方的关系浅尝辄止，腾讯只是成为了快手的一个小股东。时至今日，快手游戏依然在泥泞中前行。用一位行业专家的话来说，快手的自研产品，不能说不如字节，只能说无法比较。自媒体《竞核》曾统计过，2021年快手共推出3款中重度手游产品，包括《三国志威力无双》《镇魂街：武神躯》《一起来飞车2》。截至10月21日，上述三款手游在国区AppStore游戏畅销榜排名都在Top400开外。而字节的《花亦山心之月》打出了一个小爆款，冲到了AppStore畅销榜的第一名。而作为游戏推广渠道，字节也领先了一大截。SLG游戏《文明与征服》在今年的推广过程中，曾经比较过抖音和快手两家的性价比，最终还是选择了抖音，尽管抖音的价格更高。做产品研发需要一定的时间和运气，做渠道需要好的流量，在这两条路都走不通的情况，做游戏还有最后一条路，就是像字节收购知名的游戏公司沐瞳科技一样，快手也去以收购带动研发，盘活整个游戏业务。这就构成了游戏投资二部门联动的基础。外界环境的变化，快手在游戏业务上的资源劣势，成为了游戏部门负责人唐宇煜接手快手投资部门的根本原因。游戏做得好不好，投资做得好不好，唐宇煜负有责任，如果真有绝世强人能顶起快手游戏这一盘大棋，或许换个人就不一样，但是没有这种强人的时候，或许换个人还是一样。快手的另一项业务，国际化，这几个月也在剧烈震荡。国际化是宿华此前负责的核心业务之一，负责人是前国际化事业部首席运营官仇广宇。仇广宇来快手负责国际化一事，还曾引发了宿华和程一笑的一场争论，最终以宿华胜利告终，国际化也按照宿华的意志贯彻了下去。而宿华离职，程一笑接手，国际化事业部大调整迫在眉睫。根据“志象网”的报道，快手针对不同国家、地域和市场成立产品独立团队的模式已成为过去，2021年8月，快手国际化事业部关闭了主打美国市场的Zynn，并且计划发起了代号为“Trinity”（三合一）的产品合并行动，计划将Kwai中东、Kwai拉美与主打东南亚市场的SnackVideo这三个原本独立的应用合并成Kwai。之后，这个与国内主端产品结构一致的Kwai将会成为快手在海外的唯一产品形态。产品合一的同时，组织架构上也进行了一轮升级，将不同地区的运营团队、产品团队及中台部门整合，搭建起统一的产品中台和运营中台，以优化海外业务的协同和资源使用效率。原拉美市场负责人邵凯被任命为快手海外运营总负责人，原中东市场负责人徐智威成为快手海外产品总负责人。他们均向快手高级副总裁仇广宇汇报。有消息称，邵凯已经离开快手。邵凯，原为滴滴拼车事业部总经理，于2019年6月加入快手，负责快手极速版业务。2020年3月，邵凯成为快手美洲区总经理，负责快手在北美和拉丁美洲的发展。当年，Kwai拿到了巴西传统节日六月节期间知名度非常高的SoJoo音乐节的全程转播权，在Kwai应用内播出音乐节期间的45场演唱会，并邀请部分歌手做独家直播，在巴西用户中掀起了一段观看高潮。南美市场是快手在过去几年最高光的海外市场，2019年第三季度，Kwai多次登顶巴西应用总榜第一，并持续霸榜前三。和北美市场一样，采用了通过现金补贴进行社交裂变的方式进行快速扩张。早期拉新中，老用户介绍一个新用户可获得6美元的奖励，随着TIkTok入局竞争，这一奖励上升到了20美元。快手和TikTok在南美进行了一场烧钱大战，虽然Kwai入局更早，但是烧钱烧得更尽兴的TIkTok很快就占据了上风。周受资上任TikTokCEO后的一次业务会议上，他得知了Kwai的追赶速度和10亿美元的投入预算，表示“快手烧多少，我们也烧多少，只多不少”。在宿华卸任之前，国际化是快手最受重视的部分。今年6月份与中央广播电视总台举办的联合发布会上，出于对国际化战略的信心，宿华当众宣布快手全球月活跃用户数达到了10亿。不过这一数字很快就在第二季度财报中被证实并不准确，快手月活用户只有5.06亿。但是既然宿华已经卸任，烧钱又烧不过TikTok，那么既往的国际化战略还要不要再坚持下去呢？新的领导团队选择不要。没过多久，快手国际化风格突变：不再局限于用户数量增长，变现成了重中之重。去年10月底快手在巴西上线了广告平台KwaiforBusiness，启动信息流广告和开屏广告，并已在海外市场测试直播中的虚拟礼物打赏。这是快手国际首次在海外推出品牌化的广告平台，命名和业务上都在对标老对手TikTok旗下广告平台TikTokforBusiness。其次有消息称Kwai已经在巴西开始测试直播电商，用户观看Kwai上的直播内容时可以直接在内容下的链接中点击购买商品，无需跳转外链。测试期间，Kwai单场直播的时长从30分钟到一个半小时不等，主要取决于商家的销售目标以及观看直播用户的参与情况。快手在去年二季度的财报中显示，当时海外月活用户1.8亿，与一季度相比同比增加了80%，同时二季度销售及营销开支同比增长100.8%，达到113亿元，海外营销占总营销成本的三分之一。第三季度财报已经不再提及海外用户数量。宿华走了，谁能接替宿华挑起他在快手的大梁呢？在一些接近快手的人看来，唐宇煜肯定不行，因为没有足够服众的业绩。马宏彬和王剑伟算是两个干将，尤其是马宏彬，在快手内部声望颇高。他作为K3的总指挥，在快手极速版的推广上打了一场漂亮的胜仗，给快手增加了亿级用户，这一场战功让他成为了快手的股肱之臣。王剑伟打好了快手春节的增长战，这成为了他近两年来快速升迁的基础。今年5月，王剑伟从快手原运营负责人严强手中接过了用户增长，之后日活跃用户规模相关数据有明显回升。根据快手三季度财报，快手日活跃用户数已增长至3.2亿，相比上个季度增幅近10%。但这些并不足以支撑他们两人上位。无论从资本市场的影响力、在快手的资历和业绩、以及个人威望而言，CEO的位置都非程一笑莫属。快手去年2月上市，彼时资本给出了2000亿美元的市值，十个月后，快手市值只剩下了五分之一。快手在这几年来做的最对的一件事情就是选对了上市时机。去年2月还属于港股的牛市，金融市场信心十足，但是很快转为熊市，快手股价大幅下挫也受到了大环境的影响。宿华退位，资本市场的压力占了很大一部分原因。程一笑上位的时机也不错。快手股价虽然仍在不断下行，但是基本已经在谷底附近徘徊，下探的空间不大，之后的上行预期良好。只是恰逢熊市，对于互联网公司而言，向来有牛市看增长，熊市看收入一说，快手这几个季度的增长都不错，第三季度的月活突破5.7亿，单季度净增了6670万用户，营收增长了33.4%。可惜亏损数值高，三季度净亏损率23.5%，比二季度稍有下降，但是不多，所以资本市场不敢现在下赌注。股价上不来，程一笑压力大；因为压力大，所以要收窄亏损；为了应对亏损，降本增效第一要务。快手前三个季度总营收为566亿元，而包括61亿元的期权激励开支在内，公司的雇员福利开支达到160亿元。如果能大幅度降低公司雇员成本，快手就能有效收窄亏损。裁员，从哪个部门开始？在脉脉的一个快手员工爆料中，亏损中的快手正在进行一场大裁员，涉及主站、国际化、商业化等多块业务，国际化裁员幅度达到30%，整体裁员幅度约10%-15%。这都是宿华此前的直管业务。裁员寒冬已至。当然裁员的重点只是在某些业务上。所有快手员工都感受到了降本增效的威力。近期快手下调了员工福利，取消三年以上老员工房补，取消免费三餐、取消下午茶等等也是降本增效的一环。在低谷中挣扎的快手在等待着股价重新回升的那一刻。至于要等到什么时候才能看到市值回春的希望，从大环境的走势来看，程一笑还是必须慢慢熬。现在快手最需要什么？快手需要的是自信。程一笑作为中国最卓越的产品经理之一，当年关于产品是有着自己的自信的，但是在融资受阻的阶段，他的自信被摧残得差不多了，所以之后才有果断赠股，让宿华入局。宿华入局后引进了推荐引擎的技术，并且转战短视频，重新打造了快手的产品自信。在2018年以前，快手都是中国短视频第一梯队的领头兵，所以当时也有自信。但是抖音在六个月之内日活翻番，从不如快手变成反超快手时，快手内部的自信又丧失了。2018年之后，快手一直处于努力追赶抖音的状态，虽然位于行业第二，但是外有腾讯作为股东不断加持，一起对抗抖音，又有大规模烧钱打下来的K3战役、春晚战役带来的稳定增长，所以宿华一度认为这条道路是可行的。等到了国内短视频行业趋于饱和的时候，快手又顺利上市，资本市场给了快手不错的估值，更是让宿华和快手到达了超级自信的状态。但是这种自信很快又破灭了。因为上市之后，快手市值不仅一路走低，而且幅度惊人，这让快手上下坐立难安，甚至要依靠改换CEO来打上一针镇定剂。如今程一笑接替宿华，启动了内部大变革，从组织人事到产品战略上开始了一遍遍地刷新。如果没有足够的自信在背后支撑变革的意志，战略就会陷入左右摇摆的困境。那么怎么能够让老板有足够的自信？答曰：首先要实事求是，不要恐惧逃避，客观面对问题，别急着甩锅，把自己的责任扛起来。这一切做到了，才有机会找到正确的方向，才有耐心等到柳暗花明的那一天。
新浪科技,上热搜了！全线缺货！Kindle要退出中国市场？官方回应→,央视网,2022年01月04日 19:31,来源：央视财经1月4日，电子书阅读器Kindle全线缺货引发网友猜测其是否将退出中国市场，登上热搜。针对这一消息，央视财经记者联系了亚马逊中国，对方回应称：我们致力于服务中国消费者。消费者可以通过第三方线上和线下零售商购买Kindle设备。Kindle电子书阅读器深受消费者青睐，部分机型目前在中国市场售罄。据记者调查，目前在亚马逊中国官网上，Kindle全线产品已显示无货状态，平台上的Kindle官方自营店铺也出现大面积无货现象，仅剩一款青春版电子书阅读器在售。而在去年10月，Kindle在淘宝上的官方店铺已经关闭。
新浪科技,记者走访Kindle线下店：未收到亚马逊退出中国市场消息,澎湃新闻,2022年01月04日 19:06,记者/邹佳雯2022年1月4日，有网友发现，Kindle在旗舰店大面积下架，澎湃新闻记者查询发现，kindle京东自营旗舰店目前仅可买到一款青春版Kindle设备，Paperwhite、Oasis等常规机型显示无货。4日上午，“Kindle或退出中国市场的词条”登上热搜，不少网友认为，Kindle大面积缺货是电子书业务要退出国内的信号。当日上午，记者线上咨询京东旗舰店客服，客服表示，他们得到的通知是“缺货是因为缺芯片，具体到货时间不定”。亚马逊官方客服表示，没有收到退出中国市场相关的通知，电子书和设备相关的售后服务等仍在正常运营。亚马逊内部工作人员向记者透露，目前没有听到亚马逊是否会退出中国市场的确切消息。当日下午，记者走访了Kindle在上海的线下门店。徐家汇美罗城商场的Kindle门店已关闭，该门店在点评网站的最新评论停留在2021年12月30日。通过点评网站上留下的电话，记者联系到了美罗城店店长许先生。许先生表示，美罗城的门店开了有七八年时间，暂时不开了，可以去世博源门店购买。许先生进一步表示，在美罗城店闭店前，上海仅有这家和世博源Kindle两家总代理的门店，其他都是经销商。关于网上的亚马逊或将退出中国市场的言论，他表示自己看到了，但具体情况“不知道，官方没有跟我们说”。许先生表示，目前，Kindle总代理门店有青春版和Paperwhite的部分型号，最新版Paperwhite5目前无法直接到店购买，需要预订，但可以较快订到；Oasis目前无货，之后会不会到货暂时没有消息。而在Kindle旗舰店世博源店，销售人员同样表示，没有听说Kindle将退出中国市场的事情，“最近我自己就刚刚买了一台KindlePaperwhite5，我想应该是不影响后期继续使用的。”销售人员表示，“近期销售正常。”此外，Kindle在百脑汇的经销商柯先生向记者表示，其在2015年开始在百脑汇商城卖Kindle，经典款KindlePaperwhite有少量存货，但“这批卖完应该也不会进货了”。记者在柯先生的店铺看到，Kindle产品属于其营业内容的一部分，他同步出售其他品牌的录音设备、电子阅读设备、电子配件等。柯先生表示，亚马逊Kindle的新款还在出，但在他看来，亚马逊中国的Kindle设备要退出中国市场的传言，不是没有根据。他分析：“青春版、Paperwhite、Oasis，Kindle的产品线目前就这几个，比较少，不像别的品牌会有产品线的拓展。此外，现在大众可以选择的电子阅读设备、品牌这么多，竞争激烈，Kindle并不具备价格优势；再加上Kindle的质量确实很好，不容易坏，大家更新换代的速度也不够快。”之后，记者就实地探访的情况再次致电亚马逊中国官方客服，客服表示，购买设备需找对应销售渠道咨询，无货只能等待后续到货。关于亚马逊中国会否退出中国市场，他们仍未接到相关通知。此外，亚马逊中国此前就相关问题回应澎湃新闻记者称“我们致力于服务中国消费者。消费者可以通过第三方线上和线下零售商购买Kindle设备。亚马逊提供的高品质客户服务和保修服务不会改变。Kindle电子书阅读器深受消费者青睐，部分机型目前在中国市场售罄。”
