板块名,标题,作者,日期,新闻内容
国际金融论坛,彭华岗：最近在研究全球发展倡议，望全球工商界积极参与实践,睿见Economy,2022年12月04日 15:26,12月2至4日，国际金融论坛（IFF）2022全球年会以线上会议方式在广州南沙举行，中国国务院国有资产监督管理委员会秘书长彭华岗出席并演讲。彭华岗表示，国资委、中央企业积极践行全球发展倡议，在国际化经营中，秉持共同利益观、可持续发展观，目前中央企业在全球100多个国家和地区有8000多个机构和项目，这些项目运作过程当在帮助了所在国的经济发展，改善民生，走上可持续发展道路，同时直接带动了近百万人的就业，积极履行社会责任，实现了发展成果的共享。“前不久召开的上海第五届进博会虹桥国际经济论坛上，国资委和有关机构一起启动了‘践行全球发展倡议，建设世界一流企业的行动’，目的要携手全球伙伴共同践行全球发展倡议，以新的理念，新的思路，新的办法来落实联合国可持续发展目标，助力所在国经济发展和民生福祉的改善”，彭华岗称。彭华岗指出，国资委推动中央企业把全球发展倡议变成务实行动，在助力全球发展中贡献国资、央企的力量。“老话说：独行快，众行远。可持续发展是大家的共同心愿，也离不开大家的共同努力，企业是促进经济社会发展的重要力量，也是全球发展倡议的直接实践者和受益者”，他说。彭华岗还就工商界践行全球发展倡议提出了六点建议：第一是凝聚全球发展共识，为促进各国共同发展贡献工商界的力量。彭华岗说，发展是解决人类挑战的总钥匙，国资委愿意和各国工商界一起聚焦加快落实联合国2030年可持续发展议程，按照自愿、平等、互利的原则，在更大范围，更深层次加强合作，把企业的发展融入所在国的经济社会发展，积极助力所在国转型发展，产业变革，促进全球经济高质量的发展。第二是创新商业合作模式，助力全球更可持续发展。彭华岗说，要破解发展难题，就需要我们敢于创新，大胆创新，国资委愿意和各国工商界一道针对发展中国家普遍面临的债务负担问题，不断的丰富和创新合作模式，积极探索实行非债务一揽子的项目合作模式，立足投资先行，不增加所在国负债，通过规划引领，项目聚合，产融融合，多方合作，形成系统化解风险的解决方案，以高质量，负责任的发展为世界经济发展注入新的动能。第三是积极履行社会责任，让发展成果惠及更多的民众。彭华岗说，国资委愿意和各国工商界一道持续践行ESG理念，积极支持国际减贫事业，努力帮助当地发展基础农业，完善基础设施，力所能及的解决就业、医疗、教育等民生问题，积极促进妇女儿童权益保护，社区治理等等，让民众有更强的获得感和幸福感。第四是要坚持绿色低碳可持续发展，共建人类美好家园。彭华岗说，地球是人类共同的家园，需要所有人共同呵护，国资委愿意与各国工商界一道尊重自然，顺应自然，保护自然，强化规划引领，坚持创新驱动，推进产业结构，绿色低碳转型，大力发展循环经济，推动资源集约，循环利用，加强绿色经济合作，助力建设一个清洁美丽的世界，促进人与自然的和谐共生。第五是坚持普惠平衡开放包容，促进全球经济均衡发展。彭华岗说，追求幸福生活是各国人民的共同愿望，国资委愿意与各国工商届一道维护全球自然贸易规则，促进基础设施互联互通，助力全球产业链、供应链安全稳定，为创造普惠平衡，协调包容，合作共赢，共同繁荣的全球发展新时代贡献中国企业的力量。第六是在务实行动当中，践行全球发展倡议，共同培育全球发展的新动能。彭华岗说，授人以鱼不如授人以渔，国资委愿意与各国工商界一道积极帮助发展中国家、脆弱国家和特别困难国家挖掘发展潜力，坚持平等互惠，围绕减贫抗疫、人力资源培训、人员粮食安全、工业化、数字经济、绿色发展等重点领域加大投入，着力分享发展经验，共享发展理念，推动不同文明间相互交流，助力所在国提升可持续发展能力。彭华岗指出，在推动世界可持续发展过程当中，仅仅依靠国际组织，依靠各国政府是不够的，更多要依靠全球的工商领域来积极参与。“我们真诚希望更多的工商界朋友践行到全球发展倡议的行动中来”，他说，最近国资委在积极研究全球发展倡议，“我们能不能把它具化到工商界一看就能知道自己想干什么的这么一个文件，能够团结全球的工商界领域一起来行动，来践行全球发展倡议，把全球发展倡议更好的转化为我们全球发展成果，为全球民众带去福祉，共建更加美好的人类命运共同体”。新浪声明：所有会议实录均为现场速记整理，未经演讲者审阅，新浪网登载此文出于传递更多信息之目的，并不意味着赞同其观点或证实其描述。责任编辑：梁斌SF055
期货,证监会：12月6日上午江泽民同志追悼大会默哀期间，证券期货、银行间债券等停止交易三分钟,财联社,2022年12月04日 15:26,财联社12月4日讯，今日下午，央行、证监会同步发布公告，将于12月6日上午，江泽民同志追悼大会默哀期间，停止证券期货市场、银行间债券市场、货币市场、外汇市场、票据市场、黄金市场交易三分钟。央行发布公告，为表达对江泽民同志的无比崇敬和深切悼念之情，根据江泽民同志治丧委员会公告（第2号）精神，在12月6日上午追悼大会默哀期间，银行间债券市场、货币市场、外汇市场、票据市场、黄金市场临时停止交易3分钟。证监会发布公告，为表达对江泽民同志的无比崇敬和深切悼念之情，根据江泽民同志治丧委员会公告（第2号）精神，在12月6日上午江泽民同志追悼大会默哀期间，证券期货市场临时停市3分钟，默哀结束后恢复交易。责任编辑：戴明SF006
期货,俄罗斯拒绝西方设置60美元油价上限 警告将作出回应,环球网,2022年12月04日 15:22,来源：澎湃新闻12月2日，欧盟、七国集团（G7）和澳大利亚宣布批准对俄罗斯海运石油设置每桶60美元的价格上限。对此，克里姆林宫表示不会接受最高限价，警告将对此作出回应。据半岛电视台12月3日报道，俄罗斯总统新闻秘书佩斯科夫当日表示，俄罗斯不会接受最高限价，并警告将在分析情况后作出具体回应。欧盟、G7和澳大利亚2日批准了对俄罗斯海运石油设置每桶60美元的价格上限，该协议将于12月5日生效。欧盟委员会主席冯德莱恩在一份声明中表示，“G7和所有欧盟成员国已经做出了一项决定，这将对俄罗斯的收入造成更大的打击，削弱其在乌克兰的战争能力。”冯德莱恩还表示，此举“将帮助稳定全球能源价格，使目前面临高油价的世界各国受益”。美国立即对欧盟的协议表示了欢迎。白宫国家安全局顾问柯比2日向媒体表示，美国始终坚持认为，（对俄罗斯石油出口）设立价格上限，有助于限制俄石油收入及其军事行动。俄罗斯常驻维也纳国际组织代表乌里扬诺夫警告称，支持设置油价上限的欧洲国家会后悔这样的决定。“从今年开始，欧洲将在没有俄罗斯石油的情况下生活。”乌里扬诺夫在推特上写道，“莫斯科已经明确表示，不会向那些支持价格上限的国家供应石油。欧盟很快就会指责俄罗斯使用石油作为武器。”半岛电视台报道称，俄罗斯已经提前为这一决定做好准备，或将使用一些替代基础设施将其石油出口到不签署价格上限协定的国家。责任编辑：张靖笛
新浪科技,大众将向欧洲销售中国制造电动车，涉及旗下西雅特品牌车型,市场资讯,2022年12月04日 15:17,12月2日，大众汽车宣布将效仿特斯拉、宝马等，从中国向欧洲出口电动汽车，理由是其本土市场的产能有限。大众旗下西班牙品牌西雅特Cupra将在其位于安徽的一家合资工厂生产其首款电动SUVTavascan，将于2024年进入欧洲市场。（@老板联播）
证券,周末影响市场重要资讯回顾,市场资讯,2022年12月04日 15:14,摘要：人民银行、证监会宣布12月6日江泽民同志追悼大会默哀期间临时停市三分钟措施；央行：完善境外机构境内发行债券资金管理推动金融市场进一步开放；上交所：服务推动央企估值回归合理水平推动打造一批旗舰型央企上市公司；证监会同意广州期货交易所开展工业硅期货和期权交易；01本周多重利好带动A股市场上涨，沪指创10月以来反弹新高。周内支持房企股权融资“第三支箭”落地，同时防疫优化政策持续推进，投资者风险偏好明显回升，市场成交热度走高，资金做多意愿增强。海外方面，美联储再放“鸽派“信号，鲍威尔在讲话中暗示，美联储最早在12月就会放慢加息脚步，同时美国PCE物价指数增速如预期放缓，市场对于联储加息预期继续降温，带动全球股市多数回暖。02本周申万一级31个行业中来看，多数收涨，社会服务、食品饮料、美容护理等行业涨幅领先；煤炭行业表现相对较为弱势，为唯一收跌行业。1）本周社会服务、食品饮料、美容护理等疫后复苏概念板块领涨盘面。主要催化为本周以广州、北京等为代表的一系列城市进一步优化调整了疫情防控措施，在实际执行层面向“二十条”靠拢，给予资本市场更强的防疫优化和经济活动复苏预期。2）本周煤炭为唯一收跌板块。基本面变化不大，主要为资金面板块轮动所致。上周煤炭板块涨幅居前，部分短期资金有止盈需求，同时本周多方利好刺激下疫后复苏概念及金融地产等低位价值板块得到资金关注，“虹吸效应”带来板块轮动。03◆【兴证策略】顺势而为，修复继续内外部风险缓和之下，市场有望进一步回暖。11月以来国内疫情出现反复，成为对经济预期以及A股市场的主要抑制力量。而当下：1）防疫措施优化下，市场对于经济的担忧有望缓解。2）各项“稳增长”政策也在加速落地，并有望托底经济。11月中旬以来，降准、“金融十六条”、地产“第二支箭”延期扩容等政策宽松措施密集加码，11月28日证监会又宣布，决定在股权融资方面调整优化5项措施，标志着支持地产融资的“第三箭”射出。3）外部风险也在减弱，外资大幅回流。尽管12月2日公布的美国11月非农和平均时薪数据再超预期，但市场仍在继续博弈美联储12月放缓加息脚步，带动美债利率、美元指数回落，外资重新回流，11月11日以来陆股通北上资金已大幅流入809亿。4）从估值、股权风险溢价来看，当前市场仍处于高性价比的底部区域。截至12月2日上证综指12.4倍、创业板指39.5倍的PE估值仍处于历史底部区域，与此同时股权风险溢价也分别处于2010年以来74%和95%的历史高位。结构上，短期内继续重点关注大消费+国企央企的修复机会。◆【华鑫证券】蓄势前行，跨年行情可期宏观环境来看，外滞降温，内稳发力，W型反转的支撑还在。海外方面，市场对于美联储紧缩预期趋于缓和，加息拐点确认。国内方面，PMI连续两个月跌落至荣枯线之下，高频数据显示经济再度探底，倒逼稳增长加码发力。外部紧缩预期缓和，内部经济维稳加码，W型反转行情已经启动。目前全A股权风险溢价高位波动，中长期市场底再确认，短期情绪波动不改上行趋势。年底政治局会议和中央经济工作会议对2023年政策定调或将偏积极，防疫优化、货币宽松、泛财政发力、稳地产和专项债提前下发等政策可期，助力经济疫后修复，驱动A股跨年行情。风格选择上，跨年行情价值风格的胜率较高，涨幅也有相对优势。叠加中国特色估值体系重构、年底稳增长政策预期强化驱动。04◆人民银行、证监会宣布12月6日江泽民同志追悼大会默哀期间临时停市三分钟措施中国人民银行12月4日公告称，在12月6日上午追悼大会默哀期间，银行间债券市场、货币市场、外汇市场、票据市场、黄金市场临时停止交易3分钟。证监会同日公告称，在12月6日上午江泽民同志追悼大会默哀期间，证券期货市场临时停市3分钟，默哀结束后恢复交易。◆央行：完善境外机构境内发行债券资金管理推动金融市场进一步开放（新华社）为进一步扩大金融市场双向开放，近日，中国人民银行、国家外汇管理局联合发布《中国人民银行国家外汇管理局关于境外机构境内发行债券资金管理有关事宜的通知》，完善境外机构境内发行债券资金管理要求，进一步便利境外机构在境内债券市场融资。《通知》主要内容包括：一是统一银行间和交易所市场熊猫债资金登记、账户开立、资金汇兑及使用、统计监测等管理规则。二是规范登记及账户开立流程，熊猫债发行前在银行办理登记，允许分期发行中首期登记开户、后续发行后逐次报送发行信息，并可共用一个发债专户。三是完善熊猫债外汇风险管理，境外机构可与境内金融机构开展外汇衍生品交易管理汇率风险。四是明确发债募集资金可留存境内，也可汇往境外使用。◆沪深交易所制定新一轮《推动提高上市公司质量三年行动计划》（新华社）沪深交易所对标中国证监会《三年行动方案》要求，衔接上一轮三年行动计划，对未来三年推动上市公司质量工作做出了总体性安排。新一轮三年行动计划，紧扣服务实体经济主线，坚持两个“毫不动摇”，加大对科技创新企业和高端制造业的支持和倾斜力度，注重发挥化解上市公司风险在防范资本市场整体风险中的作用，以更大的力度推动改善市场生态，不断凝聚提高上市公司质量的合力和共识。◆上交所：服务推动央企估值回归合理水平推动打造一批旗舰型央企上市公司上交所制定了新一轮央企综合服务相关安排，涉及央企上市公司的主要举措有三方面。一是服务推动央企估值回归合理水平。推动央企上市公司主动与投资者沟通交流，提升透明度，组织引导各类投资者走进央企、了解央企、认同央企。二是服务助推央企进行专业化整合。配合国务院国资委开展央企专业化整合，为央企整合提供更多工具和通道，推动打造一批旗舰型央企上市公司。三是服务完善中国特色现代企业制度。持续推动央企上市公司在完善公司治理中加强党的领导，积极引导央企上市公司用好股权激励、员工持股等各类资本工具，不断完善实现高质量发展的体制机制。◆沪深交易所就资产支持证券业务规则公开征求意见为了进一步发挥资产支持证券服务实体经济功能，加强投资者权益保护，12月2日，沪深交易所分别发布《上海证券交易所资产支持证券业务规则（征求意见稿）》《深圳证券交易所资产支持证券业务规则》，并向社会公开征求意见，意见反馈截止时间为2022年12月9日。南开大学金融发展研究院院长田利辉对《证券日报》记者表示，推动资产支持证券的发展，能够盘活存量资金、促进资本市场的建设，更好地支持企业成长和实体经济发展。资产证券化产品出售给资本市场的投资者，能够有效盘活资产。◆证监会同意广州期货交易所开展工业硅期货和期权交易证监会近日同意广州期货交易所开展工业硅期货和期权交易。工业硅期货和期权是广州期货交易所挂牌交易的首个品种。工业硅是“硅能源”产业的重要原料，属于绿色低碳品种。我国是全球最大的工业硅生产国、消费国和出口国。推出工业硅期货和期权，对于完善工业硅价格形成机制、提升市场主体风险管理能力和助力我国低碳经济发展具有积极意义，符合广州期货交易所服务绿色发展的定位。◆监管机构要求四大行向房企提供带担保离岸贷款？房企人士：消息属实据媒体周五报道，中国监管机构要求四大行在12月10日前向房企提供以国内资产做担保的离岸贷款。对此，一位Top5房企人士向财联社记者证实，该消息属实，目前已有大行与其进行了沟通。◆深圳房地产重磅会议召开！落实落细“金融16条”“三支箭”哪类房企最受益（证券时报）近日，深圳金融管理部门组织召开房地产金融工作座谈会，部署落实落细“金融16条”政策，要求进一步加大银企对接力度，继续加大房地产信贷投放，做好贷款合理展期。随着信贷、债券、股权三个融资渠道“三箭齐发”，房地产融资“开闸”，多家房企获得金融支持。据中指研究院统计，截至12月1日，万科、龙湖、美的置业与绿城拿到银行授信个数最多，均为8家银行；在已申请储架式注册发行的房企中，龙湖规模最高，为200亿元；、、等近10家企业公告筹划再融资。另外，对房企授信总额度最高，为6550亿元。◆“金融16条”渐次落实！多家银行均可受理个贷延期最长12个月（券商中国）近日，多家银行在广州地区推出个人房贷延期还款服务引起广泛关注。据悉，不同银行面向广州用户提供的还款延长期限最长可达12个月。12月2日，券商中国记者咨询多家大行、股份行方面了解到，自2020年新冠肺炎疫情以来，各行均有推出包含个人消费贷和按揭贷款在内的个人贷款延期还款服务，近期这项服务主要面向呼和浩特市、新疆地区多个城市、重庆市、河南省等受疫情影响较为严重的省市，其他地区申请延期还款的用户，主要由经办行受理审批、个事个办。◆支持多子女购房、提高公积金贷款额度、限时补贴多地购房支持政策密集出台近日，多地购房支持政策密集出台。12月1日，安徽安庆发布住房公积金新政，对多子女家庭首次申请住房公积金贷款购买自住住房，最高贷款额度增加10万元。11月30日，江西九江也优化多子女家庭住房公积金业务，提高多子女家庭住房公积金贷款最高限额。另外，黑龙江哈尔滨拟于12月中旬举办2022年冬季新建商品房（线上）展销会，展会期间将推出契税、交易税补贴，以及发放大额建材、家电消费券等优惠政策。此外，安徽黟县、河南虞城等地也推出购房限时优惠，发购房补贴、契税补贴、家电礼包等。◆恒大集团召开保交楼专题会议许家印出席2022年12月2日，21世纪经济报道记者获悉，恒大集团于今日晚间7时召开保交楼专题会议，董事会主席许家印出席并讲话。截至目前，恒大集团各项重点工作正在稳步有序推进中。2022年11月28日，中国恒大行政总裁、执行董事肖恩在接受21世纪经济报道记者采访时表示，集团和各业务板块将全力保障“保交楼”等重点工作稳步有序推进，倾力维持新能源汽车、物业服务等板块的生产运营，尽力探索对集团核心资产的高效处置和有效盘活。◆：大幅下调2022年度业绩预告歌尔股份公告，大幅下调2022年度业绩预告，预计2022年净利润17.1亿元-21.4亿元，此前预计净利润40.6亿元-47亿元；公司直接损失和资产减值损失约20-24亿元，对2022年度经营业绩产生显著影响。◆：11月新能源汽车销量23.04万辆上年同期为9.12万辆比亚迪公告，11月新能源汽车销量23.04万辆，上年同期为9.12万辆。今年前11个月，新能源汽车销量为162.8万辆，比上年同期增长219.38%。◆美国11月新增非农就业26.3万就业增速高于预期（界面新闻）尽管美联储积极加息，努力减缓通胀和劳动力市场，但11月美国就业增速依然远高于预期。美国劳工部周五发布的数据显示，11月美国非农就业人数增加26.3万人，修正后的前值为28.4万人；由于劳动参与率下降，失业率维持3.7%不变。此前接受道琼斯调查的经济学家预计当月新增非农就业20万人，失业率为3.7%。上述数据可能不会使今年一直在稳步加息的美联储改变步伐。接近40年高位的通胀水平，引发了美联储自1980年代初以来最快的一轮加息。目前的联邦基金利率目标区间为3.75%-4%，是2008年以来的最高水平。◆美国电动车补贴惹怒欧洲马克龙“上门抱怨”拜登称不会道歉！美欧贸易战将开场？当地时间12月1日，美国总统拜登在白宫为到访的马克龙夫妇举办了隆重的晚宴，苹果CEO库克等企业家代表和好莱坞名人作陪，将马克龙的三天访问推向高潮。此次法国总统马克龙之行是拜登上台后首次迎来的外国元首国事访问。双方重申了两国深厚的盟友关系，表达了俄乌冲突上的对外政策团结。但在一片祥和之外，马克龙也不惮公开表达对美国的批评，特别是《通胀削减法案》对欧洲企业的伤害，直言补贴政策可能“导致西方的分裂”。◆美股三大指数均录得周线两连阳纳斯达克中国金龙指数本周累涨超22%周五（12月2日）美股低开后持续缩减跌幅，三大指数收盘涨跌不一，但周线上均录得上涨。截至收盘，道琼斯指数涨0.10%，报34，429.88点；标普500指数跌0.12%，报4，071.70点；纳斯达克综合指数跌0.18%，报11，461.50点。周线上，道琼斯指数累涨0.24%，标普500指数累涨1.13%，纳斯达克综合指数累涨2.09%。这也是三大指数今年10月以来的首次周线两连涨。责任编辑：常福强
