板块名,标题,作者,日期,新闻内容
证券,大消费不香了？医药+食品ETF份额大降！这类主题基金获大手笔加仓，行业龙头超跌反弹,数据宝,2022年10月30日 18:39,科技类ETF重新回到主流位置。10月以来，A股多个板块白马股、权重股出现调整。证券时报·数据宝统计，市值千亿的行业龙头股中，对于后市，基金公司认为目前市场进入了机会大于风险的区间。华夏基金表示，市场信心仍在恢复过程中，但上证50、沪深300等主要指数估值均处于底部区域，风险溢价也已到极具性价比阶段，具备明显配置价值，立足长远进行长期机会的把握是当前的更优选择。10月股票型ETF份额逆市增长在大盘指数持续走弱同时，ETF（交易型开放式指数基金）份额逆市增长。数据显示，截至10月29日，股票型ETF份额达到8421亿份，较上个月底增长179亿份。研报显示，在三季报中，基金对新能源车的配置比例有明显的降温，从16.3%降至12.8%。包括矿产资源、动力电池、正负极材料、隔膜、整车等多个产业链环节被减配。基金绝对持股比例最高的四个行业中，除了食品饮料本季度的持仓比例持平之外，电力设备、医药、电子的配置比例均有所下降，这意味着机构对于权重热门行业的配置在这个季度出现了明显的降温，持股的集中度出现分化。数据宝统计，10月以来，超半数股票型ETF份额较上个月出现增长，基金份额减少的占比不到四成。规模指数ETF中，华宝中证100ETF份额增长幅度最高，与上个月相比，该基金份额增长1倍以上。该ETF于8月初上市，第三季度利润亏损0.56亿元。据悉，该ETF头号重仓股是，三季度末持仓市值达到0.49亿元，其次是、中国平安等。主题指数ETF中，信息技术相关的基金份额增长较多。如国泰中证全指软件ETF、博时金融科技ETF、天弘中证沪港深物联网主题ETF、嘉实中证软件服务ETF、嘉实上证科创板新一代信息技术ETF等基金份额增幅均达到30%以上。国泰中证全指软件ETF份额增幅排在第一位，该基金第三季度利润亏损0.38亿元，期末头号重仓股为，其次是、等。与医药、电池、食品相关的主题ETF份额出现下滑。数据宝统计，方正富邦中证医药及医疗器械创新ETF、富国国证疫苗与生物科技ETF、银华中证中药ETF、浦银安盛中证智能电动汽车ETF、华泰柏瑞中证中药ETF等基金份额降幅超30%。科技类ETF获大幅加仓从二级市场表现来看，10月以来大消费板块出现明显回撤。数据宝统计，食品饮料10月以来跌幅21.06%排在首位，其次是房地产、家用电器。计算机、国防军工、机械设备等行业逆市上涨，其中计算机指数涨幅11.43%遥遥领先。计算机行业龙头股中，、、-U、、恒生电子等在低位出现反弹迹象。主题指数ETF出现与行业板块同样的走势。数据宝统计，10月以来，鹏华中证酒ETF、华夏中证细分食品饮料产业主题ETF、银华中证细分食品饮料ETF、华宝中证细分食品饮料产业主题ETF、华安中证申万食品饮料ETF等跌幅排在前五位，这些ETF均与食品饮料相关。鹏华中证酒ETF跌幅最大，10月以来下跌20.19%。该基金于2019年5月上市，最新基金规模超百亿元。截至三季度末，贵州茅台、五粮液、、等4只白酒龙头持仓市值均超10亿元。数据显示，这4股10月以来均出现大幅下跌，其中泸州老窖跌幅超过30%。23只主题指数ETF期间涨幅超过10%，其中大部分与信息技术相关。新华中证云计算50ETF、嘉实中证软件服务ETF、招商中证全指软件ETF、国泰中证全指软件ETF、华夏中证云计算与大数据主题ETF等涨幅排名前五位。新华中证云计算50ETF累计涨幅15.33%居首，该基金于10月初逼近年内低点后反弹，三季度末头号重仓股为恒生电子。责任编辑：冯体炜
国内财经,富士康郑州科技园党委书记回应：网图非原创,第一财经,2022年10月30日 18:25,原标题：富士康郑州科技园党委书记独家回应一财：网图非原创面对当下富士康及富士康员工面临的疫情防控压力，苏东霞感慨：“如今，我们的企业（因为疫情）病了，请善待它（这么多年的努力）”。今日（10月30日），一则“郑州富士康党委书记苏东霞公开发文字回应社会关切”的网图流传甚广，但第一财经记者向富士康郑州科技园党委书记苏东霞本人求证后得知，这实际上是某些自媒体未及时求证导致的“乌龙”。“我也是转载的（同事的截图），并非原创。”苏东霞说，自己昨晚（10月29日）看到一些朋友不断表达对于富士康员工“逃离”的关切后，虑及过去的10多天来，自己和同事们为了保障几十万富士康员工做出的努力，很是感慨，就发了一个朋友圈，并转载了上述截图作为背景图片，结果，别人再转载时，却只转载了背景图片，由于其中语言并未其本意的全部表达，这最终给苏东霞带去了意料之外的哭笑不得。面对当下富士康及富士康员工面临的疫情防控压力，苏东霞感慨：“如今，我们的企业（因为疫情）病了，请善待它（这么多年的努力）”。（曾被误传的网图）一则来自郑州航空港区疫情防控指挥部的最新信息称，10月30日下午，富士康已开始统一组织人员和车辆，全力以赴确保富士康员工顺利安全返乡。对于近期一些有返乡意愿的员工，本着充分尊重员工意愿的原则，航空港区也积极与相关员工输出地政府沟通和协调，在严格落实疫情防控规定的前提下，安排公安、交通、属地办事处和富士康企业，统一组织人员和车辆，启动员工点对点返乡工作。在返乡前，充分尊重员工的去留意愿，与企业员工进行充分沟通，去留自愿，并做好点对点保障。按照疫情防控规定，加强返乡员工做好个人防护，安排核酸检测，协调省内相关地区做好接收，点对点闭环运输车辆，确保员工安全有序返乡。同时，对于自愿留在企业生产生活的员工，将进一步优化、细化各项疫情防控措施，定期对厂区、员工宿舍消毒，在确保安全的前提下，全力组织好企业无疫情车间厂区的生产。同时，将积极做好在企员工的食宿、核酸检测、身体健康保障等工作，为员工提供医疗及关爱服务，开放线上、线下各类咨询渠道，竭尽全力为员工提供后勤服务及关爱保障。责任编辑：冯体炜
国内财经,富士康怎么了？公司做出最新情况说明,第一财经,2022年10月30日 18:23,昨日（10月29日）起，河南多地政府致信本地在郑州富士康工作人员，今天此事有了富士康方面的回应后续。今天（10月30日）下午，“郑州发布”连发两条消息，通告“富士康给员工连发三条关爱通知：去留自愿，做好保障，并附上返乡乘车地点和电话”，“全力以赴确保富士康员工顺利安全返乡”。而在30日下午6点的最新声明中，富士康对第一财经记者表示，照护员工是集团经营的首要原则。当前，在地方政府的指导下，集团郑州园区正持续落实防疫措施，实施了闭环管理、点对点通勤、每日核酸及抗原筛查、免费为员工提供三餐、增设24小时关爱热线、志愿者服务等员工关爱举措，并持续为员工提供最新的防疫信息及宣导。富士康称，郑州园区与政府配合防疫，目前状况已在逐步控制之中，集团也会协调其他厂区产能备援，以降低可能的影响。富士康发生了什么？10月29日，第一财经刊发《河南多地致信本地在郑州富士康工作人员》与《当地政府已向郑州富士康派驻工作组》后，今日（10月30日）下午，富士康方面对于目前郑州厂区的情况做出介绍，表示将全力以赴确保富士康员工顺利安全返乡”。“针对园区内的同仁，在符合防疫安全生产规范下，集团会全力保障员工生产安全及健康照护；由政府统筹管理的爱心观察区员工，集团也会尽最大努力，持续协调地方政府，为员工提供必要的物资供给与生活保障；目前园区内相关物资供应充足，会待疫情逐步稳定后，恢复先前因防疫而暂停的堂食等正常措施，以提高员工生活的便利性与满意度；针对部分有返乡意愿的员工，园区已联合政府统一组织人员和车辆，从今日起做好员工点对点有序返乡服务。”富士康在最新的声明中称。在“郑州发布”中的第一条通告中，显示富士康内网连发三条通知，对自愿留在公司厂区的员工和意愿返乡员工分别进行了保障安排，“凡自愿留在公司厂区的员工，港区政府与公司会联合保障大家正常的生产生活秩序，保障大家的健康安全和正当权益、工资收益，并改善大家的生活、工作环境。”“郑州航空港区管委会和富士康公司将统一组织人员和车辆服务大家。”“经与港区政府协商，政府将从今天下午开始统一派出大巴车将返乡人员点对点送到目的地”。第二条通告进一步宣告称，“本轮疫情传播速度快，但病毒载量低，截至目前，富士康厂区未发生重症感染现象，疫情总体可控。”早在两周前，富士康郑州科技园已经开始加强了疫情防控措施。富士康郑州科技园曾在10月18日晚间20点14分发布公告，对二线门岗管控及核酸检测时间作出调整，称自当晚21点起，员工/厂商只开通一个区权限，每天早晨的4点到9点和晚间的16点到21点可正常上下班，其他时间段进行管控。核酸检测时间也分为白晚班，白班为早晨7点到10点，夜班检测时间为19点到22点。10月19日，园区进一步发布公告称，为配合政府防疫措施，餐饮场所取消堂食，郑州综保区自10月19日15：00起全体员工返宿就餐，郑州园区各事业群正常出勤员工由公司免费提供一日三餐。不仅如此，在这封通告中，富士康对于员工的行为作出了非常详细的规定，要求员工“简化个人行程，宿舍（住所）、园区两点一线，减少不必要的行程轨迹，进入厂区需提供24小时核酸阴性证明后方可进入二线门岗”。在园区工作需全程佩戴N95口罩，严禁在厂区内和路上摘下口罩，进入自己所住寝室后才可以摘下口罩。”在工位工作时每小时做一次快速手消毒，上厕所、喝水前后洗手并进行手消毒。使用后的口罩、手套、消毒湿巾等要投入医疗废弃物垃圾桶（黄桶），工作结束后使用75%酒精消毒湿巾对工位的看板、传送带、台面、托盘工具、座椅进行擦拭消毒。并指出，“绝不允许带病工作”。在10月21日的公告中，园区特别提醒员工，“按时喝中药增强体质，有症状及时上报”。10月24日，园区发布通告，宣布开通24小时关爱热线，iDPBG事业群、iPEBG事业群（含玻璃组立）均有专门的热线，此外还设立单独的24小时心理疏导热线，其中白班有3人，晚班有2人。10月26日，富士康再次发布通告，宣布为缓解园区内就医压力，协调了郑州市第一人民医院社康中心开通线上问诊，并提供了关于员工发烧需要药品处理作业的流程。有发烧员工需要药品，可在线上平台下单或社区问诊渠道，总务安排志愿者配送。称将尊重员工个人意愿办理离职手续截至发稿前，包括河南省禹州市、长葛市、沁阳市、西华县、鲁山县以及许昌市魏都区、平顶山市湛河区等在内的河南多地，均发布了致当地籍在郑州富士康工作人员的一封信，表示已做好当地户籍员工返回家乡的准备。各地均表示，确需返乡者需提前报备，落实“点对点”服务和相应的隔离措施。据富士康员工向记者介绍，早上已有来自于河南多个地区的“对接巴士”按照指定地点停靠，接送当地籍贯的在郑州富士康上班的老乡们回家。一位在富士康郑州港区工作的员工钱山（化名）对记者表示，目前富士康确实并没有对返乡人员进行出行限制，但是要求需要返乡的人员进行登记。在记者获得的一份登记表中显示，“（富士康）公司秉承尊重员工个人意愿的原则，如有员工想脱环返乡，可进行请假或申请办理离职手续。手续办理后，政府安排核酸检测并协调交通工具，点对点接送大家返乡。具体流程可参考员工脱环（返乡）流程告知书。员工返乡意愿登记，请您认真填写并保证资料准确性，方便快速联系到您。”而在10月28日富士康郑州科技园公众号曾发文《致所有同仁的一封信》。文中提到：关于外宿员工纳入闭环：员工根据个人意愿由张庄、外宿酒店回迁至宿舍区，建置郑州综保区防疫安全泡泡。富士康表示，关于点对点通勤包括豫康南、山顶、华鸿、富鑫、鑫荣、港城、枣园、富航公寓步行点对点通勤；豫康北、裕鸿、天成宿舍班车点对点通勤。此外，依政府疫情防控措施及闭环管理要求，防疫期间如有同仁想离职或希望脱离闭环返乡，必须先行至政府集中隔离点隔离满7天，并提供医学健康证明后，方可离港返乡（特殊群体如产妇、孕妇、残障人士等将协调政府办理）。公司绝对尊重员工个人意愿，各事业群一定依规为员工办理正常离职手续。钱山表示，她所在的产线是生产手机后壳产品的产品，身边走了不少人。“一般看一下工牌和照片就可以走了，现在听到的说法是三个月内回来办理离职可以（补回来）底薪。”据其介绍，目前她所在的园区生产线并没有停产，员工需要一天两检，显示异常的将会被转移到一个叫做“恒大未来之光”的地方。在宿舍隔离的次密接者，富士康提供包括面包、牛奶等食品。苹果产线影响几何？作为苹果在全球最大的生产基地，疫情对于富士康等供应链的影响也牵动着苹果手机的销量走向。苹果在中国拥有近万名直属员工，其供应链上还有数百万名工人。今年10月，苹果公布了2021年供应链名单，全球目前苹果供应商高达190家，仅中国大陆供应商就超过50家，是苹果最大的供应地区。目前正值苹果销量旺季。从产能布局来看，郑州富士康在当地拥有三个厂区，分别是郑州航空港厂区、经开区厂区、中牟县厂区。郑州厂区也是富士康为苹果生产iPhone的主要制造基地，有超过90条生产线，约30万名工人。IDC数据显示，2019年中国智能手机出口占全球智能手机销售额的27%，其中有1/4的出口额来自河南省，而富士康郑州工厂更是占河南省贸易总额的60%以上。2022年1月，郑州海关发布信息称，2021年，河南外贸进出口总值达8208.1亿元，同比增长22.9%，高于全国进出口增速1.5个百分点，以手机产业链为主的机电产品进出口占全省外贸比重超六成。其中，仅手机的出口总额就高达2727.2亿元，同比增长17.8%，占到全国的28.9%。10月27日，苹果公司发布了截至9月24日的2022财年第四财季业绩报告。财报显示，苹果第四财季营收为901.46亿美元，同比增长8.1%，高于市场预期的889亿美元，创下7~9月这一季的纪录；净利润为207.1亿美元，同比增长0.83%。对于富士康目前的情况，截至发稿前苹果并未做出回应。附富士康科技集团声明2022.10.30针对郑州园区疫情状况，富士康科技集团说明如下：1、我们深知，在当前疫情形势下，如何做好园区20余万员工的照护与安全保障是一场“持久战”，也关注到了外界对富士康的关心，恳请各界给予理解和支持。2、照护员工是集团经营的首要原则。当前，在地方政府的指导下，集团郑州园区正持续落实防疫措施，实施了闭环管理、点对点通勤、每日核酸及抗原筛查、免费为员工提供三餐、增设24小时关爱热线、志愿者服务等员工关爱举措，并持续为员工提供最新的防疫信息及宣导。3、针对园区内的同仁，在符合防疫安全生产规范下，集团会全力保障员工生产安全及健康照护；由政府统筹管理的爱心观察区员工，集团也会尽最大努力，持续协调地方政府，为员工提供必要的物资供给与生活保障；目前园区内相关物资供应充足，会待疫情逐步稳定后，恢复先前因防疫而暂停的堂食等正常措施，以提高员工生活的便利性与满意度；针对部分有返乡意愿的员工，园区已联合政府统一组织人员和车辆，从今日起做好员工点对点有序返乡服务。4、郑州园区与政府配合防疫，目前状况已在逐步控制之中，集团也会协调其他厂区产能备援，以降低可能的影响。责任编辑：冯体炜
美股,印马德里空气污染加剧 金秋首次达“严重”级别,看看新闻KNEWS,2022年10月30日 18:21,据报道，印首都新德里当天的空气污染情况继续恶化，达到印度空气质量评判标准中“严重污染”级别，也就是空气质量指数介于401至500之间。这是今年入秋以来，新德里第一次遭遇这个级别的空气污染。据预测，未来两天新德里的空气污染仍可能维持在“非常差”的级别，并且有可能在11月1号再次恶化至“严重污染”级别。近年来每到冬天，新德里都会出现严重的空气污染，主要原因是附近农民燃烧秸秆和居民燃放烟花爆竹庆祝节日。为减少污染物排放，今年德里地区下令禁止在传统节日期间燃放烟花爆竹，违者将被处以罚款、甚至面临监禁，但部分居民仍无视规定。（实习编辑：杜钰愉）责任编辑：王茂桦
产经,北京环球度假区将于10月31日恢复开放,新京报,2022年10月30日 18:14,编辑陈媛媛来源：北京环球度假区官方微博责任编辑：吴剑SF031
国内财经,前三季深圳GDP增3.3% 工业仍是拉动经济增长主引擎,第一财经,2022年10月30日 18:13,从深圳公布的前三季度成绩单可以看出，工业仍是拉动深圳经济增长的主引擎。10月29日晚，深圳市统计局正式发布，根据广东省地区生产总值统一核算结果，2022年一到三季度深圳地区生产总值为22925.09亿元，同比增长3.3%。其中工业生产恢复加快，前三季度深圳第二产业增加值为8364.64亿元，同比增5.2%；第三产业增加值为14540.51亿元，同比增2.2%。前三季度，深圳市规模以上工业增加值同比增长6.2%，比上半年加快0.3个百分点。从行业门类看，规模以上采矿业，制造业，电力、热力、燃气及水生产和供应业增加值分别增长7.8%、6.1%、7.0%。主要行业大类中，规模以上汽车制造业增加值增长105.9%，石油和天然气开采业增长6.6%，专用设备制造业增长7.0%，计算机、通信和其他电子设备制造业增长3.9%；主要高技术产品产量持续快速增长。令人瞩目的是，新能源汽车、充电桩、5G智能手机、民用无人机产量分别增长217.3%、130.0%、37.4%、28.7%。今年5月，深圳市重提“工业立市、制造强市”口号，夯实深圳制造业基本盘地位。今年以来，深圳已发布“20+8”产业集群政策、5个“30条”稳增长政策，近期又出台推动软件产业高质量发展政策，打造“国际软件名城”，如今深圳工业占GDP的比重已超过三成。广东省国研数治研究院执行院长熊义刚在接受第一财经采访时表示，这个增速高于全省（2.3%）、全国（3.0%）。但也要看到，外部环境更趋复杂严峻，经济稳步恢复面临压力和挑战极大，受疫情、收入下滑、人口外流、信心不足等影响，第三产业拖累严重，前三季度三产增速仅为2.2%，社消零增速仅为1.7%。可见，工业是拉动深圳GDP增长的主引擎。值得注意的是，进入到9月，深圳外贸逐渐回暖。前三季度，全市进出口总额26091.30亿元，同比增3.9%，比上半年加快2.5个百分点。其中，出口15241.58亿元，增12.9%；进口10849.72亿元，下降6.5%。一般贸易进出口增长5.2%，占进出口总额的51.0%，比重较上年同期提高0.6个百分点。据深圳海关数据，9月份深圳企业进出口额同比增长27.16%，实现大幅增长。其中出口同比增长51.98%，主要体现在一般贸易出口额大幅增长。对于出口贸易增长，主营国际物流业务的深圳市递四方速递有限公司近期有明显感受。其负责人告诉第一财经记者，9月份公司出口业务量比8月份有约15%的增长。主要原因一是年底欧美国家有几个重要的促销时间节点（黑色星期五、圣诞节、世界杯等），卖家在9月份便开始加大了旺季备货；二是由于欧洲能源问题，导致保暖类产品出货量有一定增长；三是公司加快美东和马来西亚等地区仓储布局，吸引了一定卖家进驻。熊义刚也认为，目前国际市场对“宅经济”商品、防疫物资、供暖储能等有较大需求，相关出口产业优势明显。虽然外贸、工业发展势头可喜，但要完成年初提出的经济增长目标还需努力。深圳大学经济学教授钟坚对第一财经表示，在疫情和国际国内经济形势下行压力下，深圳需要进一步夯实经济复苏的基础，培育新的动能和增长点。熊义刚建议，目前形势下，深圳依然要牢牢稳住工业基本盘，减少疫情影响，改善物流通关效率增加出口。同时要减少疫情防控对经济社会影响，增加居民收入与提振信心，促进投资消费，扭转服务业的颓势。责任编辑：冯体炜
证券,应莹：上证指数预计在2900点以下出现阶段性底部,市场资讯,2022年10月30日 18:06,这几周人民币快速贬值已达阶段性高点，市场将慢慢恢复理性，稳定外资的出逃。本周外资集中流出，导致外资重仓股的股价暴跌，在公司基本面没有变化的情况下形成了非理性的抛售行为。与外资关联度更高的港股市场，恒生指数本周跌了8.3%。投资者对美联储的11月加息已在预期之中，市场依然出现非理性的恐慌性抛售，市场的自我反射和自我强化已达顶峰。综合上述，上证指数预计在2900点以下出现阶段性底部，推荐和国家安全密切相关的绩优军工股。2022.10.30责任编辑：冯体炜
