板块名,标题,作者,日期,新闻内容
基金,刷屏！千亿私募大佬罕见发声,市场资讯,2022年10月15日 12:10,来源中国基金报记者任子青吴君A股3000点上下震荡之际，基金君从渠道获悉，10月13日晚间，千亿私募淡水泉投资总经理赵军举办了一场投资人线上交流会，谈到这两年公司产品净值下跌的原因，错过新能源布局窗口期的反思，以及未来投资能力建设的想法。他还讲到了对当前市场的理解、投资组合如何布局等。以下是淡水泉掌门人赵军的核心观点：1、我们布局的双低资产，在今年上半年遭遇冲击，是净值下跌的核心原因。2、我们认为很多机会应该在2021年下半年才具备布局价值，但市场突然展开一轮新能源行情。给我们的教训是要优化投资决策对信息的反应机制。4、对这些企业，分歧不在于成长趋势，而是在这样的趋势下，给多少倍估值，从而判断是不是机会。后来我们复盘，在投资方法论上，其实可以由宏观主题组打包做一些主题类的投资。5、一方面我们要坚持已有的基本面驱动投资，判断企业中长期价值；另一方面，面向未来相对不确定性的环境，加强自上而下宏观主题能力，这可能也是一个很好的平衡或适应市场的方式。7、稳增长相关的投资机会，可以定义为是受短期极度悲观的基本面和情绪压制以后的修复机会。8、具体到投资板块，消费板块具有韧性和弹性，消费建材等房地产产业链的基本面会有所改善，同时也会关注能源转型、企业数字化、AI应用等新兴成长行业的布局机会。10、今年淡水泉的净值回撤是过去十五年来最大的一次，团队内部也做了很多反思与认知。跟以往任何一次遇到阶段困难一样，我们要靠团队更加冷静地面对当下，专注在投资中，有信心能够渡过这段相对困难的时期。以下是此次线上交流的具体内容，供大家参考关于布局，赵军谈到，从国家统计局每月发布的制造业和非制造业采购经理人指数（PMI）可以看到，我们经历了一次明显的经济收缩。他们在调研企业时，也能从微观上感受到经济的压力。“在去年下半年，我们认为这种收缩程度已经具备了触发一次经济反弹周期的条件，所以我们利用经济收缩，在去年三、四季度布局了‘双低’资产。”何为“双低”资产，指在经济下行影响下，行业景气度低，但是预期未来景气度会回升；同时因为短期不好，市场对这类资产的预期和情绪较低。“我们布局的‘双低’资产，在今年上半年遭遇冲击，是净值下跌的核心原因。”赵军说。也有投资人问淡水泉，为什么没有跟上今年5、6月的市场反弹幅度。赵军解释，复盘市场可以发现，这一波市场反弹中以新能源为主的结构性特点比较明显。“淡水泉在2021年之前其实有相对重要的资产比例参与过新能源领域。去年12月汇报时讲过为什么错过了2021年二季度新能源布局的窗口期，当时我们认为市场位于一个调整期，尤其是核心资产整体情绪较高，面临一次高估值回落压力。我们认为很多机会应该在2021年下半年才具备布局价值，但市场突然展开一轮新能源行情。”“给我们的教训是要优化投资决策对信息的反应机制。过去我们让各产业组投资经理负责这些公司的基础覆盖和案头研究，发现机会来做立项讨论，后推荐给公司组合做配置建议。这样的决策流程，要有深度研究，包括实地调研、同行比较、上下游验证等，至少要1-2个月时间。”赵军坦言，正常的市场环境下，这种投研流程方法是可以的。但是在快速变化的市场环境下有挑战，比如发现潜在投资火花和立项之后但是还需要对很多信息和假设进行验证的时候，一个月已经涨了50、60%，还追不追？这样的情况还记忆犹新。赵军讲到现在淡水泉的改进，现在公司把整个工作流程前置，比如CIO和投委会成员在很多细分行业标杆公司的基础覆盖和案头研究阶段就参与到这些公司的调研和讨论中去，“不管有没有机会，我们要提前去感知了解，熟悉这些企业的状况，便于更精准、更快的识别和发现机会，发现机会后也可以更快决策行动。”到了2021年下半年，市场中声量最高的是新能源板块，情绪较高。赵军表示，站在2021年底，建立的基础认知是新能源在未来是值得我们长期重视的大赛道，有三个具备万亿空间的巨大市场：电动车、电池和储能产业链、光伏。但是他也称，在后续的市场发展中，根据淡水泉对这些行业的理解，在2022年参与新能源方面，仍有三方面的认知和市场有一些分歧：第一，他们认为过去这个市场是在供求关系迅速错配之后导致的高景气，而进入2022、2023年之后，这种供求关系的不平衡，会逐步走向平衡，甚至可能很多产业链的环节会进入供大于求的状况，很多细分行业和公司处于景气周期的后半段，估值定价会受到影响。第二，去年供求关系的急速错配导致部分原本平静的行业出现高景气度，表现为很多上游的价格上涨，但除电动车外，多数新能源行业属于ToB的商业模式，而ToB商业模式的属性是，如果供求相对平衡，要么是技术驱动，要么本质上是成本和效率驱动，最终比拼性价比，将回到一个合理利润率。即使上游短缺缓解、材料价格下跌，但在产业链不同环节中利润留存情况会怎样，淡水泉对此比较谨慎。第三，无论是光伏还是电池，虽然未来是需求量比较确定的上升市场，但是仍然会有工业品属性的特点，就是终将随技术进步、供求关系平衡，价格会有下降趋势。即使量增长很多，但是由于价格下跌使得市场容量或收入体量并没有显著增加，而行业估值定价可能从新兴成长向周期成长模型变化。所以基于这几方面认知，赵军表示，今年5、6月份新能源机会反弹时，他们认为更多是波动性的体现而不是基本面格局的系统性改善。“当然这中间还是有些新变化。比如疫情封控导致供应链受到冲击，在5、6月份供应链相对恢复之后，很多电动车的销量出现了明显的提高，所以带动一部分电动车产业链相关的机会。但经过最近一两个月的市场调整，很多也有较大回调。所以整体上新能源指数呈现了一个波动特征。”赵军坦言，淡水泉错过了一些结构性的细分赛道机会，股价并没有像指数这样波动，可能创出了新高。“无论是新技术驱动，还是细分领域一些板块短期供求错位的高景气机会，普遍的是一些中小市值公司，我们内部的产业组对其持续性有疑问。往后看一两年，如果这些公司缺乏真正的核心能力和技术，产业组往往不敢给估值。对这些企业，分歧不在于成长趋势，而是在这样的趋势下，给多少倍估值，从而判断是不是机会。后来我们跟宏观主题组复盘，在投资方法论上，其实可以由宏观主题组打包做一些主题类的投资。”通过这次市场给的一些经验和教训，赵军表示，“为更好地适应未来，一方面我们要坚持已有的基本面驱动投资，判断企业中长期价值，这是我们信仰的投资风格、投资能力；另一方面，面向未来相对不确定性的环境，加强自上而下宏观主题能力，这可能也是一个很好的平衡或适应市场的方式。这种能力在建设当中，还要不断积累实战经验，成为一种稳定的能力后才能循序渐进地提高应用比例。”另外，赵军也指出，当下的策略坚持并不是为了坚持而坚持。“我们在内部经常说，所有的投资组合布局，如果缺乏对它长期价值的判断，一定要把它换到你更有信心的机会上去，而不是说担心把它卖掉后会涨起来从而被动坚持。所以过去一段时间，我们还是在积极地调整组合。随着未来新信息、新变化，我们依然会遵循实事求是的态度，不断应对。”赵军表示，相信淡水泉布局的机会，在经济调整当中应该能够穿越周期。经过这一轮调整，优秀企业应该能够渡过困难期，最终实现超越历史上最好经营水平的业绩，在经济恢复常态之后，能迅速地获得更大的市场份额或竞争力。“这样的企业我们觉得具备长期确定性，是可能输时间但不输空间的机会。”回顾国内过去一年的经济发展情况，赵军表示，从2021年下半年开始，季度经济增速开始低于预期目标，但他认为，经济收缩的状态不可持续，未来依然能够回归至正常增长水平。“稳增长相关的投资机会，可以定义为是受短期悲观的基本面和情绪压制以后的修复机会。”具体到房地产板块，赵军称，房地产产业链的马太效应明显。经历了行业性的压缩调整之后，优秀的公司能够获得更大的市场份额和成长机会，消费建材等细分行业存在机会。未来几个季度，过度压制的基本面乃至于情绪面会有所改善。其次，消费板块具有韧性和弹性。赵军强调，2020年疫情发生以来，经济下行对就业、收入预期都有系统性影响。但即使在这样的情况下，因为存在巨大的国内市场基数，仍有很多细分赛道呈现可持续的结构化增长趋势，优秀的消费品公司表现出很强的抗经济风险的韧性，随着被压制的消费需求释放，这类公司在未来也会有很强的恢复弹性。除此之外，淡水泉也在关注能源转型、企业数字化、AI应用等新兴成长行业的布局机会。赵军表示，当前市场中的机会是多样的，会寻找更好的进入时机和投资标的。今年以来，市场大幅震荡，多家百亿私募业绩表现不佳，作为老牌私募的淡水泉亦是如此。以淡水泉旗下的某只代表产品为例，在今年复杂的市场环境下该产品业绩承压，净值回撤也是过去十五年来最大的一次。自2007年成立以来，淡水泉经历过多次市场底部，往往都是以高仓位、不断优化组合的方式参与其中，但同时也因为高仓位的操作承受了较大的质疑。赵军坦言，历史上每次这种情绪低迷的时候都会听到“这次不一样”的声音。他表示，要动态、变化地看问题，避免追逐市场情绪，相信独立思考、独立判断、知行合一的价值。很多时候我们感知到的也许只是一种情绪上判断的可能性，但情绪不具备预测能力。如果带着相对情绪化的态度去看问题，往往会把可能性当作是最后的预测，这是十分危险的。他强调，低情绪是投资的朋友，在这个时候尽管感受不好，但应该用常识和纪律应对极端情绪。将纪律作为知到行动的保障，可以减少一些情绪对投资的影响。“今年淡水泉的回撤在过去十五年来最大的一次，团队内部也做了很多反思与认知。跟以往任何一次遇到阶段困难一样，我们要靠团队更加冷静地面对当下，专注在投资中，齐心协力去应对好不确定性的环境，这也有赖于客户和合作伙伴的信任和耐心。我们有信心能够渡过这段相对困难的时期。”赵军说道。责任编辑：王涵
国际新闻,硬核又浪漫，还懂王羲之，她真是“宇宙级网红”！,新浪新闻综合,2022年10月15日 12:07,
美股,9月全球大类资产报告：加息风暴重挫全球金融市场，股债汇三市承压,第一财经,2022年10月15日 12:05,9月自美联储加息75个基点开始，英国、瑞典、瑞士等多国央行跟进加息操作，应对通货膨胀。激进加息下，美债利率快速上行，加深了利率曲线的倒挂程度。同时，俄乌地缘冲突升级，欧元区能源危机正逐渐转向金融危机，使得非美货币继续贬值，美元指数月内突破111大关，创20年以来新高，人民币对美元中间价时隔两年多再“破7”。三大市场表现排序为：大宗商品市场相对领先债券市场和权益市场。责任编辑：李园
证券,违规放贷逾千万！金华银行两员工被禁业5年并获刑丨局外人,界面新闻,2022年10月15日 12:00,记者王景张晓云近日，温州银保监分局公布的两张罚单，牵出了金华银行两名员工违规放贷逾千万的案件。罚单显示，陈某在金华银行温州分行员工违法发放贷款案件中因未有效履行贷前调查职责，被禁止从事银行业工作5年。沈某某同样因未有效履行贷前调查职责，被禁从事银行业工作5年。界面新闻记者查阅裁判文书网发现，该案已于2017年做出一审刑事判决。陈某和沈某某犯违法发放贷款罪，判处有期徒刑三年，缓刑四年，并处罚金人民币5万元。判决书显示，经审理查明，被告人沈某某、陈某均于2015年1月进入金华银行温州分行工作，分别担任金华银行小微贷款部门经理及下属信贷员。同年2月至4月，在经办林某介绍的张某、韩某、丁某、胡某、瞿某、单某等人共计人民币1100万元的个人经营性贷款中，被告人均未按规定对借款人的房产抵押评估价值进行核实，也未对借款人的经营场地开展实地调查即发放贷款导致出现贷款逾期。其中，对张某、韩某等人申请的不动产抵押加保证人保证形式的经营性贷款时，上述二人名下不动产的实际所有人林某伪造了二份虚高的房产抵押评估书，将上述二套不动产虚高价值共计人民币48万元，后二被告人以虚高后的房产评估书为参考，作出房产价值七折的抵押贷款及房产价值二折的保证贷款，共发放贷款人民币284万元，并造成贷款逾期，其中张某2房产实际价值145万，虚高价值人民币162万元，贷款人民币134万元（抵押贷款102万及保证贷款32万）、韩某房产实际价值135万，虚高价值人民币166万元，贷款150万元（抵押贷款116万及保证贷款34万）。另查明，韩某的抵押贷款已全部结清，保证贷款在还款中；张某的房产已被查封等待处理，目前银行无法计算损失。公诉人温州市鹿城区人民检察院认为，本案二被告人违反了《贷款通则》及金华银行内部规定，未对借款人的房产抵押评估价值进行核实，且未对经营场地进行实地调查，导致发放人民币1100万元贷款并出现贷款逾期，应构成违法发放贷款罪。其辩护人辩称，二被告人未经过专业业务培训及学习，对行业规范及法律法规并不熟悉，主观上没有违法的故意，且均已履行自己的工作职责，未审核出房产价值评估书系伪造的及未双人实地考察属于工作失误，不属于违反法律规定的行为，且银行并不存在损失，故二被告人的行为不构成犯罪。二被告人称其已按照银行惯例对涉案的六笔贷款进行了形式的审核及部分的调查，但未对经营场地进行实地调查，若构成犯罪，愿意自愿认罪。法院审理后认为，二被告人对借款人提供的证明借款用途的材料审查后，未双人到现场实地调查的行为直接违反了金华银行的内部规定，但不能以此认定违反了国家规定。辩护人就此提出的辩护意见，予以采纳。另外，二被告人未尽到审慎注意义务，未审核出2份房产评估书中评估师签名的问题，导致发放的该二笔贷款逾期，累计金额人民币284万元，应构成违法发放贷款罪。法院对辩护人提出二被告人系工作失误，不构成犯罪的辩护意见，不予采纳。最终，法院根据各自的犯罪情节轻重做出判决，认为被告人沈某某和陈某身为银行工作人员，违反国家规定发放贷款，数额巨大，其行为均已构成违法发放贷款罪，应予惩处，判处二人3年有期徒刑，缓刑4年，各处罚金5万元。公开资料显示，金华银行成立于1997年12月，前身是在原金华市区16家城乡信用合作社基础上组建的金华城市合作银行，1998年更名金华市商业银行，2020年变更为现名。财报数据显示，截至2021年末，该行资产总额865.59亿元，在职员工2056人，在金华、杭州、温州、嘉兴、台州等地设有109家营业网点，同时作为主发起行设立1家村镇银行。责任编辑：王涵
证券,扩张负极材料石墨化产能，易成新能拟3.34亿元收购两家材料科技公司股权,界面新闻,2022年10月15日 12:00,在新能源电池产业链蓬勃发展的情况下，部分上市公司也在跑马圈地。易成新能2022年半年报介绍，公司坚定走“新能源、新材料”的发展战略，新能源行业主要业务有：高效单晶硅电池片和锂离子电池的生产与销售、光伏电站的投资建设运营；新材料行业主要业务有：超高功率石墨电极、负极材料的生产与销售。营收数据来看，易成新能的石墨电极及相关产品在2022年上半年的营收已经达5.61亿元。公司在2022年半年报介绍称，锂电负极材料供不应求，导致行业产能快速提升。负极材料目前以人造石墨为主流，2022年人造石墨市场占有率超过84%。人造石墨具有高性价比，首次效率高、使用寿命较长、结构稳定、成本低等优势，经过多年发展，相关技术和配套工艺已经成熟，成为目前应用最广泛、技术最成熟的负极材料，是负极行业目前的主流路线，占锂离子电池总成本的比例控制在10%左右，通常小于15%。其他部分如正极材料占比在40%以上，电解液为10%-20%，隔膜为20%-30%。预计2022年至2023年石墨化产能为111-153万吨。需求端，人造石墨出货量在79-104万吨，石墨化需求为87.8-115.6万吨。2022、2023年存在石墨化供需缺口，为6.5-8.4万吨至18.1-23.7万吨之间。收购情况来看，易成新能拟以2.2亿元拿下四川开炭40%股权。公司在公告中指出，四川开炭位于四川省雅安市天全县，拥有天然的电力资源优势，毗邻水电发电站，发电成本低，电价较其他地区具有天然优势，现具有负极材料石墨化能力4万吨/年，基于当前负极材料生产对石墨化工序的需求急剧增加，本次收购四川开炭40%股权，有利于弥补公司石墨化和加工能力不足问题，有利于公司持续完善产业链布局，持续增强公司抗风险能力和盈利能力，符合公司发展战略及整体利益。另一起收购股权的标的公司为河南博灿，该公司同样主要经营负极材料及碳素制品的生产销售，现具有负极材料石墨化能力3万吨/年。财务数据显示，公司2021年全年的营业收入7739.66万元，而在2022年1-8月，该公司营业收入便达到5614.39万元。易成新能在公告中指出，收购有利于提高石墨化产能，符合公司发展战略，有利于公司更好地开展业务，增强其综合竞争力。界面新闻记者注意到，尽管在“新能源、新材料”的浪潮下，易成新能的营业收入得到了大幅度的提升，不过在2017年-2021年的扣非净利润均为负数。在2022年上半年，易成新能扣非净利润达6330.42万元，成功负转正，新能源产业链的发展或已让公司盈利能力发生显著变化。责任编辑：王涵
证券,巨亏后资金链紧张？ 亚光科技拟定增6.8亿元“回血”,界面新闻,2022年10月15日 12:00,亚光科技在定增公告中指出，随着公司业务的持续发展，仅依靠自有资金和银行贷款难以满足公司快速发展的资金需求，本次发行募集资金将有效缓解公司快速发展所产生的资金压力。同时，将有助于增强公司的资本实力，减少公司财务费用的支出，增强财务稳健性，降低财务风险，进一步提升公司核心竞争力。另一拟募投的项目亚光微电子研究院项目，主要是可以效优化公司研发环境，有利于引进项目研发所需的先进技术人才，提升公司自主可控技术能力，筑高公司技术护城河，加快研发成果的产业化进程，是实现公司中长期发展战略的必然要求。项目建成后将为SIP、MMIC、MMCM等新技术的研发提供良好的研发平台，可以充分发挥公司广大科技人员的积极性和创造性，不断开发出新技术、新工艺和新产品，提高产品的技术含量和附加值，提高企业的核心竞争力。公司治理的角度来看，亚光科技披露声称，按照本次向特定对象发行股票数量上限145，922，746股计算，本次发行完成后，不考虑其他因素影响，李跃先直接及间接合计控制公司344，716，747股股份，占本次发行后公司总股本的比例为29.88%。本次发行有助于巩固李跃先作为实际控制人的地位，维护上市公司控制权的稳定，促进公司稳定发展。从发行的内部因素来看，亚光科技及其实控人等近年来遭遇多个监管措施。如2019年11月，因资金占用问题，深交所认为亚光科技及太阳鸟控股的上述行为违反了相关规定，亚光科技实际控制人、董事长李跃先，董事兼总经理胡代荣，财务总监兼时任董事会秘书曹锐对上述违规行为负有重要责任，亚光科技及部分责任人员遭通报批评。不过，按相关规定，上述监管措施不足以影响公司的定增事宜。值得一提的是，作为唯一参与亚光科技定增的控股股东太阳鸟控股，其在2021年全年的亏损额同样高达13.14亿元。责任编辑：王涵
