板块名,标题,作者,日期,新闻内容
31度室温下放1小时不化,钟薛高为何“高温不化”？明码标价严防“雪糕刺客”,市场资讯,2022年07月03日 20:29,来源：证券日报本报记者谢若琳见习记者王君7月2日，“钟薛高31度室温下放1小时不化”的消息登上热搜。针对网传钟薛高海盐椰椰产品长时间不融化问题，7月2日晚间，钟薛高回应称，并不存在不融化的雪糕。固形物高、水少，完全融化后自然就为粘稠状，不会完全散开变成一滩水状。此前，“雪糕刺客”“高价雪糕”等话题频繁冲上微博热搜。所谓“雪糕刺客”，是说冰柜角落里其貌不扬的雪糕，一般未在显著位置明码标价，买单时其高昂的价格往往让消费者伤透了心。而钟薛高“高温不化”一事又让大家对“高价雪糕”的产品质量产生了质疑。钟薛高回应“高温不化”有网友发文称，将一支钟薛高海盐口味雪糕放置在室温31度的条件下，半小时后，雪糕表面的冰层化开，呈现奶油状；50分钟后，盒子里的雪糕仍然是比较粘稠的乳状而非水状，整体形态完好。此事迅速引发网友关注，引发了对钟薛高雪糕配料的质疑。有不少网友推测雪糕不会融化是否与胶质添加剂太多、牛乳含量不够有关，甚至有消费者质疑“不会化的雪糕是否可以吃”？“增稠剂有很多种，一般使用卡拉胶、瓜尔胶的比较多，在添加剂量上有严格规定和限制。”中国品牌研究院研究员朱丹蓬对《证券日报》记者表示，不确定钟薛高使用的增稠剂是否在国家的安全范围值之内，“但如果增稠剂过量，则涉及食品安全方面的问题。”对于上述疑问，7月3日，钟薛高相关负责人对《证券日报》记者表示，融化呈粘稠状是因为这款产品配方中主要成分为牛奶、稀奶油、椰浆、炼乳、全脂奶粉、冰蛋黄等等，产品本身固形物含量达到40%左右，除部分原料本身含少量水外，配方未额外添加饮用水。对于添加剂问题，他表示，“为了在货架期内保持产品的良好风味和形态，产品仅使用极少量的食品乳化增稠剂，均严格按照国家相关标准添加，可放心食用。”新规发布“雪糕刺客”或休矣6月份以来，“雪糕为何越卖越贵”“雪糕刺客”等话题持续引发网友关注，不少人大呼失去冰淇淋自由。国家市场监督管理总局7月1日发布《明码标价和禁止价格欺诈规定》，明确了经营者销售、收购商品和提供服务时，应当按照市场监督管理部门的规定明码标价。“明码标价应当根据商品和服务、行业、区域等特点，做到真实准确、货签对位、标识醒目”“商品或者服务的价格发生变动时，经营者应当及时调整相应标价”“不得在标价之外加价出售商品或者提供服务，不得收取任何未予表明的费用”。“雪糕刺客”的消失或将指日可待。对于明码标价一事，便利蜂相关负责人对《证券日报》记者表示，“如遇到大促类优惠活动，便利蜂会通过海报、电视屏等显著形式告知消费者促销条件、促销后商品价格等信息；针对日常促销频繁的日配类商品，便利蜂投入了电子价签，当商品价格发生变动时，价签信息能够自动更新，价签颜色也会随之转变，以明示消费者。”另外，便利蜂自助收银机的投入，也为门店收银环节加了一把规范的锁。7月2日，《证券日报》记者走访连锁商超时发现，连锁商超大多在显著位置贴出商品价格，一品一码，明码标价。但某些小型便利店并未对所有商品进行明码标价。在北京市丰台区的某个小型便利店，记者发现，除了个别品牌雪糕有简易备注外，大部分品牌雪糕价格均未标注。《规定》第十九条明确，不标示或者显著弱化标示对消费者或者其他经营者不利的价格条件，诱骗消费者或者其他经营者与其进行交易，构成价格欺诈行为。相关部门将依据《中华人民共和国价格法》等法律进行行政处罚。（编辑上官梦露）责任编辑：张书瑗
保险,【教育有料】中小学7月15日放暑假 26所民办非学历高教机构有招生资格,新浪财经,2022年07月03日 20:27,北京教育最新动态北京|中小学7月15日放暑假26所民办非学历高教机构有招生资格北京中小学将于7月15日如期放暑假6月25日，在北京市新型冠状病毒肺炎疫情防控工作第376场新闻发布会上，北京市委教育工委副书记、市教委新闻发言人李奕表示，暑假时间不变，将根据校历安排如期进行。根据安排，北京高一高二、初一初二年级和小学一至六年级6月27日（周一）返校，幼儿园7月4日（周一）返园。根据校历安排，北京市中小学校7月15日至8月31日为暑假时间，为期6周零6天。同时在考试上，鼓励针对不同科目特点，采用更加灵活的考试方式和成绩的呈现方式。李奕称，学校要关注考试和诊断的方式，开展形式多样和更加灵活的检测方式，特别是针对不同科目的特点，文科理科包括动手实践的科目，采用更加灵活的考试方式和成绩的呈现方式，帮助同学做好自我检测和问题诊断，“比如说有的是通过研究性学习任务来完成，有的可能是笔试，也有可能是乐考，还有开卷考试等等。”在期末考试成绩的呈现方式上，李奕表示可以是百分制，也可以是5分制，也可以是等级制。每周测2次核酸、倡导分餐到班，北京市教委发布八条校园防疫提示6月27日，北京市高一高二、初一初二年级和小学一至六年级学生将迎来返校。返校前夕，北京市教委发布八条校园防疫提示，守好健康入校“第一关”。一是做好返校前的准备，细化完善学校疫情防控方案，制定突发疫情快速响应处置应急预案；做好环境消杀和物资储备；及时准确掌握师生员工健康状况，动态调整各类信息台账；核查师生员工本人及共同居住者14日内的健康监测记录，查看48小时内核酸检测阴性证明。二是继续严格校门管理，压紧压实扫码查验“四方责任”，教职员工入校须扫码、测温，按规定查验核酸检测阴性证明等，校外人员坚持“非必要不入校”，确保能够健康入校。三是用好物流缓冲区，师生员工要避免与快递、外卖服务人员“面对面、手递手”接触，及时对外包装进行全面消毒。四是坚持常态化核酸抽检制度，中小学师生在校期间，每周开展2次核酸检测，每次至少间隔48小时，每次抽检应保持适当的抽检比例；保安、食堂、保洁、宿管等重点人群，按照行业规定进行核酸检测；原则上每周进行1次校园环境采样。五是加强用餐管理，各学校可以在合理安排、科学统筹的基础上，采取分批、分时段、错峰就餐原则，在学校食堂内就餐。排队取餐时全程佩戴口罩，保持1米以上距离，餐桌设置隔离挡板，用餐期间不扎堆、不聊天，减少聚集风险。当前时期倡导继续采用“分餐到班”就餐方式。六是做好消毒通风，对师生活动的公共区域以及洗手间、室内外健身器材等重点场所和重点部位，通过喷洒、擦拭等方式定期开展预防性消毒，室内定时开窗通风。七是继续坚持以班级、年级为单位的单元式、网格化管理，班级之间、楼层之间尽量少接触、不交叉，课间活动等要分区域、分时段进行，尽量避免不同班级学生接触。八是压紧压实“四方责任”，严格落实学校、家长、学生健康监测责任，出现发热、干咳等11种新冠肺炎相关症状，应尽早就医，及时向学校报告，不要到校；师生员工在校内、校外要科学佩戴口罩，保持安全距离，做好手卫生等，落实好个人防护责任；倡导师生员工及其同住人坚持“两点一线”简约生活，注意上下班、上下学途中的防护。北京26所民办非学历高等教育机构具有招生资格6月27日，北京市教委发布《关于民办高等学校民办非学历高等教育机构2022年秋季招生政策的通告》称，今年北京具有招生资格的民办非学历高等教育机构共26所。北京市教委在通告中表示，民办普通高校是经教育部或北京市人民政府批准、具有颁发普通高等教育本科或专科学历证书资格，并已颁发《民办学校办学许可证》的民办高校（含独立学院）。北京市民办普通高校本（专）科教育的招生，严格执行教育部和北京市关于普通高等学校招生管理规定，一律纳入全国普通高等学校统一考试招生录取体系。民办普通高校自行招收的非学历教育学生，在办理入学手续前必须向学生和家长公示获得证书的性质、收费项目、标准和退费办法，并与学生签署相关协议。在名单中看到，26所民办非学历高等教育机构中，包括北京工商管理专修学院等9所全日制民办非学历高等教育机构，北京金融研修学院等17所非全日制民办非学历高等教育机构。本文内容来源：新浪教育责任编辑：赵妤初
港股,世茂集团：前五月销售额342亿元，一笔美元债违约但未被追债,澎湃新闻,2022年07月03日 20:26,澎湃财讯7月3日，（00813.HK）公告称，公司于7月3日到期的10亿美元公募债券未能如期偿还，到期应付本息10.2375亿美元。公告称，相关债权人目前并未采取任何强制措施以要求加速偿还债务，且收到了数个银团贷款行出具的书面支持函，表示其原则上支持公司继续探讨重组方案，并愿意与公司合作，不影响公司的正常经营。贷款人同时表示目前无意采取或执行任何其他措施收回未偿还金额。公告同步披露截至2022年5月31日止五个月，公司合约销售额约为人民币342.6亿元，较2021年同期的1217.9亿元下降约72%。责任编辑：刘秀浩责任编辑：张海营
保险,【教育有料】十年来全国普通话普及率80.72% 文盲率降至2.67%,新浪财经,2022年07月03日 20:26,语言文字发展成就语言|十年来全国普通话普及率80.72%文盲率降至2.67%6月28日，教育部召开“教育这十年”“1+1”系列第六场新闻发布会，介绍党的十八大以来语言文字事业改革发展成就。十年来，我国语言文字战线依法履行宪法赋予的职责，坚定不移推广普及国家通用语言文字，全国普通话普及率从70%提高到80.72%，识字人口使用规范汉字比例超过95%，文盲率下降至2.67%。教育部语言文字应用管理司司长周为在会上介绍，我国实施推普助力脱贫攻坚行动计划和国家通用语言文字普及攻坚工程，助力决战决胜脱贫攻坚。教育部与国务院扶贫办等开展“推普脱贫攻坚”战略合作，不断加大投入，面向教师、青壮年劳动力、基层干部、语言文字工作者等重点人群实施国家通用语言文字培训，十年来培训逾千万人次。我国建立东西部合作机制，组织开展东西部对口支援，实现“三区三州”国家通用语言培训全覆盖。我国组织动员青年力量，开展推普志愿服务，中央财政专项支持986支团队1.1万余名大学生，辐射带动数十万高校大学生深入中西部推普一线。2019年召开“中国语言扶贫与人类减贫事业论坛”，发布《语言扶贫宣言》，建设“语言扶贫”APP等学习资源平台。帮助贫困人口通过学习普通话走出大山、走向社会，实现就业、脱贫致富，为打赢脱贫攻坚战贡献了语言力量。同时，实施推普助力乡村振兴计划和国家通用语言文字普及提升工程，助力推进共同富裕。包括：开展民族地区推普攻坚、农村地区推普助力乡村振兴，以及国家通用语言文字高质量普及“三大行动”；重点开展面向中西部重点省份实施的“一地一策”，面向民族地区的学前儿童普通话教育专项计划，面向广大农村地区的语言文化助力乡村“五大振兴”方案，面向城市地区的语言服务能力提升等项目。目前，该工程计划全面实施，民族地区幼儿园已基本实现全部使用国家通用语言文字开展保育教育活动，为实现2025年全国范围内普通话普及率85%的目标打下良好基础。76个国家将中文纳入国民教育体系教育部语言文字信息管理司司长田立新介绍，十年来，我国语言文字战线坚持统筹国内国际两个大局，促进中外文明交流互鉴。我国制定发布首个面向外国学习者、全面评价其中文水平的规范标准《国际中文教育中文水平等级标准》，并积极推动走向世界，已向海外发布8个语种对照版，与20多个语言教育机构进行标准对接。同时，我国建立海外普通话水平测试站，打造中文水平考试（HSK）品牌。中文的国际地位和影响力随国家综合实力的提升而显著提升。截至2021年底，联合国教科文组织、联合国粮食及农业组织、世界旅游组织等10个联合国下属专门机构将中文作为官方语言，180多个国家和地区开展中文教育，76个国家将中文纳入国民教育体系，外国正在学习中文人数超2500万，累计学习和使用中文人数近2亿。另外，全国普通话水平测试机构发展至1700余个。十年来共开展普通话水平测试6200余万人次、汉字应用水平测试22万余人次。我国还建成122个国家语言文字推广基地。打造国家语委语言文字应用研究优秀中青年学者研修班、民族语文应用研究中青年学者高级研修班、中青年学者出国研修班、中青年学者协同创新联盟、优秀中青年学者论坛的“三班一盟一论坛”中青年人才培养框架，开展15个培训研修班次，培养700余名中青年学者。举办18期国家级普通话水平测试员培训考核班，培养国家级普通话水平测试员2135名，不断壮大骨干力量。本文内容来源：新浪教育责任编辑：赵妤初
生活,奔驰提车一个多月后怀疑做过油漆 4S店称待确认,市场资讯,2022年07月03日 20:23,4月份，小胡买了一辆奔驰GLC63。他说一个多月后去贴车衣，发现车辆左侧部分位置的油漆有问题。他提供了第三方检测报告，两处位置有喷漆修复的情况。责任编辑：梁斌SF055
银行,警方岀手！编造南京银行“有事”，券商分析师被治安处罚！涉事银行股价曾一度跌停,证券时报网,2022年07月03日 20:19,7月3日，南京市公安局玄武分局发布警方通报称，7月1日20时许，向公安机关报警，称有网民散播有关南京银行的谣言。公安机关经工作查明：6月30日18时许，网民傅某某（男，39岁），出于博眼球的目的，在小区业主微信群内发布自己编造的有关南京银行的虚假信息造成不良影响。事发后，傅某某主动采取消除影响的措施并认错悔过。公安机关已依法对其给予治安管理处罚。6月30日，南京银行股价曾一度触及跌停。当日，南京银早盘开盘报10.80元，之后快速下行，盘中一度触及跌停，最终收跌6.46%。对此，南京银行方面当日表示，该行也正密切关注资本市场最新动向，目前其经营一切正常，尚未有进一步信息。分析师紧急道歉南京银行报警据中国基金报，此前，通讯首席分析师，在微信群里对南京银行发布了几句点评。其中的分析内容不少臆测跟联想，结果这份群聊记录在社交媒体快速传播发酵。随后，首席分析师紧急在朋友圈发了声明：相关群聊记录未征得本人同意外发传播，内容并非其专业研究范围，也未经证实，与事实相差很大。受该群聊记录传播影响的南京银行，深表遗憾和歉意。资料显示，这位分析师2021年11月底离职民生证券，今年2月份加盟西部证券。1日晚间，南京银行发布澄清公告称，“近日，网传南京银行有关不实信息。公司郑重声明：相关信息为恶意造谣，公司已经向公安机关报案并将依法追究相关主体的法律责任。”南京银行还在公告中表示，目前，公司经营管理一切正常，经营发展良好。林静然任职刚满两年就卸任在南京银行大跌的前一天，6月29日晚间，南京银行公告称，董事、行长林静然因工作需要、另有任用，于当日向公司董事会提交辞职报告，辞去公司董事、董事会风险管理委员会主任委员、发展战略委员会委员、行长、财务负责人以及公司授权代表职务。南京银行方面称，林静然已确认其与该行董事会无不同意见，亦无因本人辞职需知会该行股东及债权人的任何事项。该行董事会对林静然在公司任职期间为公司做出的贡献表示感谢。林静然的辞任自当日起生效，公司行长职责暂由董事长胡升荣代为履行。在加入南京银行之前，林静然先后历任玄武支行行长、新港支行副行长，并在也有多年任职经历。江苏银保监局此前于2020年5月核准其南京银行行长任职资格，至今刚满两年。出生于1974年的林静然，是一位“70”后上市银行行长。作为土生土长的江苏扬州人，其职业生涯也基本投入在深耕于江苏地区的金融业中。1995年，林静然从南京审计大学毕业之后便加入中国银行江苏分行，先后在中行南京玄武支行、南京新港支行工作。2005年，其告别老东家，加入民生银行南京分行，并于2008年底担任民生银行无锡分行（二级分行）行长。2011年底，林静然出任民生银行昆明分行（一级分行）副行长，主持工作。距此不到2年的时间，他就被调回江苏地区，出任民生银行苏州分行行长。随后，林静然于2015年3月正式出任民生银行南京分行行长，并于2017年6月当选第十一届江苏省工商联副主席。另据中国基金报消息，7月1日，南京银行原行长林静然“现身”南京东南国资投资集团有限责任公司（下称东南集团）领导一栏，显示他为东南集团副董事长、党委委员（保留市管企业正职待遇）。综合券商中国、中国基金报相关报道责任编辑：张文
国际财经,日本移动通信故障影响近4000万人：40小时仍未修复 负责人鞠躬致歉,海外网,2022年07月03日 20:17,来源：海外网全日本3915万手机用户无法正常通信（东京都会电视台）海外网7月3日电据日本《读卖新闻》报道，2日凌晨起，日本第二大移动运营商KDDI因设备问题突发通信故障，全日本3915万手机用户无法正常通信。日本总务省称这是电器通信事业法层面的重大事故，目前KDDI社长已出面致歉。KDDI称，故障发生于2日凌晨1时35分。出故障后，恢复作业进行了约40小时，仍未完全恢复正常，这种情况“极其罕见”。故障给整个日本社会造成了不小影响。作为日本第二大移动运营商，KDDI旗下手机用户数量约3100万人，再加上租用该公司线路的其他运营商，受影响的用户数量多达约3915万人，相当于日本人口的1/3左右。KDDI负责人在记者会鞠躬致歉（东京都会电视台）3日，KDDI在故障发生后首次举行记者会，社长高桥诚道歉称：“我们作为给社会基础设施提供支持及稳定服务的通信行业者，一定深刻反省。”他还称，这是“KDDI历史上最大的故障”。《读卖新闻》表示，此次情况可能成为日本最大级别的通信事故。日本电気通信事业法规定，若超过3万人在1小时以上无法紧急联系上消防或警方，这种情况被视为重大事故。日本的手机运营商曾于2018年发生过一次重大事故，当时软银公司故障影响了3060万用户的正常通信。（海外网王珊宁）责任编辑：刘玄逸
