板块名,标题,作者,日期,新闻内容
债券,南京、苏州、郑州房贷利率没降多久，又要迎来上调？假的！,中新经纬,2022年06月18日 15:39,来源：中新经纬近日，中新经纬记者在多个社交平台浏览时发现，有南京、苏州、扬州、郑州、重庆、济南等多个城市的房产中介表示，他们所在城市的住房贷款利率将上调。由于这种说法与房贷利率普遍下行的现状相悖，引发了不少网友讨论。不过，中新经纬从数个城市的银行网点了解到，上述传言不实，当前这些城市的住房房贷利率较为稳定，没有出现上调的情况。一位房产经纪人则称，这可能是一些同行贩卖焦虑，让购房人快点入市买房。而随着新一期LPR将于20日公布，研究机构预测，房贷利率或还有下降空间。近日，网上有聊天截图显示，苏州4.25%的房贷利率即将提升到4.9%，南通市最近也会调整。该截图提醒，“赶紧该买的买该定的定，别到时候后悔，我们有这个义务做好告知！”此外，有网友称，济南房贷利率已经上调到4.4%，青岛、徐州上调到4.9%。另一则传言则称，徐州的房贷利率从4.25%上涨到了4.6%。同样，近期楼市政策不断的南京，也传出利率上调的消息，传闻称，多家银行将首套房贷款利率上浮15%，二手房贷款利率或上浮20%。类似传闻在多个社交媒体上传播，不少网友难以判断真假。对此，中新经纬随机挑选了传闻中的几个热点城市，并以申请住房贷款为由咨询了当地主流银行。16日下午，同样，南京某支行的工作人员近日对中新经纬表示，该行首套房贷利率最低为4.25%，对于网上所说的房贷利率上调，其表示暂时不清楚。南京某支行的工作人员称，目前首套房贷款利率最低4.25%。根据南京当地媒体统计，截至6月10日，南京首套房利率普遍在4.25%-4.45%左右，最高为5.4%；二套房利率普遍为5.05%，最高为5.5%。对于苏州房贷利率上调的传闻，中新经纬咨询发现，该消息也不属实。建设银行苏州某支行、工商银行苏州某支行的工作人员均表示，目前首套房贷款利率最低为4.25%，其中一位工作人员表示，暂时没有收到利率上调的相关通知。河南郑州也有房产中介在朋友圈、短视频平台上称，该市房贷利率将要上调。但工商银行郑州某支行的工作人员近日对中新经纬表示，新房、二手房的首套房房贷利率都在4.25%左右，具体多少要根据情况而定。农业银行某支行称，该行的房贷利率也已下调。另外，郑州市15日发布的官方文件，更是直接击碎房贷利率上调的传闻。15日，郑州市人民政府发布的《郑州市稳经济促增长政策措施的通知》提出，推动各商业银行全面执行首套房贷款利率4.25%的下限标准，并促进二套房首付比降至40%。jwview5年期以上LPR或继续下降中新经纬梳理近期有关房贷利率上调传闻后发现，这些信息多为各地的房产经纪人通过朋友圈、短视频平台的途径向外传播，信源出处不明。同时，也没有官方、半官方机构、权威市场机构及媒体对这些信息进行过回应或证实。郑州市一位房产经纪人对中新经纬说：“发这种消息的人，多半都是贩卖焦虑，如果有置业顾问或者房产经纪人以房贷利率要上调诱导你看房，那就可以把他拉黑了。目前房贷利率没有上调，而且郑州市还发文要降利率。”易居研究院智库中心研究总监严跃进对中新经纬表示，有个别从业者可能希望通过炒作房贷利率上涨等消息，加快购房人赶快入市，这种方式不可取。从目前看，房贷利率上涨的可能性很低，为刺激购房需求，利率还处在继续下降的通道。今年5月15日，央行、中国银保监会联合发文提出，对于贷款购买普通自住房的居民家庭，首套住房商业性个人住房贷款利率下限调整为不低于相应期限贷款市场报价利率（LPR）减20个基点。5月20日，新一期LPR出炉，1年期LPR为3.7%（与上月持平），5年期以上LPR为4.45%（下降15个基点）。新的LPR发布后，结合上述央行、银保监会的政策，全国首套住房商业性个人住房贷款利率下限已降至最低4.25%。随后，包括不少大城市在内，全国许多地方的首套房贷款利率都降至最低4.25%。有机构称，目前首套房房贷利率已经是近十年来的低点。6月20日，6月份的LPR将会发布，5年期以上LPR是否还会下调，再度引发关注。不过，浙江大学国际联合商学院数字经济与金融创新研究中心联席主任、研究员盘和林对中新经纬说：“个人预测，短期LPR会有所下调，但5年期以上LPR的下调幅度会小于1年期LPR下调幅度。当前中国货币政策总体趋于宽松，这是政策面选择的结果。”至于5年期以上LPR的变动对房地产市场的影响，盘和林分析称，今年的房地产市场力求稳定，保证不出现流动性问题，但想要重振几年前楼市雄风的话，难度较大，原因是当前房价已经在比较高的位置。（更多报道线索，请联系本文作者薛宇飞：xueyufei@chinanews.com.cn）文：薛宇飞实习生胡静蓉编辑：赵佳然审校：李中元责任编辑：赵思远
国内新闻,新京报：发现水稻耐高温基因 为何对世界如此重要？,作者：新京报,2022年06月18日 15:39,
国内财经,首批上岗的核酸采样志愿者：成了“大白”才知道他们多不容易,新京报,2022年06月18日 15:37,原标题：首批上岗的核酸采样志愿者成了“大白”才知道他们多不容易新京报讯（记者陈琳）近日，东城区第一批核酸采样志愿者经过筛查、审核、培训后正式上岗。他们当中，既有医护人员，也有高校学生、公职人员。北新桥街道海运仓社区居民皮方方曾学过针灸推拿、中医临床等专业，毕业后有近3年的从业经验。在谈到正式上岗后的感受，她说，只有真正成为“大白”的一员，才能明白他们是多么不容易。5月24日起，北京市面向社会招募核酸采样志愿者。6月初，首批核酸采样志愿者陆续上岗。志愿者的加入，大大提高了全市核酸检测采样能力。据“志愿北京”平台统计，全市核酸采样志愿者报名人数已突破4.3万人，并在持续增长中。经过报名、筛选、线上培训、线下考核等环节，皮方方在北新桥街道南馆公园核酸检测点正式上岗了。从登记到完成采样，顺利完成一次核酸采样只需几十秒。对于每一位“大白”而言，炎炎夏日里真正的考验，并不在业务。防护服材质虽轻，但密不透风，上下连体，袖口和裤腿都是收紧的，只有两只眼睛露在外面，不消几分钟便汗如雨下。皮方方说：“平时我是属于不喝水也不会觉得渴的体质，可现在每次脱下防护服时，都是一瓶矿泉水直接下肚。”然而辛苦之余，一些“小温暖”也让皮方方觉得十分感动。根据疫情防控要求，南馆公园核酸检测点设置了单向通行路线，同时为行动不便或有特殊需求的居民开设“绿色通道”。皮方方说：“有一对行动不便的老两口和一位盲人居民，每次检测都坚持按照常规路线进出，为的就是尽量不给工作人员添麻烦。”几乎每一位完成检测的居民都会向皮方方说声“谢谢”，这一刻，她感受到了温暖与认可。每次忙完任务，皮方方还要赶回家照顾不久前刚刚做完腿部手术、行动不便的母亲。“母亲特别支持我，每次都说让我放心、不用惦记。”皮方方说，“大白”虽然辛苦，可居民的认可和家人的支持，却也让自己愈发笃定，必须完成好这个任务。安定门街道交北头条社区居民赵林晰今年20岁，是首都医科大学的大二学生。在仔细查看了北京市核酸采样志愿者招募条件后，她认为自己“年龄、专业都合适”，于是不假思索地报了名并被顺利录用。第一次参与核酸检测服务，赵林晰早早来到安定门街道位于雍和文化艺术中心的核酸检测点。起初，她只是负责信息录入工作。随着前来检测的居民越来越多，点位负责人、国子监社区党委书记王颜颜决定增加一个检测通道。赵林晰“临危受命”，承担起新通道的采样工作。“起初心里多少还是有些紧张，毕竟是第一次承担采样工作，所有的事情都要靠自己独立完成。”核酸采样是核酸检测过程中的重要环节之一，其规范性直接关系到核酸检测的质量。通过培训，赵林晰熟练掌握了采样方法。采样、掰管、拧盖、手消，整套动作“快、准、稳”一气呵成，进入角色的赵林晰工作效率丝毫不输“老手”，两个多小时的时间里，顺利完成近400人的采样工作。实践中，她还摸索出了与不同服务对象交流的技巧。有的居民会用舌头挡住咽喉，偶尔有两三岁的小朋友采样时会不由自主地紧张。每当遇到这种情况，赵林晰都会温柔地提醒和鼓励对方。“有的居民习惯采样过程中咨询一些问题，这就要求‘大白’们的心态要平和，既要及时解答居民的问题，还要在交流过程中保持好采样的每一个规定动作，不能分神、打乱步骤，影响采样规范。”赵林晰说。责任编辑：王蒙
外汇,全球连线｜美联储大幅加息助推经济衰退之忧,新华网,2022年06月18日 15:31,面对持续高通胀重压，美国联邦储备委员会15日宣布加息75个基点，将联邦基金利率目标区间上调至1.5%至1.75%之间。这是美联储自1994年以来单次最大幅度的加息。6月16日，由于市场担忧美联储异常激进的加息举措会使美国经济陷入衰退，纽约股市三大股指全面大幅下跌：道琼斯工业平均指数跌破三万点，纳斯达克综合指数重挫4%，标准普尔跌幅3.25%。记者：夏林刘亚南谢锷新华社音视频部制作新华社国际传播融合平台出品责任编辑：郭建
中国军情,台媒：解放军军机今天三度进入台东部空域,环球网,2022年06月18日 15:31,
河南安徽6家村镇银行无法取现,许昌警方：河南新财富集团利用村镇银行实施严重犯罪 一批犯罪嫌疑人已被抓,市场资讯,2022年06月18日 15:29,“平安许昌”微信公众号6月18日通报，2022年4月19日，许昌市公安机关依法对河南新财富集团投资控股有限公司涉嫌重大犯罪立案侦查。现初步查明，2011年以来，以该公司实际控制人吕某为首的犯罪团伙涉嫌利用村镇银行实施系列严重犯罪。目前，案件侦办取得积极进展，公安机关已抓获一批犯罪嫌疑人，依法查封、扣押、冻结一批涉案资金、资产。该案涉嫌犯罪行为持续时间长、参与人员多、案情十分复杂。公安机关将进一步加大案件侦办力度，不让犯罪分子道遥法外、逃避惩罚，进一步加大追赃挽损力度，维护人民群众合法权益并适时发布案件侦办阶段性进展情况。责任编辑：赵思远
上海石化化工部乙二醇装置区域发生火情,已致1死1伤！上海石化化工部突发火情，“五六公里外听到燃烧声”！何为乙二醇？毒性几何？,媒体滚动,2022年06月18日 15:29,来源：北京商报6月18日凌晨4点左右，化工部乙二醇装置区域突发火情。据该公司官方微博@上海石化在线，经初步核实，目前事故导致上海石化一名员工手臂轻微擦伤，一名第三方运输车辆驾驶员死亡。据报道，事故现场浓烟滚滚，附近居民称睡梦中被爆炸冲击波惊醒，凌晨有居民驱车外出避险。目前，现场火势已经得到有效控制，正在实施保护性燃烧，事故具体原因正在进一步调查。上海石化凌晨突发火情“五六公里外听到燃烧声”18日清晨，据@上海石化在线消息，上海石化化工部乙二醇装置区域发生火情，公司立即启动一级预案，目前正在紧急处置中。上海消防也发布消息称，6月18日4时28分，上海市金山区隆安东路一石化公司乙二醇装置发生火情，上海市119指挥中心接警后迅速调派金山、奉贤、化工区等救援力量至现场进行扑救。新民晚报报道称，上午7时，记者驱车赶到石化厂区，一路上晴空万里，但一下高速天空突然暗了下来，远处地平线上升起两道巨大的烟柱，浓烟滚滚直冲云霄，天空中的“乌云”就是扩散开的浓烟。离火场大约3公里距离，能听见类似飞机引擎一般的轰鸣声，可以看到失火的厂区正熊熊燃烧，火光冲天而起。附近市民被剧烈的爆炸声惊醒，五六公里外都能听到燃烧的声音。另据每日经济新闻，记者通过微信从一位距爆炸点7公里左右的网友处了解到，爆炸伴有冲击波，“冲击波太强，睡梦中被冲击波弄醒，玻璃震碎了”。同时，据网友反馈，爆炸发生后，他们均立即逃离了室内，“人都是懵的，没有思考时间，穿好衣服就往楼下跑。我4点30出的门，那时候路上已经很多车了”，“凌晨4点多大堵车”。18日9时许，上海石化称现场火势已经得到有效控制，正在实施保护性燃烧。据应急管理部消防救援局官方微博@中国消防消息，应急管理部已派出由消防救援局负责同志带领的专家工作组赶赴现场协助指导处置。事故发生后，当地消防救援队伍立即调派563名消防救援人员、113辆消防车赶赴现场处置。目前现场火势已经得到有效控制，处置工作仍在进行中。截至发稿，事故已导致一死一伤，具体原因正在进一步调查。何为乙二醇？毒性几何？公开资料显示，乙二醇（ethyleneglycol）又名甘醇、1，2-亚乙基二醇，简称EG。化学式为（CH2OH）2，是最简单的二元醇。乙二醇是无色无臭、有甜味液体，对动物有低毒性，乙二醇能与水、丙酮互溶，但在醚类中溶解度较小。用作溶剂、防冻剂以及合成涤纶的原料。乙二醇的高聚物聚乙二醇（PEG）是一种相转移催化剂，也用于细胞融合；其硝酸酯是一种炸药。据北京青年报报道，火情发生后，有金山居民担心空气质量开车离开，清晨5时遇到堵车。上海市金山区政府工作人员18日告诉记者，目前火势已得到控制，暂不需要对周边居民进行转移，如有需要会通过官方渠道进行通报。上海石化也表示，火情发生后同步启动了环境应急预案，对公司厂界及外部区域持续进行环境监测，挥发性有机物监测正常。已经安排加强雨水排口采样、监控，目前未发现对周边水体环境造成影响。一名化工专家告诉记者，乙二醇本身不属于危化品，在一些地方也会作为燃料使用，完全燃烧的产物也没有毒性。企业在生产、运输、储存乙二醇时一般都会制定安全细则，但如果执行不到位，比如有人违反安全细则在厂区抽烟，就可能引发火灾。因此严格遵守安全细则非常重要。根据上海石化2021年年报介绍，乙二醇是公司主要产品之一，公司环氧乙烷/乙二醇装置设计产能52.5万吨，2021年乙二醇产量15.07万吨，较2020年23.67万吨同比减少36.33%，销量则为4.14万吨，较2020年的12.73万吨下降67.48%。2022年，上海石化计划生产乙二醇10.3万吨。上海石化近7年间重大责任事故为零据官网信息，上海石油化工股份有限公司是化工股份有限公司的控股子公司，位于上海市金山区，是中国主要的炼油化工一体化企业之一，也是国内重要的成品油、中间石化产品、合成树脂和合成纤维生产基地。据中国基金报，上海石化的前身是创建于1972年的上海石油化工总厂。1993年，经过国有企业股份制规范化改制，上海石化成为中国第一家股票同时在上海、香港和纽约三地上市的股份有限公司。截至今年一季报，上海石化的总股本为73亿股，其中中国石油化工股份有限公司持股54亿股（A股），占总股本的50.44%。据该公司2021年年报数据，去年公司实现营业收入892.8亿元，同比增长19.51%；净利润20.01亿元，同比增长218.50%。上海石化分析称，2021年公司营业利润较上年大幅上涨主要受原油价格上涨及国内经济从新冠疫情影响中复苏，下游端需求扩张。据上海石化披露的社会责任报告，2019~2021年，公司安全生产投入分别为23478万元、28472万元、11237万元，2021年同比下降60%。从2015年~2021年这7年间，公司重大火灾爆炸事故、重大责任事故等均为零。二级市场上，截至6月17日收盘，上海石化（SH600688）报3.35元/股，最新市值362.6亿元。责任编辑：邓健
