板块名,标题,作者,日期,新闻内容
经济新闻滚动,恐慌指数降至年内低点，美股新一轮多空战将到来,第一财经,2022年12月04日 22:04,美联储12月政策基本定调美联储主席鲍威尔上周在布鲁金斯学会的最新表态给12月会议定下了基调，从6月开始的激进加息政策很可能将从下周会议开始逐步减速。他的观点也和此前公布的会议纪要及多位美联储官员的最新表态类似，显示在委员会内部已经达成了主要共识。美联储此前将政策立场的调整归因于货币政策对经济活动和通胀影响相关的滞后效果和幅度尚存在不确定性。最新数据显示，通胀见顶回落的趋势正越发明显。上周公布的10月个人消费开支物价指数PCE同比增长6.0%，美联储最关注的核心PCE增长为5.0%，涨幅均有所回落。此前公布的采购经理人调查（PMI）显示，消费需求逐渐平衡和供应链改善令企业上游成本压力持续回落，给通胀减压。牛津经济研究院高级经济学家施瓦茨（BobSchwartz）在接受第一财经记者采访时表示，物价降温毫无疑问给了政策调整的空间，美联储会在12月有所行动。但显然通胀依然处于高位，紧缩周期的停顿看来还很遥远。值得注意的是，在物价见顶的同时，经济下行压力也在加大。作为美国工厂活动的关键晴雨表，供应管理协会ISM11月降至49，进入收缩区间。未来一周公布的服务业PMI调查预计也将显示扩张进一步放缓，并接近荣枯线。美联储最新经济状况褐皮书显示，高通胀和加息正令经济不确定性升温。芝商所（CME）利率观察工具显示，12月加息50个基点的概率接近80%，而明年本轮利率峰值预期从上月高位5.07%降至4.95%，同时投资者认为，面对风险明年末美联储利率将降至4.51%，这意味着两次降息的空间。受此影响，与利率关联密切的2年期美债收益率回落至4.30%以下，美元指数则失守104关口。美联储内部对于政策提前转向持谨慎观点。纽约联储主席威廉姆斯（JohnWilliams）和圣路易斯联储主席布拉德（JamesBullard）近日表示，降息或需要等到2024年之后才会出现。鲍威尔也试图避免任何关于降息的讨论，称在恢复价格稳定还有很长的路要走，历史强烈警告不要过早放松政策。就业市场持续紧张或给通胀目标实现带来不确定性，11月非农报告显示，薪资增速回升和失业率低位继续给企业劳动力成本施压。不少美联储官员此前担心，劳动力市场紧张导致的工资增长将给通胀增加上行压力。施瓦茨向记者表示，就业市场尚没有明显放缓迹象，工资增速加快，美联储需要劳动力市场更快降温，以实现软着陆的目标。不过这条道路已经很窄，他认为，除非在降低服务业通胀方面取得更多进展，否则利率风险将向更高的水平倾斜。施瓦茨预计，美联储在下周会将加息速度放缓至50个基点，然后明年2月再加息25个基点后选择暂停观望。近期数据显示，消费者活力将支持美国第四季度和明年第一季度GDP将保持在扩张轨道上，但接下来加息造成的金融紧缩状况将使得经济出现浅衰退。资金出逃美股或面临考验随着美联储不断释放未来将放缓加息的信号，美股反弹的动能并未衰竭。在乐观的投资者看来，由利率带来的市场不确定性正在降低，芝加哥期权交易所（CBOE）恐慌指数（VIX）自10月12日美股创下年内低位时飙升至34.53后逐步回落，目前已经跌至19.06，创今年4月以来新低。值得注意的是，资金流向显示出投资者获利了结的心理。根据财经数据供应商EPFRGlobal的数据，过去一周美国股票基金共流出162亿美元，为4月份以来的新高，市场对经济增长的担忧再次浮现。克利夫兰联储上周发布的一份报告显示，美联储的利率已经超出了通常遵循货币政策规则所要求的水平。由美联储规则测算的最新季度利率预期显示，今年四季度短期利率目标应为3.52%，这低于目前3.75%-4.00%的联邦基金利率区间，而接下来考虑到美联储加息周期并未结束，借贷成本上升或进一步冲击经济。SwissquoteBank高级分析师奥兹卡德斯卡亚（IpekOzkardeskaya）认为：“强劲的经济数据意味着美联储将继续其紧缩政策，并可能以相对更高的最终利率为目标，这对股票估值不利。因此，标普500指数反弹空间有限，这也与今年迄今的下跌通道顶部重合，应该标志着这轮熊市上涨结束，预计指数下一步将跌至3400点附近。”作为今年预测美股走势最准的华尔街分析师、摩根士丹利首席股票策略师威尔逊（MikeWilson）也发出警告，称未来美国企业业绩将大幅向下修正，并对美股造成沉重打击。“熊市还没有结束，如果我们的收益预测正确的话，美股还将继续走低。”威尔逊在展望中预测，“美股公司的利润将在未来一年下降11%。届时，受伤的将不仅仅是对利率更为敏感的科技公司，痛苦将蔓延至更大范围。预计明年前四个月的某一时刻，标普500指数将跌至3000-3300点之间。我们认为，到那个时候，盈利预期的修正加速度将达到顶峰。”美国银行经济学家哈里斯（EthanHarris）表示，经济衰退随时可能发生，因为美国所有的主要经济指标要么已经处于衰退区域，要么在最近几个月朝着这个方向发展。尽管美国劳动力市场仍在继续增长，但他指出，过去12个月的就业增长趋势是下滑的，如果持续下去，到2023年夏季，就业将转为负增长。美国银行仍然看跌2023年上半年风险资产的表现。届时叙事将改变，从通货膨胀和利率冲击转变为衰退和信贷冲击。投资策略上，美银认为上半年做多债券，为硬着陆风险做准备，下半年做多股票，美联储政策见顶后风险偏好将改善。责任编辑：李桐
产经,北京通州公布最新核酸采样点位和开放时间,新京报,2022年12月04日 22:01,来源：北京通州发布官微新京报讯据北京通州发布官微消息，为了满足市民就近检测的需要，通州区公布了最新核酸采样点位置和开放时间。居民可持身份证，按需就近就便选择核酸采样地点。在检测中做好个人防护，戴好口罩，有序排队，落实好“两米线”防疫要求，不聚集、不交谈，采样完成后戴好口罩立即离开，回到家后要仔细清洗双手，防范交叉感染风险。长期居家老人、居家办公和学习人员、婴幼儿等无社会面活动的人员，如果无外出需求，可以不参加核酸筛查。请广大居民朋友提前规划，按需检测。以下是具体点位位置和开放时间↓↓（点开图片可放大查看）编辑孙琳智来源：北京通州发布官微责任编辑：李桐
证券,挽救退市危局 多家上市公司重整计划获法院批准,市场资讯,2022年12月04日 22:00,来源：证券日报之声12月3日，发布公告表示，法院已裁定批准公司的重整计划。另据《证券日报》记者统计，在近一个月时间里，已有包括、、（维权）、等被实施风险警示处理的上市公司发布公告表示，公司的重整计划已获法院批准。近期，证监会制定下发的《推动提高上市公司质量三年行动方案（2022—2025）》指出，要优化上市公司破产重整制度，支持符合条件且具有挽救价值的危困公司通过破产重整实现重生。近年来，上市公司破产重整等事项增多，部分案例受到市场广泛关注。实践中，破产事项涉及多个特定环节和多项特有事项，程序链条长、时间跨度大，对公司主营业务、资产负债结构、持续经营能力等具有重大影响。今年3月份，沪深交易所发布的《上市公司破产重整等事项指引》提出，要从完善制度供给，全面覆盖上市公司及相关方破产事项；强化信息披露，充分保障投资者知情权；指引明确要求上市公司及相关方切实做好内幕交易防控，并在相关节点提交内幕信息知情人档案；督促归位尽责，保护市场主体合法权益等四个方面入手，按照上位法规要求对保护投资者权益作出相应安排。博星证券研究所所长、首席投资顾问邢星在接受《证券日报》记者采访时表示，“对于被实施风险警示处理的上市公司申请破产重整密集获批说明在当前复杂的市场环境中，上市公司在政策抒困方面得到很好落地，也说明了证券市场制度性建设不断优化和完善，让濒临退市的上市公司有希望通过重整获得新生。”挽救危局积极推进重整计划从上述公司申请重整的原因来看，普遍提到受宏观经济形势、民营企业融资环境、公司经营策略以及新冠肺炎疫情等内外部因素共同影响，导致公司整体连年亏损严重，债务出现逾期、股价大幅下跌，陷入了经营及债务双重困境。还有部分公司由于高管违法违规行为加重了公司经营负担。*ST方科、*ST安控、*ST尤夫、*ST海核等公司均为债权人申请模式，即由债权人向法院申请破产重整。*ST方科采用管理人管理模式，*ST安控、*ST尤夫、*ST海核等公司采用债务人自行管理模式。以*ST尤夫为例，*ST尤夫是一家主要从事工业涤纶丝、帘子布的生产和销售的上市公司。受近年来对外投资新能源行业未达预期、原实际控制人违规对外担保等因素叠加影响，公司负债规模增长过快，财务费用激增，逐步陷入债务危机。根据*ST尤夫2021年年度报告，净资产为-13.54亿元，已被实施退市风险警示，存在严重的退市危机。如果2022年度经审计的净资产仍然为负，股票将被终止上市，因此公司急需通过重整化解债务危机并改善经营状况，以维持上市地位。2022年10月28日，法院裁定受理*ST尤夫破产重整，2022年11月29日，法院裁定批准*ST尤夫重整计划，并终止公司重整程序。2022年12月2日，*ST尤夫发布公告称，公司控股股东将由湖州尤夫控股有限公司变更为共青城胜帮凯米投资合伙企业（有限合伙），公司实际控制人将变更为陕西省人民政府国有资产监督管理委员会。公司的重整计划执行正在有序进行之中。虽然法院裁定批准公司的重整计划，但是否能够保持上市地位仍面临不确定性。*ST尤夫公告表示，若重整计划顺利执行，将会化解公司的债务危机，公司执行清偿债务的行为将对公司2022年度的净资产和净利润产生影响。若公司不能执行或不执行重整计划的，根据《中华人民共和国企业破产法》第九十三条的规定，法院有权裁定终止重整计划的执行，宣告公司破产。如公司被宣告破产，根据交易所的有关规定，公司股票将面临被终止上市的风险。透镜公司研究创始人况玉清告诉《证券日报》记者，“破产重整能够让一些主营业务仍有盈利能力、但资金链陷入困境的企业解决债务问题，恢复盈利能力，实现涅槃重生。但是，如果解决债务问题并不能恢复主业持续盈利能力的话，那就属于‘应退尽退’的范围了。”重获新生已有企业回归正轨从实践来看，此前已有（维权）、（维权）、等多家上市公司通过完成重整计划摆脱债务危机，在重整计划中，也明确阐述重整后经营方案，避免公司再次陷入债务危机之中。以赫美集团为例，由于无法及时归还欠款，公司陷入债务危机，无法偿还到期债务。2019年5月6日，公司股票被实施“退市风险警示”特别处理，债权人于2020年12月24日向法院申请对公司启动预重整，2021年2月1日法院对公司启动预重整，2021年11月29日，法院裁定受理债权人对公司的重整申请，2021年12月29日，法院裁定批准公司重整计划，并终止公司重整程序。2021年12月31日，法院裁定确认赫美集团重整计划执行完毕。2022年7月5日，公司被撤销退市风险警示及其他风险警示。赫美集团表示，“完成重整后，公司彻底解决了历史债务问题，生产经营逐步回归正轨，资产负债结构显著改善，降本增效效果明显，亏损幅度较去年同期大幅下降。”“推进上市公司破产重整具有积极意义，通过有效重组可以将债务危机进行化解，企业经营得到延续，避免退市风险和广大股东权益得到相应的保障，也有助于上市公司估值得到一定修复。此外，有效的破产重组将对资本市场起到积极稳定作用，有助于上市公司质量的提升和证券市场中长期稳定发展。”邢星表示，“需要注意的是，要谨防部分上市公司打着破产重组的幌子，利用政策给予的优质条件来进行内幕交易或从事其他违规行为。”责任编辑：杨红卜
经济新闻滚动,每桶60美元 西方明天起对俄海运出口原油限价,媒体滚动,2022年12月04日 22:00,来源：上观新闻欧盟和美国宣称，此举一箭双雕，既能大幅减少俄罗斯的石油收入，又有助于稳定全球能源价格，惠及新兴经济体。不过，舆论普遍表示怀疑。有美媒称，华盛顿大费周折推动限价，但违背市场规律，很可能徒劳无功，沦为普京笑柄。具体而言，西方将依赖自身在全球海运服务领域的主导权，对俄原油服务实施禁令。如果俄原油出口公司的售价超过每桶60美元，欧盟、G7和澳大利亚将禁止其融资、保险、船舶和航运公司提供一切合作。西方认为，此举将成为俄罗斯石油收入的枷锁，也将有助于稳定全球能源价格，并对新兴经济体有利。如果俄公司拒绝遵守价格上限，将很难找到西方海运服务的替代方案。其实，自2月乌克兰危机发生以来，美欧针对俄罗斯能源收入实施多轮集体围剿，价格上限只是制裁锁链的最新一环。今年3月，美国出台法令禁止进口俄石油、天然气等制品。在美施压下，今年6月，欧盟通过制裁方案，拟从12月5日起对俄实施石油进口禁令，明年2月起实施石油精炼品进口禁令。今年9月，G7提议对俄石油实施价格上限，作为石油禁运附加条款。只不过，自那以来，美欧围绕限价标准分歧严重，谈判旷日持久。G7起先提议价格上限应设在每桶65至70美元；波兰和波罗的海国家则主张严厉制裁，限价每桶30美元；然而，对航运业依赖较大的希腊、塞浦路斯和马耳他要求上限为每桶70美元。最终，在其他成员国都同意60美元的门槛后，“钉子户”波兰松了口。有欧洲观察人士称，这是石油市场的历史性时刻，将扭转俄罗斯从对欧能源贸易中获得巨大收益的局面。数据显示，自2月以来，俄罗斯的石油和天然气出口收入增长近50%。但也有评论称，这或是欧洲的妥协时刻，价格上限将为对俄石油禁运打开“后门”。根据欧盟此前禁令，自12月5日起，欧盟将停止进口俄海运原油，欧盟将全面禁止向俄油轮提供服务。但是，法新社注意到，最新价格上限放宽了限制，允许欧盟公司为遵守价格上限的俄油轮提供服务。可见，价格上限和石油禁令之间有着微妙联系。随着欧盟不再是俄石油的最大客户，全球石油市场的平衡正被打破，但价格上限为这种失衡提供缓冲。价格上，限价每桶60美元与俄罗斯主要出口油种乌拉尔石油11月底的牌价差不多，算不上严重打击。时间上，限价计划酝酿已久，实际效力随着周期拉长而弱化，对俄罗斯的杀伤力可能较为有限。制裁对象上，限价措施不会对俄欧直接石油交易产生太多影响，主要是限制第三方进口俄石油的价格。“可见，它可能更具外交意义，相当于欧美拉上所有人去薅俄罗斯的羊毛。”张弘说。一是矛盾性。它必须切实伤害俄罗斯，但也允许俄罗斯获得最低水平的利润，以便其继续向外输送石油。如果尺度把握不当，该措施可能适得其反，引发油价飙升。二是试探性。欧盟表示，价格上限不是一成不变，将每两个月审查一次，确保其金额比俄罗斯石油售价低至少5%的水平。据国际货币基金组织估计，俄石油生产的成本盈亏平衡价约为每桶30至40美元。眼下，俄罗斯运往一些欧洲地区的乌拉尔原油交易价已跌至每桶60美元以下，远低于伦敦布伦特原油期货每桶85美元的价格。尽管西方设置价格上限，俄罗斯仍有盈利空间。有数据显示，近半年里，俄罗斯原油供应已向亚洲市场大规模转移，市场结构发生重大变化。今年10月，俄对亚洲和不明目的地的海运石油出口飙升至日均206.7万桶，为今年以来最高水平。印度、中国成为俄原油的两大买家。近几个月里，尽管美国反复推销“限价联盟”，但印度始终无动于衷。印度观察者研究基金会一项民调显示，43%的印度人认为俄罗斯是本国最可靠伙伴，高于美国的27%。多家美媒指出，西方正通过限价计划对欧盟原有的禁运计划松绑。欧盟禁运计划完全禁止为俄石油运输提供保险和融资。但如今，美国拆分、撤销关键运输条款，放开部分海运服务，淡化全面制裁，以免太刺激俄罗斯。比如，欧盟提议给予价格上限45天过渡期；只有“故意”运输超过价格上限的俄原油，才会受到禁运90天的处罚等。西方押注，离开西方的海运系统，俄罗斯的原油出口无路可走。但事实是，海运保险市场并非完全被英美垄断。为了突破封锁，俄罗斯正组建自己的独立系统，买方可由俄罗斯实体安排保险，将在很大程度上避开制裁。新的国际结算替代机制正在形成。另有美媒称，一个“影子市场”正在形成，来自俄港口的石油越来越多地运往不明目的地。现实需求下，欧洲交易商将通过古老的方法瞒天过海运输石油。两位分析人士指出，西方试图通过限价措施对俄罗斯经济造成打击，但追求的目标较为复杂，在一定程度上自相矛盾，甚至与市场规律背道而驰，作用可能较为有限。从俄罗斯方面看，张弘指出，其原油日产量是1090万桶，出口规模为250万至300万桶。俄自有的海上运力只能满足其出口量的15%。因此，俄西之间紧张的经济关系，会对俄经济景气度带来一定冲击，损害俄在全球能源价格市场上的定价权。但是，西方制裁也促使俄罗斯和其他国家主动规避西方海运和保险服务，再加上一些灰色空间的石油出口产业链一直存在。俄罗斯可能受到多大冲击，仍待观察。从限价细节看，孙霞指出，设定的金额很笼统，没有区分乌拉尔混合原油、西伯利亚轻质原油等不同原油类型，它们本身价格不一。禁运对象有局限性，石油交易方仍可通过一些操作规避制裁。至于限价措施对国际油价的影响，仍取决于俄罗斯和其他产油国的下一步行动。西方越俎代庖，试图为俄罗斯石油价格“封盖”，那么，俄罗斯会如何回应，引发外界关注。俄能源专家称，俄罗斯已准备好以“普京公式”回应西方限价。普京明确表示，俄将拒绝与实施限价机制的国家开展贸易。也有美媒担心，俄罗斯可能限制产量，全球油价可能上涨。美国竭力推动限价，但高估了自己对全球原油贸易的影响力，很可能徒劳无功，沦为普京笑柄。与此同时，欧佩克+（由世界主要产油国组成）定于12月4日举行部长级会议，讨论下一阶段的石油产量问题。有消息称，欧佩克+内部对西方用政治手段干预市场价格表示担忧，正权衡潜在影响，不排除进一步减产的可能性。“俄罗斯可能会推动整个欧佩克+减产，以维持国际油价处于一定水平，维护产油国的整体利益。”张弘指出，沙特和俄罗斯可以说是利益共同体，限价措施虽指向俄罗斯，但对沙特的利益也有影响。一旦西方将这种违反市场规律的操作制度化，将严重损害欧佩克+的利益。“俄罗斯会继续转移出口目的地，拒向设置价格上限的国家出口石油。”孙霞指出，西方限价的后续影响，不仅取决于俄罗斯、欧佩克+的行动，还要看美欧的经济状况及其后续政策。欧洲可能会根据经济承受度来调整对俄限价金额，美国也可能会在压力下释放石油战略储备、推动放松对委内瑞拉制裁等。值得一提的是，两位分析人士提到，西方对俄金融制裁日益加重，将激发越来越多的国家逃离西方主导的金融体系。比如，印度等国提出通过本国货币进行石油贸易结算等。这可能会对以美元为主导的国际货币金融体系造成冲击，加大新兴经济体的离心倾向。责任编辑：周唯
美股,欧洲议会最大党团：若美国执意不让步，将采取“核选项”,环球网,2022年12月04日 22:00,欧洲议会最大党团发言人马库斯·费伯在接受德国《柏林晨邮报》采访时，费伯指出，如果美国在贸易保护主义道路上一意孤行，欧盟将被不得不“将所有酷刑工具摆上台面”，同时，欧洲议会国际贸易委员会主席贝恩德·朗格呼吁欧盟针对美国的《通胀削减法案》向世界贸易组织提起申诉。责任编辑：李桐
滚动新闻,美国房价新高，但聪明钱已提前离场,市场资讯,2022年12月04日 22:00,来源：华尔街见闻美国房价叠创新高？对也不对近期的美国地产可谓信息庞杂，一方面成交量持续下滑，Zillow的数据显示，10月卖家房屋挂牌量同比下降24%，为连续第四个月下滑。而作为次贷危机亲历者的房利美也在三季报中，警告美国地产崩盘的风险。其实不止美国，全球的地产都出现了价格下行风险。既有作为新兴经济体的越南；也有号称全球金丝雀的韩国；也包括炒房圣地，房价自从次贷危机后经历15年长牛的澳大利亚、加拿大。但奇怪的是，在一系列指标走弱，全球都在“期待”美国地产崩盘的背景下，美国房价居然创下了新高。最新公布的10月美国新屋销售数据显示，环比上涨了7.5%，大幅高于市场预期的环比下降5.5%；与此同时，新房中位价格规升至创纪录的49.3万美元。其实这个新高指的主要是美国的新房市场。这中间原因可能比较多，一方面跟疫情后的美国住房的市场结构有关，购房者开始偏好独屋这种价格高，且相对偏远地区的新房。另方面，也跟新房市场相对成屋而言，受贷款利率影响相对较小有关。因为新房的降价压力主要还是在开发商，且美国开发商的负债率一般都不高，因此对于利率上升的忍受能力要比一般的居民要强。所以基本新房卖不动，开发商也不会主动降价。但实际上，即便美国购房者开始偏好独屋等新房，也无法改变美国房地产市场以二手房为主的格局。由于市场已经步入成熟期，美国房地产市场成交主要还是以二手房为主，占比达到85%以上。事实上，二手房市场完全是另外一个画面。从2022年6月开始，已经持续调整达半年时间。且过去价格越强势的地区，房价在本轮调整过程中，压力越大。地产在煽动蝴蝶翅膀作为美国地产基本盘的房地产持续走弱，但问题恐怕并不仅仅在于此。首先美国地产由于进入成熟期，因此美国房地产的资本化率极高，通常被认为是一种类固收的资产，通过Reits或者说08年次贷的形式来作为底层资产。而随着底层资产出问题，相关的产品也受到波及。《黑石被困地产，雷曼魅影再现？》中提到，黑石作为全球私募巨头，面临赎回压力，而相关底层资产就是房地产。从规模上而言，18亿的赎回，就让1250亿的资金被迫停止申赎。而这恰恰体现出了房地产作为底层资产的特点，就是流动性差，一旦面临赎回，基本规模不大也会引发赎回限制，但这看似保护性的条款，却很容易引发流动性的挤兑。更重要的是，由于相关产品底层资产模糊、杠杆率模糊、估值价格模糊，要有准确的数据，恐怕需要研究量子力学。而如果看过电影《大空头》，就知道现在跟08年是何其相似。在一系列的模糊下，恰恰一系列的不透明，扩大了投资者的恐慌。特别是黑石的客户，都不是等闲之辈。不过《十次危机，九次地产？这次恐怕是例外》也指出，过去地产的危机同股市是高度结合的。比如说08年次贷危机，美股跌幅如此巨大是因为成分权重中，都是大金融。而科技股繁荣后，现在美股的权重已经大幅偏移至科技股。且或许是08年的痛太深刻，金融股的估值也已经今非昔比。责任编辑：周唯
