板块名,标题,作者,日期,新闻内容
产经,搜狗瓦解史：一年关闭六个业务，370亿输入法巨头风光不再,时代周报-时代在线,2022年08月21日 12:40,作为PC互联网时代的余晖，搜狗在并入腾讯近一年后，也正在逐渐退出移动互联网的舞台。近日，搜狗游戏中心官网公告宣布，由于公司业务调整，搜狗游戏中心将正式停止服务与运营。公司将协助用户与游戏官方对接，沟通转服事宜；如客户有尚未消耗的游戏币且决定不转服，可在2022年11月16日12点前联系搜狗游戏服务中心客服退款。至此，搜狗旗下已有至少六项业务被陆续关停，包括搜狗地图、搜狗阅读、搜狗借钱、搜狗搜索App、搜狗号等。大量与搜狗一同并入腾讯的前搜狗人，也逐渐在一轮轮的人员优化中离去。一名前搜狗员工向时代财经透露，搜狗整体合并到腾讯的各个事业群后，除核心的输入法和浏览器保留原有的运营模式，其他小业务都将逐步关停。而他自己，也随着业务的调整，在7月初被迫离开。从2004年问世，到2010年被拆分成独立公司，再到2017年成功上市，搜狗曾历经辉煌，其输入法业务凭借先发优势常年占据全国市场最高份额，王小川提出的“输入法-浏览器-搜索”三级火箭的流量传导模式，也曾是搜索行业追赶破局的经典商业模式。然而在移动互联网时代，当跨应用跳转障碍重重，搜索引擎引以为傲的信息收集和整合能力失灵，在一众新的浪潮里逐渐被边缘化。而作为PC互联网时代的余晖，搜狗在并入腾讯近一年后，也正在逐渐退出移动互联网的舞台。一部搜狗“消亡史”2021年9月24日凌晨，搜狗公告宣布与腾讯完成合并，搜狗将成为腾讯间接全资子公司，完成退市，之后作为存续公司继续运营。合并后，据界面新闻报道，大部分搜狗业务和公线团队将并入腾讯看点。腾讯平台及内容业务事业群（PCG）随之发布了囊入搜狗后新的组织架构调整，成立“信息平台与服务线”。QQ浏览器、搜狗浏览器成为基础支撑平台，搜索引擎如人工智能和输入法，成为核心业务。与之同时发生的，是一些边缘业务的即刻清退。去年9月，搜狗内容开放平台“搜狗号”发布公告称，因公司业务调整，平台将于22日停止运营和服务。10月，搜狗借钱App亦发布“服务暂停公告”。随后进入短暂的休整融合期，直到今年上半年互联网公司普遍开展降本增效动作，更大规模的业务收缩由此开启。今年5月，有着超过20年历史，中国最早提供互联网地图服务的搜狗地图也宣布正式下线，所有相关服务全部关闭，进入原有域名也会直接跳转至腾讯地图；7月，搜狗阅读亦宣布停运，所有用户的金额转至QQ浏览器小说余额，不同意或不接受则视为自动放弃权益。紧接着，搜狗核心的搜索业务也受到影响。搜狗在合并前最后一份财报显示，搜索业务占公司整体营收的93%，搜狗过于依赖搜索业务也曾被认为是公司发展的一大挚肘。但在8月初，搜狗却公告表示，搜狗搜索App将于8月8日23时59分正式停止服务，后续搜狗搜索App将无法使用，而网页版搜狗搜索仍可继续使用。但在移动互联网时代，网页搜索引擎的使用频次大不如从前。此前，搜狗曾将搜狗搜索App升级为BingoApp，更名后保留搜狗搜索App原有的搜索引擎和小说服务，但去除了首页信息流。可惜的是，这样的举措未能让搜狗搜索迎来新的生机，目前BingoApp已经从各大应用商店下架，与搜狗搜索App一同退出了舞台。下半年，这样的进程仍将继续。有搜狗前员工对时代财经透露，不同部门“毕业”时间不同，6月底已有一大批员工离开，到9月底还将有另一批人员优化的动作。被腾讯吸收是最好的选择？搜狗也曾历经辉煌。当年随着张朝阳一声令下，刚刚从清华大学硕士毕业的王小川挂帅组建搜狐研发中心，用6个人的编制，请来12名清华奥赛集训队的大学生兼职员工，投入搜索引擎的开发工作。仅11个月后，在2004年8月，搜狐自己的搜索引擎“搜狗”便正式上线。然而，搜狗却没能如预期般被市场拥抱。百度在先，相似的产品，搜狗没有太大的竞争力，始终不温不火。直到2005年，一封偶然的邮件，让搜狗意识到用搜索引擎做输入法的商机。一年后，搜狗输入法正式面世，立刻凭借产品在拼音输入的准确度以及联想词汇丰富等特点，获得了广大用户的好评。公开资料显示，凭借先发优势，在2009年前后，搜狗输入法的用户使用率达到79.7%，遥遥领先于其他输入法。这一优势直到这两年才被百度超越。在做输入法产品的过程中，王小川意识到，互联网的流量入口正在发生变化，搜索的入口前移是必然的选择。同时，输入法在用户流量的转化上也存在天然的短板，基于此，搜狗决定入局浏览器市场。自此，搜狗依靠输入法带动浏览器，浏览器带动搜索，最后在搜索变现的“三级火箭”的商业模式也开始逐渐成型。2010年，王小川拉来阿里投资，搜狗从此拆分独立发展。两年后阿里退出，腾讯以4.48亿美元入股搜狗36.5%的股权。交易完成后，腾讯开始向搜狗倾注大量资源，直接将QQ输入法、SOSO两项业务并入搜狗，且在搜狗搜索内独家上线微信搜索频道，接入微信公众号。腾讯入股之后，王小川和搜狗迎来了新的高光时刻。2017年，在历经14年的奋斗后，作为PC互联网时代走出的最后一只独角兽，搜狗终于登陆纽交所，市值一度达到54亿美元，约合人民币370亿元。但这也是搜狗最后的荣光。随着移动互联网的快速发展，搜狗开始逐渐衰落。东方Choice数据显示，2018年搜狗达到9878万美元的净利最高点后，便开始持续萎缩。2020年甚至出现过亿美元的巨额亏损，其市值也是一路下跌，最低点时仅有11.34亿美元。衰落、亏损，再加上大股东搜狐无心恋战。到最后，搜狗似乎已经没有比卖身腾讯更好的选择。只是对于腾讯而言，选择性吸收已是搜狗最好的结局。责任编辑：刘万里SF014
国内财经,三亚新鸿港市场暂停交易影响蔬菜供应？不属实,中国新闻网,2022年08月21日 12:30,中新网8月21日电中共三亚市委网络安全和信息化委员会办公室21日发布消息，8月20日，有网络视频称，三亚新鸿港市场暂停交易影响蔬菜供应且销毁200多万吨蔬菜。经核实，此消息不属实。数据统计显示，淡季（5月至10月）三亚市日均蔬菜消费量约380吨，旺季（11月至次年4月）约450吨。且从三亚菜篮子产品流通网络及结构看，传统“批发市场—农贸市场—消费者”的蔬菜流通模式其交易份额约占市场份额的40%；以“菜篮子配送中心”等新兴业态的流通模式和市政府主导的平价网点在疫情期间供应稳定且供应量不断增长，约占市场份额的60%。目前，三亚蔬菜、肉类等重要生活必需品均足量储备，可保障市场供应。据悉，8月20日，三亚南果公益性批发市场已投入运行。自8月21日开始，三亚农投集团将会同相关平价蔬菜联盟企业，计划每天调运基本蔬菜品种不低于200吨。同时，三亚益民肉联厂也将于8月21日恢复市场供应。针对主城区（天涯区和吉阳区）疫情防控严峻形势，三亚已建立“打通社区保供最后100米”配送日报督查制度，加强信息报送和监督机制，各区以网格为单位，每日梳理各社区网格物资配送情况，包括网格内住户数量、已配送数量、配送覆盖情况，及时掌握物资配送动态和缺口，随时做好“菜篮子”“米袋子”产品调配供给。下一步，三亚市重要生活物资工作专班将持续密切关注重要生活物资的市场供应情况，加强分级分类监测和趋势预测，做好物资调配，搭建供需对接平台，全力做好生活必需品市场供应保障工作，确保生活必需品市场供应充足、运行稳定。（中新财经）责任编辑：刘万里SF014
新浪科技,水滴筹回应中介抽成70%：坚决抵制和打击 高于筹款额3.6%的费用不是平台收取,新浪科技,2022年08月21日 12:28,新浪科技讯8月21日午间消息，针对职业筹款推广人被曝最高抽成70%一事，水滴筹回应称，所谓的筹款中介是由部分恶意推广的第三方商业组织运作，为筹款人提供不正当筹款方式的服务，对于此伤害用户和水滴品牌的行为，水滴筹采取零容忍态度，坚决抵制和打击。水滴筹再次声明，任何高于筹款额3.6%的费用都不是平台收取。今年6月，《中国慈善家》发文曝光一些游走在大病众筹平台的“职业筹款推广人”，他们以帮助求助人迅速筹款抽取善款分成，最高比例达到70%。水滴筹表示，2016年7月上线以来，在接近六年的时间里，一直是水滴公司全额补贴水滴筹平台的运营成本。直到今年4月，水滴筹试运行收取筹款金额的3%作为服务费(除此之外，第三方支付平台收取0.6%支付通道费用)，用于维持平台运营。水滴筹声明称，任何高于筹款额3.6%的费用都不是平台收取，希望广大用户和网友共同监督。如果大家发现有机构或个人收取高额佣金，可向水滴筹平台报或向公安机关报案。公开声明近日有媒体报道称“水滴筹筹款中介抽成最高达70%”。事实上，所谓的筹款中介是由部分恶意推广的第三方商业组织运作，为筹款人提供不正当筹款方式的服务，对于此伤害用户和水滴品牌的行为，水滴筹采取零容忍态度，坚决抵制和打击。6月17日，水滴筹与轻松筹发布联合声明，共同打击冒充平台收取“推广费”。6月28日，水滴筹对外声明，大病筹款灰色链条不仅严重影响了大病筹款行业的公众形象，而且筹款中介收取30%-70%的费用，侵害了筹款人、捐款人的权益，已经构成违法行为。近日我们对外披露了打击恶意推广的进展，经过几个月的调查和打击，水滴筹风控团队已经能够有效识别，哪些是有筹款中介参与的筹款项目，7月份，平台查实的此类筹款项目20余起，数量呈持续下降趋势。水滴筹将持续完善平台规则和风控体系，让“灰产”从业者没有漏洞可钻。对于违法行为，水滴筹将向公安机关报案，配合警方将不法分子绳之以法。水滴筹2016年7月上线以来，在接近六年的时间里，一直是水滴公司全额补贴水滴筹平台的运营成本。直到今年4月，水滴筹试运行收取筹款金额的3%作为服务费(除此之外，第三方支付平台收取0.6%支付通道费用)，用于维持平台运营。水滴筹再次声明，任何高于筹款额3.6%的费用都不是平台收取，希望广大用户和网友共同监督。如果大家发现有机构或个人收取高额佣金，可向水滴筹平台举报或向公安机关报案。水滴筹2022年8月21日
产经,七田真早教机构7月促销，8月闭店，上百万的预付费能要回来么？,北京日报客户端,2022年08月21日 12:26,来源：问北京微信公众号近年来早教行业迅速发展，然而因为这一行业预付费的经营模式，在出现经营不善、闭店停课的时候，往往导致家长们退费无门。近日，北京的一家早期教育培训机构就突然暂停了所有课程服务，涉及的退费问题让家长们头疼不已．．．．．．早教机构多门店闭店歇业近日，多位家长向“问北京”（北京新闻广播新闻热线65159063）反映，他们报名的早教机构——七田真早期教育培训突然贴出通知，称自8月14号开始，所有的北京门店暂停课程服务，随即于8月15号闭店歇业。去年10月在七田真早教机构（丰台凯德Mall大峡谷店）给孩子报名早教课程的家长王女士（化姓）告诉记者，之前因为过年放假加上疫情闭店的原因，她报名的课程就一直断断续续没有上完，然而7月份早教机构又推出了嗨购节，因为价格优惠，很多家长又续报了新的课程。王女士：当时交的是18，400，一共是66节课，然后因为断断续续的有疫情，所以上课的话到差不多7月份，还剩了20来节课。后来他7月突然就又搞活动，销售就开始给我推荐课包，说活动力度特别大，然后又续了一个新的课包。就光我们这个区域，光7月报这个课的费用就都有上百万。王女士说，让大家没有想到的是，新的课程还没有开始使用，就收到了门店暂停服务的通知，而且闭店的不只是这一家门店。王女士：结果8月13号晚上差不多11点的时候，我们的客群里面就发了一个通知，从8月14暂停了整个的课程服务。后来就发现整个北京市有富力中心店，还有什么蓝港店全部都闭店关门了。家长质疑诱导消费后跑路就家长们目前掌握的信息，仅在凯德mall一家门店报名的人数已达300多人，涉及课程费用600多万。而据家长们的不完全统计，已知的北京七田真门店就有11家，涉及的课程费用金额庞大。在其他门店购买课程的家长们表示，7月还在促销，而8月就大范围闭店，大家有理由怀疑，这是有预谋的诱导家长们消费：家长：也都是基于对老师的信任，家长们才都去续了课的。但是现在大门紧闭发一个通知，然后任何人都联系不到。家长：特别便宜，就诓骗家长去报名，也没有给发票，也没有给合同，很多家长课包都没开就卷钱跑路了。七田真：可通过小程序退费记者看到，七田真早教机构发布的《致会员家长的一封信》中指出，“因为有突发聚集性维权，所以不得已于8月14号开始暂停课程服务。希望家长们通过理性合法的途径维权。”记者尝试拨打七田真总部服务热线了解具体情况，然而人工服务始终无人接听，语音助手提示可通过微信小程序申请退费。七田真：为您带来不便，我们深感抱歉，会员家长可通过七田真微信小程序提交退费申请，提交成功后，我们将尽快与您联系。员工被拖欠工资也在维权但此前在七田真蓝色港湾门店消费的颜女士（化姓）告诉记者，微信小程序已经是一片空白，没有任何信息了。同时，她还了解到，老师们目前也在维权。颜女士：我们也尝试着去跟老师沟通，那老师也处于一个欠薪的状态，人家也在维权。蓝色港湾店的销售主管武女士告诉记者，4月份曾有过个别老师出现被拖欠工资的现象，但因为后续工资正常发放，所以员工们也没有提高警惕。武女士：大家为什么感觉嗨购节没事呢，就是因为五六月份都发了，就感觉这个是稳了。（等）7月10号不发6月份工资的时候，我们感觉这个事不对劲，然后找他们去对质的时候就找不见人了，就是领导跟老板属于失联的状态，我们也在维权。法人：将持续追踪退费问题记者在天眼查网站上了解到，2021年12月七田真教育咨询有限公司更名为北京喜七哒教育咨询有限公司，法人代表名为小野思延。8月16号，公司法人在抖音平台上发布了直播，在涉及到家长退费的内容时，他表示：法人：我们七田真这几个一线城市永远不会放弃，但是当巨大的困难到我们面前的时候，我们也不可能去硬顶硬碰，我们要打一套组合拳来去解决这个问题。当然对有退费要求的人，我们也会诚心的去跟踪。我相信几年过后，当我们过了这个最大的难关生死之劫之后，我们不光是在全国其他地方，我们在北京、上海、深圳我们会继续发展。市监局：已立案，建议法律维权对于法人的这种说法，家长们认为只是一句空话。丰台局市场监督管理局马家堡市场所的工作人员崔先生在回复记者时也表示，相关的负责人无法联系上：崔先生：之前跟我们做对接的这个（人）呢，我们这边也暂时是联系不上，电话关机，加的微信也是属于说给我们进行了拉黑状态，所以目前我们这边是把这家公司，喜七哒这家公司列入了经营异常，同时我们这边也进行了核查立案，走核查立案程序。针对这种毫无预兆的大范围闭店情况，马家堡市场所的崔先生也建议家长们运用法律武器维权：崔先生：目前是先去派出所做一个登记，然后再走司法，通过微信小程序里面的移动微法院，从那里提交这个司法诉讼。然后我们这边再看看想想其他的办法，能不能找到这些人来去处理这个事儿。律师：根据证据认定是否欺诈关于家长们质疑的机构闭店前的促销活动是否涉嫌欺诈，记者也咨询了消费领域资深律师葛友山，葛律师表示，消费者们可以尽可能提供相关证据，最终由公安机关调查认定：葛律师：如果对方明显没有履行能力，而且以非法占有消费者金钱为目的的情况下，编造说多种活动，然后为了更多的侵占消费者的合法财产，那就构成诈骗。但是否构成诈骗，必须有公安机关进行侦查之后进行认定，这个是需要有严格的证据支持。近两年在政府大力推动下，预付资金监管制度在学科类教育培训的头部机构已基本得到落实，然而，政策没有完全落地，监管缺位的情况也时有发生。在此也希望相关部门强化预付费市场监管，从严打击恶意圈钱跑路行为，保护消费者的资金安全和消费信心。有关此事件的进展，新闻热线也将持续关注。小问说一纸通告闭店停课退费无门家长维权若要市场良性发展加强预付制度监管责任编辑：刘万里SF014
亚洲金融危机25周年的回顾与启示国际研讨会,戴相龙：现有国际货币体系弊端日益突出，应继续推进多元化,第一财经,2022年08月21日 12:24,由美国引发的全球金融风险正在不断扩大。亚洲金融危机已过去25年，全球进入新时代百年未有之大变局，以中国为代表的新兴经济体逐步崛起。近日，在“让历史告诉未来：亚洲金融危机二十五周年的回顾与启示”国际研讨会上，中国人民银行原行长戴相龙表示，站在新的历史时点上，回顾亚洲金融危机，主要由美国引发的全球金融风险正在不断扩大。作为亲历者，戴相龙曾参与制定和执行中国应对亚洲金融危机的重大措施。他在研讨会上表示，与25年前相比较，美国经济总量占全球的比例逐步下降。美国政府负债占GDP比例，已从65.9%提升到128.8%以上。美国经济实力很难支撑原来美元的地位。而美国重大货币政策的出台都会带来全球金融市场波动，新兴经济体和发展中国家不断增加美元储备，承担了美元外汇储备投资风险和贬值风险。戴相龙认为，现有国际货币体系的弊端日益突出，为防范和化解风险，他建议继续推进国际货币多元化。包括国际货币基金组织扩大发行特别提款权（SDR），允许其中一部分可用于成员间的流动性支出。同时，推进国际货币多元化。加强中欧经贸合作，促进欧元稳定。坚持市场驱动和企业自主选择，稳慎推进人民币国际化。“美元虽然是美国的本币，但又是全球最主要的储备货币，新兴市场国家和发展中国家有权通过20国集团领导人峰会及其财长、央行行长会议，督促美国政府把国家负债率逐步降到70%以内（相当于25年前的水平），减少美国货币政策溢出的负面效应。”他称。此外，要加快中国现代金融建设，增强我国防范和化解金融危机的能力。戴相龙表示，抓紧建立和完善现代中央银行制度、现代融资制度、现代金融监管制度，提高我国对囯际金融治理的地位和作用。中美作为全球两大经济体，长远看，经济和金融很难全面脱钩。中美金融关系应该继续寻求交流、合作、共赢。但是，也要准备好应对美国发起金融战的有力措施。为防范应对金融危机、加强区域协作，2000年5月，东盟10国和中、日、韩3国的财政部长在泰国签订“清迈协议”。根据协议，“10+3”对设立2500亿美元的互助性资金进行了深入交流，达成了很多共识。戴相龙建议，继续推动“10+3”金融合作，建立区域应对全球金融风险的制度安排。为巩固和发展“10+3”经贸合作关系，还应创造条件继续讨论“清迈协议”的落实，提高东亚和东南亚各国应对全球金融危机的区域性协防能力。新浪声明：所有会议实录均为现场速记整理，未经演讲者审阅，新浪网登载此文出于传递更多信息之目的，并不意味着赞同其观点或证实其描述。责任编辑：梁斌SF055
国际财经,彭斯表态“什么机密文件都没拿”，美媒：在特朗普家被搜查背景下值得关注,环球网,2022年08月21日 12:17,【环球网报道】美国前总统特朗普遭联邦调查局突击搜查一事引发持续关注，他的前副手也就此事更新表态。据美联社报道，美国前副总统彭斯当地时间19日表示，自己在离任时并没有带走任何机密文件。美联社称，当一个前副总统发表此类言论时，通常不会引起什么注意，但是在特朗普刚被搜查并且可能违反联邦法律的背景下，这一表态值得关注。据报道，彭斯当天在爱荷华州一个博览会上被记者问及，在离任时是否带走了任何机密文件，彭斯表示：“据我所知，没有。”报道称，FBI从特朗普海湖庄园带走的物品清单中有标记为“机密文件”的材料，彭斯对此表示，“说实话，在我们了解所有事情之前我不想提前评论”。彭斯同时还提到，突击搜查特朗普庄园可能是出于政治动机，他还呼吁司法部长披露更多细节，说明是出于什么原因发起此次行动。“我知道这在调查中并不常见。但这是司法部采取的前所未有的行动，我认为它应该值得前所未有的透明度。”彭斯说。报道称，彭斯当天还表示，自己会在明年年初决定是否参选美国总统。他的助手表示，这一决定和特朗普是否参选无关。据了解，这不是彭斯第一次就海湖庄园被搜查一事表态。美国前副总统彭斯于当地时间8月17日表示，他将考虑出席调查2021年1月6日国会大厦骚乱事件的众议院特别委员会举行的听证会并作证。彭斯在一次活动中表示：“如果有邀请我参加，我会考虑的”。但同时彭斯称，副总统在国会山作证是“前所未有”的，他必须对其性质进行权衡。责任编辑：刘万里SF014
