板块名,标题,作者,日期,新闻内容
新浪科技,5G终端战：冲向高地,21世纪经济报道,2022年03月17日 19:29,来源：21tech作者：骆轶琪编辑：张伟贤智能手机市场进入发展瓶颈期日久，但多方数据统计都显示，针对高端机市场的需求目前并没有完全得到满足。这成为产业链间都在积极寻求对高端市场突围的原因，为此，终端大厂自身针对单项场景的芯片自研能力在推进，同时也在联合底层SoC芯片厂商展开联合调教，并考虑共同探索新的应用落地。OPPOFind产品线总裁李杰告诉21世纪经济报道记者，近日即将上市的OPPOFindX5Pro天玑版就是在这样背景下推进的研发。“这次与天玑9000芯片的合作，是我们跟MediaTek（联发科）在旗舰产品上最深入的一次合作。”他表示，“我们从开始只是借用MediaTek这种集成式的芯片；到慢慢跟MediaTek一起探讨开放式的架构，能让我们差异化的体验在AI、影像上体现出来。这次是更全面的，从最开始的SoC底层，包括信号网络、基础通信等方面都开始更深入地合作。这次的模式是以前的延续，或者是一个很大的升级。”当然，行业一直认为，冲刺高端始终是一个需要长期积累的过程，这中间需要包括研发积累、生态合围、市场和营销等匹配，同时也会让高端之争的联合生态日益丰富。在智能机发展的较早时候，行业共识多是高端手机用芯片、中端手机用联发科芯片、低端手机选择国产芯片的模式。而随着自研芯片不断推陈出新，安卓阵营越来越多希冀冲刺高端市场，这让主芯片市场的既往思维惯式在逐步被调整。据调研机构Counterpoint统计，2021年第四季度的AP/SOC市场中，联发科以33%的份额依然稳居行业出货量第一，排在第二位的高通以30%份额紧追其后。该机构指出，二者的比例差异缩小与中国安卓阵营进行一定库存调整有关；而高通的策略是优先销售高端芯片，这能够保证其获得相对高的盈利能力、且受芯片短缺影响略小。苹果则是因为其高端产品能够维持健康的需求量，而令其以21%比例可以稳居第三位。变化可能出现在2022年，随着前一年末高通发布高端骁龙8芯片、联发科发布旗舰芯片天玑9000，显示出在高端芯片市场将有更多参与者进入角逐。MediaTek无线通信事业部副总经理李彦辑分析道，“从MediaTek的角度，手机现在已经进入到消费升级的换机潮，接下来我们认为旗舰市场是所有厂家的兵家必争之地，我们也非常看好这块市场，在这个时间点天玑9000的出现，也正好符合这个市场机遇。”他进一步指出，过往的旗舰市场，尤其是安卓市场，芯片选择非常少。“市场也急需要更好的方案，带来更多创新，尤其是针对功耗、发热这个部分，这也是天玑系列一个最重要的未来发展方向。”当然，在如今摩尔定律放缓的背景下，芯片厂商要寻求突破可能也将面临更多难点。李彦辑坦言，制程演进的确在速度上看起来有放缓迹象。不过更重要的是在芯片设计角度，不管是CPU、GPU、APU或者是影像ISP、多媒体、通信相关技术模块，更重要的是仰赖芯片设计公司自己。尤其是MediaTek在一些全局式的能效优化上，怎么样能够通过架构设计达到更好的体验改善。MediaTek无线通信事业部技术规划总监李俊男也指出，“如果以体验的角度，我们在手机芯片上还有很多可以努力。比如端游级的游戏体验、更好的渲染技术、更省电的技术，这是我们在之后芯片规划的时候一些主要提升方向。”在此过程中，软硬件的能力也要密切匹配。因此李俊男表示，在旗舰机体验的道路上，软件生态构建非常关键。为此，MediaTek有相应准备。“第一是天玑开放架构，我们面对的不是只有终端，还会面对紧密合作的第三方软件开发伙伴；第二是AI部分我们准备了NeuroPilot，我们有很紧密的算法合作公司，或者是头部算法+应用公司。我们提供开放架构、完整有效的开发工具，让头部开发团队能做出好效果。”他续称，面对游戏部分，联发科会与头部游戏公司保持紧密的联调合作，“玩得很顺畅又减少发烫，这是基本目标。更积极的目标，会跟游戏引擎公司合作先进技术，比如光线追踪，这是比较长远的合作之路，我们会继续投资和支持游戏这部分能力。”前述OPPO高端新机也是首款搭载联发科高端芯片商用的机型，显示出双方都希冀借此在高端市场进行能力的协同沉淀。更何况在早期OPPO从蓝光DVD转型智能机的过程中，联发科就已经是其重要的产业链支持方。据李彦辑介绍，OPPO和MediaTek是长期战略合作伙伴，2021年OPPO是其芯片出货量最多的厂商。“我们一直探讨在旗舰上的合作可能。未来还有更多合作机会，打造符合用户体验、真正旗舰性能OPPO+MediaTek天玑的手机，这是双方未来在高端上一个共同的目标。”他进一步指出，这次二者的合作和联调是前所未有的人力投入。“更早期我们还是跟OPPO针对旗舰体验做到什么程度有不同层次的讨论。实际上开始做OPPOFindX5Pro天玑版我们打磨了快1年左右。我想旗舰未来的创新所需要的时间会越来越长。所以我们在每一次旗舰的讨论上，都会花非常久的时间，在各个方面都有深入讨论。”李杰补充道，在这接近一年的联合探索过程中，OPPO相应在各个领域的研发人员投入超过2000人。具体来说，他表示，在OPPO的高端机型采用天玑9000芯片，主要是看重整体性能和能效比。“我们深入跟MediaTek的同事交流发现，天玑9000在整个芯片的架构上，无论CPU还是GPU，都有非常先进的理念和架构去做。另外，这个架构下比如ISP可以达到90亿像素每秒这种顶级性能；MediaTek平台在AI一直跟我们深入沟通比较多，对影像上AI性能的挖掘非常充分。”“供应链紧张我认为是短期市场供给需求平衡的问题。虽然大家都会受到不同程度影响，但它不是我们选择天玑9000的重要原因。”李杰告诉21世纪经济报道记者，OPPO选择和天玑9000在旗舰上深度合作，目的是想带来更多体验、产品创新。“对于供应链，我们能做的是更好地控制自己的产品节奏、订单节奏，保证我们的市场和用户不会受到影响，这是更重要的。”当然，也正因为双方都希望以此为一个支点更好探索高端手机市场，这同时也成为目前面临的一个挑战。李杰坦言，“我觉得对OPPO也好、MediaTek也好，品牌高端化都是我们的挑战，怎么样能让更多的消费者、用户和市场在旗舰机型的选择上接受我们，这是一个比较大的挑战。”不过因为合作时间相对较近，此次发布的合作版本并没有搭载OPPO自研的马里亚纳NPU芯片。“我们在技术上的互联互通以及算法协同是完全打通的。透露一个信息，我们已经在开始调试整个天玑系列和马里亚纳芯片的工作了，今年可以期待一下。”李杰续称。据悉，不止手机硬件层面，OPPO与联发科还共同推动了在欧洲运营商市场的一定拓展。基于此李杰表示，面对高端市场，OPPO认为有三大突破点：底层技术走向芯片能力的机遇，手机形态创新，以及大时代背景下的品牌机遇。“自研芯片或者跟SoC更紧密地合作，才有可能打破同质化竞争的局面，包括OPPO和MediaTek一起用关键技术解决关键问题，这是一个非常大的机遇。”他进一步分析，而折叠屏等手机新形态的创造，对国内甚至海外高端市场的开拓都是好机会；此外是品牌方面，“OPPO在过去更为大众了解的是Reno系列、R系列，现在我们有更稳定的高端产品布局，以及更稳定的品牌和营销资源投入、全球化投入，无论是在国内还是国际，对于中国品牌都是千载难逢的机遇。”
天齐锂业赴港上市,重金收购SQM背负巨额债务？天齐锂业再冲港股只为还债？,投资时报,2022年03月17日 17:34,原标题：重金收购SQM背负巨额债务？再冲港股只为还债？|IPO棱镜从毛利率数据来看，2019年、2020年及2021年前三季度，天齐锂业毛利率在60%至40%间浮动，总体来看不太稳定。同时，锂产品价格波动较大或影响天齐锂业的经营业绩。《投资时报》研究员李沐阳“双碳”目标下，锂作为一种新能源材料，给相关行业带来了巨大的发展空间。作为国内以锂为核心的新能源材料公司，天齐锂业股份有限公司（下称天齐锂业）也乘借此东风，向港交所主板递交上市申请，摩根士丹利、、招银国际为其联席保荐人。招股书披露，本次IPO，天齐锂业募集资金用途主要是偿还SQM债务的未偿还余额，剩下资金将用于为扩张项目（包括但不限于奎纳纳厂二期、安居工厂20000吨/年碳酸锂产能）拨资，以及用于一般公司用途。查阅天齐锂业招股书，《投资时报》研究员注意到，2019年、2020年以及2021年前三季度（下称报告期），天齐锂业营业收入和净利润十分不稳定。并且，由于天齐锂业收购SQM股份背上巨额债务，导致公司资金短缺。《投资时报》研究员亦注意到，作为已经在A股上市的公司，天齐锂业（002466.SZ）最近半年股价呈走低趋势，截至3月16日收盘，天齐锂业A股收于87.48元/股，较2021年8月31日创下的143.17元/股阶段性高点下跌38.9%。初步实现扭亏为盈天齐锂业是以锂为核心的新能源材料公司，主要业务是开采锂矿石并生产锂精矿以及生产锂化合物及衍生物。根据伍德麦肯兹报告，就2020年而言，天齐锂业是全球最大的锂矿生产商，按2020年锂产生的收入计排名第三位。同时，天齐锂业是中国唯一通过大型、一致且稳定的锂精矿供给，实现100%自给自足以及全面垂直整合锂矿的锂生产商。然而，在各方面占据领先地位的天齐锂业，近年业绩却为亏损状态。招股书数据显示，2019年、2020年以及2020年前三季度及2021年前三季度，天齐锂业的业务收入分别约为48.16亿元、32.15亿元、24.17亿元、38.49亿元，营收增速有所下滑。同时公司净利润为负，分别约为-54.8亿元、-11.25亿元、-5.79亿元。不过，2021年前三季度，公司净利润为23.02亿元，初步实现扭亏为盈。从毛利率数据来看，2019年、2020年及2021年前三季度，天齐锂业毛利率分别为56.0%、41.3%、53.1%，总体不太稳定。而锂产品价格波动较大，或影响天齐锂业的经营业绩。招股书披露，2019年及2020年之间，锂产品的市场价格稳步下降，主要由于终端用户的需求减少以及新冠肺炎疫情的影响。根据伍德麦肯兹报告，电池级碳酸锂的平均合同价格在2018年达到顶峰，亚洲到岸价格为每吨1.43万美元，在2020年下降至每吨1.03万美元，并在2021年前九个月进一步下降至9305美元。中国电池级碳酸锂的平均现货价格从2019年的每吨8748美元下降至2020年的每吨5668美元，下降35%，并在2021年前九个月上升至每吨1.23万美元；中国工业级碳酸锂的平均现货价格从2019年的每吨7530美元下降至2020年的每吨4807美元，下降36%，并在2021年前九个月上升至每吨1.16万美元。锂价格十分不稳定，并且整体呈下降趋势，可能对公司业务、财务状况及经营业绩产生重大不利影响。不仅如此，锂化合物及衍生物以及其他产品的开采及制造涉及复杂、精确且经常出现危险的过程，需要在严格控制的环境下进行生产。天齐锂业的产品开采及制造过程复杂且危险，可能在开采及制造过程中发生事故或中断，也会对天齐锂业的声誉及业绩产生不利影响。收购SQM背负巨额债务招股书显示，天齐锂业此次赴港IPO募集资金大部分将用于偿还SQM债务的未偿还余额。2018年12月，天齐锂业以约40.7亿美元的对价完成购买由Nutrien持有的SQM的6256股A股。同年，订立了两份融资协议（银团贷款A及银团贷款B、银团贷款C），并且已经提取其下所有可使用融资35亿美元为SQM交易对价拨资。因此，在SQM交易完成后，天齐锂业也背负了巨额债务。不仅如此，银团贷款A、银团贷款B及银团贷款C通过天齐锂业的附属公司股份的质押及所持的所有SQM股份作为抵押，由天齐锂业董事长提供个人担保且由单一最大股东集团提供一份承诺契据，规定在特定情况下须向贷款人抵押A股。同时，由于相关条款规定，天齐锂业在获得额外融资方面的能力受到了限制，这为该公司获取营运资金、资本支出、额外收购事项、业务发展活动或一般企业用途所需资金造成障碍。据招股书显示，天齐锂业目前为SQM的第二大股东，其无法行使控制权，也无法对SQM或其相关业务产生任何决定性影响。并且，SQM财务情况不会与上市公司并表，在上市公司报表中仅以股权投资的形式体现。天齐锂业已根据SQM股权的市值估值确定SQM交易的购买价格，但公司无法确保估值完全准确，也无法确认巨额投资会给天齐锂业带来如预期一样的收益。此外，由于天齐锂业的债务较高，该公司在研发等方面的开支也逐渐收紧。2019年、2020年以及2021年前三季度，相关指标分别为4840万元、2430万元以及1490万元，呈现快速下降的趋势。责任编辑：张熠
对智能电视SDK侵权说,存在隐私不合规，小米电视助手等15款APP及1款SDK被点名,新华社,2022年03月17日 15:48,国家计算机病毒应急处理中心近期通过互联网监测发现15款移动App及1款SDK（软件开发工具包）存在隐私不合规行为，违反《网络安全法》《个人信息保护法》相关规定，涉嫌超范围采集个人隐私信息。1、隐私政策中未对个人信息处理者的基本情况进行描述，涉嫌隐私不合规。涉及1款SDK如下：《AgoraVideoCall》（版本6.2.8）。2、未向用户明示申请的全部隐私权限，涉嫌隐私不合规。涉及13款App如下：《Cutie》（版本1.6.2，360手机助手）、《方元健康》（版本1.8，360手机助手）、《美团管家青春版》（版本3.21.400，360手机助手）、《爱卡汽车》（版本10.6.9，乐商店）、《甜芝士Sweech》（版本1.9.62，乐商店）、《咸冰考研》（版本4.0.1，乐商店）、《小米电视助手》（版本2.7.1，乐商店）、《营创书院》（版本2.7.6，乐商店）、《重启世界》（版本2.3.17，乐商店）、《时尚志》（版本3.9.55，豌豆荚）、《领主世界》（版本4.1.9，小米应用商店）、《Healer》（版本2.5.0，应用宝）、《乐玩星球》（版本1.7.5，应用宝）。3、未逐一列出收集使用个人信息的目的、方式、范围等，且向第三方提供个人信息未做匿名化处理，涉嫌隐私不合规。涉及1款App和1款SDK如下：《营创书院》（版本2.7.6，乐商店）、《AgoraVideoCall》（版本6.2.8）。4、App在征得用户同意前就开始收集个人信息，涉嫌隐私不合规。涉及5款App如下：《Cutie》（版本1.6.2，360手机助手）、《咸冰考研》（版本4.0.1，乐商店）、《重启世界》（版本2.3.17，乐商店）、《我的绿洲》（版本0.24.0，绿色资源网）、《时尚志》（版本3.9.55，豌豆荚）。5、未提供有效的更正、删除个人信息及注销用户账号功能，或注销用户账号设置不合理条件，涉嫌隐私不合规。涉及5款App如下：《方元健康》（版本1.8，360手机助手）、《企鹅电竞直播助手》（版本2.30.0.326，360手机助手）、《咸冰考研》（版本4.0.1，乐商店）、《重启世界》（版本2.3.17，乐商店）、《乐玩星球》（版本1.7.5，应用宝）。6、未建立并公布个人信息安全投诉、举报渠道，或超过承诺处理回复时限，涉嫌隐私不合规。涉及3款App和1款SDK如下：《Cutie》（版本1.6.2，360手机助手）、《方元健康》（版本1.8，360手机助手）、《甜芝士Sweech》（版本1.9.62，乐商店）、《AgoraVideoCall》（版本6.2.8）。针对上述情况，国家计算机病毒应急处理中心提醒广大手机用户谨慎下载使用以上违法、违规移动App及SDK，同时要注意认真阅读其用户协议和隐私政策说明，不随意开放和同意不必要的隐私权限，不随意输入个人隐私信息，定期维护和清理相关数据，避免个人隐私信息被泄露。责任编辑：刘万里SF014
金融一线,锦泰财保被罚12万：未按规定使用保险条款和保险费率,新浪财经,2022年03月17日 14:31,3月17日消息，四川银保监局机关行政处罚信息公开表显示，锦泰财产保险股份有限公司因未按规定使用保险条款和保险费率，被银保监会四川监管局罚款12万元。另外，相关责任人卫国被警告并被罚款人民币2万元。责任编辑：李琳琳
银行,龙湾农商银行7宗违法被罚265万 财务会计信息不真实等,市场资讯,2022年03月17日 14:27,中国经济网北京3月17日讯银保监会网站今日披露的温州监管分局行政处罚信息公开表（温银保监罚决字〔2022〕3号）显示，龙湾农商银行存在以下违法行为：一是违规以“过桥贷款”形式变相收费；二是财务会计信息不真实；三是投资入股企业整改不到位；四是违规保管客户已签字的空白业务凭证；五是个人贷款资金违规流入房地产市场；六是流动资金贷款资金违规流入房地产市场；七是以贷收息掩盖信贷资产质量真实性。胡荣安对上述违法行为一负有管理责任。银保监会温州监管分局依据《中华人民共和国商业银行法》第七十三条第一款第（四）项及第二款、第八十九条第二款；《中华人民共和国银行业监督管理法》第四十六条第（五）项，对龙湾农商银行处罚款人民币265万元；对胡荣安警告。《中华人民共和国商业银行法》第七十三条规定：商业银行有下列情形之一，对存款人或者其他客户造成财产损害的，应当承担支付迟延履行的利息以及其他民事责任：（一）无故拖延、拒绝支付存款本金和利息的；（二）违反票据承兑等结算业务规定，不予兑现，不予收付入账，压单、压票或者违反规定退票的；（三）非法查询、冻结、扣划个人储蓄存款或者单位存款的；（四）违反本法规定对存款人或者其他客户造成损害的其他行为。有前款规定情形的，由国务院银行业监督管理机构责令改正，有违法所得的，没收违法所得，违法所得五万元以上的，并处违法所得一倍以上五倍以下罚款；没有违法所得或者违法所得不足五万元的，处五万元以上五十万元以下罚款。《中华人民共和国商业银行法》第八十九条规定：商业银行违反本法规定的，国务院银行业监督管理机构可以区别不同情形，取消其直接负责的董事、高级管理人员一定期限直至终身的任职资格，禁止直接负责的董事、高级管理人员和其他直接责任人员一定期限直至终身从事银行业工作。商业银行的行为尚不构成犯罪的，对直接负责的董事、高级管理人员和其他直接责任人员，给予警告，处五万元以上五十万元以下罚款。《中华人民共和国银行业监督管理法》第四十六条规定：银行业金融机构有下列情形之一，由国务院银行业监督管理机构责令改正，并处二十万元以上五十万元以下罚款；情节特别严重或者逾期不改正的，可以责令停业整顿或者吊销其经营许可证；构成犯罪的，依法追究刑事责任：（一）未经任职资格审查任命董事、高级管理人员的；（二）拒绝或者阻碍非现场监管或者现场检查的；（三）提供虚假的或者隐瞒重要事实的报表、报告等文件、资料的；（四）未按照规定进行信息披露的；（五）严重违反审慎经营规则的；（六）拒绝执行本法第三十七条规定的措施的。以下为处罚原文：责任编辑：李琳琳
银行,阿拉善农商银行因贷款五级分类不准确等被罚100万元,中国网,2022年03月17日 14:11,中国网财经3月17日讯今日，银保监会网站发布消息，阿拉善农商银行因贷款五级分类不准确；未执行统一授信，贷款授信超比例；未按信贷合同约定用途使用信贷资金，被阿拉善银保监分局罚款100万元。责任编辑：李琳琳
