板块名,标题,作者,日期,新闻内容
国内财经,月饼行业遇冷，你今年被“月饼降级”了吗？,市场资讯,2022年09月10日 17:40,三联生活周刊根据艾媒咨询数据，2016至2021年，中国月饼市场经历了5年的连续增长，突破200亿大关。行业内一些报告提到，今年月饼市场整体销售额仍在增长，但业内人士观察到，增长是因为前端原料成本上升，月饼价格略微上浮，而非销售量的增长。而根据某电商数据平台的数据显示，今年中秋前6天，京东平台月饼销售量为249万，销售额2.3亿元。相比去年，同比下降了70%和75%。疫情和新规之下，送礼的月饼少了，有的还从高档变成低档了，甚至一些医院和学校这样的单位，还做起了月饼生意。实习记者|陈银霞编辑|王海燕吴志富感觉到，今年的月饼市场明显比往年冷得多。吴志富是广东化州人，在当地经营一家月饼厂，工厂规模1000平方米，全自动机器化生产，“今年月饼销售下降了20%，以前忙的时候机器日夜开工，现在只有白天开工。”吴志富的客户主要是工厂和经销商，销售占比达到40%和50%。其中礼盒产品又分低档、中档和高档，价格分别在70元、100元和180元左右。先是订单数量少了，以前大的订单都来自工厂，四五百个员工，要拿十来万的月饼礼盒，今年工厂拿货的规模基本在两三百个员工。礼盒销量也在变化，往年三斤重的高档大月饼很受欢迎，今年客户送的都是100块左右的两斤装中档月饼礼盒。2022年9月9日，哈尔滨，中秋节前一天，中央大街沿线的多个月饼摊前，基本都是冷冷清清，少有人停步购买。（图|）以前中秋节前的销售高峰期，他每天都在招呼老板，跟他们喝茶、品月饼，今年茶喝得很少。中秋前半个月，很多合作多年的顾客打来电话，要降低订单量。因为销量下降，厂里的工人规模，也从往年的一百多人，降到四五十人。广西梧州的刘根生（化名）感受到了同样的市场变化。他今年60多岁，在梧州本地经营一家小型月饼厂30多年，做的是传统的月饼，有叉烧、五仁、莲蓉、水果等口味。他主要跟个体老板打交道，每年订单量在两三百之间，今年虽然只比去年少了5-10%，但销售档位却差了很多。刘根生厂里的月饼分20元、40元、60元三档，往年起码有三成是60元档，今年几乎全是中档月饼。《锦衣之下》剧照一些月饼工厂是季节性开工，51岁的赵洪荣（化名）在广西一个乡镇经营一家月饼小作坊，接的是加工活儿，就是每家每户拿月饼馅料请她做成月饼。往年农历7月底她就开始有客人了，多的家庭，一家能做1000多元的月饼，半个月时间，她能有四五万收入。今年7月底回家后，她一个星期没能开张。甚至本刊联系联系河南、甘肃的两家月饼厂时，对方直接告知，今年没开工。非季节性开工的月饼工厂，一般都有包点、糕点等其他业务，正因为作为主要业务的月饼消费疲软，广东茂名市月饼行业协会工作人员告诉本刊，一些月饼厂开始更积极拓展其他业务，涉及月饼前端产业，甚至生产起端午的粽子、过年的年糕等。吴少琴（化名）在江西九江市经营一家二三十人规模的小型月饼厂，她说，自己只跟沃尔玛这些大型商超合作销售，今年线下渠道售卖疲软，还要交七八万的固定费用，包括陈列费，再加上商超压账厉害，她选择暂停线下商超合作，转向线上销售。因为无力请网红带货，她自己开了个账号，从早到晚线上直播。接受采访时她刚下播，一边吃饭一边聊，吃完晚上还要接着播。《武林外传》剧照实际上，线上销售也不轻松，根据电商数据平台鲸参谋提供的数据，截至2022年9月4日，也就是中秋前6天，京东平台月饼销售量为249万，销售额2.3亿元。而去年同期，同平台月饼销量为857万，销售额9.5亿，相当于销量和销售额，分别同比下降了70%和75%。月饼是分工合作的产业，除了一些大型工厂和个性化小作坊会自己做馅料，自己做饼皮，并完成全产业链生产，一般来说，馅料都是由专门的厂家生产的。李文军（化名）在广东珠江一家大型月饼馅料供应商里面做销售，从业已经10余年。李文军说，他的顾客是B端食品厂和酒店，最大的单子能有上千万，普通中小企业的单子也有50-100万，后者也一直是他的主要客户来源，算是稳扎稳打的风格，不至于因为一个客户就造成决定性影响。李文军算了一下，他今年的个人销售额下降了5%-8%，主要是因为大城市的销售额下降，而西南一些地方，比如云南的一些中小城市反而有所增长。他在这些小城市开拓了一些中小型的跨界月饼生产单位，比如医院和大学食堂这样的企事业单位。根据李文军的了解，其中大学食堂主要面向师生销售，有的医院则会生产月饼，售卖给医疗用品供应商。这些都是这几年刚跨入月饼市场的生产单位，因为自带庞大的客户群体，每年销量都在增长。李文军分析，现在中小城市房价下跌，可能让一些居民可支配收入增加，原先买二三十元的月饼，后面会选择买四五十元的月饼。2022年9月9日，太原，中秋将至，消费者在超市选购月饼。中新社记者张云摄（图|视觉中国）“像上海封控时，大家2个多月在家没有工作，公司也没赚钱，月饼礼盒需求量自然下降。”李文军告诉记者，他手里一些国民品牌级别的大企业，往年都会在他这里拿七八十万甚至上百万元的订单，今年都只拿了十几二十万，砍了一大半。这个时间的变化跟月饼零售时间缩短密切相关。根据京东发布的《2022企业线上福利采购趋势洞察报告》，2021年中秋节和端午节，一般的企业，从节前40天就开始采购月饼作为中秋福利，到了今年中秋节，企业基本都是从节前30天才开始福利采购。《溏心风暴之家好月圆》剧照上文提到的广东茂名市月饼行业协会工作人员解释，行业内一些报告也提到今年月饼市场（月饼销售额）仍在增长，但李文军观察，月饼市场的增长来自前端原料成本上升，月饼总体价格略有上涨后带来行业销售额上浮，而非销售量的增长。8月29日，离中秋节还有10来天，去年这时候，李文军还在拼命发货，但今年他已经发完最后一批货，因为他对接的食品企业都怕卖不出去，不敢继续生产了。“要是像往年，这时候我都没法接受采访，今年没什么事情了。”李文军说。跟月饼成品和馅料不同，月饼包装的生产周期更长一些。今年30岁的柯海伦在深圳经营一家包装公司，旗下有一个礼盒厂和一个制罐厂，两个厂都是200人左右。柯海伦，每年中秋过后，他的包装公司就开始着手设计新型月饼盒，一般一年要设计100多种设计，当年11月到12月完成定稿，然后开始生产，基本上每一种礼盒样式都会生产几万件，加起来每年要生产几百万件，其中一小部分属于高端礼盒样式。今年有些食品厂打电话向柯海伦订月饼盒，第一句话就是问，这个盒子有没有达标？实际上，对比新的国家标准，部分原来的高端月饼礼盒就是不达标的，导致顾客不敢下单。柯海伦说，月饼包装的客户粘性算是比较大的，因为厂不多，客户选择性不多，加上换厂就需要重新沟通各种配套包装，成本较高，但单个客户订单量下跌，还是让柯海伦的生意受到了影响，销量比去年少了10%左右，也是他的包装厂10年来首次下跌。《鬼怪》剧照往年这个时候，柯海伦的仓库里，基本只有几万库存了，但今年，他的仓库里还有几十万个月饼盒，只能留到明年销售。不过，他其实也不确定明年能否卖出去。起码目前看来，形势是不乐观的。柯海伦的包装公司主要客户来自广东、广西和海南三地，尤其海南，是他的一个“大粮仓”。但今年海南疫情刚好赶在中秋前，海南的一个酒店，本来订了几十万元的月饼盒，但月饼盒真正送去后，酒店却被征用为隔离酒店，无法生产，造成很大损失。柯海伦说，这个单子虽然今年没给他造成直接影响，“但明年他们不用再订月饼盒了，还是会反映到销量上。”因此，柯海伦最后的总结是，“就像任正非讲的，这几年能保住性命就好了。”责任编辑：郭建
外汇,美国一飞机降落后滑出跑道,央视网,2022年09月10日 17:39,当地时间9日，在美国加利福尼亚州圣迭戈市，一架载有两名飞行员的小型飞机在圣迭戈海军基地降落后，滑出跑道，飞机机头受损。目前，飞行员已被送往医院进行观察，事故原因还在调查中，或许与天气状况有关。加州部分地区正受热带风暴“凯伊”影响，事故发生时圣迭戈正在下雨。责任编辑：郭建
国内财经,特步集团捐赠价值超500万元物资驰援四川泸定,市场资讯,2022年09月10日 17:39,特步集团责任编辑：郭建
社会万象,月饼行业遇冷，你今年被“月饼降级”了吗？,新浪新闻综合,2022年09月10日 17:30,
美股,查尔斯三世正式宣誓登基成为英国新君主,央视网,2022年09月10日 17:25,当地时间9月10日，英国国王查尔斯三世在圣詹姆斯宫正式宣誓登基成为英国新君主。国王查尔斯三世的长子、威廉王储全程陪同。当地时间9日晚，英国国王查尔斯三世发表全国电视讲话，表达对母亲伊丽莎白二世的怀念，感谢女王多年来对王室和国家的付出。他表示，自己会像女王一样，“庄严承诺维护国家宪法”。现年73岁的英国国王查尔斯三世是英国历史上担任王位继承人身份时间最长的王储，也是英国历史上登基时年龄最大的君主。（总台记者梁弢）责任编辑：王茂桦
国内财经,“黑马”突围，为什么是安徽和陕西？,每日经济新闻,2022年09月10日 17:13,每经记者淡忠奎每经编辑刘艳美进入2022年，中汽车产业一路高歌猛进。根据中汽协公布的最新数据，1-8月，国内新能源汽车产销分别为397万辆和386万辆，同比增长1.2倍和1.1倍，市场占有率达22.9%。9月6日，全国政协经济委员会副主任、工信部原部长苗圩公开表示，2025年新能源汽车渗透率达到20%的目标，“大概率会在今年提前三年实现”。此前，国务院办公厅印发的《新能源汽车产业发展规划（2021-2035年）》提出，到2025年，我国新能源汽车新车销售量将达到汽车新车销售总量20%左右。中国汽车行业迎来弯道超车的重要机遇，传统燃油车时代的区域格局也在悄然改写。其中，安徽作为新能源汽车领域的一匹“黑马”，近来备受关注。国家统计局最新数据显示，今年1-7月，安徽汽车产量达到96.43万辆，超越广西跻身全国第6位。与此同时，另一座在传统燃油车时代不太“显山露水”的省份也在悄然发力——今年前7个月，陕西汽车产量达到67.87万辆，连超辽宁、浙江、河北及北京，从2021年底全国第13位升至第9位。这两个在传统汽车版图中显示度并不高的省份，正在新能源汽车赛道上掀起新一轮“抢位战”。01作为制造业中产值最大、产业链最长、相关产业最多的一项，汽车产业强大的产业联动效应，使其成为衡量区域制造业实力的重要指标之一。无论传统制造强省还是新晋“黑马”省份，都在争相发力和布局。最新数据显示，1-7月，广东、上海、吉林、重庆、湖北汽车产量分别达到226.49万辆、150.81万辆、126.05万辆、121.77万辆和112.37万辆，依然盘踞全国前五。5座“头部阵营”省份独占全国汽车总量的49.1%，相比五年前上升2个百分点。其中，广东、上海两大巨头均实现两位数增长，发展势头强劲。重庆则凭借9.8%的增速，汽车产量一举超越湖北，晋级全国第四，距离第三名吉林也只剩不足5万辆的差距。相比之下，吉林和湖北两座传统汽车制造大省未能完全走出下滑态势。紧随其后，安徽、广西汽车产量也达到90万以上，差距不算太大。此外，山东、陕西、浙江分别达到74.75万辆、67.87万辆、59.82万辆，与前述省份一同完成全国前十的“拼图”。这十大省份占到全国汽车产量近八成份额，呈现出高度集聚态势。其中，安徽、陕西堪称两大赢家，全国排名大幅攀升。根据国家统计局公布的历年数据，2019年，安徽汽车产量还排在全国第14位。2020年，其一举超越山东、辽宁、江苏、浙江、天津及河北，跻身全国前8位。2021年超越北京，排名再升一位至全国第7位。2022年前7个月，安徽又超过广西，新晋全国第6位，成为“头部阵营”的有力挑战者。陕西近年来同样频频发力。2020年、2021年，其汽车产量增速分别为14.9%、27.5%，今年前7个月更是高达71.9%，居全国主要汽车省份第一位。跟安徽一样，陕西近两年汽车产量也在不断“超越”——2020年超越河南、湖南，2021年超越四川、江苏及天津，今年前7个月又超过辽宁、浙江、河北及北京，正式晋级全国第9位。在西安朝华管理科学研究院院长单元庄看来，近年来，陕西尤为重视工业特别是制造业在国民经济中的比重，作为突破口的汽车产业有望进一步提升。有分析指出，今年陕西全年汽车产销量有望突破100万辆，其中新能源汽车产量预计可达70万辆以上。按这个趋势，今年陕西很有可能超过山东，排名或将再度提升。02事实上，安徽本就是近年来全国汽车版图上的最大“黑马”。凭借自身产业基础与“双招双引”，其逐渐聚集起以奇瑞集团、、合肥长安、蔚来汽车等为代表的一批整车生产企业，在汽车产业规模上突飞猛进。2018年至2021年，安徽汽车产量从83.43万辆上升至150.28万辆，是全国增长最快的省份。“长三角四省市中，2019-2021年仅有安徽汽车产量保持高速增长，江浙沪三省市汽车产量保持平稳。”证券研究所汽车行业首席分析师吴晓飞等分析指出，地处长三角的安徽，已经出现承接产业转移的势头。更为重要的是，随着新能源汽车产业飞速发展，正在搅动区域竞争格局。城市进化论&启信宝此前发布的《2022全国新能源汽车产业区域研究报告》（下称《报告》）显示，过去五年，新能源汽车渗透率不断提升，传统燃油车主要产地也面临产能削减、产业竞争力下降挑战。比如，受新能源汽车市场冲击影响，传统汽车制造大省湖北汽车产量从2017年最高峰时的266.61万辆逐年下滑，2021年才勉强止跌。与此形成鲜明对比，安徽已经占得先机。《报告》显示，截至2022年5月，安徽新能源汽车产量达25.2万辆，同比增长140%，占全国7%。从产量上看，仅次于上海（63.19万辆）、广东（53.54万辆）、广西（48.51万辆）和陕西（27.41万辆）。根据规划，2023年，安徽新能源汽车占全国比重要达到10%以上，零部件就近配套率达到70%以上。安徽主要车企新能源车型占比较高，并且已经形成较为完善的产业链体系，产业规模和竞争力都有望进一步跃升。同样，对陕西来说，新能源汽车也正对地方产业带来重塑性影响。汽车产业是陕西重点打造的支柱产业，也是全省唯一一个确定有两条省重点产业链的产业，即重卡产业链和乘用车（新能源汽车）产业链。从今年前7个月来看，陕西新能源汽车产销达43.3万辆，增长435%，已超过去年全年产量。从份额来看，陕西新能源汽车产量已经占据全国新能源汽车产量13.2%，更是贡献着全省汽车产量64%的份额。陕汽、、吉利和法士特是陕西汽车工业四大龙头，对陕西制造业支撑带动作用明显。今年前7个月，陕汽汽车产量达6.9万辆，产值342亿元，产销增速好于行业平均水平；吉利汽车在陕产量11.03万辆，产值超过110亿元；比亚迪整车产量44万辆，产值565亿元，其中新能源汽车产量43万辆，增长443%。03与安徽相比，陕西汽车产业基础更为薄弱，但眼下破局求变的势头同样明显。事实上，在比亚迪、吉利入局之前，陕汽一度是陕西汽车行业唯一的名片。今年上半年，陕汽集团在全国的市场份额为14.3%，仅次于（24.1%）、（19.5%）、（19.0%）。预计到2025年，陕汽产值将突破1500亿元，实现“再造一个新陕汽”目标。而在轿车领域，陕西其实起步很晚，且与比亚迪息息相关。2003年，比亚迪董事长王传福看到电动汽车的发展趋势，力排众议斥资收购西安秦川汽车，开启造车之路。在陕西省要求下，比亚迪将生产基地设在西安，并由此获得乘用车生产牌照，也为陕西轿车产业的起步提供了基础。如今，将近20年过去，比亚迪已成为全球最大的新能源车企，西安也成为比亚迪除深圳总部之外，布局最全、业务合作最广的城市。根据今年前7个月数据测算，西安比亚迪汽车产量已占到比亚迪55.5%，更贡献了陕西新能源汽车产量99.5%的份额。作为陕西支柱产业之一，汽车产业寄托着陕西和西安制造强省、制造强市的梦想。一直以来，工业不大不强、能源依赖度高，被认为是制约陕西经济体量进一步做大的重要原因，疫情以来，这种脆弱性更是加速暴露。近两年，陕西汽车产业的逆势增长，有望成为破解这一问题的关键。陕西省发展改革委工业发展处副处长王群伟此前谈到：“目前，我省汽车产业‘一心两翼多点’格局初步形成，即以西安为中心，宝鸡、咸阳为两翼，依托陕汽、比亚迪和吉利等整车厂，引进零部件配套产业链项目聚集发展，陕南、陕北各市立足自身特色，错位发展汽车产业。”在单元庄看来，陕西汽车制造业若能强势崛起，不仅会对陕西经济发展提供强劲支撑，对于陕北、陕南的带动作用也会进一步增强。比如，汉中城固的光电新材料产业园预计年底前建成投产，可年产3D车载显示玻璃600万片。不过，他认为，当前的核心问题还是关中汽车产业带的规模与竞争力。相比零部件产业，整车更是要抓住的关键环节，”整车上来了，需求量大了，配套自然就成了。”责任编辑：郭建
