板块名,标题,作者,日期,新闻内容
保险,大病筹开收服务费，水滴筹的商业闭环却断裂了 || 深度,无冕财经,2022年03月08日 17:23,////零服务费的水滴筹，已耗费5亿人力和运营成本，如今开始试点收服务费，对身处困局的水滴公司能有多大帮助？作者：杨煜一笔服务费难倒了英雄汉？曾开创“大病筹款0服务费”的水滴筹，开始试着收取服务费了。从2022年1月开始，水滴筹以江苏为试点，除了0.6%通道费外，另收3%的服务费，最高不超过5000元。自上线以来，水滴筹在帮助病人筹款时未收取过费用。如今，连续5年亏损叠加市场环境遇冷，水滴似乎再难维系行业开创者的体面。或许，水滴创始人沈鹏也不愿收取手续费。因为水滴公司自成立以来，围绕其“是商业还是公益”的争议从未停止，加上负面新闻不时传出，水滴至今并未完全走出信任危机。重塑大众对水滴筹的信任仍然至关重要。但现在，水滴公司面临着更重要的挑战。水滴公司曾表示，依靠“众筹+互助+保险”的商业模式，从导流到变现，形成了一个商业闭环。随着监管趋向严格，水滴互助现已关停，这个闭环也断裂了。至于公司赖以生存的互联网保险生意，在激烈的竞争中走得也颇为坎坷。资本市场上，去年5月上市的水滴（NYSE：WDH），发行价为每股12美元，但上市首日即出现大跌，此后节节下滑，截至3月8日，其股价为1.399美元，较发行价大跌逾88%。流量尽，公益止收费模式已经开始试点探路，距离全面实施还有多远？对此，水滴筹相关人士对无冕财经（ID：wumiancaijing）研究员表示，目前还没有全面实施的计划表。至于对于收取这笔手续费的目的，其表示，“收费的出发点并非为了盈利，从上线至今，通过水滴筹的捐赠规模已经超过457亿元，产生了3.83亿捐赠者和220万名患者，同时也累积了超过5亿元的人力和运营成本。据无冕财经粗略估计，如果水滴筹从成立之初，就收取3%的手续费的话（不算5000元封顶条件），能获得13.7亿元的手续费，要覆盖5亿元的运营成本不难。不过，水滴公司一开始并没有将水滴筹列入营收计划，而是建立了水滴筹吸引流量，水滴互助提供场景，最后通过水滴保险商城变现的“三级火箭”的策略。2018年之前，水滴公司超过80%的营收，是通过水滴互助+水滴筹业务引流而来。但是，近两年来，水滴公司的业务板块出现大调整，。一方面，由于监管对网络互助行业的态度清晰，认为其非持牌经营，涉众风险不容忽视，头部网络互助平台纷纷“关停转”。水滴互助也于2021年3月末正式终止互助计划，水滴公司的一大场景支撑被斩断。数据显示，2018年、2019年、2020年三年，水滴互助带来的收入，分别占其总运营收入的19.8%、9.4%、3.6%。随着水滴互助的关停，互助带来的这部分收入彻底归零。此外，水滴公司在公告中称，将进行服务模式升级，对于在保障中的互助会员，将通过保险为其升级保障，投保一年期，最高保额50万元的健康险，由水滴互助承担保费。尽管公司宣称，这一变动不会影响到整体发展，但互助计划停止的善后措施，仍然导致公司盈利情况出现恶化。研报显示，另一方面，水滴筹带来的流量不如从前，沈鹏曾表示，“来自水滴筹广告带来的保费收入，仅占公司总保费收入的20%左右”。换言之，内部带来的流量眼看快要封顶。互助业务没了，还得出一大笔钱做善后，加上水滴筹也受疫情影响，大病筹款业务带来的流量不如从前，水滴公司的商业闭环断裂。再维持0手续费“公益战略”，只会令运营费用高企。不想做“赔本赚吆喝”的生意，这或许才是水滴筹开始收费更深层次的因素。不仅仅是水滴筹，从行业来看，其他的大病众筹平台也纷纷开启了商业化探索。轻松筹向捐款人收取1-3元不等的支持费，360大病筹平台也在原捐款额之外，提供了一元或两元的助力金选项，但目前0服务费的承诺仍然有效。大病众筹收取服务费似乎已经成为了行业新的风向，流量瓜分大战即将进入尾声，各大平台都不再愿意做赔本赚吆喝的生意了。这不由得令人思考，这样的盈利模式是否可持续？能不能被大众接纳？如何翻越四大难关？现在，保险经纪业务，扛起了水滴公司的营收重任。2017年，水滴公司拿下保险经纪牌照，同年水滴保险商城上线，现在，水滴公司手握经纪、保代、公估等3张保险类牌照，但。依托过去的流量优势，水滴保的首年保费已实现从零到百亿的跨越，2018-2020年，水滴保的首年保费收入从不足10亿飙增至144亿元。这3年时间里，水滴保给水滴公司带来的营收更是翻了20多倍。▲水滴保发展情况。水滴公司也在招股书中称，水滴保是我国最大的互联网独立第三方保险分销平台。但是，在水滴保迅速发展的背后，也存在着一些无法忽视的隐忧。公司内部流量见顶的趋势已经凸显，。这样一来，第三方渠道和营销费用同样也成倍数增加，其中营销费用从2019年的10.6亿元增加101.7%至2020年的21.3亿元。如何改变“烧钱获客”的局面，以及降低营销成本，是水滴公司要跨越的第一道阻碍。此外，尽管水滴保作为第三方保险分销平台的业绩亮眼，但在保险中介赛道，已经涌现多个劲敌。腾讯、阿里、百度、京东等互联网流量霸主，平安等传统保险巨头纷纷向互联网保险业务发力。此外，同样以众筹起家的轻松保也在快速崛起，意图瓜分这块市场蛋糕。沈鹏也曾坦言：“疫情唤醒更多传统保险巨头们加速加码发力线上保险业务，已经看到平安等公司的发力，我们还在成长中的互联网健康险业务也将会面临更为激烈的竞争。”面对激烈的市场竞争，水滴公司要如何建立优势，和手握流量、资本的巨头竞争？这是其要跨越的第二道阻碍。而在监管层面，近十年来。互联网保险监管框架从无到有，监管强调持牌经营与合规发展。银保监会在行业内部发布了《关于开展互联网保险乱象专项整治工作的通知》，互联网保险业开展了集中整治。其中明确的一条就是，所涉违规广告包括但不限于“首月1元”、“1元升级”、“免费赠险”、“实物抽奖”、“限时停售”等内容，以及存在广告标识不清晰、关闭按钮不显著、整屏诱导点击等问题的广告。水滴保险经纪业务就踩到了这根红线，在2021年11月，由于没有按照规定的保险条款、保险费率销售，水滴经纪共被罚款100万元，两位责任高管也各罚10万。此前，如何整改营销乱象，拥抱监管，走出灰色地带，是水滴保实现可持续发展过程中需要思考的问题，也是其要跨越的第三道阻碍。而水滴保现在做的，归根结底还是赚点平台费用，保险公司拿着利润的大头。而且，市场就只有这么大，水滴保在激烈竞争下会越来越难做。水滴公司早有入局保险，自己展业的想法。2020年，水滴公司旗下子公司斥资3.05亿收购通宇科技全部股权，意在曲线入股互联网保险公司安心财险，持股比例为11.28%。但据悉，相关方案在工商备案之后，“卡”在了最终监管审批环节。安心财险是目前国内仅有的四家持牌经营的互联网保险公司之一。目前，水滴公司能不能拿下这张保险牌照仍然存疑，监管对该交易提出了一些建议，而前者后期可能会据此调整入股方式。水滴保如何消除变数，拿下保险牌照，是其要跨越的第四道阻碍。尽管水滴一直以来饱受争议，但不得不说，这家由美团的年轻前高管创立的公司，也体现着创业者身上的坚韧品格。沈鹏在2016年创立水滴公司，在摸索商业模式、公司连年亏损、融资环境遇冷以及监管趋严的背景下，仍然带领着水滴公司于2021年5月上市。但摆在沈鹏面前的，也是整个行业面临的发展阵痛。除了水滴筹，大病筹款行业的主要平台还有轻松筹、无忧筹、爱心筹、水滴筹、诺言筹、悟空筹、360大病等。前段时间，轻松筹也传出裁员的消息，据称，水滴筹的商业化部门也全部裁员，360数科的保险团队也进行了调整。Tobe，ornottobe．上述平台似乎都进入了一个和时间赛跑的关键阶段。在市场环境变冷的情况下，这类商业模式还能不能撑得下去？作为行业头部平台，水滴的新十年又该走向何方？（无冕财经）责任编辑：王婉莹
保险,帮帮保险遭罚 违反规定开展互联网保险业务,中国网,2022年03月08日 13:18,中国网财经3月8日讯3月7日，中国银保监会陕西监管局针对帮帮保险销售有限公司及公司当事人做出处罚决定。经查，帮帮保险销售有限公司存在违反规定开展互联网保险业务的问题，违反了《保险代理人监管规定》第一百零八条的规定，根据《保险代理人监管规定》第一百零八条，决定对公司予以警告，并处2万元罚款；对熊闲予以警告，并处5000元罚款。以下为具体信息：责任编辑：张玫
金融一线,安润国际保险违法被罚1万元并警告：未按规定开展互联网保险经纪业务,金融一线,2022年03月08日 13:14,3月7日，中国银保监会陕西监管局针对安润国际保险经纪（北京）有限公司做出处罚决定。经查，安润国际保险经纪（北京）有限公司（以下简称安润经纪公司）存在未按规定开展互联网保险经纪业务的问题，违反了《保险经纪人监管规定》第一百零一条的规定，根据《保险经纪人监管规定》第一百零一条，决定对公司予以警告，并处1万元罚款；对庄丽予以警告，并处3000元罚款。以下为具体信息：责任编辑：张玫
新浪科技,最高法：帮助弱势群体跨越数字鸿沟,最高法网站,2022年03月08日 10:49,最高法工作报告：完善互联网司法模式。北京、杭州、广州互联网法院运用先发优势，推动技术创新、规则确立、网络治理向前迈进。浙江法院推进“全域数字法院”，福建法院融入“数字福建”，重庆法院探索“全渝数智法院”，司法紧跟数字时代步伐。为老年人、残疾人等积极提供辅助引导或线下服务，帮助跨越“数字鸿沟”。在全球率先出台法院在线诉讼、在线调解、在线运行三大规则，以人民为中心的互联网司法规则体系逐步建立。我国互联网司法从技术领先迈向规则引领，为世界互联网法治发展贡献中国智慧中国方案。
无缘,红星美羚还要上市：经销商费用得不到核算，只能低价甩货，羚恩贝贝仅需130元/桶！,市场资讯,2022年03月08日 08:45,五谷财经前些年，登陆新三板的红星美羚便顶起了“国产羊奶粉第一股”的称号，而在退出新三板之后，又于2019年6月向深交所创业板发起冲刺。然而，敲开A股的大门并非易事，在2021年9月红星美羚上市进程处于“中止”状态。在中止审核几个月后，2021年底，红星美羚恢复发行上市审核。但是，截至目前，红星美羚上市仍未取得实质性进展。公开资料显示，红星美羚的主营业务是以羊乳粉为主的羊乳制品研发、生产和销售，产品包括婴幼儿配方乳粉、儿童及成人乳粉等。包含“德瑞兰帝”、“羚恩贝贝”、“富羊羊”三个系列产品。从主营业务收入构成上看，报告期各期，红星美羚婴幼儿配方乳粉占主营业务收入比例从2018年的42.61%上升至2020年的64.15%；而儿童及成人乳粉占主营业务收入比例分别为56.74%、34.11%、31.36%，呈逐年下降趋势。数据显示，2018年到2020年，红星美羚实现营业收入分别约为3.14亿元、3.42亿元和3.63亿元；净利润分别约为0.41亿元、0.45亿元、0.55亿元。可见，报告期内红星美羚收入、利润均呈现逐年递增趋势。同时，报告期内，红星美羚应收账款余额分别为0.14亿元、0.34亿元和0.26亿元，虽然2020年应收账款余额较2019年有所下降，但其账龄在一年以上的应收账款余额及占比有所增长，分别为28.68%、12.19%、18.31%。对此，深交所要求红星美羚，结合发行人营业收入变动、赊销信用期的变化，分析并说明2020年应收账款余额下降的原因及合理性。对此，红星美羚在首次公开发行股票并在创业板上市申请文件的第三轮审核问询函的回复中表示：“主要是由于国内KA客户较为强势，普遍从自身资金安排角度出发而较慢回款，账龄连续滚动增加所形成。”近年来，羊奶粉凭借差异化优势迅速出圈，满足了消费者持续升级的营养需求，婴配羊奶粉市场规模迅速发展，2020年已突破百亿。羊奶粉市场已形成了“一羊领先，多羊齐追”的格局，其中佳贝艾特以超30亿规模稳居市场“领头羊”地位，蓓康僖、可贝思、蓝河等多个羊奶粉品牌持续追赶。与此同时，伊利、君乐宝、美赞臣、美素佳儿、达能等国内外一线奶粉品牌纷纷推出或是收购羊奶粉品牌，巨头林立的格局已经形成了。有业内人士指出，如今羊奶粉已成为各大乳企战略布局的必争品类，正在加速迈入奶粉主流市场，伴随行业持续规范化，羊奶粉还将迈向新的发展阶段，而像红星美羚、美力源、和氏乳业这样的中小羊奶粉企业，未来发展空间较为有限。由于新品在短期内快速增长，但终端消费却未能同步火爆，导致部分羊奶粉品牌的价盘出现不稳趋势，经销商只能低价甩货、回笼资金。在五谷母婴（销售群）中，就有红星美羚的经销商对富羊羊（3段，800g）、羚恩贝贝（3段，800g）进行甩货，价格仅为99元/桶和130元/桶。“羚恩贝贝（3段，800g）来的时候是169元/桶，答应给我的活动费用没有核销”，该经销商表示，由于红星美羚公司人事出现变动，全国总监下放区域，原华西（粤、闽、桂、海）大区等高管辞职，厂家费用没有兑换，现货新日期处理。“没有办法，一件事情自2021年7月沟通解决，到现在人都快走光了，走投无路，只能这样了。”但也有其他经销商表示，即使富羊羊（3段，800g）、羚恩贝贝（3段，800g）降到99元/桶和130元/桶，也有点贵。值得关注的是，在部分电商平台，富羊羊（3段，800g）的价格普遍在105元左右，如果多买的话，可以更加优惠一点；羚恩贝贝（1段，800g）的价格则仅为119元。对此，奶粉经销人士在五谷母婴（销售群）中直言，红星美羚的产品质量还是可以的，但上层比较混乱，现在公司处于下坡路了。“前几年上市估计是为了套现，现在上市八成是为了卖盘。”责任编辑：陈悠然
新浪科技,工信部：2023年底初步建立车联网安全体系 切实保护行车数据安全和人身安全,证券日报,2022年03月08日 07:53,本报记者孟珂3月7日，工信部网站发布消息显示，工信部近日印发的《车联网网络安全和数据安全标准体系建设指南》（以下简称《建设指南》）提出，到2023年底，初步构建起车联网网络安全和数据安全标准体系。重点研究基础共性、终端与设施网络安全、网联通信安全、数据安全、应用服务安全、安全保障与支撑等标准，完成50项以上急需标准的研制。到2025年，形成较为完善的车联网网络安全和数据安全标准体系。完成100项以上标准的研制，提升标准对细分领域的覆盖程度，加强标准服务能力，提高标准应用水平，支撑车联网产业安全健康发展。无锡数字经济研究院执行院长吴琦对《证券日报》记者表示，《建设指南》不仅会对汽车行业产生影响，也会对车联网产业链相关的软硬件企业产生影响，比如摄像头、雷达、高精度地图、计算平台、芯片等感知系统和通信系统等上游产业，智能驾驶座舱等中游产业，以及出行服务、数据增值服务等下游产业。《证券日报》记者根据上市公司公告统计，截至目前，A股市场中有安恒信息、金溢科技、天融信、启明星辰、奇安信等多家上市公司布局车联网网络安全和数据安全。中国国际经济交流中心经济研究部副部长刘向东对《证券日报》记者表示，随着汽车行业智能化网联化加速，与之相关的数据安全等问题就凸显出来，亟待对行车相关数据的收集使用及隐私保护制定相应标准规则，目的是将其纳入网络安全和数据安全法规标准体系之中。“《建设指南》将有利于车联网在数据收集、使用和传输等有规可依，有效杜绝车联网信息使用乱象，切实保护行车数据安全和人身安全，确保网络畅联安全和数据安全，将能有效推动交通智能化，解决交通堵塞问题，有效推动节能减排，促进车联网产业健康发展。”刘向东表示。谈及当前车联网网络安全和数据安全有何不足时，吴琦认为，主要面临三个问题：一是相关政策体系不完善，由于车联网跨部门、跨领域的行业特性，需要工信、交通、公安等多部门协同形成政策合力。二是自主创新能力偏低，高端传感器、车载操作系统、车载芯片等关键领域仍面临卡脖子难题。三是安全问题日益凸显，不仅包括网络和数据安全，还包括车辆运行安全、司机及乘客人身安全等。“当前车联网发展较为迅速，但智能驾驶、无人驾驶等技术应用给交通管理和人身安全带来新的挑战，特别是缺乏统一的技术标准，让汽车之间的互联互通会存在较大的安全隐患，特别是不同的处理器、操作系统、传感器等不同，让车辆数据传输使用等方面缺乏统一标准，容易造成信息安全泄露。”刘向东表示，《建设指南》出台意在在网络互联和数据安全方面建立相应标准，一方面提高智能电子零部件数据接口的通用化，另一方面确保移动终端的安全，谨防被远程控制。
