板块名,标题,作者,日期,新闻内容
新浪科技,周鸿祎否认炮轰微软抄袭：本质上是惺惺相惜,新浪科技,2022年07月30日 12:38,相关新闻：周鸿祎：微软抄袭了360安全模式，所以成为美国最大的安全公司新浪科技讯7月30日午间消息，针对自己微软做安全就完全抄袭了360的模式的言论，周鸿祎发微博澄清称，“我不是炮轰微软，本质上是惺惺相惜。”周鸿祎称，360和微软不约而同选择了同样的路线，都是面向未来的公司。此前，周鸿祎在公开发言中表示，“我已经很少diss同行了，现在已经从红衣大炮换成了红衣大叔，但是今天我还是忍不住要怼一个同行，微软现在做安全就完全抄袭了360的模式，所以他很快就发展成美国最大的安全公司。”我得澄清一下，我不是炮轰微软，本质上是惺惺相惜。老有人说toC的公司做不了toB，今天360和微软在安全能力和安全市场上的成功都证明，数字化时代只有C端出身的公司才能做好安全，因为拥有海量的终端用户，因为能把大数据放到云端去做安全分析，因为拥有“看见”的基因和优势。我认为，360和微软不约而同选择了同样的路线，都是面向未来的公司。
第五届国际健康金融高峰论坛,国家医保局医药服务管理司原司长熊先军：商业保险需与医药服务管理等衔接,金融一线,2022年07月30日 12:38,7月30日消息，由教育协会、北京康盟慈善基金会、中国健康促进基金会主办，艾社康承办的“第五届国际健康金融高峰论坛”于7月29日至30日举行，大会主题为“多层次医疗保障体系创新”。国家医保局医药服务管理司原司长熊先军在论坛上表示：“商业保险除了要在赔付待遇上跟基本医保衔接以外，还要在四个方面进行衔接：医药服务管理衔接、医药服务价格衔接、医药服务信息衔接、医疗保险经办管理衔接。”责任编辑：潘翘楚
证券,全国首个算力大会来了，首批重磅算力成果将公布！超算服务行业增速超24%，这些超跌概念股中报业绩预增,证券时报,2022年07月30日 12:38,报告显示，全球15个主要国家计算力指数与GDP的走势呈现出了显著的正相关。首届2022中国算力大会来了由工业和信息化部与山东省人民政府主办的首届2022中国算力大会7月29日至7月31日在济南召开。本届算力大会以“算赋百业力导未来”为主题。据悉，本次大会集中发布中国首个算力产业发展指数、中国首个《算力白皮书》等首批重磅算力成果。首次集中展示算力融合应用成果，涵盖智慧城市、智慧医疗、智慧交通、智能电厂、超级计算、航空航天、工业互联网、元宇宙等领域。计算力指数对GDP拉动效应显著随着数字经济时代的全面开启，算力作为重要“底座”支撑，赋能作用日渐凸显。算力是数字经济时代新的生产力，将为加强数字政府建设、激活数据要素潜能以及各行各业的数字化转型注入新动能，助推经济社会高质量发展。据IDC、和清华大学全球产业研究院联合完成的《2021-2022全球计算力指数评估报告》，指出全球15个主要国家计算力指数与GDP的走势呈现出了显著的正相关：计算力指数平均每提高1点，数字经济和GDP将分别增长3.5‰和1.8‰。当一个国家的计算力指数达到40分、60分时，计算力指数每提升1点，其对于GDP增长的推动力将分别增加1.5倍和3倍。根据沙利文研究的数据，过去五年间中国超算服务市场的年复合增长率保持在24%左右，预计至2025年，这一数据将继续维持在24%。这些超跌概念股中报业绩预增证券时报·数据宝统计，布局算力相关业务的上市公司超过150家。按照半年报、快报、预告净利润下限计算，20股上半年净利润增速超10%。、、（维权）、、等5股净利润增速排前五位。在上述业绩预增的股票中，截至7月29日收盘，8股今年以来股价下跌，包括、、、、、高鸿股份、、等。按区间成交均价计算，北上资金增持超千万元的仅南都电源、、雪人股份等。在此期间，融资客加仓超千万元的有6股，分别是三七互娱、中天科技、神州数码、南都电源、雪人股份、（维权）等。在甘肃、宁夏等国家东数西算西部枢纽节点已有数据湖布局，例如：宁夏枢纽的银川数据湖、甘肃枢纽的海东数据湖、成渝枢纽的雅安、成都、重庆黔江、重庆南岸数据湖等。目前雅安数据湖由川发展下属公司与易华录联合运营，项目正在建设中，未来将为区域数字产业发展提供力量。与甘肃政务云合作，规划建设200PB以上的超算中心，用于存放对于时延要求不高的，优先承接后台加工、离线分析、存储备份等非实时算力及存储需求2022年上半年建设超过60个边缘多线节点。仕佳光子在年报透露，无源芯片及器件方面，公司应用于数据中心用O波段、4通道CWDMAWG和LANWDMAWG复用器及解复用器组件实现大批量销售，满足了国内外多家数据中心用光模块需求。菲菱科思2021年交换机产品完成了“百兆/千兆/万兆”、“电口/光口”、“无管理/管理”等多维度的自主产品迭代，并成功量产数据中心交换机。易事特在互动平台表示，数据中心业务是公司重要业务领域之一，公司与庆阳市就数据中心及光伏、储能等领域进行合作接洽，在国家算力枢纽节点所在的长三角、珠三角等地区均具备丰富的数据中心项目建设经验。佳都科技定位为人工智能软件和算法提供商，致力于轨道交通、城市交通、城市安全应急场景的数字化升级。公司基于自主研发的人工智能和数字孪生技术，打造视觉算法中台、数据中台、数字孪生中台三大技术引擎以及公共开发平台。责任编辑：谢伊岚责任编辑：石秀珍SF183
证券,泸州老窖将捧场“免税茅”，拟投资8000万美元参与中国中免H股发行,证券时报网,2022年07月30日 12:33,同为消费赛道明星公司，（000568）将捧场“免税茅”（601888）H股发行。7月29日晚间，泸州老窖公告，公司拟作为基石投资者，投资8000万美元（含经纪佣金、交易费等相关费用）认购中国旅游集团中免股份有限公司发行的境外上市外资股（H股）股票。一度因为疫情影响暂缓H股IPO的中国中免，于上月底刚宣布重启港股上市进程。此外，稍早前（7月27日晚间），中国中免刚披露半年度业绩快报。受疫情影响，公司业绩高增长止步，今年上半年营收与净利均同比下滑超过20%。3200亿市值白酒龙头捧场中免港股IPO证券时报·e公司记者注意到，中国中免去年冲击港股上市时，泸州老窖就有意参投其H股发行。泸州老窖2021年报显示，在2021年11月8日，公司战略委员会就审议通过《关于投资参与中国旅游集团中免股份有限公司H股发行的议案》，并同意提交董事会审议。最新公告显示，董事会会议于今年7月28日在泸州老窖营销网络指挥中心6-1会议室以现场结合视频的方式召开。最终该议案以“11票同意，0票反对，0票弃权”获得通过。因此，此次中国中免重启港股上市，泸州老窖拟参投事项正式落地。不过，上述投资尚待正式签署相关协议，且发行上市尚待获得相关监管机构最终批准。最新公告尚未披露股权占比、投资目的等详情。中国中免以免税业务为核心，近年公司通过对日上免税行和海免集团的并购，成为全国唯一手握3张免税牌照的全渠道头部玩家，现在也是全球最大的旅游零售运营商。在白酒国际化进程中，免税店已成为众多白酒企业的重要渠道。从免税及旅游零售市场主要销售品类看，第三方研究机构Generation数据显示，2021年香化销售额2186.5亿元（344亿美元），占比高达57.7%，其后是就时尚饰品（占比11.9%）和酒水（8.8%）等。此前也有投资者提问过泸州老窖与中国中免的合作话题，泸州老窖就简要表示，公司产品在中国中免门店有销售。泸州老窖作为头部酒企，和中国中免一样，也是机构重仓股。二级市场上，该股现价222.20元/股，市值约3270亿元。再度冲击港股上市中国中免的港股上市进程也一直备受市场关注。中国中免于2009年登陆上交所。去年6月25日，中国中免向香港联交所递交了上市申请，欲完成“A+H”布局。11月11日，中国中免公告，证监会批复核准公司发行不超过1.95亿股境外上市外资股，即不超过总股本的10%。拟募资用于巩固国内渠道、扩展海外渠道、改善供应链效率、升级信息技术系统、市场推广和进一步完善会员体系等五大用途。随后，11月22日晚间，香港联交所文件显示，中国中免通过上市聆讯，并披露聆讯后资料集。和瑞银证券为联席保荐人。但没过多久，中国中免就在12月3日晚间公告，已全面完成了包括境内外有关监管机构核准在内的发行上市相关准备工作。不过，目前，受新冠肺炎疫情等因素影响，全球经济受到较大冲击，资本市场持续低迷，公司经慎重考虑，决定暂缓H股发行上市的进程，后续安排视市场情况确定。直至今年6月30日晚间，中国中免发布《关于重新向香港联交所递交境外上市外资股（H股）上市申请并刊发申请资料的公告》，才继去年12月公告暂缓境外上市后重启赴港IPO。二级市场上，自去年12月初至6月30日宣布重启赴港上市，中国中免期间股价向上修复超过15%。6月30日，中国中免一度创出236.10元/股的阶段新高，随后该股震荡下跌，现价209.90元/股，当前市值约4098亿元。记者注意到，近期又有投资者在互动平台表达了对中国中免H股上市的不满。有投资者表示，“每次管理层提出港股上市，资本市场中免股价随即暴跌！请问管理层在公司自由现金流充沛的情况下提出港股上市，摊薄每股收益，打压股价，是否有无视中小股东权益的情况？”中国中免于7月18日回复称，二级市场股价走势受多重因素影响，从长远看，公司市值取决于公司的内在价值。公司也将综合考虑各种因素来确定本次发行相关事项。中免作为A股上市公司，进一步选择香港上市，搭建境内外双融资平台，将进一步提升公司的国际品牌认知度和竞争力，有助于公司开展业务以及开拓国际市场，进一步巩固公司全球旅游零售行业的龙头地位，有利于公司未来长远发展。业绩方面，在赴港上市暂缓的半年里，中国中免也没能保持去年同期的超高增长。最新业绩快报显示，今年上半年，中国中免的营收为276.51亿元，同比下滑22.17%；归母净利润39.38亿元，同比下滑26.49%；基本每股收益2.02元。中国中免将业绩下滑归因于疫情，期内国内疫情多点散发、多地频发对公司日常经营造成短期影响。其中，海南机场离岛人数3-5月单月同比分别下降56%、79%、66%，上半年累计下降37%，导致公司免税门店客流尤其是海南地区同比大幅下滑；海口海关此前发布的数据也显示，海南离岛免税行业受到较大冲击。另外，上海地区因疫情防控临时关闭物流网点39天，对中国中免的业务销售带来了较大冲击。需要指出的是，中国中免今年业绩水平虽不及去年同期，但纵向来看，公司上半年逾39亿元的盈利仅次于去年，仍为历史同期第二好成绩。责任编辑：王涵
新浪科技,ISC2022周鸿祎：360是在用做双11的数据处理能力来解决网络攻击,新浪科技,2022年07月30日 12:32,新浪科技讯7月30日上午消息，在第十届互联网安全大会上，360公司创始人周鸿祎在介绍360的安全能力时表示，360是用互联网公司做双11的数据处理能力来解决网络攻击，这是传统网络安全公司所缺乏的能力。360以免费杀毒起家，服务全球225个国家和地区的用户，覆盖全球15亿终端。周鸿祎表示，目前全球最伟大的安全公司都是ToC出身，与微软、卡巴斯基一样，360拥有海量终端用户，有全网云端数据和大数据分析能力，不堆砌产品，而是依靠服务的形式提供安全能力。周鸿祎用16个关键要素所组成的故事，讲述了360的进化史。在终端上，360能看清全球全网的安全事件。同时，360也是全球第一家云原生安全公司，首创了“云查杀”。最终凭借亿万终端、大数据分析、AI和持续的数据运营等，建立起全网视野，收获了“看见”全球和全网安全态势的能力。据周鸿祎介绍，99%的国家级网络攻击皆由360独立发现。“如果说安全的来路是‘看见’的能力，安全的未来一定是服务，过去他常说360从ToC到ToN，再到ToB是无心插柳。现在看来，应当是安全行业的必然。”（文猛）
国际军情,乌军被指袭击战俘营，美方：就算真的也是“无意的”,参考消息,2022年07月30日 12:32,
2022中国财富论坛,蔡昉：中国老年人收入水平低于年轻人，还要为儿孙辈着想，更倾向于储蓄,市场资讯,2022年07月30日 12:31,2022中国财富论坛于2022年7月30日-31日在青岛召开。主题为：新发展格局下的财富管理创新路径。中国社会科学院原副院长蔡昉出席并演讲。蔡昉表示，中国人口有几个效应对消费产生不利影响。第一，2010年应对供给侧冲击的时候，我国的需求结构也进行了相应调整。不再过度依赖外需、出口，也不再过度依赖投资、资本形成，而逐渐地转向了三驾马车中的“消费”，特别是居民消费成为最主要的拉动力。但由于我国人口和经济增长逐渐减速，人口总量效应成为导致消费低迷的一个因素，“人口增长速度慢了或者是负增长了，消费一定会受到影响”。第二，收入效应。由于经济增长速度放慢了，收入水平的提高速度也一定会放慢，则直接影响到消费。“我们从人口的增长、人均GDP的增长和居民消费的增长来看，三者是一致的，都是下行的”，蔡昉说，未来会出现人口的负增长，人均收入水平的增长速度、GDP的增长率还会更低，这些无疑在相当大程度上会压抑居民消费。第三，人口年龄结构效应。蔡昉称，发达国家很多老年人的工资水平是根据年资来决定的，年纪大了收入水平就比较高，退休以后的保障水平也还都可以，甚至还有财富带来的收入，因此老年人一般会比年轻人收入水平高一些，但是他们也有不愿意消费的倾向。所以，在学界产生了“退休消费之谜”的研究。“但中国没有这个之谜”，蔡昉称，总体来看，中国老年人的收入水平低于年轻人，退休以后还会出现一些后顾之忧——为自己的孩子、孙子辈着想，更倾向于储蓄，减少消费。所以，消费力和消费倾向都比较低。“随着年龄增长，消费支出水平是下降的”，蔡昉说，中国老年人剔除了医药支出之外，是支出水平最低的人群。蔡昉称，全世界都存在老龄化趋势，越来越多的国家出现了人口负增长，特别是疫情期间，人们都不生孩子了，“短期的不生孩子会成为新常态”。因此，世界老龄化趋势、人口负增长或者是人口停滞都会成为一个趋势。蔡昉称，中国从“未富先老”的特征来看，我们预计未来消费是经济增长主要的、常态的、持续的制约，这是我们必须转变的观念。新浪声明：所有会议实录均为现场速记整理，未经演讲者审阅，新浪网登载此文出于传递更多信息之目的，并不意味着赞同其观点或证实其描述。责任编辑：梁斌SF055
国际财经,中方：不要玩火自焚,环球时报,2022年07月30日 12:31,中国代表在联合国安理会重申中方就乌克兰问题的立场。当地时间7月29日，联合国安理会就乌克兰局势召开会议。耿爽表示，乌克兰危机自爆发至今已延宕5个多月，不仅给欧洲地区带来严重冲击，负面外溢效应也已波及全球。受战争和制裁影响，乌克兰、俄罗斯的粮食化肥出口受到阻碍，不仅对全球粮食安全构成挑战，加剧脆弱发展中国家困境，也给国际社会实现2030年可持续发展议程、推动世界经济企稳复苏带来更大困难。在有关各方的共同努力下，上周在伊斯坦布尔，俄罗斯、乌克兰、土耳其、联合国签署了乌克兰粮食外运协议，俄罗斯和联合国签署了俄罗斯粮食化肥出口协议。目前，四方共同参与的联合协调中心已经成立，首批运粮船离乌的准备工作正稳步推进。这为缓解发展中国家的粮食短缺、缓解贫困人群的苦难、缓解全球粮食危机带来了希望。中方对此表示欢迎，对古特雷斯秘书长和有关各方发挥的积极作用表示赞赏。两个协议的签署表明，只要作出不懈努力，当事方仍有通过协商解决问题的可能。中方对俄罗斯、乌克兰超越政治分歧、开展建设性接触感到鼓舞。希望双方继续保持对话沟通，争取早日重返外交谈判，尽快实现停火止战。粮食外运问题十分复杂，协议在执行过程中难免遇到这样那样的困难。有关各方要坚守政治意愿，秉持合作精神，加强沟通协调，妥善应对挑战，共同推动协议执行起好步、开好局，并持之以恒推进下去。国际社会要从人道主义角度看待两个协议的签署和执行，摒弃政治化作法，努力为协议的后续落实营造良好的环境，提供坚实的保障。中方先后提出缓解乌克兰人道危机的六点倡议和国际粮食安全合作倡议，已向乌克兰提供两批共1500万元人民币人道主义援助，近期还将追加2000万元人民币紧急人道主义物资援助。中方以负责任的方式为降低危机的外溢影响、缓解危机对全球产业链供应链的冲击作出努力，并将继续为稳定国际贸易和世界经济秩序发挥积极和建设性作用。中方始终主张，各国的主权、领土完整都应该得到尊重，各国的合理安全关切都应该得到重视，《联合国宪章》的各项宗旨和原则都应该得到遵守，一切有利于和平解决危机的努力都应该得到支持。耿爽强调，各国要秉持共同、综合、合作、可持续的安全观，重视彼此合理安全关切，构建均衡、有效、可持续的全球和地区安全架构，共同维护世界和平。将本国安全凌驾于别国安全之上，图谋强化军事集团，建立绝对优势，甚至按照自己的标准塑造别国的周边环境，只会引发冲突对抗、分裂国际社会，也只会让自己更不安全。在充满变化和挑战的时代，没有哪个国家能够独自应对，也没有哪个国家能够独善其身。在国际社会最需要团结合作、共克时艰的时候，固守冷战思维和集团政治，推行脱钩断链和“小院高墙”，把经贸往来政治化、工具化、武器化，胁迫其他国家选边站队，刻意制造分裂和对抗，是极不负责任和极其危险的举动。国际社会对当前这股逆流要高度警惕，共同抵制。我们决不能让乌克兰危机拉开“新冷战”的序幕，决不能重蹈历史上的覆辙，决不能让人类社会再次经历惨不堪言之战祸。作为当今国际秩序的法律基石，联合国宪章的作用不可替代，地位不可撼动。遵守宪章宗旨和原则应当一以贯之，言行合一，不能说一套做一套，更不能采用双重标准，搞选择性适用。个别国家在乌克兰问题上一再强调主权原则，但在台湾问题上却不断挑战中国主权，甚至蓄意在台海制造紧张局势，这是对宪章宗旨和原则的亵渎和侵害。责任编辑：邓健
2022七夕,8月天宇：赏年度第三大满月 看英仙座流星雨,新华网,2022年07月30日 12:29,
产经,降了！五连涨后燃油费终于下调了，800公里以内每位旅客80元！,证券时报网,2022年07月30日 12:26,连续五连涨后，国内机票燃油附加费收费标准终于降了，自2022年8月5日起，800公里（含）以下航段每位旅客收取80元燃油附加费，800公里以上航段每位旅客收取140元。这是今年2月燃油费恢复征收以来，收费标准首次出现下调。燃油费年内首降7月29日，去哪儿、同程等多家平台均接到航司通知，自2022年8月5日起，燃油附加费收取标准将下调。此次调整后征收的国内航线燃油附加费标准为：成人旅客800公里（含）以下航线每位旅客收取80元燃油附加费，800公里以上航线每位旅客收取140元，相较于调整前分别降低了20元、60元。燃油附加费成本成为影响旅客出行的一大因素，今年2月5日，航空公司恢复征收国内航线燃油附加费，当时燃油附加费征收标准为800公里（含）以下航段收取10元，800公里以上航段收取20元。此后，燃油附加费便进入月月涨阶段。3月5日，第1次上调征收标准，为20/40元；4月5日，燃油附加费第2次上涨，达到50/100元；5月5日涨至60/120元；6月5日涨至80/140元，为年初水平的7-8倍。在此轮最新上涨后，已达到年初水平的10倍。7月5日，是今年2月恢复征收燃油附加费以来的第五次涨价，彼时多家航司再上调燃油附加费收取标准，其中800公里以上航段，每位旅客收取200元，至此，国内航线燃油费收费标准全面突破2008年7月创下的历史最高纪录。如此涨势下，燃油费加上机建费，一趟航班的附加费用直逼一张机票的价格，许多网友直呼“坐不起飞机了”。甚至为降低旅客附加费费用，多家平台推出了机建燃油费次卡、燃油立减“魔盒”等促销优惠。比如同程的“燃油立减魔盒”售价50元，用户可获得一次机建燃油费随机立减的机会，立减金额在50-250元不等，最高可扣减单次航段的全部机建燃油费。按照民航局规定，国内航线旅客运输燃油附加采取与航空煤油价格联动的机制，由航空公司在规定范围内自主确定具体收取标准。7月29日，能源化工市场价格指数供应商隆众资讯发布消息，由于国际油价呈下行态势，航空煤油价格也整体下调。按照最新调整标准，燃油附加费下调至80/140元，相当于回到6月份的征收水平，但相比2月份的10/20元，还是有7-8倍的差距。多家上市公司曝暑期旅游回暖显著“此次燃油附加费降低对整个行业都是利好的，首先意味着航司燃油成本下降，之前因为考虑成本原因取消的航班，现在可以执飞。对于旅客而言，可以直接降低出行成本，有更多出行选择方式，同时刺激旅客的出行意愿增加。”去哪儿大数据研究院院长兰翔指出，近期行业平均票价逐步回落，8月5日燃油附加费下降后，双重因素叠加，将会在一定程度上促进旅客暑期出游。据了解，暑运前半段票价处于上升趋势，到7月中旬部分日期经济舱平均票价已超过2019年同期。进入7月以来，国内机票裸票平均支付价格自7月5日后持续走低。截至7月27日，去哪儿平台上机票裸票平均支付价格在680元左右，相较7月5日最高峰值下降近70元。航班管家数据显示，7月份以来全国民航每日客运航班执行量稳步增长，日航班量基本保持在10000架次左右。携程数据显示，截至7月12日，近半个月通过携程预订暑期旅游产品的订单总量环比上涨超过九倍，增势迅猛；机票暑运搜索指数已追平2019年；酒旅市场回暖至去年七成。去哪儿平台数据也显示，7月前三周全国酒店预订量环6月同期增长了64%，较2019年疫情前同期预订量增加了25%。据马蜂窝的2022年夏季旅行“蜂向标”数据显示，“贵州避暑游”等词条的搜索热度上涨150%，截至7月15日，关于以“贵州避暑”为话题的景区订单量环比上月增长了近一倍，跨省游、避暑游热度不断攀升。上市公司方面，7月29日，（002033）回复投资者称，暑期是公司传统旅游旺季，7月份以来，丽江旅游市场恢复情况良好，公司旗下各酒店的入住率保持在90%以上，房价也随之上涨。民宿方面，结合公司推出的夏令营及相关活动内容，对公司旗下各家民宿拉动明显，公司旗下民宿的入住率和房价也都随之提高。7月26日，（002627）也表示，进入暑期旅游旺季以来，公司以两坝一峡和长江夜游为代表的的游轮旅游产品游客接待量显著增加。（002707）近日也表示，受益于国内疫情得以有效控制，针对当前暑期出行旺季，公司已研发推出覆盖全国各热门旅游目的地的旅游产品，截至目前国内游市场回暖明显，复苏势能强劲。责任编辑：邓健
