板块名,标题,作者,日期,新闻内容
新浪科技,美团单车宣布涨价的背后：“骑行热”下，自行车和共享单车企业冰火两重天,红星新闻,2022年08月07日 20:44,8月6日，话题#美团单车宣布涨价#登上微博热搜。涨价后，美团单车7天、30天、90天无折扣骑行卡价格分别为15元、35元、90元。美团单车称，本次涨价原因为“硬件和运维成本增加”。红星资本局了解到，中国自行车协会发布的最新数据显示，今年第一季度自行车上游原材料价格同比上涨超10%，原材料上涨的压力正在从自行车制造企业向下游传导。但同样面对原材料成本上涨的行业问题，对自行车制造企业和共享单车企业的影响却大不相同，堪称“同人不同命”。适逢近年的“骑行热”，自行车企业销量大幅上涨，带动相关业绩亮眼。但收入模式单一的共享单车却没有这样的运气，叠加成本压力，涨价或许是一种“不得不的选择”，但这一行为是否能为消费者所接受，是否能有效缓解企业的盈利困境，还有待市场验证。美团单车骑行卡涨价5-30元红星资本局消息，美团单车8月5日发布公告，由于硬件和维护成本的增加，从2022年8月10日23时起，将对骑行畅骑卡价格进行调整。美团单车公告显示，7天卡无折扣价由10元调整为15元；30天卡无折扣价由25元调整为35元；90天卡无折扣价由60元调整为90元。也就是说，这三档骑行卡分别涨价5元、10元、30元。值得一提的是，美团单车并不是近年来首个宣布涨价的共享单车平台。去年3月，哈啰单车在上海率先涨价一事引起多方讨论。今年1月起，哈啰单车率先将骑行套餐7天卡涨至15元，30天卡涨至35元。此外，沈阳、长沙、佛山、绵阳、珠海等多地单次骑行也已涨价。红星资本局发现，美团单车跟涨后，骑行卡价格已与哈啰单车齐平，7天、30天、90天无折扣价均分别为15元、35元、90元；而目前还未涨价的青桔单车三种骑行卡无折扣价分别为10元、25元、75元。共享单车优惠越来越少，骑行价格一直在攀升。有网友算了一笔账，对比公交出行，骑16分钟共享单车花费2.5元，比2元钱的公交还要贵。也有网友说道，“补贴结束了，开始涨价了。”“市场份额有了，就开始涨价，当年争地盘的时候可不是这么搞的。”事实上，共享单车从当年的“补贴乱战”稳定后，价格一直在上涨。2016年9月，摩拜和ofo相继进入市场时，共享单车最初价格为0.5元/半小时，随着后续其他车型的推出，共享单车的价格调整为1元/小时，如今从市场平均水平看，一小时收费3.5-4元已成普遍现象。对于此次涨价原因，美团单车在公告中提到为“硬件和运维成本增加”，而此前哈啰单车的涨价原因则为“运维人力投入和产品折旧成本增长”。成本，作为本次涨价的关键词被抬上了桌面。自行车和共享单车企业冰火两重天红星资本局了解到，中国自行车协会发布的最新数据显示，今年第一季度自行车上游原材料价格同比上涨超10%，自行车、电动自行车行业正面临生产成本上升较快等困难。而原材料上涨的压力正在从自行车制造企业向下游传导。据《华夏时报》报道，近两年，包括金属材料、塑胶在内的自行车上游原材料都在涨价，基本上涨15%-20%。作为自行车的核心零部件材料，铝锭占自行车成本的20%-30%，而其价格从13000元/吨涨到23000元/吨，涨幅超过80%。对自行车生产企业来说，虽然原材料成本在上涨，但因为赶上了“骑行热”，业绩仍然可观。来自工信部消费品工业司的相关数据显示，2021年1-8月全国规模以上自行车（含电动自行车）制造企业营业收入1451.6亿元，同比增长30.6%，实现利润总额71.6亿元，同比增长46.4%。销量上，京东数据显示，今年京东618购物节中，自行车的销量暴涨500%，有的订单甚至排到了2024年。2021年，自行车行业龙头企业之一上海凤凰（600679.SH）实现营收约20.58亿元，同比增长49.59%；归母净利润1.04亿元，同比增长71.26%。今年一季度，上海凤凰实现营收4.14亿元，同比下降23.40%，但归母净利润同比仍在增长，增速达14.70%。从事自行车整车及其零部件设计、研发、生产和销售的久祺股份（300994.SZ）增长势头也十分强劲。2021年实现营收约37.10亿元，同比增长62.31%。今年一季度，久祺股份实现营收7.74亿元，同比增长3.31%；归母净利润4248.33万元，同比增长27.41%。缺货严重的捷安特集团2021年全年销售额为818亿新台币（约合人民币180亿元），同比增长17%。但共享单车企业，就没这么幸运了。主营政府端有桩公共自行车业务的共享单车第一股永安行（603776.SH）年报显示，2021年永安行实现营收8.73亿元，同比增长0.04%；归母净利润为4384.44万元，同比大幅下降91.13%，俨然是其2017年上市以来业绩最差的一年。今年一季度，永安行业绩继续下滑，营业收入为1.7亿元，同比下降15.88%；归母净利润1237万元，同比下降57.33%。永安行表示，去年利润下滑主要原因之一是2021年度对HelloInc。（即哈啰出行）的新增投资收益减少，2021年度汇率变动以及2020年度所得税税率调整所致。据财联社报道，永安行公司人士表示，尽管永安行与哈啰出行不会合并报表，但哈啰出行所遭遇的困境，一定程度上仍然拖累了永安行的业绩。同样面对原材料成本上涨的行业问题，共享单车企业却没有大幅提高销量的“运气”，只能选择涨价来缓解压力。这背后，其实是共享单车盈利模式单一的难题。在共享单车的早期阶段，各企业主要盈利手段是用户押金而非计时收费。彼时，一辆ofo小黄车的押金为199元，摩拜单车为299元。根据ofo当时的估算，平均每辆被投入市场中的单车可以负载6-10份押金，从而保证企业盈利，扩大生产和投放数量。计时收费更多地是作为补充。虽然押金可以迅速为企业补充资金，但这种盈利模式更像是一种金融产品，一旦企业资金链断裂，所有提供押金的用户都将受到牵连。2018年，ofo爆雷，千万用户的押金至今无法退还。近日，摩拜可以退押金的话题登上微博热搜，收购了摩拜的美团单车则表示，这是一条旧闻。2020年12月14日，摩拜单车停止服务，全面接入美团，更名为“美团单车”，原摩拜单车账号中的余额、骑行卡套餐等相关权益仍可在美团App内继续使用。如今，哈啰、美团、滴滴都推出了“免押金”骑车，仅需授权芝麻信用分或微信支付分等就可直接扫码骑车，支付后续计时费用即可。目前，共享单车行业内早已实现“三足鼎立”，但即使告别了烧钱阶段，截至最新财务数据，这三大企业也没有一家摆脱了亏损。哈啰单车招股书显示，自2018年起至2021年一季度，一直处于亏损状态，2018年-2020年，三年合计亏损48.41亿元，最高年亏损金额超过20亿元。被美团全资收购的摩拜单车2018年-2020年累计亏损接近50亿元。滴滴2021年的财报数据显示，青桔共享单车被划分进300亿的“其他业务”的亏损中。失去了押金收入，单一的收入模式造成了共享单车行业的普遍性困局，再叠加本次上游原材料成本承压，涨价或许是共享单车们“不得不的选择”，但这一行为是否能为消费者所接受，是否能有效缓解企业的盈利困境，还有待市场验证。红星新闻记者俞瑶谢雨桐编辑肖子琦责编邓旆光
国内财经,加强商品房预售资金监管 多地新规向烂尾楼说“不”,市场资讯,2022年08月07日 20:43,来源：证券日报网证券日报之声本报记者何文英向烂尾楼说“不”有了最新动向。近日，多地出台了商品房预售资金监管新规，加强预售资金流向透明度，同时进一步加强开发商、政府部门和银行的三方主体责任。对此，IPG中国首席经济学家柏文喜对《证券日报》记者表示：“从近期频繁出台的政策来看，预售资金监管正处于边执行与边完善优化的进程之中，这对房企以及行业发展将起到促进流动性恢复和行业回暖的作用。”监管政策密集出台7月28日，中共中央政治局召开会议指出，要稳定房地产市场，坚持房子是用来住的、不是用来炒的定位，因城施策用足用好政策工具箱，支持刚性和改善性住房需求，压实地方政府责任，保交楼、稳民生。同时7月份以来，陆续有城市发布商品房预售资金监管新规，为“保交楼”和“防烂尾”打下了坚实基础。7月12日，河北沧州发布关于征求《沧州市商品房预售资金监管办法》（征求意见稿），将银行和地方政府部门对预售资金的监管义务纳入了买卖合同。7月14日，西安发布《关于印发防范商品房延期交房增量问题工作措施的通知》，广东汕头发布《商品房预售款监督管理暂行办法》，均将预售监管资金与项目进度高度挂钩。7月28日，江西九江市住建局公示了中心城区85个在售楼盘139个商品房预售资金监管账户，并提示购房人购房时注意核实预售资金监管账户信息，将购房款直接存入商品房预售资金监管账户。8月2日，广东东莞市住房和城乡建设局发布《关于进一步规范商品房预售款收存管理和使用管理的通知（征求意见稿）》，对监管单位、银行机构和房企需履行的职责做了明确说明。8月4日，长沙市住建局出台《关于进一步加强商品房预售资金监管的通知》。《通知》要求，对预售资金流向进行全程监测，对项目工程建设款实施重点监管，保证资金“留在项目、留在当地”，优先用于项目建设，保障房地产项目竣工交付。一位知名房企内部人士在接受《证券日报》记者采访时表示：“此次出台的一系列政策思路基本一致，主要是加强预售资金透明度、与项目高度挂钩以及进一步明确政府部门和银行的监管责任，其最终的目的均是‘保交楼’和‘防烂尾’，这一系列政策对房地产行业、金融业、以及保障民生等方面都有着积极意义。”专家建言完善预售制度“商品房预售资金监管既要保证项目按期交房不烂尾，又要防止过度监管引发和加剧房企的流动性压力。”柏文喜指出，当前我国预售资金监管制度存在监管不到位和过度监管问题并存的现象，“不过从今年频繁出台的政策脉络来看，预售资金监管有边执行边优化完善的迹象。”“预售制度有利于加大房企开发资金来源和加快资金周转，促进房地产行业开发建设效率的作用，但在房地产探索新发展模式背景下，相关制度对房地产企业向高质量发展以及可持续的良性循环发展提出了更高的要求。”柏文喜说道。以近期出台的系列政策为例，诸葛找房数据研究中心首席分析师王小嫱对记者表示：“公示预售资金监管账户使得预售资金监管更加透明化，同时也防止预售资金被挪用，让预售资金用于项目建设，将有效维护购房者的购房权益，减轻购房者对新房烂尾的顾虑，同时也将倒逼房地产行业向财务稳健、安全运行的方向转型。”虽然新政的密集出台从根本上剑指“烂尾楼”，但不少专家认为，接下来仍有待进一步细则出台并落实到位。王小嫱认为：“政策对于预防烂尾楼有一定的积极作用，但起到有效预防还需要细化流程，仅公示预售资金监管账户对于购房者来说还是比较迷茫，还需要公示账户如何查询，如何确定自己的购房款是否进入相应的预售资金监管账户等。”广东省城规院住房政策研究中心首席研究员李宇嘉在接受记者采访时也给出了进一步的监管思路。他建议：“一是预售资金监管账户要由住建局、监管银行、开发商三方监控，监管银行要招标确定；二是监管流程要清晰明了，资金使用审批流程需先由企业申请，再由监管银行审核，最后由监管部门审批；三是预售监管部门、银行以及住建部门各司其职，不达到项目进度不批准资金申请；四是对施工单位、监理单位等建立黑名单，对有严重违规的企业原则上永不录用。”责任编辑：杨红卜
国内财经,暴雪回应网传“《魔兽世界》手游取消开发”：与网易没有财务分歧,IT之家,2022年08月07日 20:41,IT之家8月7日消息，近日有报道称，暴雪和网易因财务纠纷取消了一款未宣布的《魔兽世界》MMORPG大型手游。8月5日，暴雪发言人AndrewReynolds就该传闻回应表示暴雪与网易仍有“非常成功的关系”，并称两家公司之间存在任何财务分歧的说法是“完全不真实的”。不过，暴雪发言人没有提及《魔兽世界》手游的开发状态。IT之家了解到，这款手游将是一款大型多人在线角色扮演游戏，设置在与《魔兽世界》端游相同的宇宙中，游戏代号为Neptune，计划作为暴雪在不同时间段内长期运行的PC游戏的衍生产品。知情人士称，该游戏已经开发了三年，在取消之前有一个由100多名网易开发者组成的团队参与了该项目。后来，两家公司在条款上产生了分歧，最终要求停止该项目。不过，暴雪在今年5月份公开了其魔兽宇宙世界观下的手游作品《WarcraftArclightRumble（魔兽弧光大作战）》，定位为策略动作游戏，和端游的玩法相差很大，包含PVP及PVE玩法，将包含超过65名来自《魔兽》宇宙的知名角色。目前上市时间还未公布。责任编辑：王茂桦
证券,国内厂商市场份额望快速提升！半导体设备中标数量高位运行，一文梳理核心标的,财联社,2022年08月07日 20:39,财联社8月7日讯（编辑笠晨彭飞）半导体设备概念股20CM涨停，总市值超1600亿元的涨停，周五收盘大涨12%，本周累计最大涨幅高达48.56%。根据德邦证券倪正洋统计，2022年7月中国大陆半导体设备中标数量为37台，国产率达48.68%。1-7月开标的624台设备中，源自中国大陆厂家制造的设备共计226台，占比达36.2%。分析师表示，聚焦7月份国内中标厂商，嘉芯迦能（子公司，中标12台）、嘉芯闳扬（万业企业子公司，9台）、屹唐（4台），排名靠前，持续体现国内厂家在刻蚀、沉积、前道检测、炉管等设备环节的强势地位。蒯剑在8月3日发布的研报中表示，国内半导体厂商在手订单充沛，份额有望快速提升。由于半导设备生产交付、验收均需要3-6个月左右的时间周期，因此订单反映到公司收入上一般需要6-12个月时间。此外，合同负债情况可一定程度反映设备厂商在手订单情况，存货则可以一定程度反映设备厂商交付订单的情况。从绝对值来看，2022Q1北方华创合同负债51亿元，存货97亿元，合同负债15亿元，存货21亿元，表征订单量充沛、且设备交付客户等待验收的量亦十分乐观。华创证券表示，目前国产设备的验证正稳步推进，重点客户扩产规划稳步推进中。行业持续高景气，成熟制程产能供不应求，同时中国大陆地区约占全球半导体芯片需求的35%-40%，未来几年国内晶圆厂扩产有望保持高增速。综合验证、订单、扩产三个方面，华创证券认为国内半导体设备厂商有望迎来业绩快速增长阶段。根据SEMI报告，2021年全球半导体制造设备销售额同比增加44%达到1026亿美元的历史新高，预计到2022年全球半导体设备市场将扩大到1140亿美元。2021年中国大陆半导体设备市场销售额增长58%，达到296亿美元，占全球市场约28.9%，达到全球第一。半导体设备按照制造环节可以分为前道晶圆制造设备、封装设备和测试设备。国盛证券郑震湘等人在6月22日发布的研报中表示，前道设备占主要部分，设备投资一般占比70~80%。以集成电路为例，半导体设备可分为前道工艺设备（晶圆制造）和后道工艺设备（封装测试）两大类。国盛证券指出，设备行业核心公司主要为北方华创、芯源微、华峰测控、中微公司、、、万业企业、、，、及。蒯剑表示，在同一制程水平下，国内半导体设备厂商产品覆盖度的三个层次：1）已覆盖设备环节；2）环节内细分品类覆盖；3）单品类工艺覆盖。覆盖的设备环节即光刻、薄膜沉积、刻蚀等大类。细分品类覆盖以薄膜沉积为例，薄膜沉积设备可分为PVD、LPCVD、APCVD、PECVD等细分类别，不同厂商覆盖品类有所差异。分析师表示，仅从当前时点的产品覆盖来看，北方华创在集成电路前道领域产品覆盖最广，其设备涵盖刻蚀、薄膜沉积、热处理、清洗领域，其次是北京屹唐，覆盖去胶、热处理、刻蚀环节，盛美上海亦有多种产品覆盖，涵盖清洗、热处理、薄膜沉积。依据Gartner2021年各类半导体前道设备市场规模占比的数据进行推算，以设备大类来计算，目前国内半导体设备厂商产品覆盖度最高的三家厂商为北方华创、中微公司及盛美上海，产品覆盖度分别达到51%、44%和29%，拓荆科技由于卡位核心设备环节，产品市场覆盖度按大类来看亦达到22%。东方证券表示，以盛美上海、万业企业为代表的国内设备企业积极拓展产品线，延伸至其他设备环节。拓荆科技、中微公司等当前阶段则深耕所处领域，进一步拓展所处环节内产品细分品类覆盖。值得注意的是，我国半导体设备市场仍非常依赖进口，从市场格局来看，细分市场均有较高集中度，主要参与厂商一般不超过5家，top3份额往往高于90%。业内人士表示，国内半导体前道设备国产化率低，行业呈现高度垄断的竞争格局，半导体设备整体国产化率仅10%左右。责任编辑：冯体炜
保险,探索保险中介“新陈代谢”，北京先行一步！支持参与产品研发、核保风控……,市场资讯,2022年08月07日 20:38,来源：保险秘闻占保费收入八成以上的保险中介市场正迎来变革。8月7日，北京商报记者从业内获悉，近日北京银保监局下发了《支持和规范管理型保险中介业务发展工作方案（征求意见稿）》（以下简称《意见稿》），计划培养一批管理型保险专业中介机构，可辅助承担产品研发、销售管理、核保风控等方面的工作。从当前监管趋势来看，保险中介公司的清虚提质是变革主旋律，一方面，“三无”机构持续被清退，另一方面，监管也在重点培养优质机构，大浪淘沙下，谁存谁留？保险中介有望参与产品开发等工作售前进行产品、人员分，对炒停“划红线”售前进行产品、人员分级，对炒停“划红线在探索保险中介市场破旧立新方面，北京地区先行一步。根据北京银保监局近日公开征求意见的《意见稿》，经营区域为全国的北京地区保险专业代理公司、保险经纪公司或保险公估公司，符合条件并有能力成为管理型保险专业中介机构的可以按要求向中介协会申报，通过中介协会组织的行业评议并公开披露结果后，视为管理型保险专业中介机构。成为管理型保险专业中介机构会有哪些“特权”？《意见稿》指出，管理型保险专业中介机构在自身经营业务范围内，经保险公司委托后，可以辅助承担一项或多项保险公司经营管理职能，包括产品研发、销售管理、核保风控、查勘定损、理赔服务、风险减量管理等方面，这些业务视为管理型保险中介业务。也就是说，未来北京地区的保险中介公司，有望同保险公司一起参与产品研发、销售管理、核保风控等工作。对此，中国人民大学中国保险研究所研究员张俊岩分析，北京银保监局在2021年末印发的《关于加强分类指导推动北京地区保险专业中介机构高质量发展的实施意见》中提到，中介机构要加强专业能力、突出中介价值。以产品研发为例，国内保险市场始终存在产品同质化现象，随着客户投保特征的变化，从“以产品为中心”向“以客户为中心”转变不能继续停留在口号层面。保险经纪公司和保险代理公司在销售过程中能够最直接地接触到客户的真实需求，其参与产品研发及销售管理有助于让产品、服务模式与渠道、消费群体相匹配。以往也有保险经纪公司与保险公司合作开发并销售的产品受到市场欢迎的先例。北京银保监局相关负责人此前曾透露，北京保险中介市场将培育发展一批专业特色鲜明、专业优势领先、专业价值突出，在全国乃至国际相关领域有一定知名度和影响力的保险专业中介机构。《意见稿》的发布，可以看出北京银保监局在培养高质量保险中介机构方面已经迈出了重要步伐。根据北京银保监局的安排，北京地区争取用三年时间探索形成一批可复制、可推广、高价值、高质量的管理型保险中介业务新模式，加快推动保险中介转型升级为“专业型、科技型、管理型”。保险中介市场加速“新陈代谢”售前进行产品、人员分，对炒停“划红线”售前进行产品、人员分级，对炒停“划红线现阶段的保险中介行业充满挑战。麦肯锡发布的相关报告称，部分中介机构的业务模式与传统代理模式严重同质化，员工队伍能力素质低下、服务水平不足，未能有效发挥经纪业务的独特优势，机构利润空间也在不断加剧的市场竞争中日益被挤压。从当前监管趋势来看来，逐渐引导行业向正规化、精细化发展，部分小型中介机构在日趋严格的监管要求下或面临被淘汰的命运。根据近期下发的《关于印发保险中介机构“多散乱”问题整理工作方案的通知》，将有序清理无法正常经营的保险中介机构。有行业交流数据显示，2021年以来，各地银保监局已陆续注销超2800家保险中介机构的经营保险代理业务许可证。清退“三无”机构的同时，行业也在重点培养优质机构。并且，这样的布局不仅限于北京地区，深圳银保监局发布的《关于推动构建新型保险中介市场体系的实施意见》也明确表示，争取用三年时间逐步构建“市场结构合理、经营主体稳健、市场秩序规范、发展基础扎实、风险防控严密”的“一体五维”新型保险中介市场体系。行业大浪淘沙下，什么样的保险中介机构才能站稳脚？张俊岩表示，随着消费者保险意识的提升，在购买保险过程中会更加理性，对保险销售和理赔服务的质量要求也更高。我国保险中介市场经过30多年发展，已经成为推动保险业创新和平衡市场关系的重要力量，在此基础上要进一步发挥专业优势，推动保险供给与市场需求精准结合。要想在市场上立足，需要以合规经营为基础，以科技创新推动转型升级为手段，根据企业自身特点在细分领域中形成差异化竞争优势。责任编辑：张文
国际财经,特朗普又自夸：“我身体太强壮了，我是有史以来最健康的美国总统”,环球网,2022年08月07日 20:37,【环球网报道记者索炎琦】据美国《新闻周刊》报道，美国前总统特朗普当地时间周六（6日）参加在得克萨斯州达拉斯举行的美国保守派政治行动会议（CPAC）并发表演讲，期间谈及自己的健康情况，特朗普说前白宫医生罗尼·杰克逊“喜欢检查他的身体”，并称自己是“有史以来最健康的（美国）总统”。《新闻周刊》称，就像在往日大部分的周末集会所做的那样，特朗普在6日演讲中照例深入谈论了一系列话题，包括谈论他自己。在向集会人群介绍了白宫医生杰克逊后，特朗普谈及自己在任期间曾接受医生体检，“他喜欢检查我的身体。我的身体太强壮了，”特朗普说，“但他说我是有史以来最健康的（美国）总统。我是最健康的。我说过的，我喜欢这个家伙。”《新闻周刊》介绍，曾任白宫医生、现任美国得州共和党籍众议员的杰克逊，是特朗普的盟友，也屡次在推特上攻击现任总统拜登。责任编辑：李思阳
