板块名,标题,作者,日期,新闻内容
产经,走进美锦能源 解码氢能发展,媒体滚动,2022年09月10日 10:45,来源：中国能源报几乎看不到工人、看不到产品、闻不到异味。置身于山西股份有限公司（以下简称“美锦能源”）太原清徐厂区，很难想象这是一家以焦化产品为主、已有40年历史的传统能源企业。如今，美锦能源的氢能产业发展势头正劲，引人关注。短短6年，它从一家传统能源企业变身为现代化的能源企业，且成为行业翘楚。它成功转型的奥秘何在？9月3日，中国能源汽车传播集团党委书记、董事长、总编辑兼中国能源报总编辑谭介辉走进美锦能源，与美锦能源集团董事局主席姚俊良围绕氢能产业发展等话题做了一番对话。让我们来听听这位浸润焦化产业40年的掌门人怎么说。（文|本报记者吴莉姚金楠）▲总编辑对话。图左为美锦能源集团董事局主席姚俊良，图右为中国能源汽车传播集团党委书记、董事长、总编辑兼中国能源报总编辑谭介辉。立足传统优势跃上热点风口谭介辉：山西是能源革命综合改革试点，作为传统能源与新能源同步发展的企业，美锦能源是如何在发展中践行能源革命的？姚俊良：能源革命为新时代我国能源高质量发展指明了方向、开辟了道路。山西是国家能源革命的排头兵，肩负着国家能源产业转型升级的重大使命，这也是推动美锦能源坚定转型升级的重要因素。美锦能源以前主要的业务是焦化，从卖煤、洗选、物流到加工焦化，企业竞争实力位居山西前列。我们启动氢能产业发展规划，就是以实际行动践行能源革命。2017年，公司正式启动氢能产业，目前已完成第一个五年计划，形成了完整的氢能产业链布局，建成了覆盖全国主要氢能发展城市的氢能供应体系。美锦能源深耕焦化产业多年，成就非凡。作为一家传统能源企业，转型很不容易，美锦能源是基于怎样的考虑选择将氢能产业作为转型升级的新方向？有哪些优势？美锦能源从1981年成立至今已经40多年了，拥有焦化产能715万吨/年，煤炭产能630万吨/年，是全国最大的独立商品焦和炼焦煤生产商之一。我们赶上了一个好时代。习近平总书记5年3次考察山西，勉励山西在高质量发展上不断取得新突破。我们在省委、省政府的直接指挥下，投巨资对传统能源进行转型升级。能源行业走向清洁低碳、煤炭行业整合加速和我们自身发展的需要，几重因素促使我们下定决心蹚出一条转型升级的新路来。这些年，我们一直在尝试传统能源与清洁能源的协同发展。可是，怎么蹚出新路呢？当时有几个方向，一是做甲醇，二是做天然气。我们研究发现，这两种物质都不能实现真正的零排放，而氢能是最具发展潜力的清洁能源之一，对推动能源转型、保障国家能源安全、促进全球经济可持续发展具有重要意义。中国的国情就是富煤、贫油、少气，而且氢资源的获取相对容易得多，因为有绿氢、蓝氢、生物氢，石化、焦化、煤层气也可以转化为氢气。对我们来说，发展氢能有着先天的优势，焦化业务的副产物——焦炉气中工业副产氢的占比高达50%—55%，通过提纯能够满足低成本制氢的需求；而且，焦炉煤气具有大规模、低成本、高效率的制氢优势。所以，早在2016年，我们就坚定地把氢能作为转型升级的重要突破口。当时，氢能产业刚刚兴起。可以说，选择氢能是公司发展的一个里程碑，也是一个新起点。刚起步时并不容易，对氢能市场还缺乏认知。这几年，我们通过投资项目、设立公司、建立产业园等方式闯出了一片新天地，架构起氢能产业的全产业链：上游搭建氢气制储运加用产业链；中游搭建从膜电极—燃料电池电堆及系统—整车制造的核心装备产业链；下游推进六大区域发展战略，即粤港澳大湾区、长三角、京津冀、环渤海、能源金三角、中部地区。把先天优势做成持续优势应当说，虽然时间短，但是美锦能源在氢能业务方面交出了一份转型升级的优秀答卷，请您具体谈谈目前公司氢能发展的最新进展？又是怎样一步步成为行业排头兵的？方向定了，就坚持走下去。六年多的摸爬滚打，确确实实见成效了。现在，我们从制氢到储、运、加、用，形成了相对完整的产业链闭环，可以说是氢能全产业链布局的头部企业。首先，氢来源更多元化了。一部分是从天然气或焦化产品中提取，一部分是就地取材，还有些是来自周边地区。按公司现有715万吨/年焦炭产能来计算，可以从焦炉煤气中提取氢气6.4万吨/年，能满足24000台中型卡车或18000台8.6米公交车一年的用量。我们也在与石化企业加强合作，拓展氢能的来源。第二，加氢站数量是衡量产业发展的重要参考指标。目前，国内运营和在建的数量比较少，而且主要分布在长三角、珠三角和京津冀地区，配套设备也处于示范阶段。我们在全国范围内投建了十几座加氢站和氢能产业园，几千辆氢能公交车和400多辆氢能重卡每天都在路上跑。第三，我们在北京、上海、河北、山西、内蒙古、宁夏等地区积极开展燃料电池汽车示范项目，形成“产业链+区域+综合能源供应体系”的多维格局，是目前国内少数具备实际量产能力以及运营调试经验的氢能源整车制造公司。我们与国内外多家氢燃料电池技术企业、研究机构保持紧密的合作关系，车型覆盖公路客车、旅游客车等。随着市场需求的扩大和各地氢能产业园的建成，我们还会投建更多的加氢站，形成覆盖全国氢能发展城市的氢能供应体系。现在，氢能是热点赛道，很多企业都已经涉足，美锦能源对氢能有什么进一步的发展规划？我们最早做氢能的时候，当时很多人不理解，但随着产业发展壮大，大家都重视起来了。我们也做好了中长期的规划，在上一个五年基础上，2022年，公司氢能规划战略全面升级为“五个一”的战略规划。一点（整车制造）、一线（燃料电池上下游产业链）、一网（综合能源供应网络）、一平台（碳资产、大数据管理运营平台）、一中心（氢能汽车运营中心）。人才是企业发展的命脉，美锦能源拓展氢能发展业务，从传统能源企业升级到综合能源服务企业，人才必定发挥了关键作用，在人才的吸引、使用、储备等方面，美锦能源主要采取了哪些措施？我们始终坚持“人才引领发展”的发展理念，加大对人力资本的投入和对关键人才的重点引进，推动高素质人才队伍建设。美锦能源是上市公司，我们愿意与大家一起共享发展成果。为发展氢能，我们甚至从世界范围内引进高端科技人才。2022年，公司聘任叶思宇院士、张久俊两位业界领军人物为美锦能源首席科学家。事实证明，通过对高端技术人才的引进和激励，经过这几年的发展，我们的有些产品成本比一些国际化公司下降超过30%，产品种类也在增多，质量也比较稳定。走进美锦能源几乎看不到工人、闻不到异味、看不到产品，我们看到的是一座现代化的能源企业，美锦能源在推动绿色发展方面主要采取了哪些举措？虽然焦化业务是我们的主营业务，但我们很早就有了环保意识。从上世纪90年代开始，我们就尽可能地减少排放，而且循环利用工业排放物。比如，把焦炉尾气用于发电、轧钢热源发电、煤矸石等劣质煤发电、干熄焦发电、生产高压蒸汽。我们用焦炉尾气生产替代进口的乙二醇、液化天然气，实现了氢气到能源的综合利用。在焦化煤气的处理上，我们把煤气送到太原、清徐、交城、阳曲等地，方便“要用就用最好”，这是我们的发展理念。最好的设备、最先进的技术、最优秀的人才，这对长远发展来说肯定是有益的。2017年，公司与加拿大工程院技术团队共同创建鸿基创能，研发制造出高性能、长寿命的燃料电池膜电极，解决了氢能发展的“卡脖子”问题，产品寿命长达50—60年，一致性、良品率都达到了国际一流水平，占据国内膜电极50%以上的市场份额，公司成为该领域自主研发和产业化、规模化、工程化的领军企业。美锦能源提出了2040年实现碳中和的目标，比国家提出的2060年整整提前了20年，请问美锦能源的底气来自哪里，将如何做到？我们虽然出身于传统煤化工企业，但积极践行国家“双碳”目标，立志起到引领作用。所以，我们完全有信心实现这一目标。2022年1月，我们发布了碳中和路线图，设定2020年为碳中和规划的基准年，温室气体排放量为203万吨，主要来自生产过程中的碳排放。我们预计将于2026年实现碳达峰，预计总排放量为469万吨，并承诺2040年实现碳中和，力争成为行业率先实现碳中和的企业。为实现上述目标，我们想了很多办法。首先，成立了专业的碳资产运营公司，全面管理公司碳排放，对公司的排放量和碳中和量进行摸底排查，并成为能源交易所的成员。其次，我们的氢能发展战略也是实现碳中和目标的重要措施。此外，我们还增加了风电、光伏、水电等新能源的业务比重。多方合力助推氢能产业大发展目前，公司制氢还是多采用焦化气，对于绿氢，美锦能源有着什么样的考虑？绿氢是指利用可再生能源分解水得到的氢气。从灰氢过渡到蓝氢，再到最终实现绿氢，代表了氢能低碳化、无碳化的发展趋势。除灰氢外，我们参股了北京环宇京辉京城气体科技有限公司，目前拥有包括800立方米/小时天然气制氢装置（蓝氢）、500立方米/小时水电解制氢装置（绿氢）。我们一直都在密切关注绿氢的发展，还在和一些企业洽谈绿电制绿氢的项目，已经与国家能源集团、北京能源等央国企合作，通过优势互补，整合资源，推动绿氢的发展。目前氢能产业的发展还有哪些瓶颈需要打破？作为行业的引领者，您有什么建议？根据我国的资源禀赋情况、“双碳”发展目标以及全球低碳化发展趋势，石油、天然气、电力这些传统能源消费量在慢慢减少，新能源和可再生能源正逐步上升。美锦能源做了40年的传统能源，氢能可以说是能源革命的一种重要载体，应用场景广泛，可以制冷、制热，涵盖生活的很多领域，但发展中也面临着一些问题：首先，要给制造、运输、储运、行业管理等氢能发展相关各个环节“松绑”。目前，氢能依然被列为危化品，对于氢能的储运环节有一定的影响，要让氢能产业更好地发展，建议将其从危化品中删除，鼓励其发展。第二，中国作为世界第一大产氢国，氢能产业处于商业化前期，目前很难通过规模化生产降低制氢成本。建议从政策层面加大行业在发展初期的支持力度，降低各环节的成本。举个例子，1台49吨的氢能重卡价格大概在160万元，就算减去各种补贴，也比同样规格的燃油重卡高出二三十万元。所以，氢能汽车的市场竞争力还不强，但氢能重卡排放很清洁，基本无污染，排出来的水甚至可以喝，一辆氢燃料电池重卡按1年行驶10万公里计算，可以少排放120吨碳。长远来看，加氢要比加油便宜。所以，应该给予一定时期内的补贴。第三，拓展氢能应用场景。氢燃料电池商用车只是氢能的一个应用领域，提升空间还很大。氢能产业是一项系统工程，需要聚焦各方的方量，充分激活产业优势，让行业实现可持续发展。一个产业的发展不能只靠一家企业或者几家企业，众人拾柴火焰高，氢能产业要想实现持续稳定发展，必须要大家一起携起手来，共同努力。美锦能源公司简介山西美锦能源股份有限公司是全国最大的独立商品焦和炼焦煤生产商之一，是氢能全产业链布局的头部企业，是能源行业率先转型升级的革新者。1981年，美锦第一代创业者在清徐起步。历经40年，三代人励精图治，与国家、区域经济发展同频共振。多年来，母公司美锦集团是山西省循环经济试点企业、山西省安排就业和纳税大户、中国民企500强。美锦能源于2007年借壳上市，2015年完成重大资产重组，目前拥有焦化产能715万吨/年，煤炭产能630万吨/年，已形成“煤-焦-气-化”完整产业链，被评为中国主板上市公司100强，高工氢电2022氢能产业榜30强，福布斯发布的2021、2022中国最具创新力企业榜50强。责任编辑：邓健
国内新闻,成都新增本土“36+39”，详情公布,封面新闻,2022年09月10日 10:41,
美股,日元跌跌不休应对办法不多，日本高官开始轮番口头干预,界面新闻,2022年09月10日 10:41,在日元对美元连续四个交易日下跌后，日本政府高官轮番上阵，对汇率实施口头干预。日本央行行长黑田东彦周五在与首相岸田文雄举行会议后表示，“汇率的突然波动增加了企业的不确定性，这是我们不愿看到的……一天之内日元对美元汇率波动2-3日元，这是非常突然的波动”。当天下午，内阁官房长官松野博和也重申了他的立场，即日元最近的波动过大，不排除采取任何措施的可能。财政大臣铃木俊一则表示，对近期突发的汇率波动感到非常担忧，目前的汇率情况已经略微偏离基本面。若波动持续，将不排除采取任何行动。受上述表态提振，日元对美元汇率日内上涨1.1%，报142.55日元。近来日本央行与美联储在利率政策上的严重分歧，给日元带来的巨大压力。今年迄今，日元对美元汇率下跌了约20%。周三，日元一度跌至24年来的最低水平。在避险情绪和加息预期的共同作用下，美元兑欧元和英镑的汇率也都飙升至数十年高位，日元并不是唯一下跌的。但日元下跌的幅度最大，因为日本是主要经济体中唯一一个实施近零利率的，世界其他地区都在争先恐后地加息以遏制通胀。为了平息40多年来的最胀水平，自3月以来，美联储累计加息225个基点，迅速将联邦基金基准利率区间从近零水平提升至2.25%-2.5%。预计美联储将在本月晚些时候连续第三次加息75个基点。包括欧洲央行在内的其它许多央行也紧随其后。周四，欧洲央行将关键利率从零提高到0.75%，这是欧洲央行继7月加息50个基点后的年内第二次加息，并暗示年内或进一步收紧。加拿大央行周三也将政策利率提高75个基点至3.25%，创14年来高位。外界预期，英国央行也将在下周实施同样力度的加息。面对全球加息潮，日本央行却一直按兵不动，将基准利率维持在历史低点-0.1%，并通过购买长期国债，使长期利率维持在零左右，以提振经济。分析师们认为，口头干预可能是日本应对近期日元疲软少数可行的选项之一。SMBC日兴证券首席外汇策略师MakotoNoji表示，首相希望通过召见黑田东彦，传达其对日元大幅下跌感到担忧这一信息。“两人都非常清楚，日元疲软是因为美元大幅上涨，这一点无人能抵抗，”他说，“日本别无选择，只能在保持战斗姿态的同时，等待美国经济降温、紧缩周期结束。”一吉证券（IchiyoshiSecurities）首席经济学家、前日本央行官员NobuyasuAtago则指出，政府正在对央行施压，“岸田密切关注他在民意调查中不断下降的支持率，因为日元走软会导致通胀加剧，所以他可能将目光投向央行。但干预将非常困难，因为它也涉及到美国。”《读卖新闻》本周的一项民意调查显示，内阁对岸田文雄的不满程度已大幅上升7个百分点，达到41%。美国已明确表示不愿支持日本政府干涉货币市场的任何行为。美国财政部长耶伦7月时曾表示，七国集团成员国的货币汇率应该由市场决定。日本央行将于9月22日召开下一次政策会议，分析师对口头干预能阻止日元持续下跌的程度表示怀疑。责任编辑：李园
国际财经,美经济学家：美国通胀正处于不可接受的高水平，低收入家庭面临更多痛苦,海外网,2022年09月10日 10:40,来源：海外网海外网9月10日电据澳大利亚广播公司10日报道，美国克利夫兰联邦储备银行行长、资深经济学家洛蕾塔·梅斯特日前在接受该媒体驻美记者采访时说，美国目前仍处于通货膨胀危机影响下，这种危机目前无放缓迹象。“我没看到有足够的证据表明通胀已经见顶。我仍然非常担心通胀，它现在正处于不可接受的高水平。”梅斯特说。美国今年的物价水平已达到数十年来最高点，虽然7月消费者价格指数比6月有所下降，但包括梅斯特在内的一些经济学家对此仍持谨慎态度。她认为，到了冬天，消费者价格指数可能会回升。梅斯特表示，在可预见的未来，美国家庭、尤其是低收入家庭，还面临着更多的痛苦。她还透露美联储未抑制通胀可能会继续加息，“我目前的观点是，有必要在明年年初前，将联邦基金利率提高到4%以上，然后全年保持在这个水平。”为对抗持续的高通胀，美联储今年以来已四次加息，其中连续两次加息75个基点，为上世纪80年代初以来最大幅度的集中加息。彭博社10日报道称，美联储激进加息策略导致美国股市第二季度暴跌，美国家庭净资产在当季创下有记录以来的最大跌幅。（海外网姚凯红）责任编辑：李园
新浪科技,继 Galaxy Z Fold4 后，三星 Galaxy Z Flip4 通过暴力测试,IT之家,2022年09月10日 10:39,今年8月10日，三星发布了GalaxyZFold4/Flip4折叠屏手机，这两款手机都搭载了骁龙8+Gen1芯片，并且支持IPX8级防水。昨日，YouTube的JerryRigEverything频道对三星GalaxyZFlip4折叠屏手机进行了暴力测试。在视频中，该博主对GalaxyZFlip4折叠屏手机的内外屏幕进行了防刮性测试，其中内屏的坚硬度明显不如外屏。该博主用美术刀刮GalaxyZFlip4折叠屏手机的中框时，留下了永久性痕迹。同时，该博主用美术刀成功撬开了手机音量键。在该博主用美术刀刮GalaxyZFlip4折叠屏手机的铰链时，该博主发现此处的三星Logo仍为镶嵌式设计，可用镊子将字母上的黑色处理取下。此后，该博主又将泥土洒在GalaxyZFlip4折叠屏手机上、用打火机烤手机屏幕、朝各个方向用力掰手机。GalaxyZFlip4在经历刀山火海后，虽然留下了不少划痕、开合出现问题并且屏幕被烫出了永久痕迹，但仍然没有关机。因此，三星GalaxyZFlip4折叠屏手机成功通过JerryRigEverything暴力测试。8月下旬，JerryRigEverything频道对三星GalaxyZFold4折叠屏手机进行了暴力测试，并且该折叠屏手机成功通过了测试。此外，三星于8月26日分享了GalaxyZFold4/Flip4两款折叠屏手机在工厂中组装和测试的视频，视频中三星将两款手机以半折叠的状态放在水中浸泡，以验证其防水性。
证券,8月动力电池装车量同比翻倍！“宁王”连续五个月市占率低于5成，“迪王”追赶势头凶猛,财联社,2022年09月10日 10:36,财联社9月10日讯（编辑俞琪）得益于新能源汽车产业快速增长，动力电池行业呈现加速发展势头。昨日，中汽协发布数据显示，8月，我国动力电池装车量27.8GWh，同比增长121%，继7月同比增172%后再实现翻倍增长；1-8月，我国动力电池累计装车量162.1GWh，累计同比增长112.3%。当前，中国已成为全球最大的动力电池市场。研报预测，随2022年国内新能源汽车产量有望达到600万辆，将带动动力电池出货超450GWh。对此，有业内人士认为，我国动力电池产业链完整，全球70%的电池产能在中国，电池的产业竞争力在相当时间内难以撼动。预计2025年国内动力电池装车量将达到约600GWh，2030年则将在1500-2000GWh之间。与此同时，对于行业排名，根据中国汽车动力电池产业创新联盟最新数据显示，1-8月国内动力电池企业装车量排名前三分别为、、中创新航，各占据47.45%、22.19%以及7.02%的市场。其中，稳居龙一的“宁王”在今年半年报称，公司动力电池使用量连续5年位列全球第一，2022年上半年全球市占率达34.8%，比去年同期提升6.2个百分点。英大证券研报表示，宁德拥有全球最大的产能，2021年实现170GWh的产能，已在全球布局落地包括福建宁德、福建厦门、江西宜春等10个生产基地，总规划产能超过670GWh。同时，据测算，2022年和2025年，宁德时代总产能将分别扩张至401GWh和750GWh，扩展速度和规模领先于同行，有望成为全球首个TWh级别的电池厂。不过，值得注意的是，相较于去年50%以上，宁德时代自今年4月至8月已连续5个月占比低于50%。相对于此，比亚迪全球市场占有率则显著提升，前7月动力电池装机量已达30.3GWh，同比增长204.7%，全球从去年同比的7.3%升至12.6%，反超LG新能源位居全球第二。对此，市场人士分析，比亚迪动力电池主要以自供为主，市场份额剧增主要源于其新能源汽车销售火爆。公司近日公告，新能源乘用车1-8月累计销量97.43万辆，累计同比增长274%；1-8月动力和储能电池累计装机49GWh，同比增长154%。9月4日研报表示，电池装机量同比高增，外供开启叠加储能爆发，全年出货预计翻番以上增长。而宁德时代则是绝大多数自主车企、新势力企业以及合资企业的主供。有市场分析称，新能源车企4月产销出现分化，动力电池装车量也出现环比下滑，而比亚迪得益于较高的自供率，产销受影响相对较少，其与宁德时代市占率差距正逐渐缩小。另外，磷酸铁锂等原材料价格的上涨同样对宁王毛利率影响更为明显。不过，英大证券研报亦指出，就配套车企数量来说，宁德时代与LG新能源优势仍最明显。其次，本次位列第三的中创新航主要供应覆盖广汽乘用车和等多家知名车企。对比券商对两大龙头今年的盈利预测，英大证券研报预计宁德时代今年营收同比增长128.87%，净利润同比增速48.18%。东吴证券研报则预计比亚迪今年营业收入同比增速83%，净利润同比增速287%。另外，在技术方面，宁德时代、比亚迪与中创新航均已推出动力电池结构创新技术。其中，宁德在今年推出备受瞩目的CTP3.0麒麟电池，其中采用全球首创电芯大面冷却技术；比亚迪推出具备“6S”理念的刀片电池，具有成“电池上盖-电芯-托盘”的“三明治”结构特征的CTB技术；中创新航核心产品one-stop电池则是在电芯层级、生产工艺以及电池系统层面进行多维度创新，其技术逻辑特征为模块化极柱、一体化电连接技术。责任编辑：王涵
新浪科技,华为Mate 50系列要有5G了！5G通信壳10月左右见,快科技2018,2022年09月10日 10:35,9月6日，华为Mate50系列正式发布，推出Mate50E、Mate50、Mate50Pro、Mate50RS保时捷设计四款机型，除Mate50E为骁龙778G4G处理器外，其它机型均为骁龙8+4G处理器。比较遗憾的是，此前传闻的5G通信壳并未随手机一同亮相。日前，数码博主“厂长是关同学”透露，华为Mate50系列的5G通信壳快来了，大概在10月左右。从晒出的图片来看，Mate50通信壳背部下方有明显的“5G”标识，并印有“5GPhoneCase”字样，材质类似皮质工艺，目前暂不确定最终设计是否和图片一样。据了解，在Mate50系列发布会前，该系列已有三款5G通信壳入网工信部，型号分别为SY108-618、SY108-658、SY108-688，预计对应Mate50、Mate50Pro、Mate50RS保时捷设计三款机型。据此前P50Pro5G通信壳，通信壳支持5G双模，支持三大运营商，需开通eSIM服务即可，在通信壳的加持下，4G手机秒变5G手机。
国际新闻,又一病毒来袭，纽约州宣布紧急状态,观察者网,2022年09月10日 10:34,
