板块名,标题,作者,日期,新闻内容
证券,金地集团，被“队友”闪了一下腰：“广撒网、低权益”的高杠杆合作模式是有代价的,市场资讯,2022年10月30日 13:55,来源：市界早知道2006年，是房地产鲜花着锦的年代。胡润富豪榜中国前十大富豪中，有六席来自地产。这一年，群雄逐鹿中，招商、保利、万科、金地，以“招保万金”的名号，成为中国地产界的四大龙头。那时的股民，挤在营业厅前排队买的，正是“招保万金”这样的股票。“最了解金地的，不是它的员工，而是经常玩股票的投资者”，这个段子广为流传时，是在资本市场上，最为高光的时刻。然而，好景不长，因错过地产弹性周期等原因，金地被新登台的弄潮儿们，生生挤到舞台的角落。直到2021年，金地终于凭借跑赢大多数同行的牌面“重回前十”了。不过，10月25日，金地再次发布澄清公告称，网络流传“金地集团旗下公司非标融资展期、表外信托融资”等不实信息，严重损害金地集团的商业信誉。尽管金地再一次公关危机，其股价并没有因此提升，反而持续下挫至10月28日的8.04元。10月27日晚，金地发布了三季报，其基本面仍然优秀，报告期内，金地的归属股东净利润不仅增长至33.63亿元，就连三道红线也继续维持绿档，债务融资加权平均成本更进一步降低到4.5%。拿着一手“好牌”的金地，为何遭到资本市场冷遇？外界对其合作项目的经营风险和表外融资的担忧，为何如此强烈？一个出人意料的“坑”10月18日，当看到“21金地01”（跌超20%）“21金地04”（跌超52%）等债券暴跌的消息时，资深散户王文峰有点紧张。他迅速打开股票软件，看到金地9.89元的股价（跌3.23%）后，王文峰心凉了半截。9月以来，金地股价持续下挫中，想“逆势抄底”的王文峰连续加仓了金地。更让他感到不安的是，金地盘面背后的机构资金出现流出迹象。这一天，金地主力资金净流出9119.28万元。都说博尔特是飞人，在王文峰看来，比博尔特更快的是操盘手。博尔特用的是腿，操盘手用的是键盘。“要不要跑？”王文峰的大脑快速飞转。历史总是惊人相似。10月18日晚间，金地管理层发出近期销售业绩报告，其中提到几项向好的数据，还特别强调，“国庆节黄金周认购金额超70亿元，创过去历史周期新高”。这是金地自今年8月“股债双杀”以来的二度危机公关。资本市场当时并不买账。10月19日早盘，金地股价尽管开始“飘红”了，但多空激烈博弈，震荡明显。同一天，债券“21金地01”突然宣布停牌，“21金地04”继续下挫。金地已在10月13日提前还债了，且无论从财务水平还是业绩表现等，它的数据都好过一些房企，为何一而再地被资本市场冷遇？这首先与地产债券普遍下跌的大环境有关。“剩者为王的房地产行业里，普通投资者考虑投地产的是少数，大环境给人的认知摆在那里，且现在资本市场比较求新，普通投资者对传统行业不大感冒。”深圳汇合创世投资管理有限公司王兆江向市界解释道。另外一名基金经理则表示，“今年，民企地产违约率的担忧，产生了放大效应，造成机构投资者信心不足。企业业绩一旦低于预期，就会引发投资者抛售股票和债券。投债券的一般都是大机构，普通投资者没有能力左右价格。但如果机构抛售，普通投资者一般都是跟随。”除了大环境，金地集团自身也遇到了不少麻烦。标普今年年中对金地集团展望的负面调整，是具有代表性的顾虑点之一。7月26日，三大国际评级机构之一的标普宣布，基于公司充足的土地储备、优于行业平均水平的销售表现及充足的流动性，维持金地“BB”的长期企业信用评级，但将金地及其子公司辉煌商务的展望从“稳定”调整至“负面”。标普的担忧，一是金地集团的合同销售额将下降，二是在行业低迷期，金地集团大量投资合资项目将增加执行风险，在未并表的合资项目上的大量敞口降低了财务透明度，增加了经营风险。实际上，尽管金地2022年以来的基本面不错，但整体业绩表现的确不及去年同期。1-9月，金地累计实现签约面积706.4万平方米，同比下降33.51%；累计实现签约金额1630.8亿元，同比下降28.69%。金地集团在合资项目上的风险，是市场更为关心的问题。通过与其他房地产企业合作，联营、合营公司，降低资金占用、分散财务风险，是房地产行业的通行做法，也是金地过去几年做大规模的方法之一。在房地产市场行情好时，合作方能帮助金地轻装上阵，迅速做大做强，但市场下行时，这些合作方就可能变成“猪队友”，它们一旦出现问题，也会因合资项目拖累金地。投资者很关注，在金地并表和不并表的项目中，有多少项目的合作方涉及债务违约，合作方爆雷项目，会否对公司经营产生重大影响？对此问题，金地做了多次回应。8月5日，金地集团在投资人会议上表示，合作项目中已识别的，涉及实质出险的合作方的项目个数是26个，总未售货值369亿元，金地的权益货值是135亿元，权益占比37%左右。金地还称，合作开发方面，公司一直坚持选择稳健的同行作为合作方，努力发挥协同优势。公司高度关注合作方出险所带来的公司项目层级经营风险。经过排查，公司涉及风险合作方的经营风险处于低位，总体可控，风险敞口小。然而，从今年7月底至今，市场对金地在合作项目上的担忧和各种猜测从来就没停止过，包括担保连带责任、表外融资等等。掌舵者的格局与视野，有时决定着企业的命运。金地集团董事长凌克有着理科生的内敛和谨慎。媒体从他身上，几乎找不到夸张的戏剧情节。早期的金地，权力是分散的。管理层主要是“三驾马车”凌克、张华纲、赵汉忠。“较之凌克的保守，张华纲和赵汉忠偏激进。”熟悉金地管理层的人士早年间透露。直到赵汉忠、张华纲2010年相继出走后，两次拿高价地吃过亏的金地，谨小慎微起来。虽然这很“凌克”，但不代表金地没有野心。也正是这一年，有媒体问凌克：下个十年，你最大梦想是什么？“成为最具竞争力的国际化地产企业集团。”凌克回答。然而，因历史问题，一直到2014年，金地还谨慎拿地，增长徘徊。同一时期，万科销售额从1081亿元涨至2151亿元，而金地增量仅从283亿增至490亿元。2014年，金地经营策略突变，当年提出“加快周转，做大规模，提升ROE”的发展目标。从每年的拿地情况，可以看到金地的转变。2015年，金地的土地权益投资金额为113亿，2016年为168亿，2017年猛增到473亿，2018年为404亿，2019年为558亿元，2020年为697亿，2021年为523亿。有业内人士认为，金地集团在2014年后的经营战略至少踩错了两个点，一是在2018年、2019年的高价位拿了太多地，二是在这个过程中，作为金地的掌舵人，凌克并不是没有警觉，他曾表示，“一下子涨50%，我觉得没必要，风险很大。要争取前十名，但不一定要去争取第一名。”金地的变通方法是，在增加土地储备面积时，找合作方。从金地集团的土储面积和权益土储面积可以看出，2016年之后，金地的权益占比一路下降。这个喇叭口在2021年扩大到了惊人的程度。2017年-2021年，金地新增土地储备权益面积和新增总面积之比，分别为45.5%、44.8%、52.4%、49.1%、39.6%，这个比例在同档位房企中处于中低水平。通过“合作”这个杠杆，金地集团的销售额和营收得以迅速增长，且融资利率和负债保持在低位，成为房地产行业的“好学生”。Wind数据显示，金地营收自2017年的376亿，迅速上涨到了2021年的992亿，涨幅高达163%；销售额在2016年突破1000亿大关，2021年暴涨至2867亿。金地终于回到房地产企业销售排行榜前十。2022年前9个月，金地更是稳中有升，以累计1630.8亿元的销售额，位居行业第七名。营收和业务高速增长，金地集团的融资利率却一直保持低位，其中2019年至2021年分别为4.99%、4.84%、4.56%，低于绝大多数民营地产公司。然而，2020年“三道红线”政策出炉，整个行业开始降低负债、去杠杆，不少房企相继出现问题。此时，俗话说，不怕神一样的对手，就怕猪一样的队友。市场对金地合作项目的经营风险和表外融资的担忧经久不息。这个风险，可能是凌克这个严谨的理科生始料未及的。罗曼·罗兰说，整个世界在改造中，不能容许任何人到过去时代美好事物中，去寻找一个藏身洞。毕竟，时代所至处，谁都躲不掉。责任编辑：常福强
证券,上市银行三季报：11家不良率三连降，拨备水平普遍较高,第一财经,2022年10月30日 13:53,截至10月29日，42家上市银行中已有40家公布了三季报。第一财经根据Wind数据统计发现，40家上市银行前三季度营业收入合计4.49万亿元，同比增长2.8%；实现归属母公司股东的净利润合计1.59万亿元，同比增长8.2%。其中，六大行合计实现营业收入2.84万亿元，同比增长2.36%；实现归母净利润合计1.03万亿元，同比增长6.47%。从资产质量来看，40家银行三季度末的不良率均低于2%，房地产风险继续出清，资产质量持续改善，拨备水平普遍较高。两家银行营收、净利双双下滑从盈利水平来看，前三季度，40家上市银行中，营业收入规模超过千亿元的银行有13家，均为国有行和股份行，依旧遥遥领先，前三季度营业收入7113.92亿元。六大行合计实现营业收入2.84万亿元，同比增长2.36%。从营业收入增速来看，上述13家上市银行中，增速较快的如，营业收入同比增长7.79%，营业收入同比增长8.71%，而工商银行前三季度营业收入罕见下滑0.1%。归母净利润排在前五位的分别为工商银行、、、、，5家银行的归母净利润规模均达到千亿元级别。另外，六大行合计实现归母净利润1.03万亿元，同比增长6.47%。部分区域性银行延续强劲的业绩增速，比如，、、、的归母净利润增速均超过30%。净利润表现也在一定程度上反映在股价中。今年，银行板块整体下跌17%，年内大部分银行股收跌，区间涨跌幅能够实现正增长且表现最好的前5家银行分别为江苏银行、成都银行、、和，均为业绩强劲的区域性银行。值得注意的是，今年前三季度，有7家银行营业收入同比负增长，3家银行归母净利润同比负增长。其中，两家银行的营业收入、归母净利润均呈现下滑状态，包括营业收入同比下滑16.87%，归母净利润同比下滑4.82%；营业收入同比下滑8.39%；归母净利润同比下滑12.37%。拨备水平普遍较高从资产质量来看，数据显示，40家银行三季度末的不良率均低于2%，平均为1.2%，低于中报时的平均数1.21%，资产质量持续改善。其中，有15家上市银行的不良率低于1%，包括邮储银行、成都银行、常熟银行、杭州银行、等；有11家上市银行的不良贷款率连续三个季度下降。但也有些银行的不良率在提升，比如，三季度末的不良率升至1.91%，高于年初水平。在拨备覆盖率方面，40家银行的拨备覆盖率普遍处于较高水平，均值达到323%，且均值水平在三个季度里连续提升，与年初的平均数306%相比，风险抵补能力进一步增强。其中，杭州银行、常熟银行、张家港行、、苏州银行、宁波银行的拨备覆盖率均超过500%，分别为583.67%、542.02%、541.02%、539.05%、532.50%、520.22%。与年初相比，29家银行的拨备覆盖率有不同程度的提升，其中，和苏州银行的拨备覆盖率均提升超100个百分点。同时，也有10家银行的拨备水平低于年初，其中，、招商银行的降幅最大，尤其是招商银行的拨备覆盖率较上年末下降28.2个百分点，但依旧达到455.67%。房地产风险继续出清在三季报中，有多家银行披露了截至三季度末的房地产风险管控情况。其中，兴业银行表示，报告期内公司对房地产业务风险开展了多轮摸排，按照项目风险等级建立“三分类”项目清单，一是对项目足值、项目开发主体能够持续运营的，通过推动项目顺利开发避免出现违约风险，今年以来已归还本金超60亿元；二是针对已出现风险但仍有足额价值的项目，通过并购重组推动足值项目和问题开发商脱钩，并配合地方政府“保交楼”化解风险，今年以来已无损化解风险45.5亿元；三是对于价值严重不足的项目以及没有资产可供处置的流动资金类融资，及时推动资产保全工作维护公司合法权益。招商银行表示，截至报告期末，其房地产相关的实有及或有信贷、自营债券投资、自营非标投资等承担信用风险的业务余额合计4737.27亿元，较上年末下降7.38%；对公房地产贷款余额3470.35亿元，较上年末减少89.42亿元，占贷款和垫款总额的6.13%，较上年末下降0.65个百分点。平安银行表示，该行高度重视房地产行业授信的风险防范和质量管控。2022年9月末，集团实有及或有信贷、自营债券投资、自营非标投资等承担信用风险的业务余额合计3353.24亿元，较上年末减少57.65亿元；理财资金出资、委托贷款、合作机构管理代销信托及基金、主承销债务融资工具等不承担信用风险的业务余额合计1053.59亿元，较上年末减少153.27亿元。责任编辑：冯体炜
基金,27万亿公募基金托管江湖：券商排队上车，商业银行一骑绝尘,时代周报-时代在线,2022年10月30日 13:50,基金托管江湖正变得前所未有的热闹。今年10月下旬，证监会接收渤海证券基金托管资格的申请材料，渤海证券基金成为第5家申请此牌照的券商。今年10月上旬，证券基金托管牌照获批，成为继、证券后，年内第三家获得基金托管资格的券商。从牌照数量上来说，目前商业银行和证券公司各自占据半壁江山。但从业务数量来说，二者目前的差距极大。Wind数据显示，2021年基金托管资产25.2万亿元，托管费用合计289亿元，其中银行收取的托管费用达到285.6亿元，而券商的托管费用收入仅为3.8亿元。公募基金的“蛋糕”仍在持续做大，年内公募基金规模一度超过27万亿。券商排队上车，能否撼动行业现有的格局，正在成为业界关注的问题。券商争相上车2013年券商托管业务开闸。自此之后，券商在资格审批上受到监管部门支持。截止目前，券商拥有30张基金托管牌照，从数量上已反超中资银行所拥有的29张牌照。有一个耐人寻味的细节，今年3月获批基金托管牌照的，为近8年来首个获得基金托管业务资格的中资银行。作为财富行业的老牌玩家，券商有其独特的禀赋。数据显示，权益类券结基金在权益基金中的占比逐渐提升。2022年上半年，新发权益券结基金占新发权益基金规模的比例达17.4%，较2021年全年提升12%；截至上半年末，权益券结基金规模达3549亿元，较年初提升3.5%，占权益基金总规模的比例提升至4.6%。有资深业内人士告诉时代周报记者，对于券商而言，托管业务的重要性并不限于所带来的直接收入。券结基金可以为券商带来增量收入，其中与分仓收入的相关性极为明显。券结基金豁免佣金分仓30%限额规定，结算券商最高可获得100%交易佣金，对券商佣金贡献显著。研报显示，上半年券结基金交易佣金达5.4亿元，占总交易佣金的比例达5.7%。其中，财富管理能力较强的、、、券结基金佣金占比分别达8.3%、16.8%、5.4%、7.6%。从数据上来看，券商的基金托管规模市占率逐年提升。天风证券研报指出，券商保有量及份额的快速提升部分原因在于统计口径的变化（如今年一季度开始，ETF场内净买入额计入券商保有量），但更重要的原因在于投资者偏好向被动指数类基金倾斜。托管业务被资管圈当作最为旱涝保收的业务。基金托管业务主要为对外开展安全保管基金财产、办理清算交割、复核审查净值信息以及开展投资监督等托管业务。除法定托管义务外，大部分托管机构都提供了同质化程度较高的增值服务。考虑到托管的业务属性，除了金融机构属性的差异外，渠道能力是构成托管牌照价值的核心竞争力。总体来说，由于代销实力的弱势，制约了券商托管业务的发展。从托管结构看，券商在被动指数基金的托管上有相对优势。沪上某中型基金公司人士直言，券商的托管业务占比提升是大概率事件，其中最直接的一个触发因素，是今年东方财富证券拿到基金托管牌照。目前东财旗下天天基金无论股混还是非货基金保有量，均位居全渠道前三甲，未来有望吸引更多托管基金以实现业务充分协同。数据显示，截至目前，正在排队申请基金托管资格的券商共有8家，分别是、财信证券、天风证券、、湘财证券、、和渤海证券，其中后5家均在今年申请。工行继续领跑被称为“宇宙行”的，是目前基金托管业务的最大玩家。工商银行2021年报显示，公募基金托管规模达3.7万亿元，比上年末增加6637亿元。公募基金托管起步于1998年，老牌玩家拥有先发优势。其中，1998年获批的工农建交中五大行优势明显，市场份额过半。以2021年为例，工商银行、、托管费用收入均超过了30亿元，其中工行托管费用收入更是达到了惊人的51.5亿元。因公募基金托管机构服务同质化明显，托管机构的托管规模与基金代销能力深度捆绑。从历史数据来看，代销规模排名和托管规模排名相对稳定，且二者成正相关关系。上述资深业内人士笑称，说托管业务是靠“卖”出来的并不为过。倘若从托管业务增量来看，是近年来当之无愧的“王者”。代销实力越强的商业银行，当年新增基金托管规模越大。目前，招行股混基金保有量雄踞全渠道榜首，对新基金的吸引力不言而喻。事实上，尽管领先者仍具备一定优势，但商业银行的托管版图并非铁板一块。从新托管基金的角度，招商银行扮演了多年“追赶者”的角色。直至2014年后，招行与工行的代销实力差距迅速缩小，并于2019年实现反超。2021年，招行公募基金托管收入26.62亿元，已经将先行者农行和交行甩了一个身位。值得一提的是，商业银行目前的托管费率也足以“碾压”券商。2021年，工行、建行、中行三家的托管费率基本在0.15%左右，而位居托管收入三甲的、、广发证券费率平均在0.08%左右。主要原因是货币型基金等低托管费率基金占比较高。即便头部市占率处于高位，仍有券商、中小银行相继入局。今年以来，苏州银行、先后获批基金托管牌照。相较全国性银行来说，城商行在金融牌照方面相对不够丰富。以苏州银行为例，除了刚获得的基金托管牌照外，还在积极申请公募基金牌照，其发起设立的“苏新基金”申请材料已于9月获证监会受理。责任编辑：冯体炜
基金,ETF增逾487亿份！“聪明钱”捕捉波动背后的机会……,上海证券报 ,2022年10月30日 13:49,10月进入尾声，大量“聪明钱”在市场波动中，借道ETF逆势布局。Choice数据显示，截至10月28日，今年10月权益类ETF份额合计增长逾487亿份。其中，科创50ETF、上证50ETF等宽基ETF以及医药、酒、食品饮料、军工等行业类ETF资金净流入较多。“聪明钱”借道ETF入市Choice数据显示，截至10月28日，10月以来权益类ETF合计份额增长超487亿份，若剔除QDII基金，份额增长也超164亿份。拉长时间看，今年9月以来，A股市场波动加大，但资金却在市场震荡中积极借道ETF入市。数据显示，9月以来，权益类ETF份额增长超过864亿份。上证指数近期走势图业内人士认为，ETF作为市场上的投资风向标之一，历来为投资者所关注。由于ETF投资者相对更为成熟，往往会出现逆势买入的情况，这也被视作投资者对长期机会的看好。从各大基金公司近期的观点来看，他们也普遍表示当前或适度乐观，可在波动中寻找合适的机会布局。面对当前的A股市场，国联安基金认为，目前经济整体在缓慢修复，从盈利、无风险利率和风险溢价这三个主要因素来看，均对股市构成一定支撑。首先，经济修复对企业盈利构成支撑；其次，政策的适度宽松将促使无风险利率保持低位；最后，市场风险溢价已处于历史高位，目前的市场已隐含了较多的悲观预期。综合以上因素，一旦不确定性担忧有所缓解，市场或迎来趋势性上涨机会。嘉实基金价值风格投资总监谭丽也认为，中国经济具有韧性，随着一些政策的出台，经济触底回升的可能性较大，这个时候可以适当乐观一些。就当前而言，能看到的市场机会正越来越多。部分行业备受资金青睐除了科创50ETF、上证50ETF等宽基ETF外，10月以来，医药、酒、食品饮料、军工等行业ETF也纷纷“吸金”。10月来份额增加较多的权益类ETF基金，不含QDII值得注意的是，从去年年中至今经历了较长时间调整的医药板块，近期市场关注度提升，资金也借道行业ETF基金加速入场。数据显示，易方达沪深300医药ETF10月以来份额增加逾29亿份、华宝中证医疗ETF和永赢中证全指医疗器械ETF也分别增加超12亿份、10亿份。按10月来的区间成交均价计算，这3只产品在此期间分别获得逾13亿元、6亿元、7亿元的资金净流入。除了医药板块之外，资金也在波动中寻找其他机会。10月以来，鹏华中证酒ETF份额也增加14亿份有余；部分食品饮料ETF与房地产ETF的份额增加逾5亿份，此外军工ETF也增逾4亿份。近1个月的机构调研情况与ETF资金动向也有所重合。Choice数据显示，医疗器械行业的机构访问量超过1573次，位居行业第一。具体来看，、10月接受机构调研均超300次，另外，、等近日也接受了上百次机构调研。展望后市，兴业基金研究部权益研究总监邹慧看好四大领域机会。第一，结合当前宏观环境和上市公司业绩表现，他首先看好资源品领域的投资机会，包括原油和煤炭；第二，高景气成长方面，主要看好包括光伏、海上风电、国防军工和半导体设备等细分行业；第三，部分消费类及出行链公司，从供给端来看，诸如化妆品、快递等板块的竞争格局在逐渐优化；第四，医药板块方面，由于医疗设备更新贷款的催化，叠加部分设备集采力度好于预期的带动，估值在极低分位的医药值得关注。责任编辑：冯体炜
国内财经,2022年前三季度全国纪检监察机关处分40.7万人 包括48名省部级干部,新华网,2022年10月30日 13:48,新华社北京10月30日电（记者孙少龙）中央纪委国家监委网站30日消息，中央纪委国家监委通报2022年1月至9月全国纪检监察机关监督检查、审查调查情况。2022年1月至9月，全国纪检监察机关共接收信访举报264.7万件次，立案45.4万件，处分40.7万人，其中包括省部级干部48人。通报显示，2022年1月至9月，全国纪检监察机关共接收信访举报264.7万件次，处置问题线索109.5万件，谈话函询22.8万件次，立案45.4万件，处分40.7万人（其中党纪处分33.8万人）。处分省部级干部48人，厅局级干部1850人，县处级干部1.5万人，乡科级干部5万人，一般干部5.7万人，农村、企业等其他人员28.3万人。根据通报，2022年1月至9月，全国纪检监察机关运用“四种形态”批评教育帮助和处理共128.5万人次。其中，运用第一种形态批评教育帮助87万人次，占总人次的67.7%；运用第二种形态处理32.4万人次，占25.2%；运用第三种形态处理4.4万人次，占3.4%；运用第四种形态处理4.7万人次，占3.7%。责任编辑：王翔
