板块名,标题,作者,日期,新闻内容
国际财经,专访：金砖机制在捍卫发展中国家利益等方面可发挥重要作用——访南非外交部副总司长苏克拉尔,新华网,2022年06月18日 10:34,新华社约翰内斯堡6月18日电新华社记者荆晶南非外交部副总司长阿尼尔·苏克拉尔日前在接受新华社记者视频采访时表示，金砖国家是国际社会中一支积极、有影响力和建设性的力量。在捍卫发展中国家利益等方面，金砖国家可以发挥重要作用。苏克拉尔表示，经过多年发展，金砖机制不断深化，“我们已经取得了巨大成果”。他举例说，金砖国家推动建立金砖国家疫苗研发中心，将在疫苗联合研发和试验等方面深化交流合作。金砖国家新开发银行项目在帮助南非等国家提高基础设施建设水平、抗击疫情等方面发挥了重要作用。他说，中国提出的“金砖+”开启了一个包容性进程，更多发展中国家参与合作，他们对金砖机制充满信心，愿与五国携手应对共同挑战，维护广大发展中国家的利益。谈到当前的国际局势，苏克拉尔指出，部分西方发达国家奉行单边主义，想维护自己的既得利益，“希望继续当世界霸主”。在乌克兰危机中，部分发达国家实施单边制裁，这些制裁影响了能源和粮食安全，导致全球供应链中断。受此影响，非洲等地区的贫困问题进一步恶化。苏克拉尔表示，金砖机制致力于促进合作与发展。如今，金砖国家已成为世界上一支重要力量。五国一致认为，鉴于全球目前面对的安全挑战，必须加强和深化金砖机制。他认为，在捍卫发展中国家利益等方面，金砖机制可以发挥重要作用。未来，包括金砖国家在内的广大发展中国家应通力合作、共同努力，推动构建更加包容、公平的国际秩序。苏克拉尔表示，即将举行的金砖国家领导人第十四次会晤，是在国际社会面对多重挑战背景下举行的重要会议。期待此次会晤进一步深化金砖国家伙伴关系，并在加强多边主义、推动建立开放的全球贸易制度等方面发挥重要作用。责任编辑：邓健
产经,拍卖结束！巴菲特午餐拍卖最终以1900万美元成交,财联社,2022年06月18日 10:34,财联社6月18日电，巴菲特慈善午餐的拍卖结束，巴菲特午餐拍卖最终以1900万美元成交。责任编辑：邓健
上海石化化工部乙二醇装置区域发生火情,上海石化火情造成1人死亡 1人受伤,北京日报客户端,2022年06月18日 10:34,6月18日4时左右，中石化化工部乙二醇装置区域发生火情。经初步核实，目前事故导致上海石化一名员工手臂轻微擦伤，一名第三方运输车辆驾驶员死亡，具体原因正在进一步调查。责任编辑：陈悠然
证券,什么情况？遭河南卢氏农商行“无故划扣”存款近1亿，*ST紫晶起诉至法院！,每日经济新闻,2022年06月18日 10:33,原标题：什么情况？遭河南一农商行“无故划扣”存款近1亿元，这家广东上市公司起诉至法院！一家科创板上市公司称河南一家农商行无故划扣其存款9868.39万元，该公司已向法院提起诉讼。6月16日，科创板“光存储第一股”（维权）（SH688086，“戴帽”前股票名“紫晶存储”，股价8.32元，市值15.84亿元）发布公告称，就公司与河南卢氏农村商业银行股份有限公司（以下简称卢氏农商行）之间的储蓄存款合同纠纷向河南省三门峡市中级人民法院提起诉讼。截至公告日，该案件已受理，尚未开庭审理。公开资料显示，*ST紫晶成立于2010年，主营光存储介质、光存储设备等。两年前，*ST紫晶还带着“光存储第一股”的光环登陆科创版，如今在违规担保、利润亏损以及被银行划扣近亿元存款等一系列负面因素影响下，公司或有成为科创板“退市第一股”的风险。上市公司称近1亿元存款被“无故划扣”6月16日，广东紫晶信息存储技术股份有限公司连发两则公告《*ST紫晶：关于公司提起诉讼的公告》、《*ST紫晶：关于公司及实际控制人涉及诉讼的更正及新增诉讼事项的公告》披露了此事经过。*ST紫晶在第一份《*ST紫晶：关于公司提起诉讼的公告》公告中叙述了与河南卢氏农村商业银行之间的储蓄存款纠纷过程。2021年4月至2022年2月，公司在河南卢氏农商行开设了多个银行账户，先后存入8500万元作为定期存款；今年3月20日，河南卢氏农商行无故划扣上述存款7575.85万元；3月28日，卢氏农商行再次无故划扣2292.54万元。上述扣款事件发生后，*ST紫晶在公告中表示：“公司财务人员按照卢氏农商的规定携带有关资料交涉，但该银行却拒不办理银行UKEY挂失及资金转账业务。在经过多次交涉后，卢氏农商行仅同意*ST紫晶划转339.31万元，剩余924.15万元仍拒不办理资金转账业务。”综上所述，河南卢氏农商行共划扣*ST紫晶存款9868.39万元，并且拒绝办理剩余924.15万元银行资金转账业务。*ST紫晶多次要求河南卢氏农商行予以返还、配合，但被告至今未返还且拒绝配合，为维护合法权益，对上述诉讼事件给上市公司损益带来的影响，*ST紫晶表示，该案如公司胜诉，可全部或部分收回对应存单金额，对公司的日常经营活动产生积极的影响；如公司败诉，则导致已被划扣的资金无法收回、相关账户出现资金减少的情况，可能造成公司确认预计负债和损失，可能引发影响公司日常正常经营的风险。*ST紫晶还表示：“目前无法预估相关诉讼对损益方面的具体影响金额。”疑事起实控人授意违规担保实际上，*ST紫晶的投资者对卢氏农商行并不陌生。2月12日，*ST紫晶发布因信披违法违规被证监会立案调查的公告。一个月后，*ST紫晶披露自查涉及违规担保事项的公告称：“截至2022年3月10日，公司及子公司广州紫晶、梅州晶铠存在以银行定期存单对外提供违规质押担保的情况，合计金额3.73亿元，共为14家第三方累计提供16笔担保。”担保明细显示，*ST紫晶违规担保涉及的14家被担保人中，一家公司为上市公司客户，另外10家卢氏县企业与上市公司客户三门峡灵云大数据科技有限公司、深圳中农信大数据服务有限公司之关联方卢氏县中农信大数据科技有限公司存在相同自然人交叉任职或持股情况，且息显示联系电话号码相同。经*ST紫晶向实际控制人之一、董事长郑穆确认，上述违规担保事项系其本人授意安排完成，上市公司未履行法律法规及公司章程规定的审议或信息披露义务，公司法定代表人郑穆、广州紫晶法定代表人罗铁威及梅州晶铠法定代表人钟国裕分别签署存单质押协议。在当时的公告中，*ST紫晶坦言上述违规担保事项如被担保对象不能按期还款，且贷款无法展期，公司及相关子公司用于违规担保的定期存款存在被划扣的风险。因上述违规担保问题，可能导致公司承担相关担保义务，可能造成公司确认预计负债和损失，可能引发影响公司日常正常经营的风险。受上述事件影响，*ST紫晶分别于3月13日、3月17日、3月23日、4月18日收到上交所下发的与违规担保相关的问询函，上交所要求其说明违规担保发生的原因、背景及资金去向等。但*ST紫晶数次延期回复问询函。河南农信社工作人员：扣划一般都是司法扣划*ST紫晶公告称，其在河南卢氏农商行的存款被该行无故扣划9868.39万元，并且银行拒绝办理剩余924.15万元银行资金转账业务，要求卢氏农商行返还其银行存款1.08亿元并支付利息。对于这一说法，每日经济新闻记者于今日（6月17日）下午拨打卢氏农商行的上级管理部门河南农信社官网上的联系电话，相关工作人员表示：“银行没有这个权限，扣划一般都是司法扣划，看一下这个公司是不是有司法案件。”记者随即拨打上述河南农信社人士给的卢氏农商行电话，对方是卢氏农商行营业部工作人员。对于上市公司公告提出的无故扣划存款资金的表述，该工作人员向记者表示，“我不知道”，并进一步表示，“如果无故扣划客户资金，客户会来调查。”公告显示，截至2022年3月10日，*ST紫晶存于河南卢氏农商行有7张定额存单，金额总计8500万元。此外账户还有活期存款余额2629.43万元。根据今年4月从卢氏农商行获取的银行对账单及交易明细清单，上述7张定期存单以“质扣”名义于2022年3月20日被划扣合计7575.85万元，活期存款以“法扣”名义于2022年3月28日被划扣2292.54万元，合计被划扣金额为9868.39万元。截至4月19日，上述银行账户余额合计为1263.46万元。北京京师律师事务所律师孟博今日接受每日经济新闻记者微信采访时表示，根据《上市公司监管指引第8号——上市公司资金往来、对外担保的监管要求》第七条的规定，上市公司对外担保必须经董事会或者股东大会审议。根据《关于适用〈中华人民共和国民法典〉有关担保制度的解释》第九条的规定，相对人根据上市公司公开披露的关于担保事项已经董事会或者股东大会决议通过的信息，与上市公司订立担保合同，相对人主张担保合同对上市公司发生效力，并由上市公司承担担保责任的，人民法院应予支持。相对人未根据上市公司公开披露的关于担保事项已经董事会或者股东大会决议通过的信息，与上市公司订立担保合同，上市公司主张担保合同对其不发生效力，且不承担担保责任或者赔偿责任的，人民法院应予支持。去年业绩巨亏2.29亿元另一方面，该事件最令外界好奇的是，为什么一家位于广东省的上市公司，要将一笔巨额资金存放在河南的一家农商行呢？对此，《每日经济新闻》记者联系*ST紫晶方面了解情况，但截至发稿尚未获得回应。公开资料显示，*ST紫晶成立于2010年，主营光存储介质、光存储设备等。公司于2020年2月26日登陆科创板，上市首日公司股价大涨264.08%。相比当年的风光无限，如今的*ST紫晶已是风波不断。除了被证监会立案调查外，上市公司去年业绩也是大幅下降。4月30日，*ST紫晶发布2021年年度报告显示，去年公司实现营业收入4.58亿元，同比下降6.69%；归属于上市公司股东的净利润﹣2.29亿元，同比骤降379.85%；2022年一季度，*ST紫晶实现归属于上市公司股东的净利润﹣1.00亿元，同比骤降1090.17%。业绩下降同时，这份年报还被中喜会计师事务所出具了无法表示意见的审计报告。“我们无法获取充分的审计证据判断截至报告报出日质押担保事项信息的准确性和完整性，无法判断违规担保对财务报表的影响金额。”另据《科创板上市规则》相关规定，今年4月*ST紫晶被实施退市风险警示，股票简称也由“紫晶存储”变更为“*ST紫晶”。王晶张寿林责任编辑：陈悠然
巴菲特慈善午餐拍卖以1900万美元成交,1900万美元！巴菲特“最后的慈善午餐”史上最贵,市场资讯,2022年06月18日 10:33,1900万美元！巴菲特“最后的慈善午餐”史上最贵文章来源：华尔街见闻直到截止拍卖前的最后30秒，价格还在1300万美元。当地时间6月17日周五晚22：30，巴菲特慈善午餐的拍卖结束，巴菲特午餐拍卖最终以1900万美元成交，拍卖价远超此前记录。直到截止拍卖前的最后30秒，价格还在1300万美元。责任编辑：李园
上海石化化工部乙二醇装置区域发生火情,上海石化：目前事故致1名员工手臂轻微擦伤，1名第三方驾驶员死亡,界面新闻,2022年06月18日 10:33,据@在线微博6月18日消息，经初步核实，目前事故导致上海石化一名员工手臂轻微擦伤，一名第三方运输车辆驾驶员死亡，具体原因正在进一步调查。责任编辑：邓健
国际财经,美国下达扣押令后，俄寡头价值3亿美元超级游艇驶抵夏威夷,澎湃新闻,2022年06月18日 10:32,澎湃新闻记者南博一俄超级游艇“Amadea”。美国上个月要求斐济扣押的一艘俄罗斯寡头的超级游艇，日前已抵达夏威夷，停泊在该州首府檀香山。自俄乌冲突爆发以来，美国司法部一直专注于扣押俄罗斯寡头的游艇和其他奢侈资产，以期向俄总统普京施压。据路透社17日报道，今年4月，俄超级游艇“Amadea”从墨西哥驶进斐济，随后在当地被扣押。美国方面称，这艘价值3亿美元的游艇归属于受到制裁的俄罗斯寡头苏莱曼·克里莫夫，该游艇自2月24日俄乌冲突爆发后立即关闭了自动信息系统。应美国的要求，斐济法院批准扣押这艘游艇，6月16日驶抵夏威夷。美国司法部5月发布声明称，对俄超级游艇实施扣押，是因为证据显示该船只违反了美国法律，涉嫌洗钱和共谋犯罪。据彭博社报道，克里莫夫家族曾持有俄最大黄金生产商Polyus近一半的股份，这家总部位于莫斯科的采矿勘探公司拥有超过一亿盎司的已探明黄金储量。克利莫夫曾因2014年和2018年俄罗斯在叙利亚和乌克兰的行动而遭到美国的制裁。责任编辑：邓健
上海石化化工部乙二醇装置区域发生火情,上海石化：事故致一名员工手臂轻微擦伤，一名第三方运输车辆驾驶员死亡,环球网,2022年06月18日 10:31,经初步核实，目前事故导致一名员工手臂轻微擦伤，一名第三方运输车辆驾驶员死亡，具体原因正在进一步调查。责任编辑：陈悠然
上海石化化工部乙二醇装置区域发生火情,最新！上海石化火灾已致一人死亡！上海石化：同步启动了环境应急预案，正在实施保护性燃烧,每日经济新闻,2022年06月18日 10:25,每经编辑杜宇据官方微博，18日4时左右，中石化化工部乙二醇装置区域发生火情。目前，现场火势已经得到控制，正在实施保护性燃烧。据悉，火情发生后，中石化上海石化同步启动了环境应急预案，对公司厂界及外部区域持续进行环境监测，挥发性有机物监测正常。已经安排加强雨水排口采样、监控，目前未发现对周边水体环境造成影响。目前，现场火势已经得到有效控制，正在实施保护性燃烧。火灾发生后，上海市119指挥中心接警后迅速调派金山、奉贤、化工区等救援力量至现场进行扑救。上海化学工业区消防救援支队相关人员表示，截至18日9时许，火势基本被控制，但处置难度较大，预计可能仍会保护性燃烧一段时间。经初步了解，火灾已造成一人死亡。上海石化在线官方微博发布消息称，火情发生后，上海石化同步启动了环境应急预案，对公司厂界及外部区域持续进行环境监测，挥发性有机物监测正常。已经安排加强雨水排口采样、监控，目前未发现对周边水体环境造成影响。目前，现场火势已经得到有效控制，正在实施保护性燃烧。据官网信息，上海石油化工股份有限公司是化工股份有限公司的控股子公司，位于上海市金山区，是中国主要的炼油化工一体化企业之一，也是国内重要的成品油、中间石化产品、合成树脂和合成纤维生产基地。上海石化（SH600688，股价3.35元，市值362.6亿元）2021年度企业社会责任报告显示，公司2019年、2020年、2021年均未发生重大火灾爆炸事故。上海石化2021年年报介绍，乙二醇是公司主要产品之一，公司环氧乙烷/乙二醇装置设计产能52.5万吨，2021年乙二醇产量15.07万吨，较2020年23.67万吨同比减少36.33%，销量则为4.14万吨，较2020年的12.73万吨下降67.48%。2022年，上海石化计划生产乙二醇10.3万吨。此外，上海石化2021年年报介绍，报告期内，公司环保总投资为3.93亿元，占营业收入比重为0.50%。上海石化提及，公司以新版HSE（健康、安全和环境保护）管理体系的有效运行夯实安全环保根基，牢固树立体系思维，加强关键环节过程管控，提升装置平稳运行水平。强化安全、环保依法合规，抓实员工技能培训，持续开展“优良日”活动，切实提升员工安全行为规范，筑牢安全环保防线。每日经济新闻综合新华网、上海石化在线官方微博、公开消息封面图片来源：摄图网-500911049责任编辑：陈悠然
美股,美国天然气生产商Aethon考虑IPO，估值超100亿美元,界面新闻,2022年06月18日 10:24,彭博6月17日援引消息人士报道，美国天然气生产商AethonEnergyManagement考虑进行首次公开募股（IPO），预计估计超100亿美元。据悉，Aethon还在考虑其他选择，包括出售在路易斯安那州北部的资产。Aethon是美国Haynesville页岩盆地最活跃的钻探商，该盆地横跨得克萨斯州东部和路易斯安那州北部，靠近墨西哥湾沿岸的多个液化天然气出口码头。责任编辑：李园
上海石化化工部乙二醇装置区域发生火情,上海石化火灾致1人死亡，安全生产投入同比降60%，周边居民：空气有异味,时代周报-时代在线,2022年06月18日 10:19,据消息，18日4时左右，中石化化工部乙二醇装置区域发生火情。目前，现场火势已经得到控制，正在实施保护性燃烧。火灾发生后，上海市119指挥中心接警后迅速调派金山、奉贤、化工区等救援力量至现场进行扑救。上海化学工业区消防救援支队相关人员表示，截至18日9时许，火势基本被控制，但处置难度较大，预计可能仍会保护性燃烧一段时间。经初步了解，火灾已造成一人死亡。住在离化工厂2公里左右的居民小羊告诉时代周报记者：“半夜4：25左右，在床上听到好几声爆炸声，最后一下特别响。一开始我还以为是有人搬铁片掉地上的声音。后来觉得不对劲，睁眼一看就看到了很强的光亮。一看朋友圈说是爆炸了，我就去窗边看，离家特别近，火烧得很厉害，火燃烧的声音到现在还有。”小羊补充称，从他家看去，八点多燃烧的火才灭了。“感觉空气里有异味，火烧味特别大。”根据周边市民拍摄的视频显示，爆炸发生后，明火点开始燃烧，爆炸所产生的浓烟向市区飘散。乙二醇是无色无臭、有甜味的液体，对动物有低毒性。由于是防冻液的主要成分，国外的急性中毒多系因误服，症状为反复发作性昏厥，并可有眼球震颤，淋巴细胞增多，严重时表现为不同程度的肾功能衰竭。国内尚未出现本品急慢性中毒报道。据上海石化官网，上海石化的前身是创建于1972年的上海石油化工总厂，起初是为解决全国8亿多人穿衣难问题，由中央引进化纤设备，并选址落户上海金山，而6月18日刚好是其建厂50周年。目前上海石化称公司乙二醇设计产量为38万吨/年。截至2021年，上海石化累计实现利税2580多亿元。根据上海石化披露的社会责任报告，2019至2021年，公司安全生产投入分别为23478万元、28472万元和11237万元。2021年同比下降60%。截至18日上午9点08分，中石化上海石化同步启动了环境应急预案，对公司厂界及外部区域持续进行环境监测，挥发性有机物监测正常。已经安排加强雨水排口采样、监控，目前未发现对周边水体环境造成影响。目前，现场火势已经得到有效控制，正在实施保护性燃烧。责任编辑：邓健
巴菲特慈善午餐拍卖以1900万美元成交,巴菲特称最后一次拍卖慈善午餐 媒体：未来或由其子女延续,参考消息,2022年06月18日 10:19,参考消息网6月18日报道据新加坡《联合早报》网站报道，天下虽然没有免费的午餐，但花300万美元吃一顿，你愿意吗？这是股神巴菲特在年度eBay拍卖与他共进午餐的领先标价。报道称，这个巴菲特的“传统活动”在过去两年因为新冠疫情暂停。今年再次恢复，但是91岁高龄的巴菲特却称，这将是他最后一次为慈善举行午餐竞标活动。这个竞标活动将在当地时间6月17日结束。2019年5月4日，在美国内布拉斯加州奥马哈市，美国伯克希尔-哈撒韦公司董事会主席沃伦·巴菲特在2019年度股东大会开幕前回答记者提问。新华社据报道，自从2000年开始，伯克希尔—哈撒韦公司董事长兼首席执行官巴菲特就通过这个方式，筹集了将近3500万美元的善款。这个“午餐传统”的收益都捐给格莱德基金会（Glide）。这是一个促进社会正义和摆脱贫困的中心。报道称，成功投标者可以带最多7名客人与巴菲特共进午餐。而这个午餐地点通常是纽约的一家史密斯-沃伦斯基牛排餐馆（Smith&Wollensky）。报道指出，虽然巴菲特说过在今年之后，他将不再参与这个午餐拍卖活动，但是，伯克希尔—哈撒韦公司的这个午餐拍卖传统相信会继续下去。未来的活动或许会是巴菲特的三个孩子，尤其是伯克希尔董事会成员霍华德·巴菲特和苏珊·巴菲特延续下去。责任编辑：李园
荣宝斋350周年,我眼中的荣宝斋 | 范曾：荣宝斋在中国绘画史上的功劳是非常巨大的,市场资讯,2022年06月18日 10:17,《我眼中的荣宝斋》第6期嘉宾范曾著名画家上个世纪70年代，那个时候应该讲是荣宝斋对我提拔。因为作为青年的画家，能够挂画在荣宝斋，当时我们青年人都认为很光荣。倒不是为了挣钱，而是因为这个地方我觉得是很高贵的。差不多同时我又生病了，当时我就和米景扬商量，我说我想画本《鲁迅小说插图集》。因为鲁迅啊是个伟大的文学家，可他留下的小说就是《呐喊》、《彷徨》和《故事新编》。我说我把这三本书的插图都画了，你们荣宝斋出版。大米（米景扬）说太好了。当时我还是需要输液，我说能不能在脚上插针去输液。那我就在协和医院的病床上，大概就是住院三个月时间完成的。当时大米也没数，他就印了20万本。结果20万本你们荣宝斋库房都堆满了，可是很快就卖光了，很快。这就是当时出版的《鲁迅小说插图》。我举个例子：这张鲁迅的像，杨振宁先生讲“我看到画的鲁迅的像很多，可是这张特别像他的气质”。其实就是白描，当时虽然才三十八岁，可是白描这种我完全就是毛笔直接画，不起前面的（墨）稿的。当时一天啊大概能画一张，一直到今天都可以讲是一个经典。小学、中学、大学课本里用插图都用我这个，可以讲说我平时做的事情里面值得纪念的大事。荣宝斋呢每年啊都希望我在春节的时候在荣宝斋开个展览，可能我在美术界的影响力比较大。另外呢就像荣宝斋需要有一个振奋人心的活动，来使新年充满一些节日的气氛，这样呢我每年都答应。我的展览会呢印了专门的画册，有100本是我的签名的，要排队买，开馆才能买。群众们从第一天晚上就排队要买这本我签名的书。我说太冷了，而且第二天是春节，干脆提前几天。都挤满了人，我说大家都过来一起照个相，大概有100多人照相。我说荣宝斋记住这个底片，你叫他们每个人留个地址，印一百张，每个人一张给他寄去。荣宝斋对我不是帮助，我不讲有恩惠嘛。荣宝斋和我这几十年交情我不会忘记的。它的起点高、立足点高。第二就是经营的那种合理性，没有任何欺诈，再加上和当代艺术家的一个情感。责任编辑：王翔
荣宝斋350周年,卢禹舜：感激荣宝斋为社会所做出的巨大贡献,市场资讯,2022年06月18日 10:16,责任编辑：王翔
美股,法国巴黎银行据悉已向荷政府表达收购荷兰银行意向,界面新闻,2022年06月18日 10:15,据路透社6月17日报道，一位知情人士称，法国已向荷兰政府表示有兴趣收购荷兰银行（ABNAmro），并补充说荷兰财政部目前没有寻求这样的交易。报道称，法国巴黎银行和荷兰银行的合并，将是欧洲银行业期待已久的整合运动中的第一笔重大跨境交易。另一位消息人士表示，巴黎银行没有参与收购荷兰银行的任何进程，并说这不符合法国银行的战略。荷兰财政部表示，它最近向为政府持有资产的机构NLFI征求“关于进一步出售荷兰银行的股份”的意见但不愿对出售的“具体考虑”发表评论。荷兰银行的一位发言人表示，该银行不会评论“市场传言”。2008年金融危机时，荷兰政府收购了富通银行所拥有的荷兰银行股份。此后，荷兰银行已将其业务重点转向荷兰市场，去年在连续亏损后，结束了国际贸易和商品融资业务。责任编辑：李园
