板块名,标题,作者,日期,新闻内容
延安必康因信披违规被立案,控股股东资金占用、违规担保合计超28亿，锂电新贵延安必康或“戴帽”,界面新闻,2022年01月13日 21:41,记者|陈慧东（维权）（002411.SZ）或将“戴帽”。1月13日晚间，延安必康公告称，截至目前，公司控股股东及其关联方非经营性占用公司资金余额为7500万元；公司子公司徐州北盟物流有限公司在收购前为公司控股股东及实际控制人提供担保金额为27.96亿元，至今仍在担保期间；子公司西安福迪医药科技开发有限公司违规对外提供质押担保0.8亿元，该质押担保已于2021年8月16日解除。如果上述资金占用和违规担保事项不能在2022年1月27日之前解决，公司股票将被实施其他风险警示。上述公告显示，延安必康于2021年12月31日收到证监会陕西监管局下发的《行政监管措施决定书》，公司存在控股股东及其关联方非经营性占用公司资金、违规对外担保的情形。公司于1月4日收到深交所下发的关注函，要求公司在1月13日前就相关事项做出书面说明。延安必康称，鉴于关注函中问题所涉及的事项较多、工作量较大，相关问题尚需进一步核实和完善，补充相应资料，加之目前受西安新型冠状病毒肺炎影响，给回复工作带来一定难度。为切实稳妥做好关注函回复工作，确保回复内容的真实、准确、完整，经公司审慎研究后，已向深交所上市公司管理部申请延期至2022年1月27日前回复关注函。至于已采取及拟采取的措施，延安必康称，公司将持续督促控股股东、实际控制人采取切实有效的措施积极筹措资金尽快偿还占用的资金，解除上述违规担保事项，以消除对公司的影响。公司控股股东及实际控制人出具了《关于解决资金占用及违规担保情况的承诺函》，承诺在1月27日前以现金方式偿还所占用资金；实际控制人承诺在2022年1月27日前解除北盟物流涉及的上述担保事项，若该担保事项造成公司损失，由公司实际控制人以自有资产进行弥补。深交所1月4日向延安必康下发的关注函，主要聚焦于上述两桩担保事项的具体情况，疫情上市公司说明拟采取的解除担保的具体措施及期限，并要求公司全面自查是否存在其他应披露未披露的事项，包括但不限于资金占用、违规担保、重大诉讼与仲裁、账户冻结、股份冻结、债务逾期、关联交易等。事实上，延安必康控股股东、实际控制人的偿债能力已不乐观。2021年6月，因不能清偿到期债务，且明显缺乏清偿能力，延安必康控股股东新沂必康被申请破产重组。天眼查APP显示，新沂必康于2021年2月5日被列为失信被执行人，三次被法院列为限制高消费企业。根据延安必康2021年5月13日公告，公司实际控制人李宗松因债务问题被列入失信被执行人名单。据界面新闻此前报道，延安必康成立于2002年12月，公司原名为江苏必康制药股份有限公司。2015年12月，延安必康借壳九九久登陆深交所。2018年，公司证券简称变更为延安必康。上市以来，延安必康业绩持续萎靡。2017年至2020年，公司归属于上市公司股东的净利润均现下滑。2020年，延安必康深陷财务造假风波并遭监管部门处罚，上市公司控股股东资金占用问题、债券兑付问题、信披违规等问题缠身，上市公司各主营板块业务随即“遭殃”，年内公司净亏损10.71亿元。年内，公司股价跌幅达67%。然而，凭借着2021年六氟磷酸锂的“史诗级”行情，延安必康当年上演了业绩的“翻身”。根据公司2021年10月29日披露的公告，公司预计全年净利润为9.5亿元-10亿元，同比增长188.72%-193.39%。截至1月13日收盘，延安必康报10.74元/股，已较2021年9月走出的股价高点17.99元/股跌去四成。责任编辑：李思泉
因投行业务不规范,准备掏68亿迎娶国融证券的青岛国信，为何变卦了？,市场资讯,2022年01月13日 20:38,作者|武丽娟来源|独角金融去年4月，青岛国资旗下青岛国信发展（集团）有限责任公司（下称“青岛国信”）计划收购国融证券，。作为国融证券大股东、持股比例超70%的北京长安投资集团有限公司（下称“长安投资”），也少了一笔很重要的资金。从公开信息看，青岛国信对国融证券的收购计划最早发起于2021年4月份。根据国信集团公告，已与协议各方签订了股权转让协议及增资协议，。来源：青岛国信2021年4月7日公告以上公告显示，本次交易尚需履行青岛市国资委审批及中国证监会及其派出机构的审批/备案。按照该计划，青岛国资有望通过青岛国信的收购成为国融证券的实际控制人，但在9个多月期间，一直没有相关进展。此前，有关收购计划搁浅的传闻不绝于耳。不过，直到2021年1月11日，青岛国信才正式官宣这一消息。根据最新公告，收购国融证券的先决条件未能成就，有市场人士分析认为，未成就的“先决条件”即此次交易没有通过审批。来源：青岛国信2022年1月12日公告对此，。国融证券与青岛国信缘何未能“牵手”？近年来，青岛持续推进金融科技发展，取得了显著成绩。2020年3月，山东省首家公募基金管理公司——兴华基金落户国际院士港，青岛也由此成为继北京、天津之后，北方第三座拥有公募基金管理公司的城市。2020年12月，第一家法人期货公司被批准设立，花落青岛。至此，。可以说，金融业已成为青岛名副其实的重要产业。2021年5月18日，青岛国资持巨资成为第二大股东的联储证券总部正式迁址崂山，7月，联储证券获得经营证券期货业务许可证，成为青岛第一家全牌照法人证券公司，联储证券落户青岛事项正式收官。在青岛国信的综合金融版图上，无论是银行、信托、保险、公募基金、券商金融主力军，还是其他类金融业务，各色牌照均已齐备。不过，青岛国信仍意欲通过股权并购等方式继续寻求券商牌照，而收购国融证券正是青岛强化金融领域建设的动作之一，也是完成青岛国资的“一参一控”布局的重要一环。根。对于此次交易的告吹，市场人士大多认为与定价较高及国融证券自身发展状况有关。相比联储证券，从初步接洽到项目协议签署仅仅两个月的进展，国融证券的收购进程显然阻力不小。而且，。目前内蒙古仅有恒泰、国融两家券商，其中恒泰证券30%的股权已经被收购。因此，。。此前证券公司交易的市场价确实如此。2021年10月，新时代证券股权转让的挂牌底价PB约为1.4倍；获青岛国资增资入股后迁址青岛的联储证券，其PB估值约为1.49倍；天风证券受让恒泰证券的PB约为1.5倍；泛海系对外转让民生证券股权的PB则仅为1.14倍。该人士认为，作为一个国有控股的公司，高溢价去买一个证券公司，要承担很大的风险。其次，。所以，青岛国信基本上算买一块证券牌照，如此高溢价，肯定不合理。证券行业的收购并非易事，失败的案例不在少数。比如，2020年6月，曾因交易价格、经营风险等因素而放弃收购证券；2020年10月，因交易相关方未能就转让及合并方案的部分核心条款达成一致意见，与重组告吹；2021年，、先后终止了新时代证券的股权收购事宜。国融证券前身为日信证券，于2002年04月24日在呼和浩特市成立。彼时，日信证券的股东包括“北京长安投资集团有限公司”、“北京华联集团投资控股有限公司”、“内蒙古日信担保投资（集团）有限公司”等国内知名大中型国企，因此，当时还是国有控股。从2005年开始，国融证券实控人侯守法通过长安投资代持国融证券原有股东的股份，实际上已经拿下大股东之位。2015年8月下旬，诸暨楚萦投资管理中心（有限合伙）（下称“楚萦投资”）以4元/股的价格从长安投资手中受让了5000万股国融证券股权，但彼时国融证券的每股净资产仅为1.43元。双方达成一致意见：如果国融证券不能在新三板市场挂牌，或者价格不能高于上述接手价格，则长安投资需要按照原价回购上述股份。2016年，日信证券增资扩股、完成改制并更名为“国融证券股份有限公司”。。但国融证券未将此事报告内蒙证监局。当时，侯守法表示，改制更名，是公司历史上的一个重要里程碑，标志着国融证券新三板挂牌工作已进入实质性阶段。但至今，。来源：罐头图库2020年7月，股东楚萦投资将长安投资告上法庭，要求长安投资回购国融证券股份。北京二中院2020年12月30日判决长安投资败诉，长安投资共计需向楚萦投资支付1.51亿元。不过，2021年7月29日，二审裁定驳回了楚萦投资的诉讼请求。目前，国融证券上市之路没有进展，不排除其他股东如法炮制。。这无疑给长安投资带来了压力。同时，长安投资有规模约1亿元的私募债“20长安01”2023年7月将到期。此外，。2019年1月31日，国融基金首任董事长丁险峰离职；2020年7月17日，首任总经理李宇龙离职；2020年7月30日，总经理助理、首任投资总监田宏伟离职。。2019年，证监会称国融证券存在：风险控制流于形式；经营管理混乱、业务隔离要求没有落实；业务管控缺失，如对公司投顾产品缺乏有效监控等问题，限制国融证券债券自营业务6个月、暂停资产管理产品备案一年。2020年12月31日，国融证券作为“18腾冲01”债的受托管理人，未能采取有效措施督促发行人规范使用募集资金，且未在云南监管局组织的自查工作中如实报告发行人存在将募集资金转借他人的情况，而被出具警示函。频繁的罚单，对券商自身声誉评价产生一定影响，也可能影响券商的评级表现。2019年证券公司分类结果，其中国融证券连降5级，由BBB降至C，成为分类评级跌幅最大的券商。2020年为BBB，2021年评级为BB，下降一级。业绩方面，自2016年以来，国融证券净利润和营收较为波动。2016年—2020年净利润分别为0.96亿元、0.64亿元、0.12亿元、0.26亿元、1亿元；2016年—2020年营业收入分别为7.15亿元、8.22亿元、8.64亿元、12.31亿元、10.46亿元。据wind数据，2021年中报显示，。伴随净利润的波动，国融证券的信用减值损失前几年持续大幅增长，其中，2015年—2019年，其资产减值损失分别为0.01亿元、0.11亿元、0.14亿元、0.9亿元，3.93亿元，不过，2020年为-0.16亿元。来源：wind不过，。此前的2020年国融证券经纪业务实现营业净收入1.23亿元，同比增长26.96%；投资银行业务、自营业务、资产管理业务营业净收入则出现了不同程度的滑坡，分别同比减少10.41%、36.82%、0.26%。2022年1月8日，在第26届中国资本市场论坛上，国融证券董事长侯守法表示，在注册制时代下，中介机构商业机会大增，但商业模式也将产生颠覆式的影响，券商投行的项目定价以及承销能力将逐步成为其核心竞争力。这需要券商投行有强大的行业研究团队及机构投资者资源做支持。2019年债券总承销金额274.36亿元，同比上升148.36%，承销规模排名第35位，行业排名较2018年上升13名。，主承销债券317.44亿元，同比增长15.59%，债券总承销规模排名第39位。看起来，国融证券这块牌照，虽然有历史遗留问题，但是也不乏后劲。责任编辑：冯体炜
投行业务存在系列问题,信达证券营业部及负责人被罚：员工非法炒股亏损642万元,澎湃新闻,2022年01月13日 20:19,原标题：信达证券营业部及负责人被罚：员工非法炒股亏损642万元近日，安徽证监局开出2022年首张券商罚单。信达证券股份有限公司（以下简称“信达证券”）蚌埠淮河路证券营业部及该营业部负责人，被安徽证监局采取相应监管措施。安徽证监局官网公告显示，因违规销售金融产品和对员工执业行为缺乏有效约束，信达证券蚌埠淮河路营业部被采取责令改正的行政监管措施。时任该营业部负责人的姚佐根，则被采取出具警示函的行政监管措施。据了解，2021年6月，信达证券蚌埠淮河路营业部员工周洪涛，因任职期间非法炒股，累计交易金额多达约12亿元，扣除佣金税费后亏损642.26万元，被安徽证监局处罚。因违反投资者适当性要求及对员工执业行为缺乏有效约束，信达证券营业部及负责人均被采取相应监管措施官网公告显示，1月11日，安徽证监局发布了《关于对信达证券蚌埠淮河路营业部采取责令改正措施的决定》称，经查，该营业部存在以下问题：一是在2014年至2015年期间，违反投资者适当性要求，违规销售多支金融产品。二是对员工执业行为缺乏有效约束，管控不到位。安徽证监局表示，根据相关规定，决定对信达证券蚌埠淮河路营业部采取责令改正的行政监管措施，并记入证券期货市场诚信档案。安徽证监局强调，信达证券蚌埠淮河路营业部应引以为戒，按照监管规定要求进一步强化营业部内部管理，切实提高合规管理水平，杜绝类似问题再次发生，同时应对相关责任人员进行内部问责。1月12日，安徽证监局发布了《关于对姚佐根采取出具警示函监管措施的决定》，指出姚佐根在担任信达证券蚌埠淮河路证券营业部负责人期间，因营业部存在上述两方面问题，根据相关规定，决定对姚佐根采取出具警示函的行政监管措施，并记入证券期货市场诚信档案。该营业部员工因非法炒股2021年6月被处罚，交易约12亿元亏损达642万元安徽证监局官网资料显示，本次被采取相应监管措施的信达证券蚌埠淮河路营业部，2021年6月份，有员工因非法炒股被处罚。2021年6月11日，安徽证监局发布了《中国证券监督管理委员会安徽监管局行政处罚决定书〔2021〕2号》（以下简称“《处罚书》”），指出经查明，周洪涛在信达证券蚌埠淮河路营业部任职期间，存在以下违法事实：2014年2月12日至2020年9月11日，周洪涛借用开立于信达证券蚌埠淮河路营业部的“王某某”“曹某”等10人共计15个证券账户从事股票交易行为。相关账户在周洪涛控制期间累计买入6838.45万股，买入金额5.95亿元，累计卖出6835.90万股，卖出金额5.95亿元，扣除佣金税费后，亏损642.26万元。《处罚书》表示，基于上述事实，周洪涛作为证券从业人员，在信达证券蚌埠淮河路营业部任职期间，借用他人账户买卖股票，违反了《证券法》第四十条第一款的规定，构成了《证券法》第一百八十七条所述违法行为。《处罚书》显示，虽然周洪涛提出了个别涉案账户初始开立目的并非用于买卖股票，相关账户交易行为经客户同意的申辩意见。但安徽证监局复核后认为，相关账户初始开立动机与后续买卖股票行为无必然联系，不影响对周洪涛违法买卖股票行为的定性，其主张账户交易行为经客户同意，缺乏相关证据证明，故对其陈述、申辩意见不予采纳。安徽证监局指出，根据当事人违法行为的事实、性质、情节与社会危害程度，依据《证券法》第一百八十七条规定，决定责令周洪涛依法处理非法持有的股票，并处以20万元罚款。严监管持续，2021年多名从业人员因违规炒股受罚违规炒股一直是券商从业人员不可逾越的红线。新修订的《证券法》延续并强化了相关规定。具体而言，《证券法》第四十条明确规定，“证券交易场所、证券公司和证券登记结算机构的从业人员，证券监督管理机构的工作人员以及法律、行政法规规定禁止参与股票交易的其他人员，在任期或者法定限期内，不得直接或者以化名、借他人名义持有、买卖股票或者其他具有股权性质的证券，也不得收受他人赠送的股票或者其他具有股权性质的证券。”《证券法》第一百八十七条明确规定，法律、行政法规规定禁止参与股票交易的人员，直接或者以化名、借他人名义持有、买卖股票或者其他具有股权性质的证券的，责令依法处理非法持有的股票、其他具有股权性质的证券，没收违法所得，并处以买卖证券等值以下的罚款；属于国家工作人员的，还应当依法给予处分。相关统计显示，违规炒股目前依然是证券从业人员违法违规行为的重灾区。不过，监管对此也延续了“强监管”态势。公开数据显示，仅在2021年上半年，证监会开出的119张罚单中，涉及证券从业人员违规炒股、代客理财的罚单便有15张。其中，不乏证券公司的管理人员。例如，2021年4月20日，四川证监局市场禁入决定书显示，银泰证券成都顺城大街营业部总经理刘佳杰因违规炒股，除被处以3年市场禁入之外，还被罚没了1430万元。2021年5月25日，湖北证监局对万和证券湖北分公司前总经理帖某卫的违规炒股行为进行判罚，对帖某卫借用他人账户买卖股票的行为，湖北证监局决定对帖某卫处以20万元罚款。责任编辑：李思泉
新浪科技,肯德基被点名 盲盒营销别“走火入魔”,中国经济网,2022年01月13日 16:03,联名款潮玩，很叫人“上瘾”。尤其对于年轻消费者来说，“走火入魔”的故事历来就很多。在中消协点名之前，此款“盲盒套餐”已经有跑偏的诸多迹象：比如为了集齐整套盲盒玩偶，有消费者甚至不惜一次性斥资超万元购买百份套餐；更有消费者为“求娃”而购买“代吃”服务，即为获得盲盒雇人代买代吃套餐……很显然，既然涉及食物浪费等底线问题，这就不只是商业范畴的家务事。联名无罪，潮玩有理——那么，为什么肯德基和泡泡玛特的联姻被中消协点名批评？说到底，无非两个原因：一是商业逻辑也是有边界的。说得更直白一些，周瑜打黄盖的市场交易，也总要在公序良俗的规矩之内。因为钱虽然是你的，资源却是大家的。二是企业总要讲究社会责任的。挣钱纳税是一回事，价值导向是另一回事。比如餐饮企业如果一味用流量思维做生意、罔顾资源浪费的示范效应，这显然不是“好的市场经济”。限量容易让人疯狂，而食品餐饮属于基础类刚需，在这个领域如果“算计到极致”，很容易出现买珠还椟类异化的消费行为。最终，是全社会的资源浪费为限量消费埋单。[详细]将食品与盲盒进行捆绑销售，商家利用消费者的赌博心理赚得盆满钵满，消费者“买椟还珠”只关注盲盒，不在乎食物浪费，如此行为实在有悖社会各界倡导的低碳环保、勤俭光盘的节约之风。[详细]中消协已发声，批评肯德基利用限量款盲盒诱导并纵容消费者不理性超量购买食品套餐。同时，消费者舍得为兴趣花钱也没问题，但这种兴趣不应建立在物质浪费，尤其是食品浪费的基础上。谁知盘中餐，粒粒皆辛苦。倡导节约粮食，反对餐饮浪费是中华民族的优良传统，也是新时代消费风尚。2021年4月29日《中华人民共和国反食品浪费法》正式实施，明确要求餐饮服务经营者自觉抵制食品浪费，提示消费者适度消费，必要时采取措施防止消费者浪费；不得诱导、误导消费者超额消费，造成食品浪费。肯德基在中国经营，应当学习中国的公序良俗，更应遵守中国的法律法规。[详细]对大品牌而言，比起短期性的话题性与舆论热度，营销更该追求的，是长远的口碑，是将来的美誉度与推荐值转化。揆诸现实，盲盒火了固然是好事，但“火”绝非其终极诉求，如果只以短线化的“火”为导向，那没准是玩火。值得一说的是，盲盒营销在诞生之初，主打消费者的收集癖与惊喜感，确实很容易让消费者“上瘾”，且刺激消费者的购买欲及复购率；在社交媒体发达的当下，这还能激发用户转发“朋友圈”的分享欲，从而形成二次传播，使更多人参与其中。但随着盲盒玩法被玩烂了——被引入脱单、游戏等各个领域，盲盒套路带来的新潮感已经在边际衰减，盲盒经济也在退潮。肯德基盲盒虽火，但其效益能否换来长久的复购效果，还得观察一番。说到底，品牌营销的确该围绕消费者展开，但更该聚焦的是消费者的底层心理，那就是产品服务的品质。盲盒营销当然可以玩，但它就像“酒”，小酌怡情，可别贪杯。肯德基推出盲盒套餐并不奇怪，被点名批评也不奇怪。近年来，盲盒风越刮越劲，文具盲盒、宠物盲盒、脱单盲盒……盲盒玩法都被玩烂了，不断病态“破圈”，触碰社会公序良俗，甚至打法律擦边球。揆诸现实，盲盒固然新奇刺激，拿捏住了年轻人的好奇心，但它也不应是监管盲区，有必要划定边界、立好规矩，避免其“走火入魔”。
