板块名,标题,作者,日期,新闻内容
股指期货,广发期货：中证1000股指期货期权上市表现跟踪系列报告（一）,市场资讯,2022年08月07日 12:40,广发黄埔荟文：金融衍生品组投资咨询业务资格：证监许可【2011】1292号报告摘要自2022年7月22日中证1000股指期货期权正式上市交易开始，市场各指数的表现迎来分化，总体表现为中小盘优于大盘，期指层面，IF和IH主力合约表现相较于标的指数偏弱，IC和IM主力合约相较于指数表现则相对较强。从市场股票型ETF的现有规模来看，宽基指数类ETF无论从数量还是规模方面均为第一大类，截至8月1日，市场内宽基ETF共计156支，合计份额为2545.74亿份，占股票型ETF总份额19.12%，资产净值为4575.11亿元，占股票型ETF资产净值的30.37%。在中证1000股指期货期权上市交易一周情况来看，热点仍聚焦于四家中证1000ETF的集中募集，从上市交易公告书披露的情况来看，广发、易方达、富国、汇添富中证1000ETF募集总份额分别为79.97、79.24、79.496和36.35亿份。同时，场内现有中证1000ETF规模也保持着高增，截至8月1日，南方中证1000ETF在两周内净流入90.86亿元，规模超过百亿达到115.52亿元。华夏中证1000ETF交易投资活跃，近两周规模增长45.18亿元，达到48.18亿元。对比中证500系列ETF的情况来看，目前市场上以中证500为标的指数构建的ETF共有23支，合计规模高达557.54亿元，其中南方中证500ETF规模更高达371.34亿元，中证1000系列ETF无论从数量还是规模，仍具有较为充足的增长空间。股指期货方面，截至8月1日收盘，IF、IH、IC和IM主力期货均出现不同程度的贴水，基差率分别为-0.35%、-0.13%、-0.57%和-0.61%。IM主力期货的贴水自上市以来呈现收窄后又走阔的趋势。成交量方面，IF、IH、IC和IM主力合约的日度总成交量均存在不同幅度的减少，变化幅度分别为-17.08%、-27.07%、-26.86%和-0.31%。持仓量方面，IF、IH和IC主力合约持仓在逐渐减少，变动幅度分别为-6.24%、-6.27和-10.31%，而IM主力合约持仓量增加，增加幅度为37.86%，IM主力合约持仓增加明显。总体而言，中证1000股指期货期权上市之后，完善了市场对于中小盘指数的对冲工具，补充了市场对小盘成长对冲的需求，进而通过对比中证500系列ETF与中证1000系列ETF，观察到中证1000系列ETF无论从数量和规模均较中证500系列ETF有较大差距，未来仍有相对充足的上升空间。期指层面，IM持仓量持续表现高增，并且相较交易活跃的品种IF、IC主力合约来看，持仓仍有进一步上行空间，预计未来随着参与交易者的增多以及规模的上涨，IM的基差水平有望进一步走阔。正文2022年7月22日，中证1000股指期货和期权相关合约正式挂牌交易，上市一周以来，市场显著分化，截至8月1日收盘，上涨2.07%，中证500指数上涨0.92%，下跌1.17%，下跌2.34%，市场再度表现出中小盘优于大盘，最近市场热点聚焦于中证1000股指期货和期权上市交易，其中包括四家中证1000ETF集中募集，大量存量资金带动中证1000ETF关注度大幅提升。通过观察市场股票型ETF现有规模，宽基指数ETF仍为占比最高的类别，截至8月1日，市场内宽基ETF共计156支，合计份额为2545.74亿份，占股票型ETF总份额19.12%，资产净值为4575.11亿元，占股票型ETF资产净值的30.37%。7月22日中证1000股指期货期权上市交易之后，四支中证1000ETF同时发行并于上周完成认购，从上市交易公告书披露的情况来看，广发中证1000ETF募集总份额为79.97亿份，上市交易日期为8月4日，易方达中证1000ETF募集总份额为79.24亿份，上市交易日期为8月4日，富国中证1000ETF募集总份额为79.496亿份，上市交易日期为8月3日，汇添富中证1000ETF募集总份额为36.35亿份，上市交易日期为8月8日。同时，中证1000ETF规模也在持续增长，南方中证1000ETF在两周内净流入90.86亿元，截至8月1日，其规模超过百亿达到115.52亿元，场内续增百亿ETF。华夏中证1000ETF交易投资活跃，近两周规模增长45.18亿元，达到48.18亿元。宽基指数类ETF目前仍为市场占比最高的种类，对比中证500系列ETF情况来看，中证1000ETF仍具有较高的增长空间。目前市场上以中证500为标的指数构建的ETF共有23支，合计规模高达557.54亿元，其中南方中证500ETF规模更高达371.34亿元。对比中证1000ETF的情况来看，无论是数量还是规模均较中证500ETF有一定差距，未来增长空间仍较为充足。从整体表现来看，IF和IH主力合约表现相较于标的指数偏弱，IC和IM主力合约相较于指数表现则相对较强。截至8月1日收盘，IF、IH、IC和IM主力期货均出现不同程度的贴水，基差率分别为-0.35%、-0.13%、-0.57%和-0.61%。IM主力期货的贴水自上市以来呈现收窄后又走阔的趋势。四大期货的成交量方面，从7月22日自8月1日，IF、IH、IC和IM主力合约的日度总成交量均存在不同幅度的减少，变化幅度分别为-17.08%、-27.07%、-26.86%和-0.31%，截至8月1日，IF、IH、IC和IM各主力合约的日度成交量分别为6.62万手、3.18万手、5.56万手和2.21万手。从持仓量来看，截至8月1日，IF、IH和IC主力合约持仓在逐渐减少，变动幅度分别为-6.24%、-6.27%和-10.31%，而IM主力合约持仓量增加，增加幅度为37.86%，IM主力合约持仓增加明显。IF、IH、IC和IM持仓量分别为6.97万手、3.75万手、8.62万手和2.41万手。责任编辑：赵思远
大商所豆系期权上市,广发期货：豆类期权上市首日策略,市场资讯,2022年08月07日 12:40,广发黄埔荟文：农产品组投资咨询业务资格：证监许可【2011】1292号报告摘要目前大商所已上市了黄1号、黄大豆2号、和豆油期货，形成了较为完整的期货品种体系。在大豆系列品种上，只有豆粕一个品种已上市期权，此次新添3个豆类期权（豆一、豆二及豆油期权），将于2022年8月8日（星期一）起正式上市交易。本文通过梳理豆类期货（豆一、豆二及豆油）的基本面现状，结合豆类期货的波动率分析，提供豆类期权的操作建议。正文一、豆类期货基本面现状豆一方面，各地基层大豆余粮已比较有限，东北产区余粮不足一成，南方一成以下。黑龙江地区大豆价格普遍在6100元/吨以上，本周国产大豆购销双向拍卖全部成交对市场心态有一定的提振作用。北方雨水充足、新豆整体长势良好，新季大豆供应预计充足。目前大豆余粮有限，但需求端表现差，中储粮持续拍卖增加市场的供应，短期价格上冲有难度。短期豆一价格预计呈现震荡走势。豆二交割标的是进口大豆，目前美国大豆正处于关键的生长期，大豆处于开花、结荚期，天气非常重要，当前美豆优良率为60%。按照天气预报显示，未来一周美国中西部的北部地区将恢复季节性干燥天气，中部大部分地区的温度可能高于正常水平。美国农业部将于8月12日发布最新的预测产量数据。近一个月豆二还处于天气市，市场存在一定的炒作因素，中国未来几个月进口大豆到港偏低，对国内的大豆有一定支撑。豆油受制于整体油脂市场的走势，油脂市场走势的焦点主要在于油，印尼棕榈油国内库存估计在800万吨之上，印尼出口压力巨大，而马来西亚棕榈油产量处于增长期，市场调查结果显示马来西亚7月底棕榈油库存料处于八个月最高水平，7月底棕榈油库存料环比增加8.3%至179万吨。中国国内市场油脂市场库存偏低，但整体宏观偏空和油脂供应预期增加的打压下，豆油价格反弹的动能仍较弱。二、豆类期权操作建议（1）豆类期货波动率分析黄大豆1号、黄大豆2号和豆油期货期权自2022年8月8日（星期一）起上市交易。首日挂牌的黄大豆1号、黄大豆2号和豆油期货期权合约月份分别从A2211、B2211、Y2211开始。黄大豆1号期货期权首日挂牌5个合约月份，分别为A2211、A2301、A2303、A2305、A2307；黄大豆2号期货期权首日挂牌9个合约月份，分别为B2211、B2212、B2301、B2302、B2303、B2304、B2305、B2306、B2307；豆油期货期权首日挂牌6个合约月份，分别为Y2211、Y2212、Y2301、Y2303、Y2305、Y2307。下图为近五年以来豆类指数（豆一、豆二及豆油）的价格和历史波动率走势，以3个月的周期来看，豆一指数历史波动率的极值区间大致在7%-25%之间，从波动率锥中可以看出，豆一指数的历史波动率主要集中在10%-20%之间，当前处于历史中性水平附近；豆二指数历史波动率的极值区间大致在6%-40%之间，波动水平较大，从波动率锥中可以看出，豆二指数的历史波动率主要集中在10%-25%之间，当前处于历史较高水平；豆油指数历史波动率的极值区间大致在8%-35%之间，波动水平较大，从波动率锥中可以看出，豆油指数的历史波动率主要集中在10%-25%之间，当前处于历史较高水平。（2）豆类期权操作建议综上所述，豆类期权操作建议如下：豆一方面，投资者可在豆一期货价格逢高时买入虚值看跌期权，或利用看涨期权来构建买入熊市价差组合（即卖出低行权价格的看涨期权，同时买入高行权价格的看涨期权，低行权价格选择上以虚值3至5档为主），期权合约月份选择上，近月合约以A2211为主，远月合约以A2301为主。豆二方面，投资者可利用看跌期权构建买入牛市价差组合（即买入低行权价格的看跌期权，同时卖出高行权价格的看跌期权，高行权价格选择上以虚值3至5档为主），期权合约月份选择上，近月合约以B2211为主，远月合约以B2212为主。若投资者持有豆二期货多单，则可以卖出相应月份的看涨期权（虚值3至5档为主）构建备兑看涨期权组合。豆油方面，投资者可利用看涨期权来构建买入熊市价差组合（即卖出低行权价格的看涨期权，同时买入高行权价格的看涨期权，低行权价格选择上以虚值3至5档为主），期权合约月份选择上，近月合约以Y2211为主，远月合约以Y2301为主。若投资者持有豆油期货多单，则可以卖出相应月份的看涨期权（虚值3至5档为主）构建备兑看涨期权组合。责任编辑：赵思远
新浪科技,联想造车，蹒跚起步？,AI财经社,2022年08月07日 12:37,在智能汽车这个资金和技术密集领域，尽管联想投资了一部分与智能汽车相关的上下游企业，但想真正入局新造车，这些还远远不够。因此，杨元庆所说的“要把有限的精力和资源放在已经明确的赛道上”并非过度谦虚：联想或许会走上一条像华为一样的道路，这条路一定非常“坎坷”。撰文《财经天下》周刊作者魏一宁董雨晴在宣称“不造车”的华为开始涉足智能汽车赛道后，一样说“不造车”的联想也按捺不住了。7月下旬，“联想招聘”发布了一则招聘信息，为上海的联想研究院车计算实验室招聘员工。岗位包括自动驾驶工程总监、车载信息娱乐系统负责人、高级硬件经理和软件经理、高级机械经理等，有的年薪高达百万元。在这则招聘中，联想称：“智能汽车、新能源汽车技术的发展与联想新IT架构不谋而合，联想的智能转型也必将为汽车行业赋能。联想研究院车计算实验室正在积极探索智能驾舱、自动驾驶、中央计算平台等领域的核心技术。”另外，企查查App显示，近日，深圳来点酷的科技有限公司成立，注册资本100万人民币，经营范围包括汽车零配件零售、汽车新车销售、电动自行车销售等，根据股权穿透显示，该公司由北京联想科技有限公司100%控股。这些信息都表明，联想已经开始向新造车赛道下手了。有业内人士在接受媒体采访时认为，联想此番招聘，“目的或在于强化车计算方面的研发实力”。目前，联想集团在智能汽车领域的布局也主要是围绕车联网、芯片等方面进行。事实上，今年4月的誓师大会上，杨元庆已经有所表示，将由联想研究院主导，围绕“端-边-云-网-智”新IT技术架构，“持续探索车载计算场景”。不过，去年五月时，联想集团董事长兼CEO杨元庆还曾表示，联想不会赶热闹造车，态度比华为还要坚决。杨元庆说，联想在PC等领域的战略足够清晰，“我们的精力有限、资源有限，要把有限的资源和精力放在已经明确的赛道上。”在去年第三季度的亚布力论坛上，杨元庆说得更加明确：“公司要有所为有所不为，不会同时开多个战场。不然每个涉足的领域都在起步阶段，会导致风险太大。专注还是很重要的，联想喜欢把一个行业做深做透，而不是同时铺设很多行业。”没想到，仅仅过了一年，联想的态度就发生了转变。不过，造车不是小事，考验着一家企业的核心技术能力，尽管入局造车赛道时间不短，但联想最初多是以股权投资的形式参与。早在2016年，联想创投通过股权转让方式入股宁德时代，跟投了蔚来汽车的C轮融资，并在第二年的联想全球科技创新大会上宣布与蔚来汽车达成战略合作，共同开发智能汽车计算平台。在芯片层面，联想还投资了寒武纪和比亚迪半导体等企业。相比之下，联想旗下的车联网公司“懂的通信”算是走在一线的业务，据其自己声称，拿下了“车联网智能连接服务”、“智能交互设备连接服务”两大领域的隐形冠军。但看到这些信息，已经有人开始质疑，“没有发布任何实车数据”，言外之意，认为此成绩并不能让人们所信服。但不管怎么说，联想在自动驾驶和车联网方面已经有了一定的积累，加上近年来苹果、索尼、小米、360等科技与互联网公司无一不在投入智能汽车领域，一向宣布“不造车”的华为在消费者业务承压之后，也开始向新造车进发。汽车与手机、电脑的多设备互联成为业内人士广泛期待的未来，同样需要在PC业务之外开发新增长点的联想加入造车大军，也就不足为奇了。从造机到造车，联想实际一直在发力新的增长点。2014年，移动互联网风口正起，为了重新拿回时代的船票，联想以29.1亿美元从谷歌手中收购了摩托罗拉，宣告着联想对于手机业务的加码。在当时，杨元庆表达了要在全球智能手机市场赢得竞争、实现增长，挑战苹果和三星两大对手的决心。但对于杨元庆的豪言壮语，自称“很多学生都在联想做高管”的郎咸平浇了他一头冷水，评价联想收购摩托罗拉是“买了一栋没窗的破楼”。当年，联想成为2014年第三季度全球智能手机出货量第四名，而且，联想和摩托罗拉两个品牌的手机份额加起来，超过了排名第三的小米。但八年后的今天，华为、小米接连成为国产手机销量巨头，联想和摩托罗拉这两个独立的品牌却几乎被手机市场遗忘，成了“时代的眼泪”。起初，靠着国内三大运营商推出的运营商补贴，联想推出运营商定制机，运营商渠道占比70%，但随着2014年运营商补贴缩减，联想立刻失去了市场优势。为了拯救手机业务，联想试图出海，但由于高端产品不如苹果和三星，在新兴市场的销售不如华为、小米等国产厂商品牌，又缺乏坚实的销售渠道，在海外市场同样效果不佳。联想曾经期待通过收购摩托罗拉，复制当年收购IBM的“成功”，然而，PC的成功无法复刻到手机业务上。联想手机业务频繁换帅，但效果一直不佳。尽管近年来摩托罗拉连续推出多款新品，如延续经典“刀锋”系列的Razr刀锋5G折叠屏翻盖手机，在海外也取得一定的市场份额，过去的一个财年里，联想手机业务相对回暖，Q1到Q3手机同比增幅达到200%，但在国内，无论是从销售渠道还是消费者认知方面，联想手机仍然无法与华为、小米、OPPO以及刚刚独立的荣耀竞争。也就是说，在消费者业务中，联想的王牌业务只有PC，虽然近两年PC销量的增长为联想带来了高利润，也让联想交出了亮眼的财报，但电脑属于耐用产品，当疫情带来的远程办公、学习需求增速放缓，PC业务的营收和利润未必能够持续增长。最新一季财报就显示，全球范围内涉及PC业务的科技巨头，均迎来了业绩低谷。其中，英特尔二季度净亏损4.54亿美元，同比下降了109%。苹果二季度财报显示，其总营收830亿美元，同比仅增长2%，远不及去年同期36%和前一季8%的增幅。多家计算机供应商都表示，全球智能手机和个人电脑的需求正在放缓，苹果的增长乏力也意味着，消费电子行业正走向一段缓慢甚至零增长的时期。对于主打PC业务的联想来说，寻找新的增长点至关重要。为此，联想开始逐渐布局新兴科技，在入局新能源汽车赛道之前，甚至同样向随着元宇宙概念再度火热的VR赛道下手。2022年6月，联想集团发布公告，委任HTC董事长王雪红为公司独立非执行董事。对此，HTC回应称，尽管王雪红担任了联想集团的独立非执行董事，但目前HTC和联想尚未有业务及资本层合作。HTC曾经也是安卓手机领域的知名品牌，2008年到2011年，HTC成为全球第三大智能手机厂商，但在此后的十年，HTC销量下降并持续亏损，2017年，HTC开始出售手机工厂，把Pixel手机的设计团队卖给谷歌，并在2019年关闭了HTC的京东和天猫旗舰店。在手机业务停滞后，HTC把目光转向VR，开始进军虚拟现实、增强现实领域。对于联想与HTC的合作，有分析师认为，独立董事不参与公司具体运作事务，仅能为公司出谋划策，因此，王雪红对于联想的意义，可能是一名受薪顾问，因此，业内普遍认为，聘用王雪红很可能是想推进联想的PC与HTC的VR进行合作。今年5月26日，联想集团公布2021/22财年全年（2021年4月-2022年3月）及第四季度业绩，联想全年营业额接近4600亿人民币，同比增长18%，全年净利润130亿人民币，同比增长72%。这也是联想年度净利润首次突破百亿。近年来，除了2019至2020年第四季度收入同比下滑10%，净利润同比下降64%，联想的营收和利润一直保持着平稳上升。即使在最困难的2019-2020年，其净利润也同比增长了12%。在疫情之后，由于居家办公、学习的巨大需求存在，联想的PC业务销量反弹，营收和利润也保持强劲增长。虽然财报数据显示，联想是一家持续盈利的公司，但在“硬科技为王”的时代，它仍然需要堆高自己的技术护城河。况且入局造车，本身也是一件十分考验技术的事情。但此前，人们对于联想的质疑也普遍存在于技术领域，联想称其掌握的核心专利技术全球领先，事实上，PC行业最核心的软件和硬件技术一直把持在微软和英特尔等海外科技巨头手中。联想在PC行业的优势也始于政府采购。2005年，联想收购IBM全球PC业务，杨元庆接替柳传志担任联想集团董事局主席，在那一年，联想就以130亿美元的年销售额成为全球第三大PC制造商。根据联想官网的数据，从2016年到2018年，政府采购的数量由2016的6万台增加到2018年的15万台，市场份额增长到70%。根据公开资料显示，政府采购电脑的80%来自联想。曾经，联想是一家优秀的科技企业，凭借联想汉卡和自研ASIC芯片、自产主板两次拿下国家科技进步一等奖，这是国内科技界的最高荣誉。彼时，任正非还是刚刚丢掉铁饭碗、开始创业的草根。但在这之后，柳传志和研发联想汉卡的总工程师倪光南爆发了一场路线之争。柳传志主张“贸工技”路线，发挥中国制造的成本优势，加大自主品牌产品的打造，扩大规模，倪光南则主张走技术路线，以芯片为主攻方向。最终，柳传志取得了胜利，而倪光南离开了联想领导层。此后，联想的规模越来越大，但大部分零件来自国外，而且，联想在科研上的投入并不多。1996年到2015年的十年里，联想研发支出占收入的比重几乎未超过3%，2015年和2016年，联想研发费用占比分别为3.32%和3.16%，但2017年到2019年又跌回了3%以内。比起华为、苹果等大型科技公司超过10%的研发费用，联想显得格外吝啬。2021年秋季，联想试图在科创板上市，但9月30日刚刚得到受理，就在国庆假期结束后的10月8日终止，从受理到终止，仅用了一个工作日，被戏称为“科创板一日游”。在联想申请科创板IPO的过程中，最受诟病的一点是联想“含科量”不足。从2015年到2019年，联想集团研发费用占比持续下滑，而销售和管理费用持续上升。其实联想的研发费用最低也达到了80.09亿元，但研发投入比例仍然偏低，在科创板排名倒数第五位。在新造车领域，联想的技术积累同样屈指可数。有意思的是，不久前联想刚刚在计算机视觉会议（CVPR2022）BDD100KMOT挑战赛中，在多目标跟踪（MultipleObjectTracking，简称MOT）技术的准确度上拿下了第一名。不过，考虑到联想此次招聘的主要是自动驾驶工程总监、车载信息娱乐系统负责人、高级硬/软件经理等岗位。那么自动驾驶与智能座舱才是联想造车的重注领域。在这一点上，联想可以说是选择了和百度、华为一样的道路。在这条路上，除了掌握技术，也需要持续不断进行研发投入。在今年4月的新财年誓师大会上，杨元庆公开表示，到2024财年结束的时候，研发投入将在2020-2021财年的基础上实现翻番，而未来五年，研发总投入将超过1000亿元，同时，联想集团计划增加12000名硬核科技人才，在过去的第一年里，已经招募了近5000位。去年八月，杨元庆又宣布联想也要步入华为一样的道路，甚至不排除自研芯片。但是，根据2022年3月华为的年度报告，2021年华为的研发投入达到了1427亿元人民币，占全年收入的22.4%，而十年累计投入的研发费用超过了8450亿人民币。尽管杨元庆对联想的研发投入有了新的目标，但比起华为，联想在科研上终究还是不够“硬核”。现阶段，华为与车企已经以“零部件供应商模式”、“HuaweiInside模式”、“智选车模式”三大模式展开了由浅至深的合作。其中，华为智选车AITOM5上市87天销量破万，同样是曲线造车，但华为在新造车领域已经走出了一段距离。而在智能汽车这个资金和技术密集领域，尽管联想投资了一部分与智能汽车相关的上下游企业，但想真正入局新造车，眼下的投入还远远不够，其与华为的差距也很大。据其目前披露的成绩，联想旗下懂的通信目前是中国85%的造车“新势力”厂商的合作伙伴。因此，杨元庆所说的“要把有限的精力和资源放在已经明确的赛道上”并非过度谦虚：联想或许会走上一条像华为一样的道路，这条路一定非常“坎坷”。
产经,华为供应链公司：已向华为Mate50高端旗舰手机供货,中证报,2022年08月07日 12:36,8月7日，中国证券报·中证金牛座记者从华为供应链公司独家获悉，该公司已向华为Mate50高端旗舰手机供货。责任编辑：李思阳
国内新闻,东部战区继续位台岛周边海空域进行实战化联合演训,央视网,2022年08月07日 12:36,
美股,数据显示：动视暴雪二季度手游收入超过 PC 和主机游戏总和,IT之家,2022年08月07日 12:35,IT之家8月7日消息，数据显示，在截至6月30日的三个月中，。动视暴雪第二季度PC游戏收入为3.32亿美元（约22.48亿元人民币），主机游戏总销售额为3.76亿美元（约25.46亿元人民币）。在“移动和辅助”类别下，动视暴雪称“主要包括移动设备的收入”，该公司本季度收入高达8.31亿美元（约56.26亿元人民币）。有报道指出，该公司在“其他”类游戏中获得了1.05亿美元（约7.11亿元人民币）的营收，其中包括发行业务、《守望先锋》和《使命召唤》的营收，但即使把这些收入计算到PC和主机游戏上，也不足以超过手机游戏的总营收。IT之家了解到，财报显示，动视暴雪第二季度总净营收为16.44亿美元（约111.3亿元人民币），去年同期为22.96亿美元（约155.44亿元人民币）；净利润为2.80亿美元（约18.96亿元人民币），同比下降68%。责任编辑：王茂桦
国内新闻,中国现存最长木拱廊桥昨晚烧毁，三问“廊桥”,澎湃新闻,2022年08月07日 12:35,
