板块名,标题,作者,日期,新闻内容
国内财经,“60元车费，多赚几千元”！跨省存款突然火了,证券时报网,2023年06月17日 21:53,转自：中国基金报近期，随着国有大行、股份制银行相继将存款利率下调，据观察，市场上衍生出一种“特种兵式”的存款现象。换言之，就是将现金带到其他省份及城市，以寻求较高利息的存款产品。据消费者对《中国基金报》记者透露，目前虽然不少银行将存款利率下调，但部分城市的城农商行还暂未行动，相较下来甚至两者能差100bp，“存款50万元，5年下来差价5000元。”居民热衷存款“搬家”近期，据记者观察，不少消费者群体在热衷讨论关于存款搬家问题。甚至还有消费者在社交媒体进行相互呼吁转告，并分享如何能够更好的将存款在其他城市进行存取经验等现象。特别是，有媒体报道，由于临近上海火车站，（上海闸北支行）在社交平台上俨然已成为网红银行。此主要在于，该行在苏州、上海两地存在明显的存款利差，大约15-40bp。目前，江苏银行（苏州城北支行）的存款利率分别为2.1%（一年期）、2.7%（两年期）、3.1%（三年期）、3.1%（五年期）；然而，江苏银行（上海市闸北支行）的存款利率却相对高出一些。据悉，目前该行存款利率为2.25%（一年期）、2.85%（两年期）、3.5%（三年期）、3.4%（五年期）。在不少投资者看来，这种跨省、跨市办理存款虽然麻烦，但显然是划算的。有储户表示，“往返仅需要大约60块钱，但是却能赚出几千块的利息，特别还是保本的存款产品，很值得。”城农商行对降息观望事实上，自本周一，招行、浦发、中信等多家股份制银行调降存款利率后，市场上虽然有部分城农商行也给予跟进，但在《中国基金报》记者的调研中，多数银行并未同步给予下调。例如，位于华南地区的两家上市城商行均对记者表示，暂时还处于考察中，将结合后期自身经营情况及同业情况进行调整。整体来看，普遍对存款利率是否下调保持了一定的观望态度。甚至，还有另外一家华南某城商行相关负责人士表示，因为4月份刚降过一轮存款利率，相信近期内不会马上跟随下调。在业内看来，此主要在于，存款利率再次下调后，相比理财产品、货币基金，定期存款已缺乏明显吸引力。然而，对于小银行而言，普遍不具备发行理财产品资质，存款理财化背景下资金流失压力较大，因此具有对存款利率是否调降保持观望情绪。专家：异地开户程序合规而对于上述消费者热衷于跨省、跨市办理存款现象，《中国基金报》记者也就其可行性等问题对上海及江浙地区、以及华北地区多家城农商行给予采访调研。不少银行从业人士对记者表示，这种现象是存在的。“如果在该行有办过银行卡那么直接在该行APP上定存就行，如果没有银行卡，甚至没在该地源交纳社保等，也并不会影响存款。”“如果生活居住地并不在本市，那么不需要开银行卡，直接办理存单业务就行，仅需提供身份证即可存款。”华北某农商行从业人员对《中国基金报》记者表示，当前，该行的定存利率便能够达到1年期2.25%、3年期3.25%、5年期3.4%，是相对国有行及部分股份行高的。据悉，自6月12日股份行将存款利率下调后，以为例，该行当前存款利率为整存整取两年期、三年期和五年期定期存款利率分别为2.05%、2.45%和2.50%。此外，对于这种“特种兵式”跨地存款问题是否符合规定，又能否持续及被纠正可能？星图金融研究院副院长薛洪言对《中国基金报》记者表示，存款者本人去异地开户办理存款业务，程序上是合规的。“这种异地存款现象，时间成本和交通成本较高，很难大规模普及，对行业现有格局影响可忽略不计，预计不会引发后续整顿或纠正。”责任编辑：张恒星SF142
2023亚布力论坛创新年会,俞敏洪：东北人能说会道是全国出名的，应该做直播带货,睿见Economy,2023年06月17日 21:49,2023年亚布力论坛第九届创新年会将于6月17日-18日在山西太原召开。新东方教育科技集团董事长俞敏洪与泰康保险集团股份有限公司创始人、董事长兼CEO陈东升展开对话。谈及区域经济的区别，俞敏洪分析说，东北经济遇到困难的原因之一是民营企业太少了，而民营企业太少不是因为东北人不会做生意，新东方十几位高级管理干部都是东北人，做生意很好。那个环境是由于几十年的国有企业和当时的集体所有制导致了产生了一种依赖，不自觉地依赖，希望有一个体系来保障他们的生存、安全和机会，最后的结果是老百姓自动冒险的精神，拼命的精神相对来说比较少。而过去几十年形成的官僚体系却依然很庞大，多重因素叠加就会形成当前的环境。“做好保障，鼓励更多人创业，鼓励更多人能够自主选择自己的职业，这可能是一个比较大的方向”，俞敏洪说，“比如直播，东北人的能说会道在全中国出了名，原则上东北应该是有无数的人在做着直播带货的生意，因为他们太能说会道了，中国人民太喜欢听他们讲话了，这就是一个机会”。新浪声明：所有会议实录均为现场速记整理，未经演讲者审阅，新浪网登载此文出于传递更多信息之目的，并不意味着赞同其观点或证实其描述。责任编辑：梁斌SF055
产经,马云现身杭州！参观阿里全球数学竞赛，称“创新乐趣”,新浪科技,2023年06月17日 21:41,新浪科技讯6月17日晚间消息，在东京教课的马云回来了。阿里方面透露到，马云已现身杭州，观看全球最大的在线数学赛事，今年来自全球19个国家的685位选手，从5万多名参赛者中脱颖而出，晋级时长8小时的终极对决。开赛前，阿里巴巴创始人马云来到杭州的赛事现场观赛，与参赛选手、命题老师在线交流，畅谈数学。马云说，大赛会不断创新，给热爱数学的人们带来新的乐趣。据了解，决赛分五个数学赛道，每个赛道五道大题，每道题都由命题组老师精心设计，考察选手的数学思维和平时的积累思考，不需要刷题，也无法提前准备。685位决赛选手中，既有全球顶尖高校数学系学生，也有律师、销售员、文物修复师、程序员、快递员，他们来自各行各业，但都有一个共同点：对数学充满热爱。今年的预赛吸引了5万多人参赛，其中近一半是女选手；年龄最大的67岁，也有初中生参赛。阿里巴巴全球数学竞赛由马云在2018年发起，主旨是通过有乐趣的竞赛激发人们对数学的热爱，与社会各界共同推动数学这门基础学科的发展。这一公益赛事已连续第5年举办，不设报名门槛，全程在线，最大限度激发世界各地数学爱好者的参与热情，5年来累计吸引超过25万人参赛。许多参赛者在日常工作生活中就把数学当作爱好和乐趣。来自天津的快递小哥孙金远，用连续两周的时间证明与欧拉常数相关的13个公式。律师吕致远连续两次参加阿里数学竞赛，今年进入决赛，他用数学思维证明了所办案件的关键性证据。大赛命题组由来自世界各地的顶尖数学老师组成，每年如何推陈出新让老师们绞尽脑汁。去年，大赛开始面向全社会公开征集赛题，从生活中发掘身边的数学题；今年，组委会别出心裁出了一道没有答案、与晋级无关的赛题：“用数学方式讲述你和数学的故事”，收到了2000多个脑洞大开的答案。（原祎鸣）责任编辑：张恒星SF142
产经,视频丨机场回应航班取消未告知乘客：航司起飞前一分钟才通知，已妥善安置乘客,媒体滚动,2023年06月17日 21:39,来源：齐鲁晚报近日，网传遵义茅台机场因大雾临时取消航班，旅客疑因机场未提前通知围着工作人员理论。网传视频显示，旅客们轮流理论，画面中一名工作人员被同事搀扶情绪激动，还有一名男性索性躺在柜台上。6月17日，该机场工作人员表示，航司在起飞前一分钟才通知机场取消航班，后续已为乘客们协助退款并赔偿。责任编辑：张恒星SF142
2023亚布力论坛创新年会,俞敏洪：东北经济为何遇到困难，又有何解？,睿见Economy,2023年06月17日 21:36,2023年亚布力论坛第九届创新年会将于6月17日-18日在山西太原召开。新东方教育科技集团董事长俞敏洪与泰康保险集团股份有限公司创始人、董事长兼CEO陈东升展开对话。谈及区域经济的区别，俞敏洪分析说，东北经济遇到困难的原因之一是民营企业太少了，而民营企业太少不是因为东北人不会做生意，新东方十几位高级管理干部都是东北人，做生意很好。那个环境是由于几十年的国有企业和当时的集体所有制导致了产生了一种依赖，不自觉地依赖，希望有一个体系来保障他们的生存、安全和机会，最后的结果是老百姓自动冒险的精神，拼命的精神相对来说比较少。而过去几十年形成的官僚体系却依然很庞大，多重因素叠加就会形成当前的环境。“做好保障，鼓励更多人创业，鼓励更多人能够自主选择自己的职业，这可能是一个比较大的方向”，俞敏洪说，“比如直播，东北人的能说会道在全中国出了名，原则上东北应该是有无数的人在做着直播带货的生意，因为他们太能说会道了，中国人民太喜欢听他们讲话了，这就是一个机会”。新浪声明：所有会议实录均为现场速记整理，未经演讲者审阅，新浪网登载此文出于传递更多信息之目的，并不意味着赞同其观点或证实其描述。责任编辑：梁斌SF055
国内财经,赔偿约18亿元？被17家公司联合起诉！这家巨头，摊上大事了,每日经济新闻,2023年06月17日 21:32,每经编辑何小桃据央视财经，多家媒体报道，当地时间14日，17家音乐公司联合起诉推特公司，称该平台侵犯了近1700首音乐的版权，并要求推特赔偿2.5亿美元，约合18亿元人民币。当天，由索尼音乐、环球音乐等17家音乐出版公司组成的团体——美国音乐出版商协会，在田纳西州纳什维尔联邦法院对推特提起诉讼。诉讼指出，推特平台侵犯了这些公司拥有的近1700首音乐的版权，应该为每件侵权作品支付15万美元的赔偿金。这些公司认为，推特未能阻止该平台上猖獗的侵权行为。仅2021年12月以来，就有约30万条推文使用了侵权音乐。与TikTok、脸书、优兔等正常支付版权费用的竞争对手相比，这种行为让推特在吸引用户方面获得了“不公平的优势”。目前，推特方面尚未对这一诉讼作出回应。据报道，此前推特曾与环球、索尼和华纳等三大音乐公司进行谈判，希望能获得音乐作品使用授权。但此后相关谈判陷入停滞。另外，据媒体近日报道，法庭文件显示，因欠房东三个月的租金，法官已批准将推特逐出其在博尔德（Boulder）的办公室。对此，推特没有回应置评请求。去年10月，以马斯克为首的买家以440亿美元的价格完成对推特的收购。马斯克个人斥资超过250亿美元买下了推特约79%的股份。自从被马斯克收购以来，推特的业务或多或少陷入了混乱，出现了许多关于推特未付账单的报道。不加前，金融服务巨头富达（Fidelity）表示，推特当前的估价只有当初马斯克收购该公司时所支付价格的33%。责任编辑：张恒星SF142
产经,又一新能源车企被申请破产，曾与蔚来小鹏等并称“四小龙”,每日经济新闻,2023年06月17日 21:30,又一家造车新势力陷入困境，被申请破产重整。6月14日，拜腾汽车两家关联公司新增被法院立案破产清算事项。在相关裁定书中，尽管两公司辩称拜腾汽车仍旧有“救活”的希望，但法院认为债权人权益已多年得不到保障，决定立案。作为国内造车新势力的代表之一，拜腾汽车的起点并不算低，曾跟蔚来、小鹏、威马并列称为造车新势力“四小龙”。创立之初，其核心管理团队曾囊括来自宝马、特斯拉等巨头的骨干人员。公开资料显示，拜腾汽车共经历了6轮融资，总融资金额高达84亿元。2020年8月，拜腾汽车曾因“烧光84亿元造不出量产车”而出现在央视新闻中。两公司辩称仍有“救活”希望本次被立案破产清算的两家拜腾汽车关联公司，一家名为南京知行新能源汽车技术开发有限公司（下称“知行新能源车公司”），另一家名为南京知行电动车有限公司（下称“知行电动车公司”）。法院裁定书显示，前者持有后者51%股权。天眼查信息显示，知行新能源车公司近日新增一则“破产重整”信息，案号为（2023）苏0113破48号，案件类型为“破产案件”，申请人为南京坤欧汽车服务有限公司、上海华讯网络系统有限公司，经办法院为南京市栖霞区人民法院。同一日，知行电动车公司也新增一则“破产重整”信息，案号为（2023）苏0113破47号，案件类型为“破产案件”，申请人为南京市栖霞区电力设备安装工程有限公司、圣戈班汽车玻璃（上海）有限公司、上海华讯网络系统有限公司，经办法院同为南京市栖霞区人民法院。栖霞区人民法院民事裁定书显示，知行新能源车公司破产清算案件中，申请人南京坤欧汽车服务有限公司表示，该公司拖欠其包车费用77万余元，另一申请人上海华讯网络系统有限公司则表示被拖欠货款369万余元。而在知行新能源车公司破产清算案件中，三位申请人也均表示被该公司拖欠款项。上述这些申请人认为，两家拜腾汽车关联公司作为债务人，不能清偿到期债务，且明显缺乏清偿能力，另其涉及大量的被执行案件且停止经营。为保护申请人的合法权益，故依法申请其破产清算还债。针对上述申请人的观点，两家拜腾汽车关联公司辩称拜腾汽车仍旧有“救活”的希望，并表示其已具备量产条件，正在进行资产重组，且市场价值远大于账面价值。拜腾汽车上述两家关联公司表示，拜腾集团汽车整车项目作为重大建设项目，一旦公司进入破产清算程序，汽车生产资质将会被工信部注销，之前各方的投入将付诸东流。但法院认为，知行新能源车公司和知行电动车公司涉及众多执行案件，其名下虽有巨额财产，但存在权利瑕疵以及资产的一体性，导致法院无法执行到位。对于众多的执行案件，只能终结执行程序，造成申请执行人的权利得不到维护。现公司停止经营数年，历经数次的自我重组也未成功。在此情况下，众多的申请人经案件强制执行不能得到清偿，应认定知行新能源车公司和知行电动车公司具备破产原因，其向人民法院申请被申请人破产还债符合法律规定，依法应予以受理。目前栖霞区人民法院已裁定受理南京知行新能源汽车技术开发有限公司和南京知行电动汽车有限公司两家公司破产清算一案。难解的资金问题从发展历程上来看，拜腾汽车成立时间并不比“蔚小理”晚，但如今走上破产清算的地步令人唏嘘。每日经济新闻2021年底曾报道，2018年1月，拜腾首款新车概念版（BYTONConcept）亮相美国CES消费电子展，宣告其造车计划从PPT走入现实。在此后两年时间里，拜腾汽车宣布完成了一系列部署，其全球总部、智能制造基地及研发中心设立在南京，负责车辆设计与产品概念研发的设计中心设在德国慕尼黑，负责智能汽车用户体验、自动驾驶等前沿技术以及北美市场开拓与运营的北美开发总部设在硅谷，整体形成了一个以南京为中心的全球运营布局。然而，2020年6月底，拜腾汽车表示，受疫情影响，其C轮5亿美元的融资进展并不顺利。随后，2020年7月初更是宣布暂停中国内地业务运营。2021年1月4日，拜腾汽车与富士康科技集团、南京经济技术开发区签署战略合作框架协议，合力加速推进拜腾首款车型M-Byte的量产制造工作，力争在2022年第一季度前实现M-Byte量产。拜腾汽车用“重回赛道”来形容此次与富士康的合作。不过好景不长，半年之后就传出了拜腾汽车与富士康合作出现裂痕的消息。彭博社报道称，经过了半年的磨合之后，拜腾汽车内部股东复杂的博弈和持续的“宫斗”让富士康心灰意冷，而股东方中国一汽的强势最终让富士康考虑退出。此外，有知情人士此前向《日本经济新闻》透露，其实拜腾汽车和富士康的合作早在协议签署的六个月后就停止了，而富士康也已将造车的重点转向其它更有潜力的项目上。对拜腾汽车而言，资金短缺是困扰其发展的一大难题。公开资料显示，拜腾汽车共经历了6轮融资，总融资金额高达84亿元。2020年8月，拜腾汽车曾因“烧光84亿元造不出量产车”而出现在央视新闻中。当时，一位接近拜腾汽车的业内人士告诉每经记者，彼时M-Byte的量产就差“临门一脚”，但是迫于资金的短缺未能实现最终量产。在业内人士看来，拜腾汽车将重心放在了工厂建设等重资产模式上，这也是导致其资金链紧张的主要原因之一。2022年8月，有网友曝出，在某二手车交易平台上，有人正在出手拜腾汽车的试验车，售价为5.2万元。拜腾并非首家遇到困境的造车新势力。本月初，每日经济新闻报道了不少威马车主反映，他们所在的地区已经找不到售后维修中心，厂家也无法提供配件，很多故障车辆得不到维修，只能原地“趴窝”。早在去年11月，威马汽车就开始面临资金、成本控制等方面的压力，并实施了一系列降本措施以应对资金压力。随后，威马汽车还曾传出高管降薪、员工工资调整、裁员、工厂停工停产、售后滞后等负面信息，这家造车新势力正遭遇多重挑战。除此之外，天际汽车、爱驰汽车等也正遭遇困境，面临售后难题的车主或不在少数。在竞争日益激烈、新品牌快速涌现的当下，车市优胜劣汰已成为常态。近期包括华为余承东、董事长等多位业内人士公开放话，汽车行业已经进入淘汰赛阶段，未来主流玩家不会超过5个。责任编辑：张恒星SF142
2023亚布力论坛创新年会,俞敏洪：新东方遇到困难时，在办公室喝掉了30瓶白酒,睿见Economy,2023年06月17日 21:29,2023年亚布力论坛第九届创新年会将于6月17日-18日在山西太原召开。新东方教育科技集团董事长俞敏洪与泰康保险集团股份有限公司创始人、董事长兼CEO陈东升展开对话。俞敏洪感慨，任何人的创业成功都离不开时代大背景，“我们这些人成功并不是因为天赋异禀，而是因为刚好处在了祖国改革开放，机会非常多的时代”。他说，自己创业时期，国内有大量“空白”需要去填补，随着社会的进步出现了很多新的商业机会。“那个时候，教育培训公司没有一家是大的，几乎都是个体户，刚好迎来了改革开放带来的国际留学大潮，就给了我这么一个机会”。“我们要感谢这个时代”，俞敏洪强调，“假如你生长在抗日战争时期，你哪有这个机会去创业？”俞敏洪还强调，企业家不是生而为困难而来，而是生而为发展而来，为推动社会的繁荣和进步而来。“我们不要有一个执念，认为企业家是为了困难或者是为了艰难而生的。就像你在不断地爬山，必然会遇到悬崖峭壁，必然会遇到深山峡谷，难道你就不爬山了吗？在我个人看，我们的目的不是为了战胜困难，我们的目的根本就是无视困难，因为你的目标在更加地远方。所以，风雨兼程是我们的使命，也是我们的宿命”。俞敏洪以新东方举例称，由于教培行业的变化，2021年新东方遇到了巨大的困难，“好像无路可走了，我特别感谢陈东升兄组织企业家到了丁立国那儿，做了铁锅炖肉、铁锅炖鱼，专门请我和一大帮企业家吃了一顿饭，对我表示安慰”。俞敏洪回忆说，“我跟他们说没关系，我现在还不会倒，当时没有想过做东方甄选，不会倒是因为我这个人做事比较谨慎，尽管折腾掉了很多钱，但账上还有点钱，我觉得暂时还不会倒，而且我想我真有困难的时候，只要我张口，这些大哥、兄弟或多或少冲着我做人人品还不错，也会帮我一把”。当然，随着东方甄选的上线，俞敏洪开启了事业上的新征程。“有一些朋友买了新东方的股票，当然现在都是赚了的，我还是对得起朋友的”，他笑称。陈东升也说“当时我们在立国那里（安慰俞敏洪），后来我发现我们是多余的”。俞敏洪则回应，“不多余，你们的鼓励太重要了”。“客观的困难已经来了，你就要想出路，因为抱怨改变不了客观事实”，俞敏洪透露，自己在办公室至少喝掉了30瓶白酒，“每天去了以后，就是二两白酒放在桌上，因为不喝的话，神经放松不下来，思路打不开”。“我就把新东方的骨干力量招到我的办公室喝酒聊天，聊着聊着就聊出一个卖的思路出来”，俞敏洪说，事实证明条条大路通罗马，上帝给你关上了一扇门有可能同时给你打开了一扇窗，只不过你的眼睛能否看到那扇窗是你的本领。“我相信随着祖国的发展，我们的机会还在，困难也永远不会消失，但是如果你想把路走下去，路一定还是会存在的”，他说。新浪声明：所有会议实录均为现场速记整理，未经演讲者审阅，新浪网登载此文出于传递更多信息之目的，并不意味着赞同其观点或证实其描述。责任编辑：梁斌SF055
