板块名,标题,作者,日期,新闻内容
新浪科技,经济日报：一场线上演唱会“三点五亿人在线观看”是良好开端,媒体滚动,2022年09月10日 07:46,姜天骄/经济日报上周，一场3.5亿人在线观看的演唱会震动全网，创造了线上演唱会流量新巅峰。不过，除了“顶流艺人”“打情怀牌”等讨论之外，更值得关注的是，通过举办线上演唱会，各大平台正积极储备技术能力，推动未来舞台转型升级。疫情加速了线上演出产业发展，经过两年多探索，线上演唱会已不再仅仅是线下的“替代品”。传统演唱会本身就有其发展的局限性，比如低价次座位无法看清偶像，热门歌手演唱会一票难求等。线上演唱会有效弥补了这些缺憾，成为更加高效、便捷、经济的观演新形态。从表面看，线上演唱会是各家平台的流量竞争，背后是技术实力的较量。受疫情影响，线下演出全面停摆，各平台纷纷通过技术创新布局线上演出，得以让包括演唱会在内的各类演出通过互联网走进大众生活。为更好满足观众需求，平台积极破解技术痛点。如今，线上演唱会掉线崩溃等情况已经少有发生，在清晰度和稳定性等方面越来越游刃有余。在最近举办的几场线上演唱会上，粉丝还解锁了横屏观看等功能，舞台的声光电效果也更加讲究，这些细节的优化都是技术创新的成果。新技术的拓展足以令人对未来舞台报以更高期待。在“内容+科技”的融合下，线上演唱会的观看体验将不断优化，演出内容也将被重新定义：虚拟现实和全息技术，能营造身临其境的沉浸感；虚拟数字场景拍摄可以让未来演出不再受到舞台限制；云技术能够打破时空局限，让身处不同物理空间的观众实现面对面互动；还有一些更为先进的技术手段可以呈现线下空间难以实现的场景。对平台而言，大型线上演唱会已经不是一场简单的直播，而是未来舞台的探索。前不久印发的《关于推进实施国家文化数字化战略的意见》提出，发展数字化文化消费新场景，大力发展线上线下一体化、在线在场相结合的数字化文化新体验。政策利好为演出产业发展带来新机遇。传统舞台艺术应该积极拥抱科技并进行大胆探索和创新，顺应线上演出这一新业态需求，以充满科技感的文化供给不断增强人们的文化获得感。当然，再好的技术也是为内容服务的。数字技术只是媒介，文化创造才是内容的源泉。比如线上演唱会，在打出情怀牌之后，还需要内容源头的持续创新。只有通过不断生产优质内容、吸引用户、集聚更多优质内容创作者，才能真正形成线上演出生态的良性循环。目前，线上演唱会还处于初级发展阶段，现在讨论商业模式和盈利问题为时尚早。不过有一点可以肯定，线上演出透出大众对多元文化消费的旺盛需求，是一片充满想象空间的蓝海。现阶段，各平台应沉下心来苦练内功，用技术创新筑牢竞争壁垒。一场3.5亿人在线观看的演唱会只是一个良好开端，真正的大戏还在后面。
证券,物价运行平稳 宏观政策空间足,市场资讯,2022年09月10日 07:44,媒体来源：中国证券报国家统计局9日发布数据显示，8月，全国居民消费价格指数（CPI）同比上涨2.5%，涨幅比上月回落0.2个百分点，也低于此前市场预测均值。业内人士表示，我国物价持续保持总体稳定运行，与欧美高通胀形成鲜明对比，这也意味着我国货币政策更有条件聚焦于稳增长，努力扩大需求，巩固经济回升向好态势。责任编辑：李园
证券,8月份CPI同比上涨2.5% PPI涨幅持续回落,证券日报,2022年09月10日 07:44,记者孟珂国家统计局9月9日发布数据显示，8月份，全国居民消费价格指数（CPI）和工业生产者出厂价格指数（PPI）同比涨幅均略有回落。其中，CPI同比上涨2.5%，涨幅比7月份回落0.2个百分点；PPI同比上涨2.3%，涨幅比7月份回落1.9个百分点。“受鲜菜价格涨幅回落、成品油价格下调等因素带动，8月份CPI同比涨幅低于市场预期。当前正处于猪周期价格上行阶段，食品价格CPI同比涨幅较大，成为支撑CPI的主要因素，而非食品价格涨幅持续处于偏低水平。”东方金诚首席宏观分析师王青对《证券日报》记者表示。具体来看，食品价格上涨6.1%，涨幅比7月份回落0.2个百分点，影响CPI上涨约1.09个百分点。食品中，猪肉价格上涨22.4%，涨幅比7月份扩大2.2个百分点，主要是去年同期基数走低影响。随着中秋、国庆假期来临，需求好转，猪肉价格呈现上行趋势。不过，国家发改委9月9日发布消息称，总体判断，今年后期生猪和猪肉市场供应有保障，价格有望运行在合理区间。非食品中，工业消费品价格同比上涨3.0%，涨幅比7月份回落0.5个百分点，其中汽油、柴油和液化石油气价格分别上涨20.2%、21.9%和19.8%，涨幅均有回落。对此，王青表示，在国际原油价格持续下行带动下，8月份国内成品油价格连续下调，这意味着大宗商品价格走弱正向CPI传导，并成为抑制CPI上行的重要因素之一。PPI方面，8月份同比上涨2.3%，涨幅比7月份回落1.9个百分点。其中，生产资料价格上涨2.4%，影响PPI上涨约1.87个百分点，是推动PPI上涨的主要动力；生活资料价格上涨1.6%，影响PPI上涨约0.38个百分点。国家统计局城市司高级统计师董莉娟表示，PPI同比涨幅回落除受上年同期对比基数走高影响外，还主要受三个方面因素影响：一是国际原油、有色金属等大宗商品价格波动下行，国内输入性价格传导压力有所减轻；二是煤炭等行业增产保供效果持续显现，市场供应保障有力；三是受多重因素影响，钢材等行业需求偏弱。“近期随着生产资料PPI涨势快速回落，生产资料和生活资料PPI之间的‘剪刀差’已显著收敛，中下游企业面临的原材料成本上涨压力得到明显缓解。”王青认为，当前中下游企业经营压力已经从成本端转向需求端。展望未来，王青认为，PPI同比将持续回落。一方面，全球各主要经济体央行通过大幅加息来抑制高通胀，给经济增长带来下行压力，全球经济衰退预期渐强，大宗商品需求预期承压；另一方面，国内稳增长政策持续发力，基建投资提速将给国内工业品价格带来回升动力，但考虑到短期内地产投资难见明显回暖，叠加保供稳价政策持续发力，工业品价格难现快速上涨。结合数据，多位业内人士认为，物价上涨趋势温和可控。中国首席经济学家温彬表示，从物价数据看，目前国内物价温和上涨，反映出经济恢复的基础还不稳固、需求不足仍是当前经济运行的主要矛盾，需要持续做好宏观调控稳定经济大盘。一方面，继续做好重要商品的保供稳价；另一方面，加快投资项目落地形成实物工作量，以投资促消费。“在美联储持续加息和缩表背景下，我国将继续发挥好货币政策工具总量和结构性双重功能，扩大有效信贷需求，降低实体经济融资成本。”温彬称。仲量联行大中华区首席经济学家兼研究部主管庞溟对《证券日报》记者表示，CPI上涨温和可控，货币政策工具的相机抉择空间以及货币政策和财政政策、产业政策的配合空间更宽泛。“为进一步稳定物价，关键在于将保障供给、稳定物价、管理预期与综合联动、精准调控、科学监管、长效施策结合起来，通过更为精准有效的政策组合拳，推进增储稳产，保障粮食和能源安全，保持物价基本稳定，缓解企业成本上升压力，保证基础民生供给底线需求。”庞溟表示。责任编辑：张海珍
证券,聚焦“双节”投资机遇 机构关注白酒景区方向,市场资讯,2022年09月10日 07:43,媒体来源：中国证券报中秋、国庆“双节”催化下，近期食品饮料和旅游出行相关板块标的布局价值备受机构关注，9月9日多只旅游出行概念股股价走高。在业内人士看来，中秋旺季来临，白酒行业将保持稳健增长态势，建议关注高确定性的高端酒和具备较高弹性的次高端酒。随着中秋和国庆长假来临，景区行业有望延续复苏态势，而酒店行业供给加速出清，龙头酒店有望享受较高的修复弹性。责任编辑：张海珍
国际财经,美国联邦法官驳回特朗普对希拉里的诉讼,央视网,2022年09月10日 07:42,据美联社当地时间9月9日报道，美国佛罗里达州一名联邦法官驳回了特朗普对希拉里·克林顿和前联邦调查局高级官员的诉讼。特朗普此前称希拉里和其他人构陷其在2016年大选时暗通俄罗斯试图影响选举并对此进行调查。美国地区法官唐纳德·米德尔布鲁克斯（DonaldMiddlebrooks）8日在裁决中表示，特朗普在三月份提起的诉讼包含“明显的结构性缺陷”，许多“对事件的定性是不可信的”。特朗普的律师9日表示，特朗普将继续提出上诉。据报道，特朗普提起的诉讼被告包括希拉里·克林顿、她的高级顾问、前联邦调查局局长詹姆斯·科米（JamesComey）和其他参与调查特朗普2016年大选时是否协同俄罗斯影响选举结果的联邦调查局官员。（央视记者刘骁骞）责任编辑：李园
美股,摩根大通称美元多头应坚守阵地,市场资讯,2022年09月10日 07:41,外汇分析师称，本周的回撤不会改变美元的走势，美元8月份的涨势有望延续到9月。除了第四季度的季节性因素支撑外，美元继续走强还将取决于美国数据的意外好转、市场对欧洲/英国双赤字融资不断攀升的担忧、亚洲出口疲态扩大以及美元出现短缺的情况。此外，预计美国中期选举不会对美元产生重大影响。责任编辑：王涵
国际新闻,特朗普“军师”栽了！或被判坐牢15年？,中国新闻网,2022年09月10日 07:39,
滚动新闻,多家银行关闭ATM二维码存款功能,市场资讯,2022年09月10日 07:34,媒体来源：中国证券报日前，广发银行发布公告称，9月3日起停止ATM二维码存款功能。8月以来，除广发银行外，、也发布了类似公告，部分分支机构也关闭了相关功能。业内人士认为，此项功能调整主要是为了落实监管要求，保护客户的资金安全。ATM二维码存款功能受限公告显示，建设银行、中国银行、广发银行的ATM二维码存款功能已分别于8月19日、8月29日、9月3日关闭。中国证券报记者日前实地走访上述三家银行网点调研发现，ATM机已无法找到二维码存款功能。据业内人士介绍，各家银行ATM二维码存款功能的操作流程类似，用户点击ATM机上的二维码存款功能，登录手机银行扫描二维码，选择存款账户输入密码，在ATM机存入现金即可，此项功能对于忘记携带银行卡的客户来说较为便捷。ATM二维码存款功能关闭后，建设银行表示，用户可持该行银行卡、选择无卡无折存款服务或开通“刷脸办”服务功能办理ATM存款业务。中国银行、广发银行表示，用户可持银行卡办理ATM存款或前往营业网点办理存款业务。近期还有部分银行分支机构陆续关闭此项功能。8月26日，招商银行唐山分行发布公告称，由于业务调整，自8月26日起，将关闭迁安支行ATM二维码存款功能，其余网点ATM二维码存款功能均可正常使用。不过，在取消ATM二维码存款功能之后，部分银行如建设银行、中国银行仍保留了ATM二维码取款功能，操作流程和二维码存款的流程类似。此外，在无卡取款方面，多家银行还支持在手机银行预约取款。保护客户资金安全业内人士分析，银行相继关闭ATM二维码存款功能，主要是为了落实监管要求，保护客户的资金安全。中国银行客服回应称是为了防范电信诈骗和洗钱风险，出于对客户资金安全的考虑，用户必须持卡才能进行交易。建设银行、广发银行客服的回复类似。据了解，早在2019年下半年开始，就陆续有银行关闭ATM二维码存款功能，或对该功能进行升级。一位银行基层员工告诉记者，二维码存款属于无卡存现，不能准确地识别客户信息，可能不完全符合监管要求。而从用户的角度来看，ATM机功能也存在优化改进的空间。中国社会科学院金融研究所支付清算研究中心副主任董昀表示，随着金融科技的发展，ATM机的使用频率减少，ATM机业务量缩小，对银行效率的提升和业务扩张的助益减弱。基于此，部分银行开始陆续关闭ATM二维码存款功能。扫码存取款操作起来较为繁琐，也是记者调研时得到的一大反馈。某银行客户余先生表示：“感觉扫码取款不太好用，需要和手机银行结合起来使用，用手机银行扫码验证后才能取款，并不比直接拿银行卡取款或在手机上预约取款方便多少。”不过，在大力发展普惠金融的背景下，业内人士表示，ATM机不可能完全消失。董昀认为，银行ATM机需要拥抱金融科技的发展，利用数字技术来改造银行，包括应用场景、业务模式、业务流程、组织架构等多方面。责任编辑：张海珍
美股,马斯克律师：因推特未经同意向举报人支付775万美元，马斯克无需完成收购,界面新闻,2022年09月10日 07:33,据路透社，首席执行官马斯克的律师斯皮罗在当地时间9月9日给公司的信中表示，推特公司在向该公司前安全主管PeiterZatko及其律师支付775万美元前没有征得马斯克的同意，违反了并购协议关于何时能够开展此类支付的条款。信中说，包括支付给Zatko的700万美元在内的款项“无法弥补”，因此马斯克不需要完成440亿美元收购推特的协议。马斯克的律师说，遣散费是根据6月28日推特和Zatko的离职协议支付的。推特公司的代表没有立即回应该消息。PeiterZatko在今年1月被推特解雇。他后来声称，推特在安全以及打击黑客和垃圾邮件方面误导了监管机构和公众。推特与马斯克诉讼案仍定于今年10月17日审判。责任编辑：李园
新浪科技,蜜雪冰城冲刺新茶饮第一股：已完成上市辅导，两万多家门店如何盈利,澎湃新闻,2022年09月10日 07:31,澎湃新闻记者汪琦雯蜜雪冰城完成A股上市辅导，或有望冲刺A股“新茶饮连锁第一股”。8月30日，广发证券官网披露《关于蜜雪冰城股份有限公司首次公开发行股票并上市辅导情况报告》（以下简称“报告”）显示，经辅导，广发证券认为，蜜雪冰城股份有限公司（以下简称“蜜雪冰城”）具备成为上市公司应有的公司治理结构、会计基础工作、内部控制制度。按照国内企业上市流程，蜜雪冰城完成上市辅导后，即将进入申报阶段。辅导机构曾强调加盟商管控、食安风险此次上市辅导历时近一年。2021年9月30日，河南证监局发布公告，公示蜜雪冰城辅导备案，辅导机构正是广发证券。报告显示，经过2021年9月27日至2022年1月11日的摸底调查工作，广发证券结合蜜雪冰城实际情况对募集资金投向安排提出建议。2022年1月12日至3月24日，广发证券完成募投项目备案及环评相关工作。3月25日至8月30日，广发证券重点督促蜜雪冰城进一步完善内部控制，加强加盟商管控，充分排查、有效降低加盟商食品安全等相关风险。同时，广发证券督促蜜雪冰城持续加强对第三方回款的控制，减少加盟商第三方回款金额等。具体而言，在上市辅导期间，广发证券发现蜜雪冰城有部分募投项目尚未取得备案及环境影响评价等手续。报告称，截至8月30日，蜜雪冰城募集资金投资项目均已完成方案设计、备案、环评等工作。此外，蜜雪冰城的会计师就公司最近三年财务会计报告出具了标准无保留意见的审计报告与无保留结论的内部控制鉴证报告。4元柠檬水、5元喝美式？蜜雪冰城称自建供应链压缩成本官网介绍，1996年，蜜雪冰城创始人张红超前往郑州求学，并开始创业，1997年创立“寒流刨冰”（即蜜雪冰城前身）。2000年，张红超开设蜜雪冰城中西餐厅，三年后，张红超试水蜜雪冰城家常菜馆。直到2005年，张红超推出彼时定价2元的新鲜冰淇淋，打响了市场，让张红超开出了二十余家蜜雪冰城分店。蜜雪冰城在官网自称为“专为年轻人打造新鲜冰淇淋与茶饮的全国连锁品牌”。相比中高端现制茶饮动辄二三十元的鲜果现制茶，蜜雪冰城以“平价”出圈，冰淇淋3元、柠檬水4元，近期还推出了最低5元的现磨美式咖啡。官网介绍，蜜雪冰城有自己的供应链，自建工厂制作核心茶饮原料，“没有中间商赚差价，成本价供货加盟商”。此外，蜜雪冰城上万家门店，对上游奶、茶、果、咖、糖等原材料采购“有议价优势，能以低成本采购高品质食材”。据央广网9月7日报道，目前，蜜雪冰城门店数已达22000余家，在茶饮江湖“一骑绝尘”。值得一提的是，蜜雪冰城还自建公司提供仓储物流服务，“物流费由总部承担，确保低价高质的产品基础上，加盟商还有利润空间”。官网介绍，蜜雪冰城股份有限公司主导管理运营；大咖国际食品有限公司主导研发生产；上岛智慧供应链有限公司提供仓储物流服务，三者形成完整产业链。不同于“现制茶饮第一股”奈雪的茶以及喜茶的直营模式，也不走加盟抽成模式，蜜雪冰城走出了另一条道路。蜜雪冰城官网介绍，其加盟模式为单店加盟，需要加盟商全资运营，公司不参与分成。要在省会城市成为蜜雪冰城的加盟商，每年的加盟费为11000元，地级城市加盟费为9000元/年，县级市所需加盟费则为7000元/年。蜜雪冰城预计，开设一家蜜雪冰城加盟店，需要37万元起步。天眼查显示，张红甫和张红超兄弟二人分别持股47.5%，两人合计持股95%。2021年1月，蜜雪冰城完成了首轮超20亿元融资，由美团龙珠资本、高瓴资本联合领投，CPE源峰、万店盈利跟投，双方各自投了10亿元，融资后估值将超过200亿人民币。
新股,蜜雪冰城冲刺新茶饮第一股：已完成上市辅导，两万多家门店如何盈利,澎湃新闻,2022年09月10日 07:31,蜜雪冰城完成A股上市辅导，或有望冲刺A股“新茶饮连锁第一股”。8月30日，官网披露《关于蜜雪冰城股份有限公司首次公开发行股票并上市辅导情况报告》（以下简称“报告”）显示，经辅导，广发证券认为，蜜雪冰城股份有限公司（以下简称“蜜雪冰城”）具备成为上市公司应有的公司治理结构、会计基础工作、内部控制制度。按照国内企业上市流程，蜜雪冰城完成上市辅导后，即将进入申报阶段。辅导机构曾强调加盟商管控、食安风险此次上市辅导历时近一年。2021年9月30日，河南证监局发布公告，公示蜜雪冰城辅导备案，辅导机构正是广发证券。报告显示，经过2021年9月27日至2022年1月11日的摸底调查工作，广发证券结合蜜雪冰城实际情况对募集资金投向安排提出建议。2022年1月12日至3月24日，广发证券完成募投项目备案及环评相关工作。3月25日至8月30日，广发证券重点督促蜜雪冰城进一步完善内部控制，加强加盟商管控，充分排查、有效降低加盟商食品安全等相关风险。同时，广发证券督促蜜雪冰城持续加强对第三方回款的控制，减少加盟商第三方回款金额等。具体而言，在上市辅导期间，广发证券发现蜜雪冰城有部分募投项目尚未取得备案及环境影响评价等手续。报告称，截至8月30日，蜜雪冰城募集资金投资项目均已完成方案设计、备案、环评等工作。此外，蜜雪冰城的会计师就公司最近三年财务会计报告出具了标准无保留意见的审计报告与无保留结论的内部控制鉴证报告。4元柠檬水、5元喝美式？蜜雪冰城称自建供应链压缩成本官网介绍，1996年，蜜雪冰城创始人张红超前往郑州求学，并开始创业，1997年创立“寒流刨冰”（即蜜雪冰城前身）。2000年，张红超开设蜜雪冰城中西餐厅，三年后，张红超试水蜜雪冰城家常菜馆。直到2005年，张红超推出彼时定价2元的新鲜冰淇淋，打响了市场，让张红超开出了二十余家蜜雪冰城分店。蜜雪冰城在官网自称为“专为年轻人打造新鲜冰淇淋与茶饮的全国连锁品牌”。相比中高端现制茶饮动辄二三十元的鲜果现制茶，蜜雪冰城以“平价”出圈，冰淇淋3元、柠檬水4元，近期还推出了最低5元的现磨美式咖啡。官网介绍，蜜雪冰城有自己的供应链，自建工厂制作核心茶饮原料，“没有中间商赚差价，成本价供货加盟商”。此外，蜜雪冰城上万家门店，对上游奶、茶、果、咖、糖等原材料采购“有议价优势，能以低成本采购高品质食材”。据报道，目前，蜜雪冰城门店数已达22000余家，在茶饮江湖“一骑绝尘”。值得一提的是，蜜雪冰城还自建公司提供仓储物流服务，“物流费由总部承担，确保低价高质的产品基础上，加盟商还有利润空间”。官网介绍，蜜雪冰城股份有限公司主导管理运营；大咖国际食品有限公司主导研发生产；上岛智慧供应链有限公司提供仓储物流服务，三者形成完整产业链。不同于“现制茶饮第一股”奈雪的茶以及喜茶的直营模式，也不走加盟抽成模式，蜜雪冰城走出了另一条道路。蜜雪冰城官网介绍，其加盟模式为单店加盟，需要加盟商全资运营，公司不参与分成。要在省会城市成为蜜雪冰城的加盟商，每年的加盟费为11000元，地级城市加盟费为9000元/年，县级市所需加盟费则为7000元/年。蜜雪冰城预计，开设一家蜜雪冰城加盟店，需要37万元起步。天眼查显示，张红甫和张红超兄弟二人分别持股47.5%，两人合计持股95%。2021年1月，蜜雪冰城完成了首轮超20亿元融资，由美团龙珠资本、高瓴资本联合领投，CPE源峰、万店盈利跟投，双方各自投了10亿元，融资后估值将超过200亿人民币。责任编辑：王涵
