板块名,标题,作者,日期,新闻内容
新浪科技,头部主播隐身 商家困在流量里,第一财经,2022年06月25日 16:50,作者：陆涵之那些年集体吐槽超级主播坑位费已经不再是主流，“流量去哪儿了”才是商家们关心的。大促已过，当销售开始恢复常态化，商家们终于有时间盘点过程中的得失。“今年618相对平静，可以认为是后端的小微企业活跃度不足。疫情带来的直接或者次生影响，对于小微企业来说是巨大的。”网经社电子商务研究中心特约研究员陈虎东说。受疫情反复影响，今年的行业分化较为明显，但是有一点商家们达成了共识：流量成本高了。那些年集体吐槽超级主播坑位费已经不再是主流，“流量去哪儿了”才是商家们关心的。头部主播几乎与超级流量划等号，但是2022年的618大促，头部主播的隐身让不少商家措手不及。“618当天的直播间坑位费是618期间其他日期的3倍。”某美妆品牌的负责人对第一财经表示，本次618公司原计划达到1500万的销售额，其中1000万元的目标计划在某头部主播的直播间实现。为此，美妆公司早在4月就预定了6月18日当天晚上的直播间名额，也是当天档期最贵的时段，但随后合作在6月初被临时取消。这一变化让公司将618的销售目标直接下调至500万元，同时意味着公司增加了1000万元的库存。“没有取消合作，仍然在等待主播公司更新合作方案。”即便如此，该品牌的负责人也没有考虑放弃与红人的合作，但是考虑到彩妆消费者对产品的生产日期比较敏感，如果短期内没有更新合作方案，他们会考虑与分销商合作减轻库存压力，同时考虑促销活动——这部分待去库存的产品占到总量的20%到30%左右。如果不这样做，1000万元的库存会带来每月10万元左右的仓储成本。对商家而言，头部主播的隐身也让618大促失色不少，“头部主播算是大促期间的风向标，没有了风向标影响肯定很大。而且618期间头部主播每天都会上热搜，热搜对于618的热度也有帮助，今年618热搜少了很多。”合作暂时叫停后，公司及时调整策略把预算分给了其他头部主播，但几个主播的带货效果“差距肯定是有的”。这就是流量，搭上顺风车是“好风凭借力”，一旦错过，各种显性和隐性的成本会成为压在商家身上的重担。易观分析品牌零售行业高级分析师陈涛对第一财经表示，头部主播对商家而言在一定单位时间内能带来更多的流量以及更好的效果。对于和头部主播合作的商家，临时取消合作短时间内会受到明显影响，因为品牌方前期投入了大量资源，一旦遭遇不可预期的变动从时间上无法及时进行调配。“不过头部主播的缺席并不意味商家今后的业绩会受到明显的影响。因为除头部主播以外，其他主播也发挥着相似作用，尽管其效用在短期内无法与头部持平，但也从一定程度上承接了商家需求与资源，流量会逐步分散到其他的主播上。”陈涛说。短期来看，商家并不愿意看到这样的情况出现。在品牌方看来，今年618最大的问题在于流量成本。“绝对值看流量成本比以前更高了。”护肤品牌悦慕心情相关负责人对第一财经表示，以天猫为例，今年618期间一个点击费用相比平时增长了30%以上。在促销心智下，头部商家获得的流量更多，中小型商家整体入店流量并不高。相同流量下产生更高GMV的商家会得到平台更多的流量倾斜，因此在大促期间欧莱雅、、资深堂等头部商家会更占优势，这意味着小商家在618期间要付出更高的成本，或者有更好的策略。“今年618时间线比去年更长，战线拉长导致了‘虚假繁荣’，表面上数据增长了，实际上我在朋友圈很少看到商家晒今年的战报。”这位负责人言辞犀利。具体到护肤品类目，这位负责人觉得今年消费者的囤货情况不如去年。护肤产品也存在季节性，细分品类上618大促期间轻薄类产品和防晒类目的产品销量较高，精华、乳液、面霜在夏季销量一般，“618消费者囤货意愿较低，一般还是在双11囤货。”相较于护肤产品，彩妆类产品在今年618销量下滑更加明显，业内甚至观察到一些彩妆品牌商计划转到护肤品赛道，加重身体护肤品类的开发。上述负责人表示今年不少同行没有参加平台满300减50的活动，对于618期间的营销投入也不多，“今年市场环境不算好，没必要花费太多促销。大家更关注日常销售，日常销售对于商家来说，不需要像618这样让利，整个销售链路更加健康。”这种链路也让商家慎重思考，大促带来的是否是真正行业的繁荣。尚体兽鸟电商总监聂伟对第一财经表示，今年618速尔销售额超出预期目标的20%。但从大盘数据看，他认为本次618大型健身器械设备品类的表现并不乐观，“目前商家后台能看到电商5月的大盘数据，今年5月与去年5月数据持平。去年618爆发的第一波在6月1号，但是今年618前移了，5月31号爆发了第一波，按理说营业额应该前移，今年5月的数据会超过去年5月，但在这种情况下同比是持平的。”聂伟觉得，疫情导致部分消费力的下降，健身器材作为非必需品被消费者省略，因此导致了大型健身器械设备品类在618出现了消费者在类目选择上的迁移而非增长。“目前电商的可渗透人群已经见顶，增长空间较小。”陈涛认为，当用户进入存量时代，电商平台需要更关注交易效率的提高，把有限资源投入到能提高交易效率的环节之中。
2022全球木兰论坛,姚洋：上证指数4月底止跌反弹，是市场对常态化防控做出了积极反应,市场资讯,2022年06月25日 16:50,全球木兰论坛暨2022（第十四届）中国商界木兰年会6月25日-26日举行。北京大学国家发展研究院院长姚洋发表主题演讲。谈及“双碳”与减排，姚洋表示只要按照“十四五”规划给出来的步骤，我们就可以实现减排目标。他介绍，根据国发院的计算，只要按照现有的减排的步伐来做，到2030年就可以实现碳达峰。到2030年，姚洋估计中国经济的潜在增长速度会在5%，甚至可能再略低一点。那就意味着如果减排速度也达到5%左右，就可以实现碳达峰。他进一步表示，在过去二三十年里，每年的能源效率提高3%，对于煤炭的依赖一直是在下降，这样每年还可以贡献1.6-1.7%，再加之减碳方面的步伐加快，所以中国比较容易达到每年5%的减排目标，“所以我们用不着搞运动式的减排，这给企业一个宽松的运营环境。”谈及房地产，姚洋表示5月份房地产下跌的趋势止住了，希望到6月份、7月份能够看到房地产更好，有望同比出现正增长。姚洋强调，房地产业对中国经济非常重要，房地产对中国经济的贡献是17%，在过去两年里，房地产的复苏对于中国经济的复苏大概贡献了1/3的份额。姚洋还指出，房地产的复苏会带动其他很多行业的复苏，特别是消费的复苏，“因为房地产它不仅仅是建房子，它还包括装修，还包括了家用电器、家具等等。所以我们期待房地产能够进一步的复苏。”谈及平台经济，姚洋表示，平台经济是中国经济的领头羊。“在过去的十几年间，平台经济在很大程度上，是引领了中国经济的发展，也发展出来了一些领先的技术，特别是在AI领域，还有汽车的无人驾驶领域。”他指出，第一要支持平台经济的发展，第二要支持数字企业在国内外资本市场上市，第三要坚持对外开放，“中国经济的发展得益于对外开放，没有对外开放就没有今天中国经济这么蓬勃的发展。”姚洋认为，对于平台企业的规制不应该仅仅看反垄断，而是应该通过竞争来促进创新，让更多的企业进入平台经济领域，来进行竞争，他表示，通过竞争鼓励创新，是一个非常大的思路上的改变。谈及疫情，姚洋表示，北京、上海两个地方正在探讨一条常态化防控的路子。“我们也看到，市场做出了积极的反应，上证指数到4月底已经止跌反弹。现在从4月底的最低，2800多点，回归到3300多点。市场通过他们的投资，已经对中国经济投下了一票。”姚洋说。最好，姚洋表示通过常态化防控，有望在今年二季度，实现经济增长速度的正增长。“只要我们能够探索出一条常规化的疫情防控措施，到下半年，中国经济走入一个复苏，甚至较高速增长的这样一种状态，仍然是一个可期的目标。”新浪声明：所有会议实录均为现场速记整理，未经演讲者审阅，新浪网登载此文出于传递更多信息之目的，并不意味着赞同其观点或证实其描述。责任编辑：李墨轩
国内财经,北京：餐厅内堂食要50%限流，翻台时桌面消毒,北京青年报,2022年06月25日 16:50,6月25日，北京市第376场新冠肺炎疫情防控工作新闻发布会召开。北京市商务局副局长郭文杰介绍，商超、市场、餐厅等商业服务业经营场所人流密集，是容易形成疫情“放大器”的场所。各企业要严格执行最新防控政策和措施指引，切实履行防疫主体责任，扎实做好疫情防控工作，重点做好“三个安全”。一是员工安全。员工要台账清、底数明、每日测温上岗扫描，疫苗应接尽接、2天一次核酸检测，直接服务顾客的要规范佩戴N95口罩。二是顾客安全。出入卡口要专人值守，人人测温，进店扫码，严格查验72小时核酸阴性证明。三是环境安全。合理控制人流，防止人员聚集，等位排队划定一米线；要严格场内通风消毒，按要求定期开展环境核酸检测。餐厅内堂食要隔位就坐，50%限流，翻台时桌面消毒，顾客离座时提醒佩戴好口罩。责任编辑：余坤航
国内财经,中央纪委国家监委网站：乱占耕地背后腐败，深挖严查！,北京日报客户端,2022年06月25日 16:49,近日，自然资源部通报了农村乱占耕地建房专项整治中发现的24个处理结果不准确且未整改到位问题和53宗新增乱占耕地建房典型案例，要求地方各级政府和有关部门全面贯彻落实党中央、国务院决策部署，进一步提高思想认识，依法依规严肃查处违法乱占耕地问题，加快推动问题整改，严格保护耕地。各地纪委监委加强监督检查，督促地方党委政府和职能部门提高政治站位，根据党中央确定的专项整治任务书、时间表和路线图，细化措施、精心实施，如期保质完成工作任务，加大对顶风乱占耕地建房问题的查处力度，深挖彻查强占多占、非法出售等恶意占地行为背后的责任、腐败和作风问题。全面部署，对农村乱占耕地建房问题整治工作开展专项监督农村乱占耕地建房问题历时较长，面广量多，问题突出。从查处的案件情况看，农村乱占耕地建房，与有关部门监管不力、执法不严，甚至听之任之、置若罔闻有关。以湖南省常德市西湖管理区西湖镇国土所所长刘某某、专干袁某某等人为例，其在对鼎兴村三户村民新建房屋定桩放线中，未严格按照程序操作，导致该房屋建设占用永久基本农田113.11平方米。2021年12月，刘某某、袁某某受到党内警告处分。农村乱占耕地建房往往夹杂着复杂的利益关系，甚至有一些基层干部知法犯法、公然违纪。如2020年7月，安徽省宿州市埇桥区夹沟镇青山村村委会原副主任、村土地协管员来某某，未经批准违法占用夹沟镇青山村1.93亩耕地建设养殖场。在被责令停工后，其拒不配合，仍继续扩建，至2021年2月基本完工。2021年8月，来某某受到党内严重警告处分，并责令辞去村委会副主任职务。中央纪委国家监委机关制定监督工作方案，对农村乱占耕地建房问题整治工作开展专项监督。紧盯专项整治各个阶段的重点任务跟进监督、精准监督、全程监督，深挖彻查强占多占、非法出售等恶意占地行为背后的领导干部责任、腐败和作风问题，督促严厉打击违反农村乱占耕地建房“八不准”行为，推动专项整治部署不折不扣落实见效。中央纪委国家监委驻农业农村部纪检监察组重点围绕中央关于农村乱占耕地建房专项整治重大决策部署落实情况，对牵头司局农业农村部农村合作经济指导司进行专项调研监督，通过“以下看上”组织调研组赴河北省邢台市等地进行实地调研，根据调研监督成果提出4条监督建议，书面反馈并持续跟踪落实。各相关派驻机构通过参加会议、专题会商、约谈提醒等形式，督促驻在部门认真履职尽责，定期梳理专项整治工作进展。紧盯关键少数，督促推动地方党委政府落实专项整治责任“收到监察建议书后，我们便成立工作组多次上门向养殖户宣传相关政策，在征得养殖户同意后，组织工作人员对违建养殖场依法依规进行拆除复垦，目前这块地已复耕复绿。”近日，广西壮族自治区兴业县纪委监委派出检查组到石南镇就农村乱占耕地建房问题整改情况进行回访，该镇相关负责人向检查组反馈。此前，该县纪委监委在专项督查农村乱占耕地建房问题整改落实情况时发现，石南镇有两处违建养殖场未按要求拆除复耕，随即向石南镇党委政府下发监察建议书，督促其限期做好整改。专项整治开展以来，各级纪检监察机关充分发挥监督保障执行、促进完善发展作用，紧盯农村乱占耕地建房问题整治工作各阶段的重点任务跟进监督，推动地方党委政府特别是基层党委政府落实主体责任，聚焦职能部门履职尽责情况开展监督检查，确保各项工作落到实处。四川省纪委监委从清查摸排底数阶段就全面介入监督，督促主责部门细化摸排方案、做深做细工作举措，坚决防止出现摸排不深、数据不准的问题。湖北省丹江口市纪委监委积极督促市自然资源和规划局进行图斑分类，采用2013年耕地数据库对比2019年遥感影像数据进行区划，摸清底数。经过对比，确定属于乱占耕地建房图斑3343个。紧盯“一把手”这个“关键少数”，通过通报、提醒等方式，督促履行主体责任。福建省纪委监委将农村乱占耕地建房专项整治列为政治监督、日常监督的重要内容，省纪委监委领导带队走访自然资源厅，向“一把手”面对面传导压力，点对点督促履职。河南省郑州市纪委监委驻市自然资源和规划局纪检监察组督促驻在部门每月通报违法占用耕地及整改情况，推动排名靠后的单位“一把手”现场查摆问题。聚焦农村乱占耕地建房背后的责任、腐败和作风问题，严肃执纪问责近日，安徽省纪委监委通报4起党员干部涉及农村乱占耕地建房典型问题，湖南省郴州市纪委监委通报5起农村乱占耕地建房问题违纪违法典型案件……各地注重发挥典型案例的警示震慑作用，努力实现“查办一案、警示一方、教育一片”的效果。聚焦农村乱占耕地建房背后的责任、腐败和作风问题，各地纪委监委加大监督执纪问责力度，对新增乱占耕地建房行为发现一起、查处一起，坚决做到“零容忍”。全面起底问题线索。多地纪检监察机关对2013年以来收到的涉及农村乱占耕地建房问题线索进行大起底，拓宽问题线索来源，广泛接受群众举报。湖北省武汉市纪委监委按照“全面收集、及时处置、动态管理”的原则，对党的十八大以来收到的涉及农村乱占耕地建房问题的信访举报、问题线索，以及审计、财政专项检查中发现的问题线索进行清仓起底。截至目前，共处置问题线索327件，已办结298件，问责495人。浙江省淳安县纪委监委立足职责定位，围绕粮食安全开展耕地“非农化”“非粮化”整治情况专项监督，严查土地领域腐败和不作为、乱作为、失职失责等问题，进一步压实相关部门责任，守牢耕地红线、守护粮食安全。图为淳安县纪检监察干部在威坪镇杨家畈村走访农户，了解相关情况。谢航凯摄提级办理、领导包案、挂牌督办……突出查办重大典型案件。云南省曲靖市原马龙县（现马龙区）违法批地占用耕地资源建设龙湖公园问题，被自然资源部列为挂牌督办案件，影响恶劣。2021年9月，云南省纪委监委以事立案、直查直办，经报省委常委会研究同意，对相关单位和领导干部依规依纪依法严肃追责问责并在全省通报，给予问责处理7个单位，给予党内严重警告处分4人（厅级干部1人）、党内警告处分5人、诫勉2人、批评教育1人。推动构建长效治理机制，实现源头治理在福建省福州市长乐区鹤上镇滨江钢材市场西北侧，有一块长条状、新起垄的耕地格外醒目。“去年钢材市场租户在原有厂房基础上向外扩建，占用了这块4.83亩的耕地。我们动员业主主动配合拆除，现在已经恢复种植条件了。”近日，长乐区自然资源和规划局执法人员对前来“回头看”的福州市纪委监委驻市城乡建设局纪检监察组说，“我们对这块地也持续跟踪，每个月都派网格化巡逻员过来复查。”针对专项整治中发现的责任缺位、管理缺失、制度漏洞等问题，各级纪检监察机关对症施策，推动建立健全长效治理机制，从源头上坚决遏制新增农村乱占耕地建房问题。在市纪委监委的推动下，福州市自然资源和规划局等部门制定出台《福州市遏制新增违法占用耕地全流程监管工作机制》《福州市耕地保护共同责任制》等相关制度，建立“党委领导、政府负责、部门协同、公众参与、上下联动”的保护耕地共同责任机制，实行对新增问题全流程监管，对违法用地整改实行清单化推进，同时强化纪委监委、职能部门、属地三方联动，全链条、全要素、系统化实现保耕地、守底线、促发展。从实际出发，各级纪检监察机关督促相关部门依法依规整治农村乱占耕地建房问题，确保不留后遗症。推动专项整治过程中，由于地方法院在执行非法占地案件中需要统筹协调拆除、清表、恢复原状、安保、宣传、救护、后勤、善后等各方面资源，不少地区面临农村乱占耕地建房执行难问题。对此，广西壮族自治区纪委监委督促自治区自然资源厅研究制定关于探索推进非法占地非诉行政执行案件“裁执分离”工作机制的实施意见，推动建立“法院裁定准予执行，政府组织实施，法院到场监督”的执行机制，实现优势互补，让非法占用土地的违法行为无处遁形。今年3月，广西壮族自治区防城港市防城区法院推行“裁执分离”机制，妥善处理一起申请强制拆除违法建筑案件，1300多平方米耕地得以恢复原貌。“下一步，中央纪委国家监委机关将立足职责定位，紧盯专项整治试点工作进展，指导各地纪委监委加强政治监督，推动本地区党委、政府及其职能部门认真履行主体责任，加强与有关职能部门及派驻纪检监察组的协调配合，畅通问题线索移交渠道，对典型问题进行督促督办，适时赴有关地区开展调研。”中央纪委国家监委党风政风监督室相关负责人表示。责任编辑：余坤航
2022全球木兰论坛,姚洋：平台经济是中国经济的领头羊,市场资讯,2022年06月25日 16:48,全球木兰论坛暨2022（第十四届）中国商界木兰年会6月25日-26日举行。北京大学国家发展研究院院长姚洋发表主题演讲。谈及“双碳”与减排，姚洋表示只要按照“十四五”规划给出来的步骤，我们就可以实现减排目标。他介绍，根据国发院的计算，只要按照现有的减排的步伐来做，到2030年就可以实现碳达峰。到2030年，姚洋估计中国经济的潜在增长速度会在5%，甚至可能再略低一点。那就意味着如果减排速度也达到5%左右，就可以实现碳达峰。他进一步表示，在过去二三十年里，每年的能源效率提高3%，对于煤炭的依赖一直是在下降，这样每年还可以贡献1.6-1.7%，再加之减碳方面的步伐加快，所以中国比较容易达到每年5%的减排目标，“所以我们用不着搞运动式的减排，这给企业一个宽松的运营环境。”谈及房地产，姚洋表示5月份房地产下跌的趋势止住了，希望到6月份、7月份能够看到房地产更好，有望同比出现正增长。姚洋强调，房地产业对中国经济非常重要，房地产对中国经济的贡献是17%，在过去两年里，房地产的复苏对于中国经济的复苏大概贡献了1/3的份额。姚洋还指出，房地产的复苏会带动其他很多行业的复苏，特别是消费的复苏，“因为房地产它不仅仅是建房子，它还包括装修，还包括了家用电器、家具等等。所以我们期待房地产能够进一步的复苏。”谈及平台经济，姚洋表示，平台经济是中国经济的领头羊。“在过去的十几年间，平台经济在很大程度上，是引领了中国经济的发展，也发展出来了一些领先的技术，特别是在AI领域，还有汽车的无人驾驶领域。”他指出，第一要支持平台经济的发展，第二要支持数字企业在国内外资本市场上市，第三要坚持对外开放，“中国经济的发展得益于对外开放，没有对外开放就没有今天中国经济这么蓬勃的发展。”姚洋认为，对于平台企业的规制不应该仅仅看反垄断，而是应该通过竞争来促进创新，让更多的企业进入平台经济领域，来进行竞争，他表示，通过竞争鼓励创新，是一个非常大的思路上的改变。谈及疫情，姚洋表示，北京、上海两个地方正在探讨一条常态化防控的路子。“我们也看到，市场做出了积极的反应，上证指数到4月底已经止跌反弹。现在从4月底的最低，2800多点，回归到3300多点。市场通过他们的投资，已经对中国经济投下了一票。”姚洋说。最好，姚洋表示通过常态化防控，有望在今年二季度，实现经济增长速度的正增长。“只要我们能够探索出一条常规化的疫情防控措施，到下半年，中国经济走入一个复苏，甚至较高速增长的这样一种状态，仍然是一个可期的目标。”新浪声明：所有会议实录均为现场速记整理，未经演讲者审阅，新浪网登载此文出于传递更多信息之目的，并不意味着赞同其观点或证实其描述。责任编辑：李墨轩
国内财经,北京市商务局：直接服务顾客的员工要规范佩戴N95口罩,北京日报客户端,2022年06月25日 16:48,6月25日，在北京市新型冠状病毒肺炎疫情防控工作第376场新闻发布会上，市商务局副局长郭文杰介绍，商场、市场、餐厅等商业服务业经营场所人流密集，是容易形成疫情放大器的场所。各企业要做好员工安全管理，人工台账清、底数明，每日测温，上岗扫码，疫苗要应接尽接，两天一次核酸检测，直接服务顾客的员工要规范佩戴N95口罩。责任编辑：余坤航
