板块名,标题,作者,日期,新闻内容
新浪科技,工信部：2023年底初步建立车联网安全体系 切实保护行车数据安全和人身安全,证券日报,2022年03月08日 07:53,本报记者孟珂3月7日，工信部网站发布消息显示，工信部近日印发的《车联网网络安全和数据安全标准体系建设指南》（以下简称《建设指南》）提出，到2023年底，初步构建起车联网网络安全和数据安全标准体系。重点研究基础共性、终端与设施网络安全、网联通信安全、数据安全、应用服务安全、安全保障与支撑等标准，完成50项以上急需标准的研制。到2025年，形成较为完善的车联网网络安全和数据安全标准体系。完成100项以上标准的研制，提升标准对细分领域的覆盖程度，加强标准服务能力，提高标准应用水平，支撑车联网产业安全健康发展。无锡数字经济研究院执行院长吴琦对《证券日报》记者表示，《建设指南》不仅会对汽车行业产生影响，也会对车联网产业链相关的软硬件企业产生影响，比如摄像头、雷达、高精度地图、计算平台、芯片等感知系统和通信系统等上游产业，智能驾驶座舱等中游产业，以及出行服务、数据增值服务等下游产业。《证券日报》记者根据上市公司公告统计，截至目前，A股市场中有安恒信息、金溢科技、天融信、启明星辰、奇安信等多家上市公司布局车联网网络安全和数据安全。中国国际经济交流中心经济研究部副部长刘向东对《证券日报》记者表示，随着汽车行业智能化网联化加速，与之相关的数据安全等问题就凸显出来，亟待对行车相关数据的收集使用及隐私保护制定相应标准规则，目的是将其纳入网络安全和数据安全法规标准体系之中。“《建设指南》将有利于车联网在数据收集、使用和传输等有规可依，有效杜绝车联网信息使用乱象，切实保护行车数据安全和人身安全，确保网络畅联安全和数据安全，将能有效推动交通智能化，解决交通堵塞问题，有效推动节能减排，促进车联网产业健康发展。”刘向东表示。谈及当前车联网网络安全和数据安全有何不足时，吴琦认为，主要面临三个问题：一是相关政策体系不完善，由于车联网跨部门、跨领域的行业特性，需要工信、交通、公安等多部门协同形成政策合力。二是自主创新能力偏低，高端传感器、车载操作系统、车载芯片等关键领域仍面临卡脖子难题。三是安全问题日益凸显，不仅包括网络和数据安全，还包括车辆运行安全、司机及乘客人身安全等。“当前车联网发展较为迅速，但智能驾驶、无人驾驶等技术应用给交通管理和人身安全带来新的挑战，特别是缺乏统一的技术标准，让汽车之间的互联互通会存在较大的安全隐患，特别是不同的处理器、操作系统、传感器等不同，让车辆数据传输使用等方面缺乏统一标准，容易造成信息安全泄露。”刘向东表示，《建设指南》出台意在在网络互联和数据安全方面建立相应标准，一方面提高智能电子零部件数据接口的通用化，另一方面确保移动终端的安全，谨防被远程控制。
新浪科技,代表委员为反就业歧视发声 打破职场“35岁门槛”成两会“热词”,中国青年报,2022年03月08日 07:26,代表委员为反就业歧视发声——打破职场“35岁门槛”成两会“热词”中青报·中青网记者王亦君焦敏龙全国两会开幕前，“取消公务员35岁年龄限制”的建议，冲上了热搜。全国人大代表、温州大学研究员蒋胜男连续两年在全国两会上提出这一建议。“35岁的隐形年龄歧视，在职场其实一直存在。”蒋胜男接受中青报·中青网记者采访时表示。今年政府工作报告中明确提出，“坚决防止和纠正性别、年龄等就业歧视，着力解决侵害劳动者合法权益的突出问题。”蒋胜男认为，纠正性别年龄歧视应首先从政府机关和国有企事业单位入手，对民营企业采取引导政策和措施。政府部门的招考要作出表率，逐步放开公务员考试35周岁限制。蒋胜男说，自己的读者中，有很大一部分处于35岁左右的年龄段，在跟他们交流的过程中，她了解到这个群体面临的困境。近几年，一些企业受新冠肺炎疫情影响，经营状况不善，部分员工需要再就业，35岁门槛带来的困境更加明显。“这些人并不是因为知识水平跟不上才失去工作的。不少人经验、水平都不错，但找工作还是被35岁这道坎儿难住了。”在蒋胜男看来，一个人到35岁时，经历了数年职场磨练，业务和待人都趋于成熟，正是年富力强、大展宏图之时。如果因为年龄限制无法回到职场，那真的太可惜了。现在的年轻人，从学校毕业时大多二十出头，工作两三年后稳定下来，结婚生子。很快面临父母退休、上有老下有小的阶段。她认为，如果因为年龄限制，就把这群人排除在职场之外，不仅是对人才的巨大浪费，也会让很多人担心自己到了一定年龄被淘汰，继而影响结婚率、生育率、职场投入度、职业规划等，这会成为很大的社会问题。全国人大代表、华南师范大学教授林勇也带来了关于放开公务员考试35周岁限制的建议。他对中青报·中青网记者表示，“35周岁限制”成了许多单位招聘人才时设置的门槛，这不适应人口长期均衡发展的需要。林勇介绍说，1994年6月，《国家公务员录用暂行规定》发布，报考国家公务员必须具备的基本条件是“年龄为35岁以下”。2019年，中组部修订《公务员录用规定》，明确报考公务员的年龄要求为“18周岁以上、35周岁以下”。此后，这一标准被一些事业单位及企业在招聘时采用。林勇指出，目前90后、00后已成为婚育主体，受多重因素影响，婚育推迟现象十分突出。这意味着，如果女性在25岁以后生育一孩，那么其在生育二孩、三孩后，或将超过30岁甚至35岁。此时，女性如果想要重返职场，就会被“35周岁限制”拒之门外。“放开‘35周岁限制’，有利于女性兼顾适龄生育与职业发展，是调整生育政策、促进人口增长、提高人口红利的重要配套举措。”林勇说。林勇在建议中还提出了解决办法。“机关单位应发挥带头示范作用，探索放开公务员考试‘35周岁限制’。”林勇建议，将《公务员录用规定》第四章第十八条第二项规定，报考公务员需满足“年龄为十八周岁以上，三十五周岁以下”的条件，修改为“年龄为十八周岁以上”。他认为，在需要紧缺人才、高端人才、专业性较强的岗位和经济落后地区，可以探索先行试点，放开招考年龄限制。然后，再探索全面放开年龄限制，根据人社部“十四五”规划提出的“按照小步调整、弹性实施、分类推进、统筹兼顾”等原则，稳妥实施渐进式延迟法定退休年龄，逐步提高领取基本养老金最低缴费年限”，统筹考虑实施延迟退休与全面放开公务员报考年龄限制，“有必要将两者同步推进”。近年来，针对产假的政策调整屡屡引发热议。总体看来，延长女性产假是大势所趋。特别是2021年8月“三孩”政策实施以来，各地与婚育相关的假期普遍延长。目前，全国各地规定的女性产假加上生育假的范围大概是128-190天，多数省市是158天；男性陪产假一般是7-30天，多数省份是15天。蒋胜男在今年全国两会上还提交了《关于改善产假、陪产假及育儿假规定的建议》。她认为，育儿是夫妻双方的责任，目前的产假实质上默认照顾新生儿的大部分责任由母亲承担，为了给男性更多的时间照顾产妇和新生儿，建议将男性的带薪陪产假增加到30-42天，女性的产褥期是42天，正是非常需要丈夫照顾的时期。“要改善一系列与生育有关的假期，因为简单地、一刀切地延长生育假会引起针对育龄女性的就业歧视。”蒋胜男解释说，目前产假和陪产假的规定主要侧重于增加女性的假期，这加剧了生育对女性就业的不利影响，使得职业女性的生育意愿进一步降低。一旦企业对“女性生三孩”有预期，就可能减少或者不录取女性员工，以免未来女性员工连续生育休假，企业要承担缺岗和业务中断的成本。这对女性的职业发展和生存环境都是非常不利的。她认为，生育假的长度要注意尺度，不能让女性在生存和生育之间作出选择。全国政协委员、湖北首义律师事务所主任谢文敏持相同观点。他认为，生育假的延长首先动的是企业的“奶酪”，用人单位不得不考虑人力成本。大型企业或许还可以摊薄、自行消化成本，而中小企业这方面能力明显偏弱。中小企业是我国企业的大多数，女性员工产假产生的人力成本，对这些企业来说不是小问题。蒋胜男提出了一系列改善生育假的建议：综合考虑社保基金的承受能力、不同企事业单位的工作性质及实力差异、职业女性个体对生育的不同诉求，将产假分为强制性产假和弹性产假两部分。除保证国家规定的法定产假外，企事业单位可以根据实际情况制定弹性产假政策。比如在法定产假的基础上增加多少天，产假期间工资是否照发等。这样一来，企事业单位可以将产假作为一项福利，量力而为；员工也可以在择业时，对生育假期有所预期。还有一种办法是，男女同休产假，增加男性的带薪陪产假，给男性更多时间照顾产妇和新生儿，有利于提高男性对育儿活动的参与度。谢文敏认为，没必要一刀切地规定男女休同等时间的产假。考虑到现实可行性，不妨循序渐进，或者给予家庭选择的弹性。林勇则提出，对于多孩母亲给予生育税收优惠及社保补贴，加快构建生育成本在国家、企业、家庭之间合理有效的分担机制。参照下岗失业人员再就业、应届毕业生初次就业等税收优惠及社保补贴政策，出台促进多孩母亲就业相关优惠政策，鼓励中小微企业吸纳多孩母亲就业。中青报·中青网记者王亦君焦敏龙来源：中国青年报
百乐嘉利宝巧克力工厂因沙门氏菌污染停产,因发现李斯特菌，美国8州紧急召回数十家品牌的牛肉干,环球网,2022年03月08日 06:36,原标题：因发现李斯特菌，美国8州紧急召回数十家品牌的牛肉干【环球时报综合报道】美国食品药品监督管理局（FDA）表示，由于发现李斯特菌，新泽西州等8个州紧急召回数十家品牌的牛肉干。据美国《纽约邮报》6日报道，FDA称，至少有70种加州博伊德公司生产并销往全美各地的牛肉干产品存在李斯特菌。卫生官员敦促人们扔掉2月23日生产的所有牛肉干，因为这种细菌会导致人们发烧、肠胃不适和抽搐，并对孕妇、胎儿和老年人构成较大威胁。美国卫生官员称，总共有超过740千克的牛肉干被销往新泽西州、加利福尼亚州、宾夕法尼亚州等地的零售中心。据悉，李斯特菌主要以食物为传染媒介，是最致命的食源性病原体之一。肉类、蛋类、禽类、海产品、乳制品、蔬菜等都被证实是李斯特菌的感染源。（吕克）责任编辑：王珊珊
2022年中国品牌日,发改委产业司组织召开2022年中国品牌日活动央企筹备工作推进会,国家发改委网站,2022年03月08日 18:24,为深入贯彻落实党中央、国务院关于品牌发展的决策部署，高水平办好2022年中国品牌日活动，加快建设品牌强国，助力构建新发展格局，推动高质量发展，3月3日下午，产业司会同国资委科创局组织召开参展中央企业筹备工作推进会。会上，夏农一级巡视员介绍了中国品牌日有关背景情况，通报了2022年中国品牌日活动方案总体考虑，并就做好下一步筹备工作听取了各参展央企意见建议、提出了具体要求。责任编辑：李思阳
IPO再融资组,定增月报|三分之一公司募资不及预期 优刻得持续盈利能力堪忧仍不断圈钱,新浪财经,2022年03月08日 18:16,出品：新浪财经上市公司研究院作者：IPO再融资组/钟文2月份，A股共有20家上市公司非公开发行股票（纯定增）事项审核通过，过会率继续维持100%。2月无定增收购企业上会。发行及募资层面，2月份共有21家（按上市日，下同）上市公司完成非公开发行股票，合计募集资金254.11亿元，发行数量及募资总额分别较1月份环比下降34.37%、46.72%；较2021年2月份的发行数量及募资总额分别同比下降30%、50.79%。在21家已经成功定增的上市公司中，作为主承销商的有5家，占比最高。21家上市公司合计募资254.11亿元，中信证券主承销金额合计64.57亿元，占比25.41%；、承销额分别为50.6亿元、29.7亿元，占比分别为19.91%和11.69%。2月份，头部三家券商定增的主承销金额合计占据了57%的市场份额，而近百家券商颗粒无收。2月份，在21家成功定增的上市公司中，实际募资额最高是（定增收购资产），募资额为42.47亿元；实际募资额最少的为，募资额仅为2.41亿元。21家公司中，有14家实际足额募资；7家不及预期，占比三分之一。7家上市公司分别为、优刻得-W、、、、天山股份。其中，优刻得-W实际募资额仅为预期的35.62%，占比最低。公开资料显示，优刻得-W是国内中立第三方云计算服务商，通过研发并提供计算、网络、存储等IaaS和基础PaaS产品以及大数据、人工智能等产品，以公有云、私有云、混合云三种模式为用户提供服务。2020年1月，优刻得-W成功登陆科创板。公司上市以后股价一路下跌，截至3月7日收盘，公司股价较刚上市不久的最高价125.95元/股已经下降82%，市值缩水约400亿元。优刻得-W股价大幅缩水的根本原因是基本面较差。2018-2021年，公司分别实现归母净利润0.77亿元、0.21亿元、-3.43亿元、-6亿元，亏损愈发严重。公司在2021年业绩快报中称，主营业务毛利率有所下滑，同时人力成本较同期增加、外部行业环境的变化等因素导致利润的下滑。事实上，优刻得-W的毛利率并不是有所下滑，而是连续“腰斩”。Wind显示，2018-2020年、2021年前三季度，公司综合毛利率分别为39.48%、29.04%、8.57%、3.62%。此外，优刻得-W在2021年度业绩快报中称，报告期内，教育、游戏、直播等行业的环境发生变化，年初为此准备的资源未充分利用；电商等互联网行业的发展放缓，一定程度上影响了公司的经营业绩。按照监管层关于“持续盈利能力”的规定，优刻得-W由盈利转巨亏、上游行业经营环境发生变化、毛利率等财务指恶化且短期内没有明显改善的趋势，属于持续盈利能力存疑的情形。优刻得-W盈利巨额亏损、毛利率腰斩的重要原因是公司云分发业务毛利率为负值且收入占比增高。据招股书及公告，优刻得-W2017年、2018年、2019年上半年、2020年，云分发业务收入金额分别为0.7亿元、0.56亿元、0.59亿元、8.05亿元，占当期公有云收入的比重分别为9.21%、5.50%、10.36%、44.63%，毛利率分别为3.52%、10.68%、10.38%、-12.87%。在2021年度业绩快报中，优刻得-W称低毛利的云分发业务收入占比提升导致的整体毛利率下降，主要系引入了一些互联网细分行业头部客户，此类客户的议价空间不大且对于稳定性等要求高，同时缺少同等规模可匹配的其他客户来提升资源复用率，故目前盈利水平较低。但招股书显示，云分发业务是较成熟的公有云业务，市场竞争较充分，长期定价趋势下行。IPO报告期内，优刻得-W进一步明确了云分发业务的客户定位，聚焦于服务公司有较高议价能力的客户，减少了低毛利客户的合作规模，使得公司云分发业务毛利率在2017和2018年度显著提高。在上市前后，优刻得-W截然相反的“骚操作”让投资者对公司未来产生较大质疑。既然云分发业务毛利率如此之低，市场竞争如此充分，为何还要在此业务上加大力度？既然在上市前减少了低毛利客户的合作规模，提高了毛利率和经营效率，为何在上市后就“忘记初心”？上市前的操作是否为粉饰业绩进而“圈钱”？2020年1月，优刻得-WIPO募资19.44亿元。2020年10月，优刻得-W就迫不及待地发布定增预案，拟募资19.65亿元。不过优刻得IPO募投项目极为缓慢，这让投资者怀疑此次定增有圈钱之嫌。截至2021年6月30日，网络环境下应用数据安全流通平台项目计划投资0.36亿元，实际投资0.9亿元，投资总进度为25%；新一代人工智能服务平台项目计划总投资5.71亿元，实际投资1.44亿元，投资总进度25.21%；内蒙古乌兰察布市集宁区优刻得-W数据中心项目（一期和二期）计划投资为10.1亿元，实际投资1.89亿元，投资总进度18.71%。2022年2月份，优刻得-W定增实际仅募资7亿元，为预期的35.62%。之所以出现巨额资金认购不足的情形，或许是投资人对公司基本面及持续盈利能力的担忧。2月份，A股共有27家上市公司发布定首次定增预案。其中，拟用于融资收购资产的企业有6家，用于补充流动资金（含偿还债务，不含配套项目）的有3家，用于配套项目的有18家。27家上市公司中，采用锁价发行的有10家，其中股价较发行价增长（截至3月7日）的有8家，增幅最高的是*ST乐材，最新股价较发行价增长83.45%%。10家锁价发行的上市公司，最新股价较发行价平均增长24.05%。27家上市公司中，拟募资金额最高的是立讯精密（135亿元），拟募资金额最低的是（2亿元）。募资总额的两极分化趋势较为明显。预案显示，立讯精密拟非公开发行股票不超过2123110448股，募资总额不超过135亿元，分别用于智能可穿戴设备产品生产线建设及技术升级项目、新能源汽车高压连接系统产品生产线建设项目、智能汽车连接系统产品生产线建设项目、补充流动资金等。一言以蔽之，立讯精密此次定增要跨界进入新能源汽车，与现有苹果产业链的精密电子器件业务形成双主业驱动。预案显示，立讯精密抛出135亿元定增方案的目的有三：顺应国家政策和行业发展趋势，巩固公司在行业内的竞争优势；把握市场机遇，丰富及扩大产品布局，提升公司持续盈利能力；补充流动资金，优化公司财务状况。事实上，立讯精密此次定增的深层次原因是依赖“果链”的风险已开始显现。2020年，立讯精密有近七成的收入最终来自苹果公司。2021年第三季度，公司净利润同比下降25.28%。同时为最大限度满足苹果公司产品的需求，立讯精密加大了研发投入及各项资本开支，公司有息负债居高不下。截至2021年9月30日，立讯精密账面上的有息负债（短期借款、一年内到期的非流动负债、长期借款、应付债券之和）金额约246亿元，前三季度的利息费用就高达5.18亿元，资产负债率接近60%。另一家“果链”龙头在被踢出苹果链之前，资产负债率超过了70%，有息负债金额超过了135亿元。立讯精密此时抛出巨额定增预案，无疑可以缓解债务负担，双主业发展也可以规避依赖果链的风险。但2022年进入新能源汽车领域是否为时已晚？目前，新能源汽车赛道的竞争已然白热化，现有竞争者不断跑马圈地，外部竞争者纷至沓来，立讯精密能否在细分领域分得一杯羹还不得而知。责任编辑：公司观察
