板块名,标题,作者,日期,新闻内容
证券,分析师、研报员、基金经理全下课？量化巨头幻方宣布投身人工智能！股民：AI来薅羊毛了？,市场资讯,2023年04月15日 13:53,转自：财联社财联社4月15日讯（记者吴雨其）以AI进行投资，股市交易场景会是怎么样？幻方量化关于AI炒股的官宣消息引来一片唏嘘声。这则题为《幻方新征程》微信推文中，幻方宣布了他们将投身于人工智能技术，并成立了一支新的独立研究组织，专注于探索人工通用智能（AGI）。这个消息引起了广泛的关注和讨论，特别是在股市交易领域。网友们直呼：“又要来薅羊毛了”“人工智能薅羊毛？”“这是说基金经理要失业了？”幻方称“新纪元的大门打开了”据幻方的公告显示，幻方将集中资源和力量，全身投入到服务于全人类共同利益的人工智能之中，成立新的独立的研究组织，探索AGI的本质。将充分而持续地投入，不做中庸的事，用最长期的眼光去回答最大的问题。幻方称，我们可能站在这个时代最伟大变革的前夜。人工智能出现的70年后，第一次涌现出令人惊叹的智慧，新纪元的大门打开了，“作为科技的信徒，幻方一直在人工智能技术的前沿试图更好地理解这个世界。多年以来，幻方坚持把营收的大部分投入人工智能领域，建设领先的AI硬件基础设施，进行大规模的研究，探索人类未知的奥秘。我们相信几乎所有的创新都是从大胆尝试和点滴积累中孕育而来。”幻方称将集中资源和力量，投身人工智能技术，成立新的独立研究组织，探索AGI，即人工通用智能（ArtificialGeneralIntelligence），又称强人工智能（StrongAI）。与现有的人工智能系统不同，它具有类似于人类的广泛认知能力，可以在各种任务和情境中自主地学习、推理、解决问题和适应环境。幻方量化是一家依靠数学与人工智能进行量化投资的对冲基金公司，当前管理规模逾100亿。幻方量化致力于量化对冲的研究、创新与实践。旗下有两家公司，分别是浙江九章资产管理有限公司和宁波幻方量化投资管理合伙企业（有限合伙），两家均是在基金业协会备案的证券类私募机构。财联社记者点开幻方量化官网发现，幻方已换上了极具人工智能风格的页面，在简介中也直接表示“使用AI进行投资的对冲基金。”据介绍，幻方AI已构建了深度学习训练平台“萤火二号”，它以“任务级分时共享”为核心理念，调度系统秒级响应，让每个研究人员都能拥有顺畅的训练体验。同时，平台配备强大的软件层支持：高性能算子库（hfai.nn）、分布式训练通讯框架（hfreduce）、专为AI开发而生的大容量高带宽文件系统（3FS），让AI模型能自如拓展到多节点之上，进行大规模并行训练，体验极致性能。网友直呼：人工智能来薅羊毛啦！不过，业内人士却表示，该急的不是股民，首席投顾林毅也表示“散户其实不用那么怕，更害怕的是私募和公募基金同行。”一些投资者也表示，“这样一来，基金经理要失业了。”“AI炒股挣电费，分析师、研报员基金经理全下课。”AI会代替基金经理吗？运用AI投资并不神秘。另一量化私募巨头明汯投资也早已在此方面布局，资料显示。从2017年开始，明汯投资就开始系统性地加入机器学习和深度学习技术，将人工智能技术成功应用到金融市场。在明汯投资总监解环宇看来，人工智能核心三要素（数据、算法、算力）在量化投资中都至关重要，三要素协同有助于量化投资策略持续高效迭代，若某一要素出现明显短板则有可能造成错失高速发展机遇。视线回到幻方量化本身，该公司也早已使用AI辅助投资，它也是利用机器学习识别过往市场走势，用量化和算法进行选股。据透露，幻方量化拥有1万张A100不过，市场人士并不认为AI能做基金经理，根据媒体最新发表的访谈，热炒AI股的华尔街基金经理们，似乎并不相信在可预见的未来内会出现比人类更强的“炒股AI”。不过，华尔街本身很热衷于使用新技术的行业，包括下单、风控等投资环节早已交给算法解决。文艺复兴科技基金的创始人、数学家出身的吉姆·西蒙斯从40年前就开始研究“算法炒股”，经过了多年的努力，他们终于实现使用机器学习识别过往市场走势的模式，来生成能够盈利的交易策略。然而，目前市场并没有涌现真正的“AI型炒股”，相关人士表示，文艺复兴科技用到的技术更加依赖统计学，而不是最先进的AI工具。哥伦比亚资管的董事总经理JonathanLarkin解读称，大多数的量化交易员仍倾向于“假设优先”的工作方式。他们会首先建立一个假设，说明为什么可能出现某种异常现象，然后围绕这个假设形成一个模型。量化基金公司D.E.Shaw担任高管的JonMcAuliffe也表示，投资领域的AI环境是截然不同的，我们没有无限量的数据来帮助我们运行无限大小的模型。一位上海的研究员向记者表示，“AI炒股并不完美。历史数据是股票交易的重要参考依据，但是历史数据的样本数量有限，样本的特征也会随着时间变化而发生变化。这就导致股票市场的未来走势无法完全依靠过去的数据来预测，也就无法完全依靠AI来进行决策。”他认为，“一方面，AI技术本身也有一些限制。例如，AI算法在处理非线性和非平稳时间序列数据方面仍存在挑战，且AI算法的解释性不足，难以从逻辑上解释交易决策。另一方面，股票市场本身是复杂且不确定的，受到许多因素的影响，例如政治、经济、社会和自然因素等。这些因素都会影响股票市场的波动，使得AI预测不准确。”不过，市场也有不同的声音，佛罗里达大学金融学教授AlejandroLopezLira表示，大型语言模型在预测股价方面可能很有用。他在最近一篇未经审查的论文中表示，在使用ChatGPT分析新闻标题对一只股票是利好还是利空时，他发现ChatGPT预测次日回报方向的能力远好于随机水平。让AI判断AI炒股？ChatGPT：可以若用AI判断AI炒股是否可行，会有怎样的回答？记者询问ChatGPTAI炒股现阶段是否可行时，他回答：“作为一个AI模型，我认为AI可以被用于炒股。但是，是否可行取决于许多因素，如数据可用性、算法的质量、市场的波动性等。”当记者再次询问AI炒股会代替基金经理时，它回答“为时过早”。注：本文有修改责任编辑：李铁民
2023,《中国企业家》杂志社社长钟云华：中国商界女性展现出令人赞叹的“她”力量,睿见Economy,2023年04月15日 13:37,2023（第十五届）中国商界木兰年会于4月14日-15日在北京举行。主题为“向光而行”。《中国企业家》杂志社社长、木兰汇委员会主席钟云华出席开幕式并致辞。钟云华表示，经济学家认为，“几乎一半的工业产量变动可以用心理因素解释”。现代市场经济对信心的依赖比过去任何时候都更强。中国经济“长风破浪，未来可期”，曙光就在前面。时代呼唤更多的女性企业家“向光而行”，勇于开拓创新，争做创新发展的探索者、组织者和引领者。他介绍到，中国商界木兰年会，是《中国企业家》杂志社旗下的重要品牌会议，创办于2009年，已经连续举办了十五届。每届年会，邀请五六百位女性企业家出席。十五年来，木兰年会作为价值分享平台，见证了中国商界女性在穿越经济周期、推动科技创新、引领商业进步、践行社会责任等方面发挥的积极作用、绽放的耀眼光芒；十五年来，木兰年会持续关注、努力促进中国商界女性的成长与进步，一年发布一次“年度影响力商界木兰”，共有超过200名商界女性登上这个名单，她们是名副其实的商界精英、时代先锋；十五年来，木兰年会的声音越来越大、越传越远，成为中国最具影响力的商界女性年度盛会，成为凝聚商界女性智慧、展现商界女性魅力的重要平台。演讲中他提到，商界木兰已经成为推动高质量发展的生力军。统计数据显示，女性企业家的数量和影响力正以惊人的速度增长。从A股上市公司的情况看，截至2023年3月23日，A股有318位女性董事长，去年同期，A股上市公司中有265位女性董事长，一年时间新增53位。全球白手起家女企业家榜单显示，2023年全球13个国家共有109位白手起家的女性十亿美金企业家，其中，68位中国女性上榜，占比62%，世界第一。“中国商界女性展现出令人赞叹的“她”力量。她们有一种正向光明的力量，迎着光，追着光，成为光，温暖他人，照亮世界。”他说。他指出，因为木兰年会，越来越多的商界女性走在时代前列，并以其“美好”的特质去改变世界。“让我们携起手来，一起走向更加美好的未来！”新浪声明：所有会议实录均为现场速记整理，未经演讲者审阅，新浪网登载此文出于传递更多信息之目的，并不意味着赞同其观点或证实其描述。责任编辑：李昂
银行,上海银保监局：进一步提高新发放公司类贷款中的民企贷款比重,媒体滚动,2023年04月15日 13:32,来源：国际金融报近日，上海银保监局联合上海市发改委、市经信委、市科委、市财政局和市地方金融监管局五部门召开2023年业保险业服务实体经济高质量发展工作会议，通报上海银行业保险业2022年服务实体经济工作情况，部署2023年重点工作任务。会议强调，2023年是全面贯彻落实党的二十大精神的开局之年，是为全面建设社会主义现代化国家奠定基础的重要一年。上海银行业保险业要深刻领悟和坚决贯彻党中央、国务院的决策部署，准确把握当前面临的形势任务和困难挑战，统筹谋划全年各项重点工作，在新征程上更好地推进金融服务实体经济高质量发展。一是正确处理本和末、专和全、质和量三大关系，使金融回归服务实体经济的本源，找准领域、坚守定位、做专做精，实现金融服务实体经济从量的增长向量质并举转变。二是聚焦科技金融、绿色金融、普惠金融三大重点领域。科技金融方面，金融机构自身要按照专业化、精准化、特色化、创新化即“专精特新”四化要求转型发展，贯彻落实《上海银行业保险业支持上海科创中心建设的行动方案（2022-2025年）》及配套子方案，扎实推进科技金融专业能力、产品质效、产融结合、生态圈建设四大工程。鼓励部分经营基础好、管理规范的银行保险机构设立科技金融一级部门，条件成熟的银行机构鼓励成立专门的科技金融事业部，进行专业化经营和先行先试，推进科技金融试点创新，监管部门将加强监管引导。加强银保合作，发挥保险在科技金融领域的风险分担作用。绿色金融方面，扎实推进《上海银行业保险业“十四五”期间推动绿色金融发展服务碳达峰碳中和战略的行动方案》，围绕“组织体系、产品服务、重点领域、ESG风险和信息技术”等方面积极创新，培育专业的绿色金融队伍，分期分批推进绿色银行保险机构网点建设。重视ESG理念，避免“漂绿”“洗绿”现象。普惠金融方面，要持续提升小微企业金融服务质量，实现上海普惠金融“两增”“一优”“一稳”。切实落实“两个毫不动摇”精神，进一步提高新发放公司类贷款中的民营企业贷款比重。做好稳外贸、稳消费和对交通物流领域的支持。进一步做好乡村振兴、新市民和养老等民生领域金融服务。三是扎实推进“党建引领、金融帮扶和融资畅通”三大工程。开展党建引领工程，深化金融工作的政治性和人民性，开展“金融党建+调查研究”“金融党建+服务社会”工作，做为人民服务、为实体融资、为社会赋能、为国家担当的金融机构。实施金融帮扶工程，延续“纾困融资”工作机制至2023年底，拓宽纾困融资行业领域；加大对困难行业市场主体的金融支持力度；做好延期还本付息政策到期后的接续工作；提升突发事件社会风险保障能力和保险服务能力。实施融资畅通工程，线下探索建立伙伴银行（保险）机制；线上，在2022年以来推进“上海保险码”平台建设的基础上，积极推进“上海数字金融服务平台”建设；深入开展“不法贷款中介专项治理行动”，净化金融市场。责任编辑：张文
国际财经,德国将关闭最后三座核电站 告别“核电时代”,中国新闻网,2023年04月15日 13:30,转自：中国新闻网中新网4月15日电综合报道，当地时间15日，德国将关闭国内的最后三座核电站，这也意味着，德国将正式告别“核电时代”。德国政府网站消息称，“4月15日，德国核电时代将结束。在法律上、技术上和经济上，都无法再延迟这一结束时间。”但是，在能源问题仍未解决的背景下，有关是否保留核电的争议仍然存在。德国《图片报》近期民调显示，52%的受访者反对关闭核电站，37%的受访者赞同，另有11%表示不确定。2011年福岛核电站发生核事故后，德国默克尔政府通过了在2022年前完全弃用核能的决定，但在2022年乌克兰危机爆发后，由于担心能源短缺，德国政府决定将3座核电站的运营时长延长到2023年4月15日。责任编辑：李园
巴菲特最新访谈,巴菲特最新发声：在困难环境中这样做投资……,证券市场红周刊,2023年04月15日 13:30,本刊编辑部|吴海珊本周，巴菲特访问日本，并接受了CNBC的采访，谈到了美国银行业危机、美联储的困境、ChatGPT以及企业经营情况等话题。巴菲特认为，银行业总是会定期的暴露出一些愚蠢的问题，未来还会有更多的银行倒闭，但是储户的钱不会损失。这一次的日本之行，巴菲特的目的是会见持股的五家日本商社的管理层，巴菲特对于会谈非常满意，并表示未来可能购买更多的日本股票。虽然对于宏观经济，巴菲特并不乐观，认为这是艰难的一年，但他并没有对投资悲观，他仍然高兴于伯克希尔是一家美国公司，而且他有很多现金流。“关注企业盈利、保留好现金流”是巴菲特对在困难环境中的做投资的嘱咐。更多银行会面临倒闭但储户不会损失储蓄资金巴菲特在2008年金融危机时，像“秃鹫”一样出手拯救崩溃边缘的银行，并以便宜的价格获得股权的故事被广为传颂。所以1个多月前，美国中小银行爆雷并陷入危机的时候，市场一直在猜测巴菲特会不会出手？会以什么价格出手？市场中也有一些传言表示，拜登的高级官员一直在与巴菲特联系，目的是拯救银行危机。但巴菲特对此却予以了否认。他说，从未就美国硅谷银行（SiliconValleyBank）破产后的恐慌与拜登（JoeBiden）总统沟通，“我可以随意打电话给政府成员，但绝不会打给美国总统。”重要的是，在F13公布的机构四季度持仓中，伯克希尔大幅减持了美国银行股。而四季报公布的时间，正好是美国中小银行危机前的一个月左右。这个精准的操作，让巴菲特回避了大幅的回撤。从F13来看，2022年第四季度，伯克希尔减持了8家上市公司股票，包含3家金融公司，其中，减持美国合众银行比例高达91%，减持纽约梅隆银行近60%。目前，伯克希尔重仓股中仅剩美国银行。截至2022年末，伯克希尔持有美国银行约10.1亿股，市值约335.55亿美元，占比11.19%，位列第二大重仓股。对于为什么持有美国银行，巴菲特表示：“我非常喜欢布赖恩·莫伊尼汉（BrianMoynihan）。我不想卖掉它。”不过，巴菲特总结了自己卖出其他银行的逻辑，他表示，“我确实卖掉了我们持有了25年或30年的银行。银行定期做的一些愚蠢的事情。某些银行经理人的错误已经暴露出来，但与导致2008年至2009年金融危机的那些错误相比，这些错误的严重程度有所不同。”“银行总是有这么做的冲动，即故意忽略或违反会计程序来帮助他们提高财报数据，并反复尝试把营收做得更大一点。”巴菲特提醒投资者，银行还会继续这么做，某些银行股的投资者可能会承受损失。不过，对于中小银行爆雷是否会带来更严重的系统性危机，巴菲特表示，“虽然我们还没有完全摆脱银行倒闭的困境，但不需要把经理人的一个愚蠢决定变成所有人的恐慌。”“可能会有更多银行倒闭，但储户不会损失钱财。”“不要担心自己在美国银行的存款流失”，巴菲特说道。日本是巴菲特在美以外的最大投资而且可能会进一步投资日本在本周访问日本时，巴菲特透露，他对日本五大商社的投资是伯克希尔·哈撒韦在美国以外的最大投资。目前伯克希尔投资五大日本贸易公司，包括三井、伊藤忠、丸红、住友和三菱。巴菲特表示，他对日本五大商社的投资始于4年前。“我在一家一家地看公司，正如我每天所做的一样。我就想，这些公司都是非常大的公司，他们所做的生意我是可以理解的，但股价却低得离谱。尤其是，如果我们把这些股票的价格，和当时日本的利率放在一起对比的话，就显得更荒谬了。所以，我开始买进这5家最大的日本商社。”巴菲特对日本商社的投资表示满意，“自我们收购以来，他们的业绩超出了我们的预期，我们非常满意。”根据他的测算，这些投资会带来约14%的收益。但投资的成本，大约只有0.25%或者更少。“这一成本不会增长，14%的收益却有可能增长，因为股息会增长。”数据显示，自买入之后，日本五大商社的股息平均增长了70%左右。巴菲特很早就关注到了日本商社公司，在他90岁生日的时候，也就是2020年8月30日，他把5家公司的股份都买到了5%以上。他专门给5家公司的CEO写了一封信，内容一模一样，表示伯克希尔不会在未经董事会允许的情况下，买到9.9%以上的股份。并说，“这是我的承诺，也是伯克希尔的承诺。”据巴菲特介绍，截至目前，伯克希尔持有日本五大商社的股权比例为7.4%。“正因如此，我想来和公司的管理层聊一聊。”在和高管会面后，巴菲特表示，这是一段令人愉快的时光，“我们可能会在这些公司上投资10年、20年。我们认识到这些公司的魅力，我们都深深为之吸引。”对于是否会与五大商社有更多的合作，巴菲特表示：“他们可以随时打电话给我们。”此外还表示，考虑买入五大商社以外的日本股票，称“虽然目前只持有五大商社的股票，但接下来的投资对象一直在脑海中，如果价格合适的话。”也就是说如果这些股票进一步被低估，将追加投资。鲍威尔做得很好人们很多时候不了解体系的重要性最近，美联储的政策备受争议，很多专业人士指责美联储造成了通胀的恶果。不过，巴菲特对美联储主席鲍威尔的做法表示支持。“如果让我管理美联储，我不认为我能像鲍威尔做得一样好。我觉得鲍威尔做得非常好。”他还用保罗·沃克尔在1980年代时的政策做了对比，“当时人们一直在谴责沃克尔，但他尽到了自己的职责，做了正确的事，也没有对批评做出回应。他是我所崇敬的人之一，我想他应该也是鲍威尔所崇敬的人。”巴菲特重复了自己在伯克希尔的股东大会上的意见：“你必须根据不充分的信息做出应对，你必须为美国的公众负责。也许这并不意味着你的所作所为可以阻止衰退，也并不意味着你可以把不良贷款变成良好的贷款。但这意味着，你可以让这个系统在濒临停止时继续运作下去。”“如果不是鲍威尔，在2020年3月疫情爆发后，我们可能要面对一个不一样的结果”，巴菲特说，“如果读过《万亿美元的分流》一书，就能了解到，人们不知道这个系统距离停止运转曾经有多近。”3月美国中小型银行危机之后，美联储再一次面临抉择，是抗通胀还是保护银行？就目前来看，美联储中性加息了25个基点，并有可能在5月的议息会议上暂停加息。相比硅谷银行破产之前的政策，目前的货币政策预期已经有了一个明显转变。“我们并不能准确地知道美联储应该做什么，也没有人知道。人们基于传统的智慧来行动，有时候会成功，有时候不成功。自从1942年以来美国犯了各种各样的错误，未来或将继续犯这些错误。但不知为什么，整个系统运行得非常不错。”巴菲特说，“所以多年来，我宁愿拥有美国的一部分，也不愿把钱存在别的地方，像瑞士之类的。他们并不真正理解体系的重要性，有时候他们的所作作为，正会促生他们所畏惧的事情。”巴菲特表示，他并不担心美国的能力，至于核威胁、流行病等事情，尽管有所担心，但也无能为力，因此也不必为此忧虑。巴菲特也不担心伯克希尔，他认为继任者能给公司带来更好的管理。而他和伯克希尔都很幸运，因为“伯克希尔碰巧在美国，而我恰巧是一个美国人。”巴菲特生于1930年。之后美国进入了黄金时代。在巴菲特生平的92年中，美国人均GDP增长了六七倍。他说：“世界已经变得越来越好了，人们的富裕程度与历史上任何时期相比，都有所提高。不满足是人类的天性，但你可以想一想，当我是孩童时，和现在的生活是多么不一样。”今年是一个更艰难的环境不预测经济，企业利润是关键由于最近持续爆雷的中小银行引发了金融危机的担忧，以及美联储的持续加息，市场对于在2023年底陷入衰退几乎达成了共识。虽然巴菲特几乎从来不对宏观经济做预测，但他这次表示，“这是一个更艰难的环境。”巴菲特表示，“我掌管伯克希尔58年，从未发现宏观经济预测对于企业盈利是有帮助的。我们所要做的就是尽我们所能继续经营每一项业务。手头要有足够的现金，这样才能不断根据信息做出决定，而不是被迫做出决定。”虽然一直强调伯克希尔不做预测，而是打有准备的仗，但巴菲特还是分享了一些调研和了解的情况，整体显示经济不太乐观。“对很多企业来说都很艰难，最近有一家与零售相关的企业，2月份营收比前一年同期下降了22%。”即便如此，巴菲特并不悲观，他说：“这并不意味着世界末日就要来临，我管理伯克希尔58年了，我们遇到过各种各样的问题，但这就是生意，没有什么是完美的。我希望即使一切都倒下，我们依然是最后站着的那个人。”对于伯克希尔的业务情况，巴菲特表示，公司的保险业务今年大概率会比去年好一些。伯克希尔对经济状况有一定的敏感度，公司的管理者对于自己现在的处境感到惊讶。但从巴菲特最近的行程来看，他积极的自下而上发现企业的机会，例如日本商社和西方石油的机会。他还在积极回购伯克希尔股票。宏观经济不乐观时，关注企业的利润，是投资成功的重点。一直以来对投资新兴科技股票不感兴趣的巴菲特，这一次被问到对于ChatGPT的看法。令人意外的是，巴菲特认为，ChatGPT是一项卓越的发明。“虽然我不知道这是不是有益的。”巴菲特开玩笑地说，“我问ChatGPT，你要如何毁灭人类？它说：拔掉插头。”“这是一个令人难以置信的科技进步，它向我们展示了它可以做到什么地步。”像巴菲特一样担忧的人并不在少数，自2月份以来，以ChatGPT为代表的人工智能备受关注，也在资本市场引发一波情绪性上涨。但在欧洲，以数据安全为由，开始了对ChatGPT进行审查。当人工智能不再是“人工智障”的时候，人们反而开始担忧。巴菲特形象地比喻为，这是令人震惊的发明，就像1945年我们造出来原子弹一样。“4、5个月以前，我看到了ChatGPT唱歌，它把有趣的经济观点翻译成西班牙语，而且两秒后就生成了结果。它理解每一本书、每一条法律，可以为你节省大量的时间。但它没法理解笑话，即便是我认为非常有意思的事。”（本文已刊发于4月15日《红周刊》，文中提及个股仅为举例分析，不做买卖推荐。）责任编辑：常靖蕾
