板块名,标题,作者,日期,新闻内容
银行,四川银行公布2022年年报：净利润增速超36% 总资产升至2471.81亿元,每日经济新闻,2023年04月29日 20:11,每经记者张祎4月29日，四川银行对外披露了2022年年报。报告显示，过去一年，该行紧抓对公、零售、金融市场、资产管理、普惠金融五大板块，规模效益稳中提质，资产质量持续改善，各项指标平稳运行，全年累计实现营业收入44.75亿元、同比增长27.47%，累计实现净利润8.70亿元、同比增长36.06%。资料显示，四川银行成立于2020年11月7日，是在攀枝花市商业银行和凉山州商业银行基础上以新设合并方式设立的四川省首家省级法人城商行。因此，2022年也是该行第二个完整经营年度。年报显示，2022年，面临复杂多变的内外部环境，四川银行积极发挥省级法人金融机构职能作用，有效服务全省经济社会发展，资产规模快速增长。截至2022年，集团资产总额2471.81亿元，较上年末增长623.60亿元，增速达33.74%。其中，发放贷款和垫款1302.55亿元，较上年末增长337.30亿元，增幅34.94%，在资产总额中的占比为52.70%，持续加大对地方实体经济支持力度。值得一提的是，据披露，四川银行去年全面发力绿色金融，有序推进“川银绿金”产品体系建设工作，打造了该行首家“零碳网点”，成为中国金融学会绿色金融专业委员会川内首家地方法人金融机构理事单位，2022年末绿色金融业务余额57.64亿元，同比增长410.54%。同时，该行持续加大涉农信贷投放力度，年末全行涉农贷款余额432.15亿元，同比增长86.45%。其中，普惠型涉农贷款余额41.95亿元，同比增长137.31%，高于全行各项贷款平均增速83.96个百分点。从负债端看，随着大零售战略转型、扩大主动融资渠道，四川银行正在加快资金积累脚步。截至2022年末，集团负债总额2151.28亿元，较上年末增长615.77亿元，增速为40.10%；其中吸收存款1686.47亿元，较上年末增长362.25亿元，增速为27.36%。负债结构上，存款占负债总额的78.39%，其中个人存款增量占各项存款增量比例为38.96%。监管指标方面，该行亦继续向好。2022年末，集团不良贷款率为1.57%，较上年同期下降0.02个百分点；拨备覆盖率286.69%，高出监管要求136.69个百分点；流动性比例120.41%，高出监管要求95.41个百分点；资本充足率18.60%，高出监管要求8.10个百分点。责任编辑：张文
基金,1.4万亿，重磅来了！股票ETF最新管理规模出炉，华夏基金3000亿，易方达、华泰柏瑞、国泰、南方基金超1000亿,市场资讯,2023年04月29日 20:08,【导读】鏖战1.4万亿！头部公募逼近3千亿，传媒、新能源投资新动向中国基金报记者李树超随着今年4月份最后一个交易日收官，股票ETF最新管理规模出炉。在今年前4月宽基指数走势分化、市场结构性机会增多背景下，前4月份股票ETF（统计股票ETF和跨境ETF）规模激增超1000亿元，总规模逼近1.4万亿元。分结构看，今年表现低迷的创业板ETF、医药、互联网、新能源ETF等出现资金净流入；而走势亮眼的的科创50、中证500ETF、传媒ETF等“越涨越卖”，出现资金的净流出。在产品规模的此消彼长下，股票ETF龙头公司华夏基金，在股票ETF的管理总规模逼近3000亿元关口，易方达、华泰柏瑞、国泰、南方基金等规模也都站上1000亿元关口。业内人士认为我国国内ETF市场仍然大有可为，成长空间也较为广阔。Wind数据显示，截至2023年4月末，全市场723只股票ETF总管理规模达到1.37万亿元，比去年末规模增长1082亿元，增幅8.56%。在今年大盘宽基指数分化，行业机构性行情凸显的背景下，今年股票ETF净流入资金567亿元，但大盘宽基和行业主题ETF呈现明显的资金流向剧烈分化的现象。数据显示，在今年股市回暖行情中，受制于新能源、医药板块拖累的创业板ETF资金净流入最多。易方达创业板ETF前4月收跌1%，但净流入资金108亿元，华安创业板50ETF也收获57亿元的资金净流入。而表现相对抢眼的科创50、中证500，以及部分滞涨的宽基ETF则遭遇资金“越涨越卖”。其中，南方中证500ETF前四月上涨6.62%，同期资金净流出167亿元；华泰柏瑞沪深300ETF收涨3.8%，资金净流出117亿元，都在百亿体量。而同期涨幅13%的科创50ETF，资金净流出45亿元。行业和主题ETF中，今年表现低迷的医药、互联网、新能源等板块受到资金的逆市追捧。易方达医药ETF今年吸金68亿元，同期收益率还是-3.56%；医药板块中，还有华宝医疗ETF、银华创新药ETF同期也吸金超过50亿元。互联网板块中，恒生互联网ETF今年下跌超10%，但资金净流入61亿元；港股通互联网也有近50亿元的资金净流入。今年表现更为低迷的新能源板块，同样是资金的拥趸。今年跌幅仍然超过7%的光伏ETF、新能源ETF、新能源车ETF、电池ETF等多只产品，今年净流入资金超过了30亿元。而从流出榜单看，今年涨幅超过60%的广发传媒ETF，资金净流出24亿元，位居行业ETF净流出首位。涨幅18%的华夏5GETF，也有19亿元的净流出。另外，易方达亚太低碳ETF、工银瑞信半导体龙头ETF等，也有10亿元体量的资金净流出。“股票ETF产品有‘越跌越买，越涨越卖’的交易特点。”一位公募股票ETF基金经理表示，在今年股市结构性行情突出，指数发生较大分化的背景下，股市的结构机构层出不穷。资金借道股票ETF买入创业板、新能源、医药、互联网等低估资产，逆市布局筹码，展现了资金对低估品种的青睐；而卖出科创50、传媒等，也展现了“落袋为安”的理性操作。随着国内股票ETF市场不断扩容，各家基金管理人的股票ETF管理规模也水涨船高。Wind数据显示，截至2023年4月末，国内股票ETF龙头公司——华夏基金，旗下69只股票ETF管理总规模达到2992亿元，逼近3000亿元大关，在近1.4万亿元的市场中市占率达到21.8%。易方达基金股票ETF管理规模1871元，位居亚军，市占率13.6%；华泰柏瑞基金1217亿元，位居第三名。国泰、南方基金也都超过了1000亿元关口，分居四、五名。值得注意的是，与去年末的四家千亿基金公司相比，国泰基金今年规模从916亿元增至1069亿元，新晋千亿基金公司，国内千亿股票ETF基金公司也达到5家。除了千亿体量的公司，广发基金目前增至828亿元，华宝达到632亿元，嘉实、华安、富国、天弘基金等都超过了400亿元，位居行业前列。从规模增幅榜来看，今年前四月，华夏基金股票ETF规模增长197亿元，位居行业首位，从产品贡献看，华夏中证1000ETF今年规模增长52亿元，居功至伟；涨幅翻倍的游戏ETF规模增长41亿元，另外，华夏基金旗下芯片ETF、新能源车ETF、恒生互联网ETF等都有30亿元体量上下的规模增长，都为华夏基金的规模增长贡献不少。易方达基金前四月规模增长191亿元，位居行业第二位。其中，易方达创业板ETF前四月规模就激增102亿元，是规模增长最为迅猛的产品；易方达基金旗下医药ETF规模增长近60亿元，科创50ETF、人工智能ETF分别增长24亿元、14亿元，也贡献不俗。另外，国泰、广发基金今年规模增长也超过140亿元，也出现了规模的快速扩容。谈及多家公募机构规模的增长，上述公募股票ETF基金经理表示，随着国内大类配置理念的普及，以及股票数量突破5000只，公募基金突破10000只，被动投资越来越受到各类投资者的青睐。同时，由于股票ETF具有费用低廉、跟踪效率高、简单透明等优点，适合作为投资的底层配置工具。从2018年熊市中“越跌越买”，该类工具的投资价值就得到了各类资金的重视，近五年发展迅猛，各家公募积极布局，而投资者也通过“越跌越买，越涨越卖”的理性操作，更好运用这一投资工具实现投资目标。“新发基金增多，叠加权益类市场快速回暖，都将股票ETF规模不断推高。”一位公募市场部负责人也认为，近年来伴随着泛科技ETF的发行，科创50ETF、中证1000ETF、增强策略ETF等创新产品频出，股票ETF的投资机会获得了市场的关注，相关产品的规模也在快速增长；另一方面，经过去年的震荡调整，今年以来股市快速回暖，结构性机会不断，资金借道股票ETF去抓取投资机会，资金的逆市净买入叠加市值攀升，共同推高了股票ETF市场的规模。在该市场部负责人看来，虽然头部基金公司管理规模接近3000亿元，千亿基金公司不断扩容，但相比海外成熟市场股票ETF的体量和市场占比，国内ETF市场仍然大有可为，成长空间也非常广阔，这也是各家公募积极布局这一市场的重要原因。责任编辑：常福强
国际新闻,新出生人口首次跌破80万，日本艰难“催生”,新浪新闻综合,2023年04月29日 19:37,
证券,绿地控股2022年累积稳中向好发展势能 保现金流、保交付成效显著,新浪证券,2023年04月29日 19:20,4月28日晚，（600606.SH）发布了2022年报和2023年一季报。2022年，绿地以牢牢守住现金流安全底线为核心，紧紧围绕“聚焦、转型、再造、强体”的主线，全力以赴应对各种超预期因素冲击，取得了较大的业绩体量，实现了“大局稳定、稳中加固、稳中有为、稳中向好”的总体局面。一是大局稳定。加强流动性管理，平稳渡过了年内几个重要的偿债节点，守住了现金流安全底线。负债率持续下降，有息负债余额连续三年下降。二是稳中加固。全力以赴稳增长、稳经营，各核心产业平稳发展，主要业绩指标保持了较大体量。扎实推进降本增效，主要费用持续显著下降。三是稳中有为。有力有序推进企业改革调整、结构优化、转型发展、管理提升等重点工作，取得积极的成果。四是稳中向好。准确把握政策不断宽松的契机，全力推进房地产业“去化、交付、联动政府”、基建产业“三稳两降一强”等核心工作，积累了稳中向好的势能。2022年，绿地顺利渡过了最困难的阶段，标志着近两年多来的深度调整、转型升级已取得积极成效，现金流持续改善，经营结构、负债状况、资产质量等重要指标不断优化，发展韧性和抗风险能力稳步增强，为未来业绩确定性夯实了基础。一是经营业绩保持较大体量，结构优化对冲行业波动。公司全年营业收入4355亿元，总资产13653亿元，净资产907亿元；利润总额88亿元，归属于上市公司股东的扣非净利润19亿元。房地产业保持稳健，营业收入1926亿元，结转毛利率17.11%；基建产业保持较大体量，营业收入2095亿元，毛利率稳步提升至5.40%。二是经营成本不断优化，质量效益稳步提升。营业成本3898亿元，同比减少910亿元，减幅19%；销售费用63亿元，同比减少30亿元，减幅为32%；管理费用112亿元，同比减少32亿元，减幅22%。三是现金流长期为正，守住安全底线。经营性现金流量净额274亿元，连续6年为正，年末货币资金为598亿元，保持了较大体量。四是有息负债余额进一步下降，负债结构持续优化。资产负债率及扣除预收账款后的资产负债率进一步下降0.88个百分点和0.27个百分点。全年按期足额兑付公开市场美元债近14亿美元、境内债59亿元。年末有息负债余额降至2175亿元，全年压降231亿元，自“三条红线”监管政策出台以来已累计压降1707亿元。整体平均融资成本5.65%，保持低位。五是核心产业有空间，未来业绩有保障。年末合同负债及预收款项（主要为房地产业预售金额）3747亿元，收入保障倍数达到1.95（房地产业预售金额/营业收入）。房地产业期末总土储1.57亿平方米，基建产业期末在手订单总金额1.01万亿元，为未来业绩回稳向好奠定了基础。刚刚过去的2023年一季度，从中央到地方出台各种政策措施全力拼经济、稳增长，宏观经济逐渐复苏，房地产及基建行业均有所回暖。绿地围绕“大局稳、基础稳、业绩进、质量进、管理进、团队进”的“两稳四进”目标，狠抓全年开局，主要产业经营情况逐步好转，核心业绩指标同比降幅收窄，总体实现平稳发展。一季度，公司实现营业收入788亿元，其中房地产业289亿元，基建产业410亿元。利润总额33亿元，归属于上市公司股东的净利润20亿元，经营性现金流量净额13亿元，加权平均净资产收益率2.33%。期末，总资产逐步回落至13362亿元，净资产稳步增长至928亿元，资产质量持续提升。资产负债率、扣除预收账款后的资产负债率均进一步下降，分别较上年末减少0.41个百分点和0.65个百分点。经营成本不断优化，销售费用9亿元，同比减少8亿元，减幅46%；管理费用22亿元，同比减少6亿元，减幅20%。2023年，是贯彻落实党的“二十大”精神、全面建设社会主义现代化国家的开局之年，是疫情后经济社会的重启之年和市场活力的恢复之年。绿地控股董事长、总裁张玉良指出，2023年，外部形势总体向好是主基调、主旋律，经济环境、政策环境、市场环境等均好于去年。一是宏观经济逐渐复苏。全国“两会”释放了更加明确的拼经济、稳增长信号，国家通过各种措施着力提振市场信心，宏观经济运行整体在好转。二是政策环境更加宽松。今年以来各项政策措施持续发力，财政政策、货币政策、行业监管政策等持续传递利好。三是行业市场有所回暖。刚需及改善性住房需求有所释放，房地产市场出现修复性行情。中央和各地均提出了较大规模的年度基建投资计划，传统基建及新基建机会增多。经过两年多的深度调整，绿地已充分累积了稳中向好的发展势能，为下一步发展创造了条件。新的一年，绿地围绕恢复性增长和高质量发展的总纲，坚持稳中求进的总基调，更加注重在“进”字上下功夫，持续深化企业转型升级，着重做好五方面的工作：一是房地产业抢抓行业回暖的机遇，把提升效益放在更加突出的位置，确保发展局面进一步好转。狠抓销售业绩，通过优化产品、强化运营等多种措施，不断提升盈利水平，全力保交付、保供应，狠抓重大项目进度，全面增强产品竞争力。二是基建产业把握契机，积极进取，不断提升发展的质量效益及核心竞争力。强化项目管理，狠抓业绩增长，推进项目拓展，进一步优化业务结构，强化风险管控，提升人均效能，强化专业及科技支撑。三是金融产业狠抓重大项目落地，推进转型升级，不断把发展势能转化为经营效能。加快推进绿地数科等重大资本化项目，提升基础业务经营效益，加快数字化转型，推动创新业务突破。四是能源、消费等其他综合产业进一步把握市场机遇，优化完善经营模式，提升发展能级。能源产业，做强平台功能，放大煤炭贸易等优势业务规模。汽车、酒店旅游、商贸等消费产业，推动业务增长，提升经营管理水平。五是全面落实高质量发展要求，持续提升资源配置及综合管理水平。产业发展详情2022年，绿地各主要产业实现平稳发展，总体业绩保持了较大体量。房地产业围绕去化、交付、联动政府等核心工作，实施一系列有针对性的措施，在行业低迷期稳定了主业基本盘。推进销售去化。通过抓商办大单、抓角落资产、抓酒店资产、抓住宅散售等，全面推进各类存量资产去化变现。持续强化运营管理、提升资产质量，实现高质量高效率去化。全年累计完成合同销售金额1323亿元，合同销售面积1280万平方米，其中大单销售387亿元。回款1433亿元，回款率108%。实施交付攻坚。通过强化思想认识、资源保障、目标管控和供应链协调，保障交付质量与进度。全年累计交付面积3015万平方米，同比增加11%。同时济南428超高层、西安498超高层、上海董家渡项目、杭州之门等一批重大项目也如期完成建设节点。着力联动政府。积极响应中央和地方“保交付、保民生、保稳定”要求，加强沟通协调，全面对接各地政府，积极申报各地专项支持政策，取得了显著成效。提升产品竞争力。形成保交付“问题清单”，制作“交付手册”，保障交付质量。加强重点环节技术管理，推进“美丽车库”、“极致办公”、“一铺一策”等。加强重点项目品质管控，着力打造标杆产品。深化降本增效。多角度压缩成本费用，优化重点项目成本，严控无效成本，全年完成降本金额预计超过32亿元。基建产业全力推进“三稳两降一强”等重点措施，确保当期业绩的同时提高未来业绩确定性。稳生产，狠抓业绩指标。全力稳定施工产值、促进业绩释放，全年营业收入、利润总额保持较大体量。稳现金流，推进清收等工作。全力清收应收账款，全年应收账款综合回款率达到90%。积极盘活存量资产，稳定融资规模。稳承接，拓展重大项目。扩大基础设施业务占比，加快业务结构调整，全年累计新签合同4863亿元，成功中标了合同额136亿元的沈卢高速、49亿元的阳新高速等重大项目。降法律风险，维护合法权益。大力推进胜诉案件执行债权资金回收，全年共回款33亿元。降成本，提升质量效益。以净利润和经营性净现金流为考核导向，大幅压降管理费用等成本。强基本功，提升项目管理及科技水平。完善生产管理体系，设立科研引导基金，对17个优势技术领域进行重点攻关突破。成员企业先后获得“詹天佑奖”、“鲁班奖”、“国家优质工程奖”、“钢结构金奖”的一批奖项及发明专利66项。金融产业聚焦重点项目，稳定经营业绩，推进转型发展。全年实现利润总额13亿元。狠抓重点资本化项目落地，酒店旅游资本化项目顺利实施，供应链资本化及物业资本化项目进入实质性落地阶段，绿地数科项目有序推进上市。持续推进创新业务发展，绿联国际银行正式开业运营，贵州省绿地金融资产交易中心成功转型为贵州省绿金低碳交易中心。ABC三大数字化平台迭代升级，A端平台全年挂牌资产规模达467亿元，B端平台开展供应链保理业务59笔，C端平台新增注册会员数38万。其他综合产业努力克服疫情困难，抢抓市场机遇，稳定业务经营，提升质量和效益。能源产业，营业收入144亿元。积极拓展上游煤炭货源渠道及下游市场客户，全力保障上海地区电煤供应，营收、利润均保持相当规模。汽车产业，营业收入100亿元。挖掘门店延伸利润，提升发展效益。商贸产业，成功参与第五届进博会，组织了近30个国家和地区约300个品牌参展。酒店旅游产业，推动酒店及旅游业务创收，推进会展场馆运营。责任编辑：常福强
证券,600532未来股份被立案调查，股民索赔可期,市场资讯,2023年04月29日 19:02,2023年4月25日，上海智汇未来医疗服务股份有限公司（简称：未来股份、（维权）、宏达矿业、华阳科技，代码：600532）发布《关于收到中国证券监督管理委员会立案告知书的公告》，中国证监会称“因你公司涉嫌信息披露违法违规，根据《中华人民共和国证券法》《中华人民共和国行政处罚法》等法律法规，2023年4月24日，我会决定对你单位立案。”（*ST未来维权入口）根据《民法典》、《证券法》及最高人民法院的关于虚假陈述民事赔偿司法解释的规定，上市公司、控股股东、实际控制人、董监高人员及其中介机构等因虚假陈述等的证券欺诈行为导致证券投资者权益受损的，应承担民事赔偿责任，赔偿范围包括：投资差额、佣金、印花税和利息损失等。权益受损的证券投资者可以向有管辖权的法院提起民事赔偿诉讼。由于未来股份涉嫌信息披露违法违规，被中国证监会立案调查，为维护证券投资者合法权益，上海汉联律师事务所宋一欣律师向曾经购买过未来股份的证券投资者展开诉讼代理征集，代理投资者索赔诉讼，权益受损的证券投资者可以向前述律师进行索赔登记。宋一欣律师认为，未来股份案的索赔条件为：2023年4月25日前买入未来股份股票或债券等证券市场公开发行产品，并在2023年4月25日及之后卖出或继续持有的受损投资者，可以办理索赔登记。1．上述提示的索赔条件仅供参考，不涉及投资者任何证券投资决策和证券买卖建议。索赔的最终条件将根据中国证监会行政处罚的结论进一步调整，并以相关法院最终生效的判决所认定的法律时点、赔付对象、赔付范围、赔付标准、会计计算方式为准。2．以行政处罚决定为特征的前置条件取消后，投资者虽然可以直接诉讼，但由于调查手段有限，以立案调查通知或行政监管措施决定作为直接诉讼的依据起诉存在败诉的风险，所以，我作为专业律师提示投资者：行政处罚决定仍然应当作为提起诉讼的必要前提之一。3．在拟提起的民事侵权诉讼案件中，上市公司退市与否，都不影响民事索赔侵权诉讼的进程，但有可能会影响诉讼的进度。而进入破产程序（包括重整、预重整或清算），则影响诉讼进度的可能会较大。如发生代表人诉讼，您可以选择参加或不参加、加入或退出。4．投资者索赔登记或预登记应提供下列材料：（1）《身份证》复印件。（2）《证券账户开户信息确认单》原件（加盖证券公司营业部印章）。（3）从首次买入该股票/债券/权证等至今的《证券交易记录流水》原件（加盖证券公司营业部印章）。（本文由上海汉联律师事务所宋一欣律师供稿，不代表新浪财经的观点。宋一欣律师，1992年起律师执业，现为上海汉联律师事务所合伙人。服务领域主要包括资本市场、证券市场、金融市场的法律服务及投资者/金融消费者权益维护。执业至今，为10000余件/起证券诉讼事务或股东纠纷事务提供过法律服务。编著有《证券法原理与实务》、《证券民事赔偿实务手册》、《股市维权》、《中国证券民事赔偿案件司法裁判文书汇编》、《董事责任保险与投资者权益保护》等书籍。执业证号：13101199210628065）责任编辑：韦子蓉
国内新闻,淄博烧烤火了，锦州烧烤还坐得住？,中国新闻周刊,2023年04月29日 19:00,
