板块名,标题,作者,日期,新闻内容
港股,“陈半城”，挥别祥生,市场资讯,2023年04月16日 21:58,观点网正处于风雨飘摇中的祥生，遗憾地告别了它最初的掌舵人。4月16日，祥生方面发布讣告称，其创始人、祥生控股执行董事、董事会主席兼提名委员会主席陈国祥先生因病于当日凌晨在浙江省绍兴市诸暨辞世，享年73岁。从80年代祥生集团成立，到涉足房地产领域，创下三年百亿到千亿的“祥生速度”，陈国祥——这位被诸暨当地人称为“陈半城”的实干型企业家，最终安眠于自己的桑梓地。结缘地产据公开资料显示，陈国祥出生于1951年7月，大学本科学历。年轻时的陈国祥在诸暨酒厂担任过数年技术员，并在而立之年升任为诸暨服装针织厂厂长。依靠尼龙丝绵纶丝生意，陈国祥积累起“第一桶金”，一度被称为诸暨当地“丝大王”，那时候，他或许还未意识到将与房地产结下不解之缘。直到上世纪90年代，时为诸暨金鸡坞村支书的陈国祥承接了当地村庄拆迁改造工作，祥生地产由此诞生。在诸暨走过半生的陈国祥对这座县城有着别样的情怀，从新世纪花园到福田花园，从君城到云境系列，从市中心到正在开发中的城西、持续扩张中的城东，祥生的项目遍布全城。“一座诸暨城，半部祥生史”。因开发诸暨众多楼盘，祥生被称为“诸暨第一房企”，陈国祥获得了在当地的第二个称谓“陈半城”。彼时，还正值当打之年的陈国祥雄心勃勃，亟需发展的祥生也将目光投向了更远处。2014年，祥生控股将大本营迁至杭州，确立了“立足杭州，生辉上海，深耕苏浙皖，辐射全国”的战略规划。之后祥生进入发展快车道，2017-2019年，祥生在短短三年间实现销售额从百亿到千亿突破，成为备受关注的业界“黑马”。值得一提的是，有着浙江人低调务实品格的陈国祥在此期间牢牢把握船舵，祥生迟迟未递表上市。直到2020年，年近古稀的陈国祥才带着地产平台祥生控股敲开港交所大门。当时，祥生已是TOP30房企中最后上市的企业。此时，走过30余年的祥生已成长为一家集地产开发、小镇开发及运营、商业开发及运营、建筑安装、物业管理、酒店管理等事业版块于一体的多元化产业集团。退场祥生控股上市时，陈国祥已近古稀，淡退其实早有预兆。据悉，2019年，陈国祥从各大房企挖来一批职业经理人，包括来自绿地的周琦嘉担任营销客服副总裁；来自正荣的陈建熙任设计成本副总裁、谈铭恒任财务总监；来自融创的韩波任工程副总裁等等。此外，赵红卫这一加入祥生已有15年的老将不再兼任地产集团总裁，改由陈国祥之子陈弘倪接任。新鲜血液注入加上二代走上台前，陈国祥、陈弘倪父子两人同时敲响港交所铜钟后，陈国祥逐渐消失于公众视野中。资料显示，陈弘倪出生于1983年，曾于海外留学，2010年，陈弘倪在美国福特海斯州立大学获得通识教育（商业管理）学士学位。两年后，陈弘倪加入祥生，起初担任祥生实业集团酒店管理公司总经理，负责酒店整体运营。2014-2017年，陈弘倪开始担任祥生诸暨城市分公司董事长。其后，陈弘倪接棒祥生地产执行总裁。然而，祥生“少东家”面临的或许是比以往更艰难的局面，上市并未给祥生控股带来明显正面效应，反而由于棚改货币化政策退出、三四线城市发展红利减少等因素，曾依赖“高周转+低线城市”模式的祥生销售额出现波动。2019年，祥生控股销售金额1225亿元，2020年下降到781.68亿元，跌出千亿房企阵营。2021年，祥生控股销售金额为803.31亿元，较上一年仅增加21.63亿元。三道红线出台、融资政策收紧则使得祥生控股出现流动性危机。于2021年末，祥生净负债率153%，剔除预收账款资产负债率77.5%，现金短债比0.49，踩中三条红线。2022年3月，祥生控股境外债正式违约，9月，因5000万美元债务未偿还，祥生遭遇债权人提交清盘呈请。陈国祥父子并未因此选择躺平，自2022年以来，祥生多次出售资产，最近一次为2022年11月，以2.15亿元的价格出售安吉三特田野牧歌旅游开发有限公司和杭州春园健康养老服务有限公司的股权和债权。今年2月20日晚间，祥生控股正式启动涉及五笔境外债的重组程序，合计约合6.39亿美元。有市场人士指出，陈国祥将自己全部身家都投进拯救公司当中，为了赢得债权人的理解，祥生甚至拿出了上海祥生中心这一重要项目。但目前，祥生控股仍未刊发2022年年度业绩报告。该公司此前公告称，随着多个部门（包括财务部及运营管理部）的关键团队人员近期辞任，人力不足，导致祥生控股及其核数师难以对集团截至2022年12月31日止财政年度合并财务报表进行审计工作。斯人已逝，生者前行。祥生这艘巨轮，尚需要有力的舵手。陈国祥逝世当晚，祥生控股宣布，于陈先生辞世后，该公司执行董事兼行政总裁陈弘倪已获委任为代理主席兼提名委员会主席。祥生控股将继续按董事会既定的业务策略开展集团业务营运。观点人物|我们关注的不仅仅是人物的故事，还有他和她的商业传奇与沉浮。责任编辑：马婕
证券,白酒股“强心剂”来了！“股王”业绩豪横，一季度狂赚超200亿！,市场资讯,2023年04月16日 21:54,来源：证券时报继后，也公布了一季度经营数据。4月16日晚，茅台发布的经营数据显示，2023年第一季度，公司实现营业总收入391.6亿元左右，同比增长18%左右；实现归属于上市公司股东的净利润205.2亿元左右，同比增长19%左右。Wind数据显示，截至2023年2月28日，贵州茅台拥有股东户数近16万户。贵州茅台、山西汾酒等白酒股一季度业绩纷纷双位数增长，在白酒股持续低迷的当下，无疑是一针“强心剂”。近期，部分渠道经销商和业内资深专家对白酒产业发展提出了一些担忧，导致市场情绪出现波动。认为，白酒行业稳健趋势不改，头部酒企受益集中，无需过度担忧，在调整中布局机会。一季度业绩双位数增长贵州茅台发布的经营数据显示，2023年第一季度，公司实现营业总收入391.6亿元左右，同比增长18%左右；实现归属于上市公司股东的净利润205.2亿元左右，同比增长19%左右。贵州茅台表示，2023年以来，公司紧紧围绕年度目标任务，全力以赴抓好生产经营和改革发展各项工作，呈现出良好的发展态势，顺利实现了“开门稳”“开门红”。而在贵州茅台之前，山西汾酒也曾披露一季度经营数据。山西汾酒公告称，2023年以来，公司持续深化市场布局，积极打造汾酒全方位产品矩阵，强化市场秩序管理，市场销售呈现稳中有升的良好态势。经公司初步核算，2023年1-3月，公司预计实现营业总收入126.36亿元左右，同比增长20%左右；预计实现归属于上市公司股东的净利润44.52亿元左右，同比增长20%左右。今年春节期间，白酒行业以价换量，库存得到有效消化，节后随着宴席持续回补、酒企布局积极，淡季不淡战线较往年拉长。华创证券预计，考虑企业间回款、动销及去年基数水平分化，预计白酒企业一季度业绩亦相对分化。具体而言，高端酒对应的礼赠场景基本修复，回款、动销稳健，一季度预计均有望实现双位数增长，其中茅台加大非标投放、批价稳定，周转亮眼，老窖低度和特曲势能延续。基地型次高端受益于区域壁垒强、春节走亲访友等，兼具景气度和确定性，预计普遍有望实现20%-30%的增长。扩张型次高端面临高基数、回款慢于往年、动销修复滞后等多重压力，一季度预计承压分化。行业集中度有望进一步提升近期，在春季糖酒会上，部分渠道经销商和业内资深专家对白酒产业发展提出了一些担忧，市场情绪也出现一定波动，不少白酒股跌幅较明显。例如，在酒水行业颇为知名的盛初咨询董事长王朝成就发表观点称，酒业整体将长期进入销量负增长、收入低增长或0增长、利润低增长的“内卷时代”，并且很可能刚刚开始。盛初咨询调研相关数据显示，2023年春节前（节前一个月）月终端白酒出货同比下降31%，2023年春节后（节后一个月）月终端出货额同比上升10%。王朝成表示，短期来看，白酒高端和次高端的恢复远不及预期。在他看来，2023年是白酒行业的分水岭，从场景-量价-集中度看趋势，真正的高端消费在疫情场景中并没有太受影响，次高端库存仍未消化，区域酒借助消费恢复较快。高端的恢复没有看到更强的动力，仍然在低位徘徊，一二季度上市公司业绩会出现增速放缓和进一步分化。但白酒行业量缩的趋势已延续多年，即便在外部因素扰动下，名酒集中度仍在提升。认为，白酒行业集中度提升的趋势、中小酒企出清的趋势未改，只是实现的路径在迭代升级，背后是消费端品牌化的觉醒。国金证券表示，消费端的需求实际是需要刺激的，酒企大量的品鉴、回厂游、沉浸式体验都是刺激需求的方式，又或是品牌力渗透的方式。当前已经没有场景约束，预计酒企多样化的消费者培育活动将会逐步落地。而对于高端消费的担忧，实际上奢侈品在大中华区的业绩持续高增已然证明了高端消费的韧性，社融超预期也具备货币环境的土壤，情绪的担忧更偏短期。伴随景气度逐步改善，看好批价逐步走强。责任编辑：杨红卜
产经,南方报业传媒集团总编辑郑广宁逝世,央视网,2023年04月16日 21:54,据南方报业传媒集团发布的讣告，南方报业传媒集团（南方日报社）党委委员、副书记、副社长、总编辑郑广宁同志，因病医治无效，于2023年4月15日在广州逝世，享年54岁。郑广宁曾任广东广播电视台党委副书记、副台长、总编辑等职。责任编辑：李桐
证券,下周 高中签率龙头来了！,市场资讯,2023年04月16日 21:52,本周一（4月10日），主板注册制首批10只新股正式上市，以47.92%至221.55%不等的收盘涨幅结束上市“首秀”，标志着全面注册制在A股顺利落地。根据目前安排，下周将有3只新股可申购。拟于下周四（4月20日）申购的公司是国内第三大晶圆代工厂，在核心产品显示驱动芯片领域处于全球领先地位。据Frost&Sullivan统计，截至2020年底，公司已成为中国境内收入第三大、12英寸晶圆代工产能第三大的纯晶圆代工企业（不含外资控股企业）。晶合集成本次网上申购上限为14.5万股，顶格申购需配沪市市值145万元，在今年以来的新股中排名第四，预计将有较高中签率。主板首批注册制新股首周运行平稳4月10日，主板注册制首批10只新股——、、、、、、、、、集体挂牌上市。从上市首日来看，这10只新股上市首日收盘的平均涨幅为96.52%。其中，中电港收涨221.55%，位居第一；登康口腔、柏诚股份分别收涨173.89%、110.63%，位列第二、三位；南矿集团、常青科技、中信金属的涨幅均逾70%。从首周的运行情况看，10只新股无一破发，截至周五（4月14日）收盘，平均较发行价上涨49.31%；资金交投踊跃，10只新股上市首周日均成交13.20亿元，日均换手率41.68%。从单签盈利来看，根据最新交易规则，沪市主板新股申购单位调整为500股。按当日收盘价计算，登康口腔的单签收益约1.8万元，位居10只新股收益榜榜首；海森药业、中电港的单签收益分别为1.5万元、1.3万元，分列第二、三位；其余7只新股的单签收益在2300元至9300元不等。从投资者参与情况看，首批10只主板注册制新股上市首周交投氛围活跃。成交额方面，10只股票首周日均成交13.20亿元，高于同期全部A股均值（2.21亿元）；换手率方面，10只股票日均换手率41.68%，显著高于同期全部A股均值（2.93%）。分析人士认为，全面注册制改革有助于强化资本市场功能，提高中国资本市场服务实体经济的能力。首批主板注册制新股上市首周表现亮眼，或在一定程度上提升投资者参与主板新股申购的积极性。预计后市新股换手率将逐步趋于平稳，个股表现或呈现分化态势。展望：下周新股基本面一览据目前安排，若无变化，下周（4月17日至21日）有3只新股可申购，包括科创板1只、创业板1只、北交所1只。周一公司主要从事车用、非道路移动机械用滤清器和工业用过滤设备的研发、制造和销售。产品主要包括机油滤清器、柴油滤清器、空气滤清器三大类，以及燃气滤清器、液压过滤器、工业用过滤器等其他过滤产品，共3000多个品种型号。华原股份招股书称，2022年全年实现营业收入5.05亿元，归母净利润3844.29万元。华原股份招股书周四晶合集成公司主要从事12英寸晶圆代工业务。报告期内，公司主要提供150纳米至90纳米的晶圆代工服务，所代工的主要产品为面板显示驱动芯片，其被广泛应用于液晶面板领域，包括电视、显示屏、笔记本电脑、平板电脑、手机、智能穿戴设备等产品中，获得了众多知名芯片设计公司和终端产品公司的认可。晶合集成招股书称，预计2023年一季度实现净利润-3.55亿元至-2.73亿元，同比变动-127.15%至-120.89%。晶合集成招股书周五公司是以神经专科为特色的医疗服务集团，成立于2003年，由国内知名神经医学专家栾国明、于春江、石祥恩及资深医院管理专家张阳等人创立。目前运营医院6家，在建医院2家，开放床位1500余张，年门诊量近50万人次，主要病种包括颅脑肿瘤、脑血管疾病、功能神经外科疾病、癫痫、脊髓疾病、小儿颅脑疾病、疼痛疾病等。三博脑科招股书称，预计2023年一季度实现净利润1859.09万元，同比增长28.85%。三博脑科招股书责任编辑：杨红卜
产经,白酒股“强心剂”来了！“股王”业绩豪横，一季度狂赚超200亿！,证券时报,2023年04月16日 21:49,继后，也公布了一季度经营数据。4月16日晚，茅台发布的经营数据显示，2023年第一季度，公司实现营业总收入391.6亿元左右，同比增长18%左右；实现归属于上市公司股东的净利润205.2亿元左右，同比增长19%左右。Wind数据显示，截至2023年2月28日，贵州茅台拥有股东户数近16万户。贵州茅台、山西汾酒等白酒股一季度业绩纷纷双位数增长，在白酒股持续低迷的当下，无疑是一针“强心剂”。近期，部分渠道经销商和业内资深专家对白酒产业发展提出了一些担忧，导致市场情绪出现波动。认为，白酒行业稳健趋势不改，头部酒企受益集中，无需过度担忧，在调整中布局机会。一季度业绩双位数增长贵州茅台发布的经营数据显示，2023年第一季度，公司实现营业总收入391.6亿元左右，同比增长18%左右；实现归属于上市公司股东的净利润205.2亿元左右，同比增长19%左右。贵州茅台表示，2023年以来，公司紧紧围绕年度目标任务，全力以赴抓好生产经营和改革发展各项工作，呈现出良好的发展态势，顺利实现了“开门稳”“开门红”。而在贵州茅台之前，山西汾酒也曾披露一季度经营数据。山西汾酒公告称，2023年以来，公司持续深化市场布局，积极打造汾酒全方位产品矩阵，强化市场秩序管理，市场销售呈现稳中有升的良好态势。经公司初步核算，2023年1-3月，公司预计实现营业总收入126.36亿元左右，同比增长20%左右；预计实现归属于上市公司股东的净利润44.52亿元左右，同比增长20%左右。今年春节期间，白酒行业以价换量，库存得到有效消化，节后随着宴席持续回补、酒企布局积极，淡季不淡战线较往年拉长。华创证券预计，考虑企业间回款、动销及去年基数水平分化，预计白酒企业一季度业绩亦相对分化。具体而言，高端酒对应的礼赠场景基本修复，回款、动销稳健，一季度预计均有望实现双位数增长，其中茅台加大非标投放、批价稳定，周转亮眼，老窖低度和特曲势能延续。基地型次高端受益于区域壁垒强、春节走亲访友等，兼具景气度和确定性，预计普遍有望实现20%-30%的增长。扩张型次高端面临高基数、回款慢于往年、动销修复滞后等多重压力，一季度预计承压分化。行业集中度有望进一步提升近期，在春季糖酒会上，部分渠道经销商和业内资深专家对白酒产业发展提出了一些担忧，市场情绪也出现一定波动，不少白酒股跌幅较明显。例如，在酒水行业颇为知名的盛初咨询董事长王朝成就发表观点称，酒业整体将长期进入销量负增长、收入低增长或0增长、利润低增长的“内卷时代”，并且很可能刚刚开始。盛初咨询调研相关数据显示，2023年春节前（节前一个月）月终端白酒出货同比下降31%，2023年春节后（节后一个月）月终端出货额同比上升10%。王朝成表示，短期来看，白酒高端和次高端的恢复远不及预期。在他看来，2023年是白酒行业的分水岭，从场景-量价-集中度看趋势，真正的高端消费在疫情场景中并没有太受影响，次高端库存仍未消化，区域酒借助消费恢复较快。高端的恢复没有看到更强的动力，仍然在低位徘徊，一二季度上市公司业绩会出现增速放缓和进一步分化。但白酒行业量缩的趋势已延续多年，即便在外部因素扰动下，名酒集中度仍在提升。认为，白酒行业集中度提升的趋势、中小酒企出清的趋势未改，只是实现的路径在迭代升级，背后是消费端品牌化的觉醒。国金证券表示，消费端的需求实际是需要刺激的，酒企大量的品鉴、回厂游、沉浸式体验都是刺激需求的方式，又或是品牌力渗透的方式。当前已经没有场景约束，预计酒企多样化的消费者培育活动将会逐步落地。而对于高端消费的担忧，实际上奢侈品在大中华区的业绩持续高增已然证明了高端消费的韧性，社融超预期也具备货币环境的土壤，情绪的担忧更偏短期。伴随景气度逐步改善，看好批价逐步走强。责任编辑：梁斌SF055
美股,贝莱德CEO：高通胀将持续，但美国经济不会陷入严重衰退,环球市场播报,2023年04月16日 21:39,集团CEO拉里·芬克（LarryFink）表示，美国经济不会陷入严重衰退，但他坚持认为，近期通胀的粘性会大得多。芬克最近在一次采访中表示，美国经济不会陷入严重衰退，因为一系列法案带来了大量刺激措施。他说：“这些法案是在今后几年里拿出一万亿美元来刺激经济。想想基础设施能创造多少就业机会。在我们建设基础设施之际，想想大宗商品的需求吧。”这位全球最大资产管理公司的负责人表示：“我们的一些经济领域已经开始走弱，但是我们的其他经济领域将会增长，因为这些庞大的财政刺激计划将会抵消一部分（走弱）。”芬克补充说：“所以，我不认为会出现大衰退。我甚至不确定2023年是否会出现经济衰退。我们可能会在（2024年）年初看到它，这实际上取决于短期内通胀的路径。”尽管美联储采取了紧缩货币政策，但芬克表示，由于地缘政治问题，通胀将在更长时间内保持在较高水平。“我们已经远离了全球化的整个概念。我们转向了碎片化，但没有人问这个问题。如果我们想要食品的国家安全，薯片和能源的国家安全利益，没有人会问这个重要的问题，代价是什么？”他预测通胀将达到4%。“我们正把越来越多的供应链转移到这里，但代价是什么？”责任编辑：于健SF069
证券,完美世界预计一季度利润下滑超7成，实控人池宇峰三年多变现超80亿,雷达财经,2023年04月16日 21:37,雷达财经鸿途出品文|吴艳蕊编|深海4月15日，发布2023年一季度业绩预告，公司预计一季度实现归属于上市公司股东的净利润22，000万元-26，000万元，同比下降73.82%-69.06%，预计实现扣除非经常性损益后的净利润18，000万元-22，000万元，同比下降56.54%-46.88%。公司业绩主要由游戏业务、影视业务、总部支出等构成，较上年同期同比变动的主要原因有，报告期内，公司非经常性损益预计约4，000万元，同比大幅下降。上年同期非经常性损益为42，608万元，主要系公司于上年同期确认游戏业务海外子公司股权处置收益。报告期内，公司游戏业务预计实现扣除非经常性损益后的净利润26，000万元-30，000万元，同比下降41.65%-32.67%。主要原因为《幻塔》手游于2021年12月16日国内公测，2022年第一季度该款游戏流水处于产品上线初期的高位，产生了较高的业绩贡献。目前，该款游戏已进入成熟稳定期，通过持续的内容迭代更新与运营体系优化，不断发力游戏内容建设，有效推进游戏体验提升，但受生命周期影响，该游戏流水较上线初期的高点自然下滑，相应业绩贡献较2022年第一季度同比下降。此前在4月6日，完美世界公布了2022年年度报告。报告期内，公司营业收入76.70亿元，同比减少9.95%；归属于上市公司股东的净利润13.77亿元，同比增长273.07%。这是2020年公司营收破百亿后，连续第二年营收下降。虽然公司净利润相比2021年大幅上升，但尚不及2017年水平。该年，完美世界实现了15.05亿的净利润。此外，报告期内公司控股股东完美世界控股集团有限公司减持了公司5742.58万股股份，持股比例从25.33%变为22.37%。天眼查资料中，完美世界的董事长、实控人池宇峰持有完美世界控股集团有限公司90%的股份。而根据长江商报记者不完全统计，2019年以来，完美世界实控人池宇峰，通过二级市场减持、协议转让、可交换债、现金分红等途径，直接间接累计变现金额高达85亿元左右。对于2022年营业收入下滑，公司表示，营业收入较上年同期减少，主要系公司调整海外游戏业务布局，出售美国研发工作室及相关欧美本地发行团队，该交易于报告期内完成，相关欧美子公司自2022年2月起不再纳入合并范围。扣除上述合并范围变动的影响后，2022年营业收入较上年减少3.25%，其中游戏业务本年实现收入719899.51万元，较上年增加6.09%，影视业务本年实现收入32065.42万元，较上年减少66.33%。具体来看，报告期内公司游戏收入占总营业收入的94.42%，影视业务占总营业收入的4.18%。按地区分类，完美世界境内收入67.43亿元，占总营业收入的87.91%；境外收入9.27亿元，占总营业收入的12.09%。2022年完美世界游戏业务毛利率为70.75%，比上年同期增加4.13%；影视业务毛利率为18.25%，比上年同期减少1.68%。公司综合毛利率为68.45%，上年同期为61.46%，毛利率较上年同期增加6.99%。费用方面，2022年完美世界销售费用较去年减少44.18%。主要因为报告期内市场推广费用减少所致；公司财务费用同比减少73.95%，系外币汇率波动形成的汇兑收益增加所致。证券投资情况中，2022年完美世界购入了知乎股票，年末累计亏损895.07万元。天眼查资料中，完美世界位于浙江省湖州市，是一家以从事广播、电视、电影和录音制作业为主的企业。企业注册资本193996.8404万人民币，超过了99%的浙江省同行，实缴资本193996.8404万人民币，并已于2020年完成了定向增发。通过天眼查大数据分析，完美世界股份有限公司共对外投资了6家企业，参与招投标项目5次；知识产权方面有商标信息22条，专利信息39条，著作权信息2条；此外企业还拥有行政许可3个。风险方面共发现企业有天眼风险信息671条；还发现企业有法律诉讼18条，涉案总金额4.79亿元。
