板块名,标题,作者,日期,新闻内容
国内财经,夜间经济澎湃城市活力,市场资讯,2023年04月29日 10:01,来源：求是网一杯奶茶能有多火？一片臭豆腐能有多香？答案就藏在夜长沙摩肩接踵的人群里。茶饮品牌“茶颜悦色”单店一天卖出400杯奶茶，臭豆腐品牌“黑色经典”系列门店最高峰7天卖出30万份臭豆腐。方寸之间的奶茶杯、餐纸盒里，充盈着长沙夜间经济的活力，一张张年轻的面孔、一片片闪烁的霓虹，折射出“网红长沙”的朝气。夜间经济是现代城市经济的重要组成部分。据统计，长沙夜间消费占全天消费的比重达60%左右。这样的活力从何而来？习近平总书记强调，“要增强消费能力，改善消费条件，创新消费场景，使消费潜力充分释放出来。”长沙夜间经济的繁荣，正得益于消费场景的不断创新。一方面，鼓励和引导火宫殿等“老字号”品牌企业，通过技艺展示、非遗表演、文化体验、直播带货等新模式，不断拓展品牌价值、焕发崭新活力。另一方面，培育“野肆月球”等一批以年轻消费者为中心、自带话题传播特征的新消费场景，紧跟时尚潮流、壮大“新字号”。漫步长沙大街小巷，“新老字号”各美其美，历史底蕴与时尚新潮相得益彰，既满足了长沙“老口子”家门口的享受，又吸引着各地年轻人慕名而来，叠加起近悦远来的旺盛人气。不断创新的消费场景，让长沙的夜间经济从单一的餐饮、购物等消费活动，发展到酒吧、夜游、演艺体验、灯光夜景等多元业态。逛坡子街品美食、观一江两岸灯光秀；一次次迭代后的解放西路酒吧，始终是年轻人汇聚放松的最爱；餐饮品牌“文和友”独具特色的消费场景，竟能让无数年轻人甘愿体验“前方有4538桌”的漫长等候……文化、旅游、美食等相加相融，让消费的时空得到延展，让消费的边界不断拓展。今年1-3月，仅长沙市黄兴路步行街累计客流2328万人次，同比增加90%。越来越多数据表明，夜间经济已成为新的消费增长点，在扩内需、促消费、稳就业等方面能够产生积极作用。“文和友”总经理孙平介绍，“文和友”与长沙市望城区打造的龙虾基地实现了多方共赢，通过带动1000多户农户养殖小龙虾，帮助养殖地每亩增收2000元以上，带来相关直接经济效益已超10亿元。湖南茶悦文化产业集团发展有限公司总经理孙翠英介绍，“茶颜悦色”近500家门店，直接创造了5000多个就业岗位。繁荣的市场离不开良好营商环境的打造。党的二十大报告提出，营造市场化、法治化、国际化一流营商环境。今年年初，习近平总书记在主持中共中央政治局第二次集体学习时强调，“为各类经营主体投资创业营造良好环境，激发各类经营主体活力”。夜间经济容纳的经营主体数量巨大、业态丰富，其繁荣健康程度是良好营商环境的表征。持续优化营商环境，正是长沙夜间经济活力充沛的关键因素之一。作为全市商圈最集中的区域，长沙市天心区始终坚持“企业需要什么就提供什么，企业期盼什么就向什么方向努力”的原则，全方位优化营商环境。天心区商务局党组书记、局长彭明霞介绍说：“天心区既是长沙老商贸发源地，更是新消费策源地和孵化器，我们打造了‘1+3’消费产业服务模式，‘1’即一个新消费产业服务平台，‘3’就是一个新消费研究院、一支新消费产业基金和一个新消费人力资源服务平台。”天心区还在争资争项、用地保障、信贷融资、品牌推广等方面为新消费企业提供全生命周期服务。良好的营商环境，为广大企业商家等创业奋斗、创新发展提供了肥沃土壤。对此，企业家的切身感受最具说服力。长沙伍爱美食食品科技有限公司CEO、“黑色经典”创始人之一卢路成说：“得益于长沙市政府的创业补贴和青年发展基金的助力，‘黑色经典’臭豆腐品牌连锁才得以在黄兴路步行街开设首店。此后，每一步发展都离不开政府引导、政策支持。可以说，即便我们怀揣一腔创业热情和奋斗激情，如果没有政府营造的良好营商环境，就不可能有今天这样的成绩。”为游客提供周到温馨的服务，是积聚美誉度的关键一环。夜游橘子洲、与青年毛泽东雕像合影、到岳麓山看日出等，如今已成为外地游客来长沙的“必打卡项目”。岳麓山风景名胜区管理局党委书记杨淑岚介绍，为了更好地服务游客，橘子洲景区的日常工作时间延长到晚上10点，每年5月1日至10月31日岳麓山景区设置了3点到6点的凌晨开放时段。努力提升游客体验感满意度，虽然没有立竿见影的经济收入，却有力夯实了夜间经济繁荣发展的环境基础。优化营商环境，是一项长期性系统性工程。新征程上，长沙正多措并举、务实发力，为夜间经济蓬勃发展提供更加肥沃土壤，推动大众消费升级，为城市经济社会发展注入新动能。责任编辑：冯体炜
基金,杨德龙：在全面注册制之下 今年如何做好投资？,市场资讯,2023年04月29日 09:55,今年3月开始，A股实施全面注册制，并且首批在主板注册上市的公司已经登陆资本市场亮相了，这也标志着中国资本市场进入到全面注册制时代。虽然注册制改革只是新股发行制度的一个改革，但是它对于A股市场的生态将会产生巨大的影响。注册制之后会有更多中小企业登陆资本市场，大公司比较少，中小公司的数量会增加比较多，也就是股票总体的数量会增加，这样会让一些绩差股、题材股，包括一些小盘股的稀缺性下降，也就是说所谓的壳资源价值下降，也就没有优势了。这样的话，注册制之下炒差、炒小、炒新的习惯会有所改变，就是说这些所谓的壳，未来的价值在减少。因为未来通过注册上市的排队时间减少，大家就不会花几十亿去买一个没有任何业务的壳，这样市场的炒作之风可能会有所下降。一方面实施注册制，另一方面会严格执行退市新规。退市新规会让更多绩差公司退出市场，从而实现优胜劣汰。好公司通过注册登陆资本市场，差公司通过退市新规退出市场，这样上市公司整体的质量就提高了，会让更多的资金，特别是机构资金，偏向于去买不会有退市风险的行业龙头股，这样价值投资理念就会更加盛行。有一个数据我们可以对比一下，就是市场越成熟，特别是实施注册制时间越长的市场，头部企业的成交量占比越大。比如在A股市场，前300只市值最大的公司成交量占整个市场成交量的占比大概是60%，港股大概是80%，而美股高达95%。美股实施了很多年的注册制，加上市场越来越成熟，机构投资者占比增加，散户投资者比较少，所以市场成交量基本上就围绕着前面300只大公司，更加集中。比方说过去十几年，美股走出了十年大牛市，但实际上前十大市值的公司就贡献了75%的涨幅，剩下八千多只股票才贡献了25%的涨幅，还有很多公司是跌的，另外还有很多公司是退市的。在美国退市率经常会达到8%，也就是说一年之内有8%的股票退出市场，这样就形成了优胜劣汰。比如说现在纳斯达克市场成为世界上最大的创业板市场，纳斯达克大概有三千多只股票，在历史上通过纳斯达克上市又退市的公司高达一万多家，这才叫优胜劣汰、大浪淘沙。退市有一万多家，剩下的3000家，这3000家确实是竞争力比较强，才成为大公司、好公司，所以纳斯达克才能取得成功。我们A股市场实施注册制，将来要建设中国版的纳斯达克，就要学习美国的经验。一方面通过注册制让大量的新经济企业上市，另一方面让一些绩差股、垃圾股及时退市，从而实现优胜劣汰。这样的话，A股市场整体上市公司的质量提高了，大家的投资理念变成价值投资了，更多人喜欢去买好股票，而不是去炒那些垃圾股，我觉得这是一个非常大的变化。今年资本市场我的总体判断是结构性牛市行情，这个是相当于去年结构性熊市来讲的。去年由于超预期因素的影响，整体经济出现了逐季下滑，市场重心也在不断下移，所以去年基本上是各个板块轮番下跌，所以叫结构性熊市。今年经济复苏的态势已经确立，消费也在逐步回升，因为大家感受到五一小长假很多景区都是人满为患，机票、高铁票一票难求，餐饮排起了长龙，也就是说消费其实在复苏。今年一季度上涨的主要是以ChatGPT为代表的AI板块，这是有概念性炒作的成分，当然也代表了大家对于新技术的期待。现在AI的上涨已经是接近尾声，4月份我提示是一个重要的风格切换的窗口，建议大家从人工智能这些涨幅扩大的热门股上获利了结，去配置一些被错杀的优质股票，特别是年报业绩超预期的一些新能源汽车、光伏、风电这些新能源类的股票，还有一些被错杀的消费板块的股票，比如说像白酒、食品饮料、中药以及一些创新药等等。这些消费白马股也已经调整到位，后面也会轮动起来。今年还有一个要重点关注的主题就是中字头板块，中字头股票今年以来已经有所表现，但是还没有表现充分。我认为探索中国特色估值体系是中国特色价值投资的重要内涵，也是未来很多年资本市场的主线，就是说一些低估值的蓝筹股将会迎来价值回归，从而带来一波比较强的赚钱效应。所以在今年大家要抓住结构性牛市的行情，指数可能上涨的空间并不大，但行业之间的轮动会比较多，大家要抓住封地布局的机会。哪个好公司、好板块跌下来了刚好就是一个布局的机会，如果哪个板块短期涨幅过大，有比较大的获利盘，这时候可能要考虑获利了结，这样才能踩准今年资本市场的节奏。当然在市场调整的时候，重要的就是保持信心和耐心，我们要学习价值投资就要知行合一，真正落实巴菲特讲到的逆向布局，别人贪婪时我恐惧，别人恐惧时我贪婪，才能在今年的投资中获得相对比较好的回报。包括对于基金的投资，今年也要采取这样的方法，当基金的净值跌下来就是一个抄底的机会，如果短期涨幅过大，就是一个获利了结的时机。责任编辑：冯体炜
美国第一共和银行被接管,摩根大通和PNC金融服务集团拟竞购第一共和银行,环球市场播报,2023年04月29日 09:46,媒体援引不愿透露姓名的知情人士的话报道称，在美国政府接管第一共和国银行后，包括和服务集团在内的多家银行计划竞购该银行。报道称，美国联邦存款保险公司（FederalDepositInsuranceCorp．）最早可能在本周末接管并出售第一共和银行。责任编辑：王永生
美股,濒临倒闭！股价暴跌逾97%，“接盘侠”火速行动,中证报,2023年04月29日 09:23,当地时间4月28日，美国三大股指全线收涨，道指涨0.80%。银行股第一共和银行盘中暴跌，多次触发临时停牌。有分析认为，从第一共和银行的股价表现来看，综合央视新闻等消息，当地时间4月28日，银行危机持续发酵美国经济硬着陆风险增加当地时间4月28日，美国三大股指全线收涨，截至收盘，道指涨0.8%报34098.16点，标普500指数涨0.83%报4169.48点，纳指涨0.69%报12226.58点，当地时间4月28日，第一共和银行盘中暴跌，多次触发临时停牌。截至收盘，第一共和银行跌超43%，刷新收盘价历史低点至3.51美元，盘后一度再次暴跌50%以上。另据媒体报道，包括FDIC、美国财政部和美联储在内的美国官员们正在协调与其他银行的会议，以促成对第一共和的救助计划。上述方案将导致出手相救的银行短期内蒙受损失，但从长远来看，可能比让第一共和银行倒闭并被监管机构接管的成本更低。本周，伴随着第一共和在一季度比市场预期更糟糕的存款外流形势，其危机浮出水面。当季该行的存款较去年末减少720亿美元，环比降幅近41%，剔除分析认为，除第一共和银行外，美国其他区域性银行也面临更多审视，信贷市场紧缩预计将加剧美国经济下行压力。国际评级机构穆迪日前下调了10余家美国区域性银行的评级。摩根大通资产管理公司首席投资官鲍勃·米歇尔表示，如果有人说，这场危机只波及第一共和银行，那他太天真了，这场危机发生在全世界最高度资本化的产业——银行业，区域性银行系统对美国来说至关重要。有美国高校金融学专家分析认为，从第一共和银行的股价表现来看，美国银行业危机仍在发酵。未来一段时间，美国银行业可能出现较大规模重组，大银行可能会并购很多无法存活下去的中小银行。分析指出，随着大量资金因避险和追求相对高回报流入货币市场基金，很多中小银行的准备金被蚕食，信贷萎缩加上信贷标准提高会使美国货币供应进一步缩小，加大美国经济出现硬着陆的风险。美联储调查报告：美联储监管机构并未完全意识到漏洞的严重程度在当地时间28日（评估结果称，硅谷银行事件的发生主要有四个关键要点：硅谷银行的董事会和管理层未能管理好他们的风险；随着硅谷银行规模和复杂性的增长，美联储监管机构并未完全意识到漏洞的严重程度；监管者发现漏洞时没有采取足够的措施来确保硅谷银行能足够快地解决这些问题；美联储针对《经济增长、监管减轻和消费者保护法案》的调整方法和监管政策立场的转变阻碍了有效监管，因为该转变降低了标准，增加了复杂性，促使监管者采取较不积极的监管方法。报告中，美联储负责金融业监管的副主席巴尔表示，其中三点都和美联储监管不力有关。美国油气巨头业绩亮眼美股能源股普遍上涨当地时间4月28日，美股能源股普遍上涨，消息面上，美股盘前，美国两大油气巨头埃克森美孚和雪佛龙公布今年一季度业绩。尽管当前国际原油价格较去年的峰值下跌超过35%，但两家公司已连续四个季度实现巨额利润。在过去四个季度中，埃克森美孚每季度的净利润都超过100亿美元，雪佛龙的平均净利润接近90亿美元，这是2008年油价触及147.5美元的历史高位之后从未出现的局面。有分析指出，这两家油气巨头过去四个季度的强劲业绩凸显了其如何通过削减成本和精简投资组合来应对接二连三的石油市场崩溃，从而使自己的财务状况稳健。现在，充足的现金流令股东信心大增。乌防长称反攻准备工作进入最后阶段据媒体报道，乌克兰国防部长列兹尼科夫当天称，乌克兰武装部队的反攻准备工作已进入最后阶段。关于反攻的具体日期和地点将由乌总参谋部作出决定。俄罗斯方面尚未对乌方的这一消息做出回应。ChatGPT获准在意大利重新上线据媒体报道，被意大利数据监管当局勒令下线近一个月后，美国科技公司OpenAI的聊天机器人应用ChatGPT已经在该国恢复服务。作为这件事情的起点，当地时间3月31日，意大利政府数据保护局（Garante）勒令ChatGPT下线，并暂停处理意大利用户的数据。之后该部门在4月12日又提出了一系列整改要求，限定OpenAI本月内完成整改。所以其实恢复上线，仅仅比监管给出的最后整改期限早了两天。据OpenAI的发言人透露，公司已经回应或澄清意大利政府提出的一系列问题。国际原子能机构总干事：扎波罗热核电站附近传来持续炮击声国际原子能机构总干事格罗西28日表示，国际原子能机构驻扎波罗热核电站的专家团队在收到导弹攻击警告后被迫紧急避难，随着该地区军事活动的继续，远处传来持续的炮击声，一枚地雷在现场附近爆炸。27日，国际原子能机构驻扎波罗热核电站的专家团队顺利完成了轮换。经检测，核电站的备用电力系统仍不稳定，核燃料包层完好无损。格罗西说，该地区军事存在和活动的增加再次凸显了就保护核电站达成协议的重要性和紧迫性。俄罗斯暂停公布石油、天然气和天然汽油开采量统计数据当地时间4月28日，俄罗斯政府下令，至2024年4月1日前，暂停公布石油、天然气和天然汽油的开采量统计数据。（文中行情图来自Wind）责任编辑：冯体炜
证券,医美也有“冷静期” 合同范本来了→,市场资讯,2023年04月29日 09:20,来源：中国经营报本报记者张悦曹学平北京报道近日，国家市场监督管理总局（以下简称“市监总局”）发布《医疗美容消费服务合同（示范文本）》（以下简称“合同范本”）。市监总局官网表示，近年来，随着医疗美容行业规模快速扩张，发展不规范问题日益显现，一些机构非法行医、虚假宣传等情况较为突出。《中国经营报》记者关注到，合同范本提示消费者应增强对医疗美容服务风险的了解和认知，中国法学会会员、北京医美镜医疗美容争议研究与调解中心（以下简称“医美镜”）秘书长刘洋向记者介绍，医美镜是合同范本起草单位之一，合同范本的出台对于医疗美容纠纷责任界定与处置工作提供了有力依据与帮助、为消费者与正规合法的医美机构创造了更良好的环境，对行业健康发展、改善行业形象等都起到了重要影响。同时，，“又有多少非法医美机构敢于和消费者签订合同范本呢？”对保障双方权益都有积极作用刘洋向记者介绍，在医疗美容行业，大部分医疗美容服务双方一般不会签订书面合同，合同范本的发布，实现了医疗美容服务书面合同从无到有的突破，让医疗美容消费服务合同签订有据可依、有据可查。缺少书面合同容易造成信息不对称、权利义务划分不清晰、服务效果约定不明确等问题，为后期可能发生的纠纷埋下隐患，给消费者维权造成困难。与此前进行医美项目时签署的医疗文书内容相比，合同范本的正文对医疗美容服务项目名称、效果、费用和双方的权利义务责任等予以明确，传统医疗文书仅是医疗美容机构和美容医师依法履行医疗风险的告知义务。市监总局制定发布的合同范本为督促机构合法经营、倡导消费者理性消费、促进行业健康发展起到重大作用。刘洋表示，医美纠纷成因复杂，包括但不限于机构资质不全、超范围诊疗，医生不具备主诊医师资格，药械不合规，病历涂改和书写不规范等问题。医美镜在调解医美纠纷的过程中遇到过多种情况，在参与合同范本起草的过程中考虑了上述列举的问题。例如在合同范本草案讨论中，针对目前部分医美机构使用假药（如未经批准的肉毒素）、假医疗器械（如未经批准的玻尿酸）情况，提出消费者在接受药物注射或植入性医疗器械时，应当向医美机构索要产品的外包装、说明书、合格证、质保卡、溯源码等资料，并妥善保管。此外，许多医美纠纷在消费者手术恢复期没结束时发生，针对这一情况医美镜提出消费者应当在手术恢复期结束后再行判断手术效果，避免不必要的争议与纠纷。这些建议均被市监总局所采纳。刘洋认为，合同范本对于消费者和正规合法医美机构的权益保障都有积极作用。对于消费者而言，主要体现在增强信息透明、倡导理性消费、设置“冷静期”条款等方面。如基于医疗美容服务的特点，合同范本特别设置了单方解除权条款，赋予消费者在冷静期内无责任解除合同并要求全额退款的权利，保护消费者“后悔权”。对于机构而言，主要体现在避免服务纠纷、促进正规合法机构的经营发展、为“正规军”创造出了良好环境以及引导消费者理性维权等方面。合同范本提示消费者应当在手术治疗恢复期后再判断医美效果，并应当依法理性维权，不得有干扰医疗秩序、妨碍医务人员工作生活、侵害医务人员合法权益等行为。企查查数据显示，我国现存医美相关企业9.78万家，近10年来医美相关企业新注册量不断增加。2023年第一季度，我国新增医美相关企业9103家，同比增长33.53%。北京的范晓婷（化名）向记者表示，其在私立医美机构进行过四五次光子嫩肤项目，所签署文书的具体内容已经记不太清楚，但是签署的时候只有一份而非双方各执一份，因而没有觉得更有保障。范晓婷告诉记者，自己在进行相关项目时实际上更注重价格和专业水平而不是合同是否完善，如果未来有更加规范的合同在手里会更加放心。经常进行医美项目的朱乐乐（化名）告诉记者，其已经在常去的机构进行了3年多的医美项目，自己选择机构时会关注能否直接医生面诊，顾问是不是医生、护士等专业学校毕业的等内容。在进行项目前都会签署相应的文书，护士也会照例询问之前是否做过同一个项目，自己对目前的机构和医护人员十分信任。朱乐乐也表示，一般在个人面对机构时签署的文件均出自对方法务之手，要想进行项目，不管写了什么都得签，如果未来去完全不熟悉的机构，一定会要求签署合同范本。对于未来在落实合同范本内容的时候是否会出现某些难点的问题，刘洋向记者表示，消费者不是医生，很难具备专业医疗知识。医疗美容同时兼具消费属性和医疗属性，消费者和医美机构之间在诊疗行为和诊疗效果的认知上存在差异。合同范本设置了服务效果条款，可能消费者和机构在未来落实相关合同内容时会遇到一些阻力。此外，医学是一门不完善的学科，至今仍有许多未知领域和临床上无法解决的难题，且医疗技术距离完善相去甚远。因此，医美行业通行的做法是只承诺“过程”而不承诺“效果”。即便是医美诉讼案件，法院审理过程中通常需要委托进行司法鉴定，司法鉴定的依据则是诊疗行为是否符合诊疗规范，而非只看结果。因此合同范本要求消费者与医美机构之间就服务效果进行事先约定，预计绝大多数医美机构和美容医师都不会执行。为此，刘洋认为，应当通过科普宣传，让消费者分清“美学效果”与“医学效果”之间的区别。“美学效果”没有统一标准，医美机构和美容医师不可能在手术前向消费者承诺一个没有统一标准的效果。“医学效果”则具有客观标准，例如重睑术把单眼皮做成双眼皮、隆胸术确确实实起到了丰胸的效果等。通过术前消费者和医美机构就“服务效果”进行明确和细致磋商，尽量在“医学效果”的基础上，增加一些“美学效果”的约定，对医疗美容行业将会有促进作用。同时，刘洋还建议社会公益性法律服务组织为广大医美消费者普及专业知识、传递正确医美观念、引导理性消费，使消费者在与医美机构签署合同范本之前能够对相关医疗美容项目、机构、医生、药械以及医疗行为所带来的影响与相关风险有清楚认知。如首都医疗美容药械正品宣教中心的成立以及努力打造医美治理的“北京样板”等。联合丽格医疗美容集团董事长李滨向记者表示，联合丽格与其他医美机构一样遵守基本医疗规范，在诊疗过程中的病历、术前同意书、知情同意书等相关医疗文书均构成相应的合同要件。李滨认为，合同范本能够在一定程度上确立医疗美容的消费属性，对医美行业的消费者权益保护有一定促进作用，也对广大消费者有一定宣传教育作用。而在具体应用方面，李滨认为，合同范本可以理解成为供医美机构和医美消费者选用的一种契约方式，并非强制性。所有正规的医美机构都会严格按照医疗就诊的程序和规范操作，相应医疗文书均构成合同要件。李滨认为，若未来消费者主动向医美机构提出签署该合同，医美机构一般也会和消费者签署。此外，在消费者接受服务的过程中，服务提供方等要尽量让服务过程越便捷越好，方便就医者和消费者。责任编辑：冯体炜
