板块名,标题,作者,日期,新闻内容
经济新闻滚动,“不缺我们一家炮灰”！元气森林要卖可乐味气泡水 挑战可口可乐、百事可乐能否成功？营收增速放缓 7岁焦虑,每日经济新闻,2023年04月29日 15:28,“调制可乐的口味时，想象中的对手是谁？是真的那家巨头吗？”“说实话，对手天天惦记着我们，一点想法没有也不可能。”……可乐味气泡水迭代，元气森林创始人唐彬森出马站台，展现了想再度挑战“两乐”的气势。事实上，国产汽水与“两乐”之间的战争已经旷日持久。上世纪80年代可口可乐、百事可乐入华。1994年，饮料行业上演“两乐水淹七军”，包括天府可乐在内的国内七家汽水厂与“两乐”签订合资合同，此后国产汽水品牌日渐式微。其后，尽管国内依旧有天府可乐、崂山可乐、非常可乐等国产可乐品牌，但始终未曾撼动“两乐”的巨头位置。如今，元气森林展现了自己不死的“可乐心”。但这个被唐彬森在内部称为“大概率会失败的产品”，最终也难说它会打出一场“赤壁之战”，还是走上华容道。元气森林加码可乐战时隔将近半年时间，元气森林发布了其可乐味气泡水的2.0版本。元气森林方面表示，新产品相比去年发布的可乐味气泡水1.0版本，围绕口味、爽感、气感等方面进行了升级。谈及产品的销售预期，元气森林气泡水品牌负责人虞海宇在接受记者采访时介绍，此前推出的1.0版本，只是在市场上试了试，投放量和尝试范围很小，更多的是收获消费者的反馈，摸清方向。而2.0则在反馈基础上，经过了半年的研发和迭代，“我们有自己的目标，但没有明确的时间说能跑到什么规模，我们会不断打磨我们的产品，不是为了达成什么样的数据目的而做。”元气森林切入可乐，依旧基于唐彬森所信奉的贝叶斯理论：一个事情发生概率=基础概率*这个事本身的概率。“在任何一个狭小的（饮料）品类里，都至少能看到50家以上的公司在做。就讲气泡水，前几年元气森林开创了气泡水品类，（现在）基本上只要是个饮料公司，不说自己做气泡水，都不好意思说自己是饮料公司。但是有一个那么大的品类叫可乐，居然从来没有人敢做。”唐彬森说。众多饮料企业跟进气泡水，是唐彬森更加坚定要做可乐的原因。“我一定要做个可乐，我希望这不再是一个禁区，就是一个口味。我希望从明年开始，全中国的饮料公司都应该做个可乐味，做可乐可以成为他们每天都敢讨论的事情。”唐彬森认为，可乐是一种口味，就像每个国家都有自己的啤酒、有自己的威士忌，“前几年我们元气做的这个气泡水，这个气泡水的概念其实也是以前别的国家产生的，但不代表这是这个国家的专利，其实每个国家都可以用。”元气森林气泡水产品负责人许荟介绍，元气森林做可乐的心始于2016年，元气森林刚成立时。“公司内部其实也有很多人反对，说我们一旦做可乐了，大厂围剿我们怎么办？能不能活下来都是个问题。”但唐彬森一直是这个项目的坚定支持者。许荟回忆，“当时他（指唐彬森）说我一定要做可乐。既然用户有需求、既然你们那么想做，元气森林为什么不做？全世界有那么多做可乐味饮料的公司，不缺我们元气森林一家炮灰。”去年营收增速放缓元气森林7岁的焦虑面对可乐味的气泡水，元气森林的态度有些纠结，既自信，又没那么自信。虞海宇提到，可乐味气泡水，“可以说是元气森林集团2023年最重要的新品。”元气森林生产中心总经理李炳前在接受《每日经济新闻》记者采访时也谈到，“今天开发布会请这么多重头的嘉宾，你就可以看到在元气森林内部也好，唐彬森内心也好，气泡水是（元气森林的）第一梯队，外星人是第二梯队，第三曲线我们现在把橄榄枝给了冰茶和鲜茶团队。但这中间，可乐味气泡水是放在第一矩阵的，在未来3到6个月内，我们会全渠道铺市。”但与此同时，元气森林反复强调，内部对于做可乐这件事比较保守，唐彬森曾将其评价为“大概率会失败的产品”。和半年前的1.0版产品发布会一样，在这一场发布会上，元气森林依旧在努力降低外界对于可乐味气泡水的预期。唐彬森在与罗永浩对谈的宣传片里说：“做可乐一直是我们团队里很多年轻人和研发人的想法，拦也拦不住，还不让他试试，失败了就失败了，公司也不差这一次失败。”在2023年大举攻入可乐赛道，对于过去一年并不“顺心”的元气森林而言，重要程度确实不言而喻。元气森林，这家昔日的饮料新贵同样迎来了增长的烦恼。据此前媒体报道，2022年元气森林营收增速大幅放缓，销售回款预计80亿元~90亿元，同比增长在10%~23%。此前，唐彬森给元气森林定下的2022年销售目标是100亿元。同时，元气森林在经销渠道也刚刚经历一场震动。2023年1月，元气森林发布内部全员公告，称元气森林营销中心原负责人叶礼诚，涉嫌重大贪腐等经济犯罪，已被警方依法刑事拘留。叶礼诚此前曾担任元气森林西南大区销售负责人，统管元气森林所有产品在西南区域的销售。在2021年末，叶礼诚开始负责元气整个销售团队。元气森林对于“两乐”的反攻发起于内忧外患之下。在被问到做可乐的难点时，虞海宇也表示，一方面，中国企业可乐做得很少，是因为大品牌的心智占领，“这个类型在中国消费者心里已经根深蒂固了，我们致力于让大家在碳酸饮料里喝更健康的产品，可乐是绕不开的。”消费者需要国产可乐吗？元气森林把可乐味气泡水的2.0版本选择在湖北咸宁发布，这也是三国时期的赤壁之战的发生地。这一次，元气森林想在可乐赛道再打一次以弱胜强的“赤壁之战”。天府可乐此前一直是国产可乐的代表品牌，董事长蒋林认为，做国产可乐首先是有商业价值。他介绍，中国的所有饮料厂早期都是做汽水的，以前汽水就是饮料。而目前，碳酸饮料依旧是饮料行业中除了水以外最大的板块。碳酸饮料中，最大的品类就是可乐。“一个很大的市场，一个很大的品类，并且在中国市场，这个品类的品牌是最少的。在任何一个（其他）子品类里，可能出名的品牌，找到10个、20个都没有问题，但是在可乐这个品类里面，出名的就那么两三个，然后不出名的可能也不会超过10个。”蒋林认为。国产可乐想打一场以弱胜强的战争，但对于消费者而言，需要国产可乐吗？国产可乐曾深受国内消费者的喜爱，崂山可乐被称为“中国八大可乐之首”，其董事长魏华磊回忆，在1985年左右，崂山可乐在全国各地联合工厂有98家，“当时是如此的火爆，为什么？我想（原因）有大的环境、时代的发展，人们对这种美好生活的追求。还有产品本身的产品力，八大可乐都各有特色，都得到了消费者的喜爱。”他也坦言，想做好一个产品需要天时地利人和。从崂山可乐来讲，当时并没有解决好市场的问题、市场化的发展和渠道的建设投入。“未来我们要思考未来怎么做，怎么去突破，除了坚守还要创新，还要合作。”中国饮料市场目前最大的问题是整个中国都对饮料觉得不健康，导致了其实大家更愿意喝水，“今天一个20岁的孩子，他喝瓶可乐他都不愿当着父母的面喝”唐彬森觉得需要一代人的努力，才能让大家觉得这个饮料行业是一个健康的行业，那个时候这个产业也会变得发达。“认为饮料不健康”，这也许会成为饮料企业们共同的对手。可口可乐前高管Curt最后说。
美股,Stable Diffusion团队放大招！新绘画模型直出AI海报，实现像素级图像生成,市场资讯,2023年04月29日 15:25,StableDiffusion团队放大招！新绘画模型直出AI海报，实现像素级图像生成来源：量子位StabilityAI推出全新开源模型DeepFloydIF，不光图像质量是照片级的，还解决了文生图的两大难题。开源AI绘画扛把子，StableDiffusion背后公司StabilityAI再放大招！全新开源模型DeepFloydIF，一下获星2千+并登上GitHub热门榜。DeepFloydIF不光图像质量是照片级的，还解决了文生图的两大难题：准确绘制文字。（霓虹灯招牌上写着xxx）以及准确理解空间关系。（一只猫照镜子看见狮子的倒影）网友表示，这可是个大事，之前想让Midjourneyv5在霓虹灯招牌上写个字AI都是瞎划拉两笔，对于镜子理解的也不对。使用DeepFloydIF，可以把指定文字巧妙放置在画面中任何地方。霓虹灯招牌、街头涂鸦、服饰、手绘插画，文字都会以合适的字体、风格、排版出现在合理的地方。还在视频特效上开辟了新方向。目前DeepFloydIF以非商用许可开源，不过团队解释这是暂时的，获得足够的用户反馈后将转向更宽松的协议。有需求的小伙伴可以抓紧反馈起来了。DeepFloydIF仍然基于扩散模型，但与之前的StableDiffusion相比有两大不同。负责理解文字的部分从OpenAI的CLIP换成了T5-XXL，结合超分辨率模块中额外的注意力层，获得更准确的文本理解。负责生成图像的部分从潜扩散模型换成了像素级扩散模型。也就是扩散过程不再作用于表示图像编码的潜空间，而是直接作用于像素。官方还提供了一组DeepFloydIF与其他AI绘画模型的直观对比。可以看出，使用T5做文本理解的谷歌Parti和英伟达eDiff-1也都可以准确绘制文字，AI不会写字这事就是CLIP的锅。不过英伟达eDiff-1不开源，谷歌的几个模型更是连个Demo都不给，DeepFloydIF就成了更实际的选择。具体生成图像上DeepFloydIF与之前模型一致，语言模型理解文本后先生成64x64分辨率的小图，再经过不同层次的扩散模型和超分辨率模型放大。在这种架构上，通过把指定图像缩小回64x64再使用新的提示词重新执行扩散，也实现以图生图并调整风格、内容和细节。并且不需要对模型做微调就可直接实现。另外，DeepFloydIF的优势还在于，IF-4.3B基础模型是目前扩散模型中U-Net部分有效参数是最多的。在实验中，IF-4.3B取得了最好的FID分数，并达到SOTA（FID越低代表图像质量越高、多样性越好）。谁是DeepFloydDeepFloydAIResearch是StabilityAI旗下的独立研发团队，深受摇滚乐队平克弗洛伊德影响，自称为一只“研发乐队”。主要成员只有4人，从姓氏来看均为东欧背景。这次除了开源代码外，团队在HuggingFace上还提供了DeepFloydIF模型的在线试玩。我们也试了试，很可惜的是目前对中文还不太支持。原因可能是其训练数据集LAION-A里面中文内容不多，不过既然开源了，相信在中文数据集上训练好的变体也不会太晚出现。OneMoreThingDeepFloydIF并不是StabilityAI昨晚在开源上的唯一动作语言模型方面，他们也推出了首个开源并引入RLHF技术的聊天机器人StableVicuna，基于小羊驼Vicuna-13B模型实现。目前代码和模型权重已开放下载。完整的桌面和移动界面也即将发布。作者：关注前沿科技，来源：量子位，原文标题：《StableDiffusion团队放大招！新绘画模型直出AI海报，实现像素级图像生成》。责任编辑：王茂桦
证券,中上协：2022年境内上市公司共实现营业收入71.53万亿元 同比增长7.2%,中证报,2023年04月29日 15:20,中国上市公司协会4月29日发布中国上市公司2022年经营业绩分析报告。截至4月29日，除已公告拟延迟披露和退市、重整公司外，沪、深、北三家证券交易所共5067家公司披露2022年年度报告。2022年全年，境内上市公司共实现营业收入71.53万亿元，同比增长7.2%；实现净利润5.63万亿元，同比增长0.8%，整体业绩保持平稳增长态势。分板块看，科创板全年营收增速领先，达29.3%；创业板净利润增速领先，达11.3%。从竞争力和盈利质量看，2022年非金融行业上市公司平均销售净利率5.16%、平均净资产收益率8.27%，分别比去年同期下降0.41、0.77个百分点；整体现金流状况有所改善，经营性现金流净额5.85万亿元，同比增5.2%，高于净利润增速，平均营业现金比率9.48%，五成公司营业现金比率同比增加。剔除金融行业和“三桶油”，近六成（2884家）实体上市公司实现营业收入同比增长，近五成（2337家）公司实现净利润同比增长，近四成公司保持营收、净利润双增长。1035家实体上市公司亏损，占比21.0%，亏损面较去年同期扩大4.6个百分点，超三成亏损公司来自计算机、医药生物、电子、机械设备行业。小规模上市公司营收、净利分别下降9.7%、55.6%。责任编辑：常福强
美国第一共和银行被接管,终于有同行接盘第一共和国银行? 摩根大通和PNC将于周日前提交报价,智通财经APP,2023年04月29日 15:15,智通财经APP获悉，据知情人士透露，存款监管机构美国联邦存款保险公司（FDIC）要求（JPM.US）和PNCFinancialServicesGroup（PNC.US）等银行在本周早些时候对陷入流动性危机的第一共和银行（FRC.US）的竞购意向进行初步评估后，在周日之前提交最终的报价。据悉，在当地时间周四晚些时候，监管机构联系了美国的各大银行，寻求有兴趣收购的迹象，包括拟议的价格和监管机构存款保险基金的估计成本。知情人士表示，根据周五提交的一份意见书，监管机构邀请了至少两家公司参与下一步的竞标过程。摩根大通发言人拒绝置评。PNC和FDIC的发言人没有立即回复在正常工作时间之外媒体发出的置评请求。与上月硅谷银行和宣布破产然后被FDIC正式接管后旷日持久的拍卖相比，监管机构在美国各大银行及其咨询顾问进行了数周无果的谈判后启动的这一竞标程序，可能会为第一共和银行的拍卖铺平道路。过去一周，第一共和银行的股价急剧下跌，今年以来已累计下跌大约97%。不过，一些参与过程的人不清楚的一点是，监管机构是否会采用所谓的公开市场解决方案，以避免正式宣布第一共和银行破产并将其暂时收归国有——就像硅谷银行和签名银行被FDIC直接接管那样。该公司股价自本周公布财报以来下跌，目前市值仅为6.5亿美元，有分析人士称至少在某种程度上使收购变得更加可行。据悉，上个月，在两家美国地区银行倒闭后，（BAC.US）、花旗（C.US）、摩根大通（JPM.US）和（WFC.US）为首的美国大型银行向第一共和银行注入总计约300亿美元存款，支撑了这家美国地区性银行，但这未能弥补存款外流。该行表示，第一季度存款暴跌超过1000亿美元，并正在探索重组资产负债表等方案。在业绩公布后，第一共和银行财务主管NealHolland表示：“随着几家银行在3月份倒闭，我们经历了前所未有的存款外流。”烫手的山芋——巨额抵押贷款成收购阻碍但资金并不是达成交易的唯一障碍。摩根大通是少数几家已经积累了超过10%全国存款的大型银行之一，根据美国的监管规定，摩根大通没有资格收购另一家吸收存款的机构。但是，美国监管当局将不得不破例允许该国最大规模的银行存款规模变得更庞大。知情人士表示，截至周五晚间，FDIC尚未就是否对第一共和银行进行破产管理做出决定。加州银行监管机构的代表没有回复记者的置评请求。和硅谷银行的破产程序类似，加州银行监管机构将率先宣布这家总部位于旧金山的银行是否破产。堆积在第一共和银行资产负债表上的是大量的低息贷款，其中包括向富有客户提供的异常庞大的巨额抵押贷款组合。这些债务在美国基准利率急剧上升的过程中基本上失去应有的价值，如果被迫出售，该银行将面临巨额亏损。在上个月的地区性银行业危机中，富有的客户和企业从资产负债表存在此类缺陷的银行大举撤资。作为回应，美联储设立了一项紧急贷款安排，为银行提供了一种以其持有的部分资产为抵押物，进而迅速借入资金的方式，以满足任何现金需求。华尔街大行不愿冒险，他们在等政府伸出援手11家华尔街银行在上个月向第一共和银行存入高达300亿美元，给了它寻找私营部门解决方案的时间，但事实证明，这些华尔街大行们不愿联合起来共同投资。最近几天出现的一些提议显示，一些银行要求由实力较强的银行组成一个财团，以高于市场价值的价格收购第一共和银行的资产，但最终没有达成任何协议。相反，一些实力较强的银行一直在等待美国政府提供援助或对该银行进行破产管理，它们认为这是一种更清洁且更有效的解决方案，最终可能以有吸引力的价格出售该银行或其部分资产。在美东时间4月25日，有媒体援引知情人士透露的消息称，第一共和银行正在考虑剥离500亿至1000亿美元的长期证券和抵押贷款，这是该行自身救助计划的一部分。有知情人士称，第一共和银行可能给予包括美国大型银行在内的潜在买家认股权证或优先股，激励他们购买高于市值的该行资产。任何资产出售都将有助于减少该行的资产和负债错配。该知情人士还称，第一共和银行试图强化资产负债表，避免像硅谷银行倒闭时那样被监管机构联邦存款保险公司（FDIC）接管，并为未来可能的融资扫清道路。但是，这可能需要美国政府推动同一些美国的大型商业银行的谈判，毕竟有潜在救助意图的同行们都希望在第一共和银行执行盈利计划时稳定自身资产负债表。但破产接管是FDIC希望避免的一种结果，部分原因是它可能会给政府自身的存款保险基金造成数十亿美元的损失。该机构已经计划对该行业进行一项特别的评估，以弥补上月硅谷银行和签名银行破产造成的损失。责任编辑：王茂桦
国内新闻,走过疫情三年，在武汉感受五一“热潮”,新京报,2023年04月29日 15:10,
马斯克宣布推特将迎来新CEO,推特联合创始人多尔西对马斯克收购交易表达不满:“一切都变糟了”,环球市场播报,2023年04月29日 15:03,当被问及马斯克是否已经证明自己是该平台的最佳管家时，多尔西说：“没有。我也不认为他在意识到时机不对后采取了正确的行动。我也不认为董事会应该强迫出售公司。”一年前，马斯克提出收购推特后不久，股市就出现了逆转，马斯克试图退出这笔交易。这引发了推特与这位亿万富翁之间的法律纠纷，直到收购以最初的报价完成。“一切都变糟了，”多西在他支持的只接受邀请的类似于推特的平台Bluesky上写道。推特没有具体回应置评请求。多尔西与马斯克关系很好，此前他曾公开表示支持这笔交易。去年，他称马斯克作为推特的所有者是“我信任的唯一解决方案”。上周五，一位Bluesky用户表示，这一切的发生令人非常难过，多尔西回答说：“是的。”但他在另一篇帖子中补充说，推特“不可能作为一家上市公司存活下来”。“你宁愿让对冲基金和华尔街维权人士拥有它吗？这是唯一的选择。”马斯克于去年10月下旬上任，在他的领导下，推特裁减了大部分员工，并经历了一系列公共危机，包括其用户验证计划。马斯克一直在为推特推销一项订阅服务，用户可以每月支付8美元获得一个蓝色认证标记。多尔西在Bluesky上表示：“把付费作为一个人的证明是一个陷阱，我完全不同意这一点。”“用于认证的付费系统将数百万人（如果不是数亿人）排除在外。”责任编辑：王永生
美股,台积电回应美国亚利桑那州新厂“失火”：垃圾管道冒出火苗，第一时间得到控制,界面新闻,2023年04月29日 15:02,据台湾《经济日报》，美国当地时间4月28日，社交平台上流传多张美国亚利桑那州新厂失火的照片。台积电对此回应称，该公司亚利桑那州晶圆厂外部垃圾管道冒出火苗，第一时间即受到控制，当地消防人员尚在调查起火原因。台积电美国亚利桑那州厂第一期工程将于2024年量产，预计将分三期建设，投资额扩增至400亿美元。责任编辑：王永生
银行,今年以来已有2名金融中管干部落马，退休不等于“平安着陆”,澎湃新闻,2023年04月29日 14:51,今年以来，金融领域的反腐持续“向上”推进，2名金融中管干部被查；退休不等于“平安着陆”。2名被查的中管干部分别为光大集团原党委书记、董事长李晓鹏和中国银行原党委书记、董事长刘连舸。值得一提的是，李晓鹏为退休1年多后被查。李晓鹏出生于1959年5月，曾在多家金融机构担任过关键职务，包括工行副行长，中国投资有限责任公司监事长，招商局集团副董事长、总经理等。他于2022年3月到龄退休，退休前担任中国光大集团股份公司党委书记、董事长。刘连舸出生于1961年，在赴任金融机构关键职位前，长时间任职于央行，曾担任过央行驻欧洲代表处（英国伦敦）首席代表，央行国际司副司长，央行福州中心支行行长兼国家外汇管理局福建省分局局长，央行反洗钱局（保卫局）局长等职位。进入金融机构后，刘连舸先后担任中国进出口银行副行长，中国进出口银行党委副书记、副董事长、行长，中国银行行长、党委副书记、副董事长（副部长级），中国银行党委书记、董事长（副部长级）。2023年2月，刘连舸被免去中国银行党委书记职务，并于3月卸任中国银行董事长等职。2020年9月8日，中纪委机关报曾发布文章称，退休不等于“平安着陆”，对于腐败分子而言，没有什么“既往不咎”，党的十八大以来波澜壮阔的反腐败斗争历程，早已证明这一点。从目前金融领域的反腐来看，被查的金融干部多人已退休。除了李晓鹏，今年退休被查的金融领域干部还包括：原银监会处置非法集资办公室主任刘张君退休近8年被查，广发银行原党委委员、监事长王桂芝退休2年半被查，南昌银行原党委委员、副行长黄文杰退休1年被查等。据中国纪检监察杂志，中共中央政治局常委、中央巡视工作领导小组组长李希3月27日出席全国巡视工作会议暨二十届中央第一轮巡视动员部署会并讲话。李希强调，对金融单位开展“回头看”，要深入检查落实上一轮巡视整改要求的实际行动和成效，督促金融单位把巡视整改与学习贯彻党中央关于金融改革的部署要求结合起来，推动解决金融领域存在的突出问题。此次被巡视“回头看”的金融单位包括中国投资有限责任公司、国家开发银行、中国农业发展银行、中国光大集团、中国人民保险集团等5家中管金融企业。
