板块名,标题,作者,日期,新闻内容
产经,奢侈品消费力超预期，国际品牌下沉新一线城市,第一财经,2023年04月29日 23:57,商务部预计，2023年，中国奢侈品市场规模将达到7500亿元，同比增长20%以上五一假期前，全国扩张首店“南昌武商MALL”开业首日迎来17万客流量，单日销售收入超过1700万元，不仅展现出江西省超预期的奢侈品消费力，也印证了国内高端消费品市场的复苏势头。南昌正努力打造全国性消费中心城市。今年一季度，全市实现社会消费品零售总额854.05亿元，占全省比重28.04%。“万万没想到，我们品牌在南昌这样量级的城市，一天能卖过百万，打破了开业日全国纪录。”南昌武商MALL护肤彩妆奢品CPB肌肤之钥专柜销售人员大呼意外；而顶奢名表品牌积家专柜更是人多到站不下，有消费者豪掷52.8万拿下一支腕表；QEELIN、赫莲娜、TOMFORD、梵克雅宝香氛均创下国内开业日业绩新高；中午饭点，战斧牛排、凑凑火锅等近20家餐厅门前排起等位长队，战斧牛排的线上团购券售出超6万张，凑凑火锅开业首日毛收突破10万元，翻台率达到9.6。武商集团副总经理钟子钦说，“江西奢侈品消费力和消费品味远超我们的预期”。贝恩咨询发布的《2022年中国奢侈品市场报告》显示，2023年，随着中国市场的复苏，商场客流量和消费者信心迎来反弹，高端消费品市场会重新走上正轨，高端消费品销售额将在2023年的年中重回到2021年的水平。商务部数据亦显示，预计2023年，中国奢侈品市场规模将达到7500亿元，同比增长20%以上。“境外旅行的正常化并没有给国内奢侈品消费增长带来过大的压力。”钟子钦说，三年时间已经让复购率较高的高净值人群习惯于在国内专柜消费，他们也从中体验到了国外专柜无法给予的增值服务和售后服务。普华永道在第三届中国国际消费品博览会上表示，近年来，中国线上奢侈品市场规模不断扩大，三四线城市奢侈品市场渗透率持续增长，为奢侈品品牌带来了更大的增长空间。波士顿咨询公司研报亦显示，从2022年到2030年，中国预计还将新增8000万中产及以上人口，持续给奢侈品消费市场带来源源不断的推动力。受益于城镇化，以及中国整体收入的逐渐提升，新增的中产及以上人口超过70%将来自中国一线以下城市。LouisVuitton、GUCCI、TIFFANY&CO、BVLGRAI等挺进南昌，爱马仕、迪奥、香奈儿进驻郑州，Capri集团高管亲临三亚，OTB集团掌门人到访苏州仁恒仓街……近期，各大奢侈品巨头的开店布局足迹已经在从一线城市向新一线城市延伸。普华永道预测，在2022~2025年间，中国奢侈品市场年均复合增速将达到16%以上。到2025年，中国奢侈品市场规模将达到8160亿元人民币（约合1190亿美元），约占全球奢侈品市场份额的四分之一；到2030年，中国消费者将重拾新冠疫情前的奢侈品市场主导地位，占全球购买总量的40%。“未来随着中国中产收入人群规模持续扩大和年轻人消费观念的转变，中国奢侈品市场还将快速发展。”武商集团有关负责人预测，其中潜力最大的便是像南昌这样正在发力提升首位度的省会城市和新一线城市，武商集团也将渗透到更多的下沉市场。责任编辑：李桐
产经,国家医保局：持续推进医保便民,北京日报客户端,2023年04月29日 23:43,为了让看病就医结算更加方便，医保部门持续推进跨省异地就医直接结算、互联网诊疗费用纳入医保、诊间移动支付实时结算等政策落地实施。从4月份开始，京津冀地区实施了跨省异地就医免备案的政策，新政落地近一个月，不少患者都享受到了免备案直接结算的便利。落实异地就医结算政策前不久，河北廊坊市民李宏宇被诊断为卵巢囊肿，她前往北京一家医院进行治疗，正好赶上了京津冀跨省异地就医免备案的政策。河北廊坊市民李宏宇：就是着急去北京就医，当时在就医过程中，发现咱们取消了医保异地备案这个问题，当时办理住院的话手续特别简单。经过7天的治疗，李宏宇治愈出院，实现了医保直接结算。河北廊坊市民李宏宇：住了7天院花了25000多块钱，最后医保给报了20000多一点。我觉得现在异地就医手续非常简单，也非常方便。近年来，随着全国统一的医保信息平台建成，一系列跨省异地就医政策措施陆续落地，实现异地就医备案“跨省通办”。仅2022年，全国跨省异地就医直接结算就惠及3812.35万人次，减轻患者垫资压力。此次京津冀地区推出异地就医免备案政策，进一步方便了群众异地就医。根据北京市医保局最新数据显示，从4月1日京津冀免备案政策实施到4月29日，天津、河北等地的参保人员在北京就医医保直接结算达64.69万人次，其中住院直接结算共计4.93万人次，各类门诊59.76万人次，减少参保人员资金垫付超10亿元。与此同时，北京市参保人员在天津和河北等地就医医保直接结算21.08万人次，减少参保人员资金垫付6289.30万元。互联网诊疗纳入医保支付互联网诊疗给不少患者看病就医带来了方便，近日，国家医保局明确，符合要求的“互联网+”医疗服务可纳入医保支付，全力打通网上看病就医的“最后一公里”。目前，各地医疗机构推出了“互联网+”医疗服务，为满足人民群众医疗需求提供更便捷的服务。北京大学肿瘤医院胸部肿瘤内科医生正在和一名患者视频复诊，并开具相应的检查。北京大学肿瘤医院胸部肿瘤内科主治医师陈含笑：你看到这个背景基本上都是在家里，甚至有些是在工作环境当中，可能抽个十分钟，把这个检查、药品都开出来了，不太会耽误本人的其他事情安排。肿瘤的治疗周期较长，就诊频繁，而且很多患者出行不便，北大肿瘤医院此前接到过12345热线转办的患者就医诉求，医院接诉即办专班对患者诉求进行分析，完善互联网诊疗服务内容。患者可通过“北肿云病历”App预约挂号，非首诊患者，还可以与医生使用视频复诊、开具检查等。特别是外地患者，可以减少来京住宿、交通等方面的支出。北京大学肿瘤医院胸部肿瘤内科主治医师陈含笑：以前外地患者要预约检查，可能就是先挂号，然后开单子，单子约个时间出来，然后如果说有些患者不回去了，那可能在北京要多住几天，才能做上这个检查，如果有些患者回去的话，还要牵扯到来回的时间和费用，现在只要在线上门诊开个单子，预约到哪一天，当天来就直接做上了。截至2023年3月，“北肿云病历”累计服务患者约24万人次，占门诊总人次的12%；其中外地患者占互联网诊疗总人次超过一半。25个科室的249位医护人员提供互联网诊疗服务。平均每天有超过28位包括知名专家在内的医生线上出诊，并成功完成医保对接。北京大学肿瘤医院党委书记、主任医师朱军：他的治疗，随后的观察，健康的指导，我们都可以通过这样的形式，减少到他来医院排队、交通、陪伴带来的种种不便，那么他在进行互联网医疗行动，只要是按照医保政策，都是可以实时结算报销的。浙江湖州：诊间医保移动支付零等待免排队近年来，医保“智能化”、“电子化”让结算场景更加灵活。越来越普及的全国医保电子凭证逐步实现看病不带卡，现在多地推行的“掌上办、自助办”政策，让群众医保结算逐步实现“线上付、不排队”。浙江湖州市民陈晔近日突感肠胃不适，预约了湖州市中心医院的消化内科专家。医生开具处方之后，陈女士还没走出诊室，就通过自己的手机完成了医保结算和付费、可以直接去药房拿药了。浙江湖州市民陈晔：我就直接可以扫一下，然后就直接可以付费了，也不需要到机器上面去缴费了，还是比较方便的。过去，患者在医院就医进行医保结算时，需要到窗口、自助机上才能支付费用，难免会出现排队等待的情况。随着当地“智慧医保”“移动支付”功能的普及，参保人员在诊间就能完成医保支付。浙江省湖州市中心医院医保办副主任刘红松：对于我们原先的这些窗口、自助机来说，它就相当于是分流了一些人，那么这样的话我们窗口的人员在提供服务的时候，可能有更多的时间去为需要窗口来办理业务的人提供这些服务。除了实时结算的移动支付，患者在医药机构就医购药、外配处方应用、线上医保信息查询、异地就医备案结算、医保异地关系转移等大部分医保服务，都能在“智慧医保”平台完成线上操作，做到“让数据多跑路，老百姓少跑腿”。浙江省湖州市中心医院医保办副主任刘红松：支付、取化验单、取报告单、取药整个流程都可以通过一部手机就实现了，可以说实现了看病的“零等待、免排队”，那么我们的医疗服务的效率大大提升了，病人的这个就医的感受也是得到了改善。责任编辑：李桐
美股,美国伊利诺伊州法官暂停攻击性武器禁令,央视网,2023年04月29日 23:36,据《国会山报》当地时间4月29日报道，美国伊利诺伊州地区法官斯蒂芬·麦格伦（StephenMcGlynn）28日暂停了一项攻击性武器禁令，针对《保护伊利诺伊社区法》发布了初步禁令。据报道，有多名原告起诉《保护伊利诺伊社区法》侵犯了他们在美国“宪法第二修正案”中被赋予的权利——持有和携带武器。麦格伦指出，不应当因为“少数人的罪行”去“侵犯守法个人的权利”。麦格伦承认此案“极具争议性”，但表示他的裁决不是最终裁决，并不会阻止伊利诺伊州解决枪支暴力问题。据悉，美国伊利诺伊州政府于今年1月通过并签署了《保护伊利诺伊州社区法》，使伊利诺伊州成为美国又一个禁止销售或持有攻击性武器的州。这项法律规定，包括部分半自动武器、大容量弹夹以及快速射击装置在内的攻击性武器将被禁止在伊利诺伊州销售或持有。（央视记者刘旭）责任编辑：李桐
产经,整体营收逾51万亿，科创板公司净利总额首次突破千亿……沪市上市公司年度成绩单来了,中证报,2023年04月29日 23:20,沪市上市公司去年成绩单来了！4月29日晚，上交所发布2022年沪市主板、科创板公司经营业绩情况分析。整体来看，2022年，沪市上市公司共计实现营业收入逾51万亿元，共计实现净利润逾4.2万亿元。值得一提的是，2022年科创板板块公司突破500家，整体营业收入首次突破万亿元，净利润首次突破千亿元，研发投入首次突破千亿元。整体业绩稳健增长2022年，沪市上市公司业绩整体实现正增长。主板方面，2022年，沪市主板公司合计实现营业收入50.55万亿元，同比增长6%；净利润4.16万亿元，同比增长2%；扣非后净利润3.95万亿元，同比增长3%。分结构看，营收方面，6成公司营收扩大，3成公司营收超百亿。净利润方面，超8成公司实现盈利，近5成公司实现利润增长。科创板方面，2022年，科创板公司营业收入和净利润分别突破万亿和千亿，共计实现营业收入12120.49亿元，同比增长29%；实现归母净利润1135.89亿元，同比增长6%；实现扣非后归母净利润907.81亿元，同比增长9%。近7成公司营业收入增长，23家增幅翻番，4成公司营业收入超过10亿元；超8成公司实现盈利，5成公司归母净利润增长，49家公司增幅翻番。2023年第一季度，稳增长政策持续显效，市场需求回暖，积极变化有所增多。沪市主板公司第一季度合计实现营业收入12.16万亿元，净利润1.20万亿元，同比分别增长4%、5%。具体而言，前期调整幅度较深的接触消费类行业第一季度实现加速回暖，住宿餐饮、旅游、影视院线净利润同比分别增长185%、139%、200%。科创板公司2023年第一季度亦实现经营业绩“开门稳”，除、和3家多地上市红筹企业外，科创板近6成公司第一季度收入同比增长，42家公司营业收入增幅超过100%；超4成公司第一季度净利润同比增长，72家公司归母净利润增幅超过100%。铆足干劲抓研发当下，科技创新已成为推动高质量发展的决定性力量，对于企业而言，加强科技攻关，实现创新驱动发展，则是发展之基。2022年，沪市主板公司坚定贯彻创新驱动发展战略，实体类公司合计研发投入8412亿元，同比增长18%。其中，、、、、等19家公司研发投入超百亿元，96家公司研发强度超过10%，主要集中在医药生物、计算机、电子、通信行业。栽下梧桐树，引得凤凰来。大额研发投入也为上述相关公司带来不俗的市场表现。截至2022年年末，研发投入金额超1亿元且研发强度超5%的高研发投入公司平均市盈率、市净率分别达46倍、3.59倍，高于其他公司36倍、3.15倍的平均估值水平。科创板方面，2022年，科创板公司全年合计投入研发金额1284.68亿元，同比增长28%，研发投入占营业收入的比例平均为16%，同比提升3个百分点。其中，生物医药、集成电路等行业研发投入强度居前，等69家公司研发投入占营业收入比例超过30%，等51家公司研发投入超过5亿元。目前，科创板已汇聚研发人员数量超过17万人，超6成科创板公司的创始团队为科学家、工程师等科研人才或行业专家，平均每家公司研发人员占员工总数近3成，超3成公司人力投入回报率超过100%。此外，越来越多的科创板公司通过常态化的股权激励机制留住、吸引和激励人才，对激励科研人员投身技术创新发挥了积极作用。截至3月末，共有307家科创板公司推出414单股权激励计划，板块覆盖率超6成，涉及员工近8万人。真金白银提高投资者“获得感”2022年，沪市上市公司持续用真金白银将发展成果惠及广大投资者，现金分红的市场文化日益浓厚。主板方面，全年共有1194家公司推出分红方案，占全部盈利公司家数的87%，现金分红总额1.67万亿元，同比增长13%。分红金额上，161家公司派现10亿元以上，26家派现100亿元以上。其中，、、中国移动现金分红总额分别为1082亿元、973亿元和821亿元。分红比例上，864家公司现金分红比例超过30%，占比72%；287家公司分红比例超50%，635家公司连续3年分红比例超30%。科创板方面，2022年度共有334家公司推出现金分红方案，总额317.71亿元；228家公司现金分红比例超过30%，数量、规模均同比提升。其中，77家公司现金分红金额超过1亿元。、、天合光能分红金额分别达到18亿元、14.47亿元、10.39亿元。分红回馈投资者的同时，沪市上市公司也积极通过股份增持、回购等方式向投资者传递发展信心。2022年，共有46家科创板公司发布增持计划，计划增持金额上限为12.70亿元；共有85家公司发布回购方案，涉及金额83.84亿元。沪市主板增持和回购金额更高。2022年，沪市主板公司新增披露回购计划174家次，拟回购金额上限合计逾679亿元，新增计划实施金额合计约348亿元。其中，、、、等11家公司回购斥资超10亿元。增持方面，全年新增重要股东增持计划129家次，拟增持金额上限合计超342亿元。从效果来看，回购增持信息对公司股价起到了有效提振，在公告发布后的5个、10个交易日，公司股价相对大盘的累计涨幅偏离度均值分别达1.7%、2.1%。近7成公司在公告发布后的下一个交易日股价上涨，平均涨幅3.2%。编辑：张晶责任编辑：李桐
产经,格力净利增6.26%，美的分红超170亿……白电双雄交2022答卷，谁更优秀,每日经济新闻,2023年04月29日 23:08,4月28日晚，（SZ000333，股价56.78元，市值3987亿元）与（SZ000651，股价39.34元，市值2215亿元）相继交出2022年度的经营“成绩单”。年报数据显示，美的集团与格力电器去年实现的营业收入均基本与2021年持平，净利润均同比提升。其中美的集团同比增长了3.43%，格力电器同比增长6.26%。具体到产品，在2022年全球空调市场规模下降的背景下，美的与格力空调业务收入均逆势保持增长。不过，消费电器/生活电器的收入同比下降。多元化业务中，美的的及自动化系统去年营收同比增长9.7%，格力电器的工业制品收入同比增长137.88%。二者都在加快多元化进程。《每日经济新闻》记者还留意到，格力与美的均宣布了高现金分红方案。其中格力电器宣布拟向全体股东每10股派发现金股利10元（含税），共计派现56.14亿元，2022年中期，格力电器已分红派现56.14亿元；美的集团拟每10股派发现金25元（含税），将累计派现约171.88亿元。营收同比基本持平，净利润微增去年，整个家电行业日子艰难。由中国家用电器研究院指导、全国家用电器工业信息中心编制的《2022年中国家电行业年度报告》显示，2022年家电行业的出口和内销规模均出现下降，其中出口规模同比下降10.9%，国内销售规模同比下降9.5%。4月28日晚，家电两巨头美的集团与格力电器同步发布2022年业绩。美的集团2022年实现营业收入3439.18亿元，基本与前年持平，同比微增0.79%；实现净利润295.53亿元，同比增长3.43%。格力电器2022年实现营业收入1889.88亿元，也基本与前年持平，增幅为0.6%；净利润245.07亿元，同比增长6.26%，增幅比美的集团稍高。具体到产品，去年美的暖通空调收入1506.35亿元，同比增长6.17%；格力空调收入1348.59亿元，同比增长2.39%。放到空调行业整体大环境来看，实现增长并不容易。奥维云网（AVC）推总数据称，2022年全球家用空调市场规模为1.6亿台，同比下滑3.1%，中国市场规模同比下滑1.6%。《每日经济新闻》记者还了解到，美的与格力空调业务收入的增长并不是由成本下降来支撑。实际上，去年两家企业的空调营业成本同比有所提升。实际上，驱动两巨头空调业务规模增长的是空调产品提价及高端产品占比提升。家电产业资深观察人士张彦斌今年3月接受记者采访时曾提到，2022年行业头部品牌把企业发展的方向放在了经营质量上。美的集团方面也透露，去年美的旗下双高端品牌COLMO和东芝均实现零售收入大幅度增长。具体到毛利率，2022年美的与格力的整体毛利率水平均有提升。美的暖通空调板块毛利率提高了1.79个百分点，格力空调产品毛利率提高了1.21个百分点。多元化板块，受益于市场行情良好，美的的机器人及自动化系统板块实现营业收入299.28亿元，同比增长9.7%，占公司营收比重也提升至8.7%。格力方面，2022年工业制品（电机、电容等）收入攀升至75.99亿元，同比大幅增长137.88%；绿色能源收入超47亿元，同比增长61.69%。智能装备业务呈现收缩态势，收入同比下降近50%。整体来看，两家巨头在各自多元化道路上持续前进。格力拟10派10，美的拟10派25一直以来，格力电器与美的集团都是A股分红“出手阔绰”的企业代表，尤其格力电器以“土豪式”分红风格在资本市场闻名。4月28日晚，两家企业也分别宣布了2022年度利润分配预案。美的集团拟以68.75亿股为基数，向全体股东每10股派现25元（含税），共计派现171.88亿元。格力电器则宣布拟以56.14亿股为基数，每10股派10元（含税），共计派现56.14亿元。加上已实施的2022年中期派现56.14亿元，格力电器全年分红派现金额为112.28亿元。截至2022年末，格力电器董事长兼总裁董明珠持有格力电器4448.85万股，美的集团董事长兼总裁方洪波持有美的集团股票1.17亿股。按照目前两者公布的分红预案计算，董明珠将分得4448.85万元（含税），方洪波将分得约2.93亿元（含税）。据最新披露的一季报数据，格力电器今年一季度实现营收354.56亿元，同比微增0.56%；净利润41.09亿元，同比增长2.65%。美的集团今年一季度营业收入962.63亿元，同比增长6.51%；净利润80.42亿元，同比增长12.04%。两家巨头2023年一季度均开局良好，美的集团业绩表现整体优于格力电器。封面图片来源：-VCG111133776702每日经济新闻
