板块名,标题,作者,日期,新闻内容
2023年巴菲特股东大会,杨德龙：深度解读2023年巴菲特股东大会,市场资讯,2023年05月07日 13:53,2023年巴菲特股东大会顺利闭幕，经过六个多小时的时间，巴菲特和芒格的回答了超过六十个问题，基本上投资者比较关注的问题都给予了比较详细的解答。这次来奥马哈参加巴菲特股东大会的人数高达三到四万人，和往年相比基本上是恢复到了以往的水平，也是我第五次来到现场参加巴菲特股东大会。这次巴菲特股东大会有很多干货要给大家分享，包括大家关注的很多方面，比如说对于美国经济、人工智能、美国银行业危机以及接班人等问题都做了比较详细的解答。巴菲特股东大会也是大家现场了解巴菲特真知灼见的最重要的一个方式，我有机会就会到现场来现场聆听，从而能够给大家讲清楚巴菲特和芒格他们在投资上的一些观点，以及他们的投资理念。我选择一些重点的干货给大家分享一下，从这次巴菲特股东大会上了解的一些情况，比如说关于对于苹果公司，巴菲特高度肯定了苹果，他说苹果在我们仓位中的占比超过了能源业务，持有苹果的比例达到了35%，是绝对的第一大重仓股，并且在之前他减持了一部分苹果，现在感觉到非常后悔，因为苹果是一家伟大的公司。虽然以往巴菲特不投资于科技股，但是对苹果的投资却是一如既往的。这也说明对苹果的投资，巴菲特看重的是他强大的竞争力和比较宽阔的护城河。苹果拥有大量的现金，所以抗风险能力比较强。和一般科技股不同，它可以通过比较强的现金优势来加大研发投入。关于人工智能巴菲特还是相对比较谨慎的，巴菲特认为人工智能从长期来看，它对于人类的工作生活会形成影响。但是就像当年原子弹发明一样，还不能确定AI会不会对人类的生存产生一定的威胁，是福是祸还说不清楚，所以巴菲特在AI上的态度还是比较谨慎的。但是和之前对于数字经济，还是对于数字货币基本上是排斥的态度是相比，对于AI还是保留了一定的看好偏中性的评价，就是说也没有完全排斥AI。所以并不能说是因为巴菲特岁数大了，对事物的发展没有与时俱进，我认为还是投资理念的问题。因为巴菲特喜欢投资于业绩稳定的白马股，不喜欢投资这种波动比较大并且有很大投资风险的科技股。一将功成万骨枯，将来真正能够做成世界级的科技类的公司实际上是非常困难的，所以在AI的投资上，炒作的这种风气还比较重，甚至有网友把AI翻译成“Allin”。所以在这一点上，我觉得还是要学习巴菲特的智慧，不要盲目去炒作，还是要去关注本身企业的价值，否则巴菲特很可能会竹篮打水一场空。关于大家比较关注的硅谷银行破产引发的美国银行危机，巴菲特表示这是灾难性的。即使联邦存款保险公司的限额是25万美元，这是法定规定的，但是可能会导致公众对于存款的这种担忧，保障储户的资金安全是非常重要的，否则可能会产生非常糟糕的一种结果。当然美国财政部以及美国的美联储和美国FDIC这三大机构发表联合声明，保障储户的存款不受影响。这一定程度上避免了大规模的挤兑。相对来说美国银行业的危机暂时被控制住了，不会引发的新的金融危机。但是仍然不能掉以轻心，还是要防止出现更多的银行破产倒闭的现象。在大会的开始，巴菲特对于伯克希尔哈撒韦的一季报进行了汇报，一季度营收达到853.93亿美元，而去年同期是708.1亿美元。净利润为355亿美元，去年同期为54.6亿美元。可见今年一季度伯克希尔哈撒韦的投资，业绩相对于去年同期来说出现了大幅增长。从一季报来看，截止到3月31日，伯克希尔哈撒韦大概有77%的股权投资集中在五家公司上，分别为苹果、美国银行、美国运通、可口可乐和雪佛龙。可见巴菲特是敢于重仓的，对于他看好的股票他是非常重仓。他认为分散投资是一个误区，如果说有把握的公司要敢于重仓，这样才能够真正的从投资上充分受益。而过度的分散投资只是教科书上的一些说法，并且可能会被理解偏了。因为过度分散的投资和指数基金的差别就不大，如果是有看好的公司巴菲特，还是要敢于重仓，但是又不能集中持股。就是说如果只配置一只股票，这样风险又过于集中。所以在投资上做到集中然后又分散，这样可能更好一些。关于大家比较关注的其他的问题也都有精彩的一个论述，比如说他说自己的投资回报往往来自于别人犯的错误，来自于别人的愚蠢。也就是说当市场出现错误定价的时候，当别人干了蠢事的时候，这时候往往也是最好的一个配置好公司的一个时机。这让我们想到在A股市场也经常会出现一些错误定价的机会，比如说在市场低迷的时候，在特别是在绝望的时候，这时候往往是好公司价格大幅打折的时候，大家可以考虑逢低去布局。就像去年10月底前海开源基金在市场绝望的时候公布以2.9亿的自有资金自购基金，在当时已经公布了自购的基金公司中自购金额是排第一的。另外，我们也是在市场最低迷的时候知行合一，通过此次自购基金来提升了市场的信心，同时也成功在底部布局。对于接班人，巴菲特再次强调阿贝尔作为巴菲特的接班人，但是还是会和另外一个投资经理贾恩一起协商，做最后的决策。如果他们不能处理得当，巴菲特就不会将伯克希尔哈撒韦交给他们。查理表示，现在伯克希尔内部都很支持阿贝尔。很多投资者也在担心，投资是比较个性化的东西。巴菲特作为股神他能够创造投资上的奇迹，和他长期以来坚定不移的坚持价值投资以及犀利的眼光有关，如果换了接班人，掌门人能不能复制巴菲特的奇迹，对此大家还是有一定疑问的。估计就像库克接班乔布斯一样，更多的是萧规曹随。通过配置一些稳健的、有业绩支撑的好公司，尽量模仿巴菲特投资思路，但是否能够获得好的投资回报这一点还并没有特别大的把握。关于大家比较关注的巴菲特近几年在日本的投资，巴菲特表示日本的投资将在未来几年继续增加伯克希尔的价值。这次他去日本部分原因是为了向这些公司介绍阿贝尔，因为接下来双方可能要共事20、30、40或者50年。巴菲特投资这些日本的公司并不表示他看好日本经济或者日本股市，而是看好这些公司他们的盈利能力和高分红率，以及他们的长期的业绩表现，估值确实比较低。关于美联储加息，巴菲特认为通胀是目前最需要解决的问题。巴菲特称印钞票是非常疯狂的，不能继续这么做。疫情发生的时候就像打仗一样，没人知道印多少钞票才会出现问题，直到失控，所以我们需要非常小心谨慎。对美国来说，如果做事过激，很难看到事情扭转。美联储十次暴力加息，累计加息了500个基点，对于美国经济、美国企业以及银行都造成了很大的冲击。在最近美联储加息了25个基点，有可能终结本轮加息周期，后期可能会根据经济的变化，根据通胀的情况来决定是否加息，大概率应该是会终结本轮加息周期，但是在这次议息会议之后的声明中，美联储主席鲍威尔并没有表示要降息，可能还是要观察的。对于大家比较关注的去美元化的问题，巴菲特表示美元现在确实还是储备货币，但是未来可能未必如此，觉得没人能完全理解现在的情况，也许美联储主席鲍威尔更清楚，但他也没办法完全掌控这种局面，他没有办法控制财政政策。去美元化是今年市场关注的一个热点，在俄乌冲突发生的时候，美国利用美元的霸权地位对俄罗斯进行制裁，然后将俄罗斯的银行踢出所谓的SWIFT系统，以及采取冻结俄罗斯的外汇储备等处罚方式。这样做虽然达到了短期的制裁俄罗斯的目的，但是也让很多国家担心过度依赖美元储备可能会丧失在货币政策和财政政策的自主权。所以今年也有多个国家和我国签订了协议，在贸易上采取本币交易，这应该是一个开端。所以美元有可能会逐步降低它在国际储备货币中的份额，人民币国际化程度也有望进一步提高，这也是我国综合国力提升的一种体现，同时也是我国作为世界一百多个国家的第一大贸易伙伴所具备的一些优势。巴菲特依然不看好比特币等数字货币，当他谈到世界储备货币时，他说任何代币都是一个笑话，那是疯狂的，但继续印钞票也是疯狂的。关于中美关系，芒格表示我们应该做一件事，与中国好好相处。为了我们的共同利益，我们应该与中国进行大量的自由贸易。巴菲特和芒格一直很希望中美关系能够和平相处，这对于两国人民来说都是有利的，对于全世界的经济增长也是有益的。而由于现在经济增速放缓，芒格建议价值投资者要习惯于收益减少，给你机会的是其他人做傻事。巴菲特说人们会做重大与愚蠢的事情，他们这么做的原因在某种程度上是因为他们比我们刚开始时更容易获得资金。在近期在采访中，芒格也表示，他们的投资奇迹也是得益于生活在一个好的时代，投资的回报比较高。但是现在这样的投资的好时候可能已经过去了，未来的投资回报率可能会下降，这一点和巴菲特的观点是相似的。这就要求未来在投资上我们还是要选择经济转型受益的公司，规避那些在经济转型中被淘汰的公司。从而来获得长期投资回报。在当前A股市场低迷的时候，重提价值投资是非常重要的。这次巴菲特股东大会的召开有可能成为一个重要的契机，市场的风格可能会发生切换，从前期炒Chatgpt等AI板块逐步转向配置有业绩支撑的好公司，包括经济转型受益的消费、新能源和科技互联网等方向的一些龙头股，以及低估值的中字头板块都有可能会出现价值的回归。另一方面，市场的信心可能会得以提振，巴菲特多次强调做价值投资，要做好公司的股东，要相信国运。从长期来看，好公司会给投资者带来更好的回报。对于新能源，巴菲特依然是看好的。巴菲特强调伯克希尔能源公司实际上在爱荷华州生产了最多的风电和光伏发电，在风能和领域的投资在美国公用事业行业中无人能及。巴菲特在新能源汽车的投资获得了30倍的回报，虽然这两年出现了获利了结，减持了接近一半的持仓，但是并不表示不看好新能源汽车，并且巴菲特对于新能源汽车龙头股依然认为是伟大的公司。当然巴菲特这两年获利比较大的是对于西方石油等石油公司的增值，石油价格的大涨为石油企业带来巨大的利润。巴菲特也表示他喜欢西方石油在二叠纪盆地的位置。但是他不会把西方石油买下来，未来可能还会增持，但目前对仓位基本满意。而过去几个月西方石油还回购了一些优先股，这一定程度上也提高了股东的价值。所以巴菲特既投资于传统能源，也投资于新能源，证明他对能源产业是比较重视的。谈到企业的愿景上。巴菲特表示伯克希尔的愿景是成为一家由股东持有、社会乐见其存续、拥有无穷资本和许多有识之士的公司，并处于一个难以被击败的位置。所以巴菲特做投资取得了长期的成功，他认为是和一群最棒的人一起工作，想不出比这更好的理想工作环境了。巴菲特觉得投资的乐趣在于未知，有时成功，有时失败。巴菲特股东大会干货很多，没办法通过一篇文章就给大家说完。但是我们从这些为大家整理的看点来看，已经可见一斑。我们可以明显的感觉到价值投资的魅力，从长期来看，做好公司的股东或者是布置配置优质基金依然是抓住市场长期投资机会最好的投资策略之一。
国内财经,上海虹桥机场复航后迎来首次出入境客流高峰,上海证券报 ,2023年05月07日 13:45,5月1日，虹桥机场海关关员引导入境旅客有序进入海关卫生检疫区，开展智慧审卡上证报中国证券网讯（记者宋薇萍）记者5月7日从上海海关获悉，今年“五一”假期，虹桥机场出入境人员超2.9万次。这是自3月26日，虹桥机场国际、港澳台航线复航以来，首次迎来出入境客流高峰。复航后，虹桥机场出入境客运航班量、客流量持续攀升。4月第四周，上海虹桥机场日均出入境客运航班41架次，出入境人员日均约6100余人，较3月开航时分别增加30%、50%。复航首月，虹桥机场海关累计监管进出境航空器达1367架次，出入境人员17.4万余人次。虹桥机场海关旅检二科副科长俞振华介绍：“为确保口岸通关安全顺畅，我们每日提前分析研判客流和航班量，强化智慧旅检设施设备应用，不断优化现场工作流程，在严守国门的同时不断提升通关效率。”针对客流量日益增长情况，虹桥机场海关还加大口岸食品安全监管及卫生监督执法力度，复航首月共开展卫生监督检查65家次，监管航空餐食130万份，扎紧食品安全监管藩篱，切实保障人民群众舌尖上的安全。
证券,融创中国境外债重组成功在即，距离完全“上岸”还有多远？,市场资讯,2023年05月07日 13:45,即将迎来转机。融创中国境外债重组成功在即，距离完全“上岸”还有多远？5月4日晚间，融创中国（01918.HK）公布境外债务重组进展，于经延长同意费截止日期（即2023年5月4日香港时间下午5时正），占现有债务约85%的同意债权人已加入重组支持协议。此前，4月20日，融创中国发布境外债务重组进展公告称，其本金总额为90.48亿美元的境外债务重组方案，截至公告日期，占现有债务超过75%的持有人已递交加入重组支持协议的函件。根据最新公告，同意费必须在公司重组生效日期或之前支付。但前提条件是，同意债权人必须持有或已获得符合重组支持协议相关规定的合格受限债务，并且在计划会议上（不管是亲自出席还是委派代表）投票赞成计划，同时也没有行使终止重组支持协议的权利，并且没有违反任何重组支持协议的相关条款和条件。受此影响，融创中国股价在5月5日开盘后迅速走高，盘中时股价一度涨超18%，截至当天股市收盘，融创中国股票报收1.86港元，涨17.72%，成交额为2.19亿港元，当前公司总市值为101.35亿港元。融创的路还没有走完从时间上来看，融创中国正一步步走向“复活”。今年3月28日，融创中国发布境外债务重组方案，将约百亿美元的境外债务分为降杠杆、留债展期两大板块进行重组。其中，降杠杆计划目标约30亿美元，债权人既可选择将全部或部分持有的债权转换为股权，也可继续持有债权，两种方式均有机会获得足额偿付。同时，融创中国将发行新的以美元计价的公开票据进行置换，债权人将获得最多八档新票据，分别于重组后的2年至9年到期。对于第一、第二档债务（初始期限分别为两年和三年），融创中国有权选择将到期日延长1年，这也意味着公司三年内无刚性还款压力。按照香港相关法例，要求签署境外债重组协议的比例达到未偿还本金总额的75%，重组方案才算通过。如今看来，融创中国以获得85%的赞成票，意味其境外债务重组已实质性完成，接下来只待法庭程序完成，方案便可正式落地执行。但融创中国的债务情况并没有想象中的好。据4月27日公司披露的财报显示，2022年融创中国借贷总额2984.19亿元，较2021年的3217.05亿元减少230多亿元。但其中即期部分借贷略有增长，从2021年的2351.47亿元增加到2022年的2534.76亿元。另外截至报告日期，融创中国到期未偿付借贷本金约1005.2亿元，并导致借贷本金约835.5亿元可能被要求提前还款。而总负债方面，2022年末融创中国为1.004万亿元，相较于2021年末的1.052万亿元，减少了480亿元。在境内债方面，今年1月3日，融创中国发布公告称，总计160亿元的境内债券整体展期方案获债券持有人会议表决通过。项目层面上，在1月3日披露的公告中，融创中国以35.8亿元向珠海华发转让深圳冰雪文旅城股权，双方将设立合资公司，共同负责项目后续的开发建设及销售，以及冰雪项目和酒店项目的运营管理服务。关于境内项目层面的融资，据融创中国执行董事兼行政总裁汪孟德介绍，绝大部分项目的贷款还比较正常，尤其是核心城市的、与实力合作伙伴的合作项目。对于一些由于市场下滑造成贷款展期的项目，融创中国一直在积极争取金融机构的支持，对于银行类通过“总对总”推动等进行合理的展期；对于一些信托等展期难度较大的融资，公司也在积极与金融机构沟通制订整体解决方案，通过引入AMC等第三方资金的方式去解决。此外，融创中国还在积极申请保交楼专项借款、配套融资等，确保项目的建设及交付，目前第一批次保交楼资金已落地约110亿元；第二批次也有几十个项目获批，资金已有实质落地，公司也在积极推动银行的保交楼配套融资，已有部分项目落地放款。出险房企迎来“上岸”时刻今年以来，出险房企的债务重组进程明显提速，行业信心正在逐步修复。1月23日，首个对境外债实施“以股抵债”的（600340.HK）重组方案取得英格兰及威尔士高等法院裁决通过；3月10日，佳兆业集团（01638.HK）复牌，成为2023年首家复牌的出险房企；3月22日，中国恒大（03333.HK）发布公告，披露其境外债务重组方案以及部分未经审计的示意性财务信息；4月12日，融创公告称，达成复牌指引及恢复买卖；4月25日，花样年控股（01777.HK）披露了境外债务重组的最新进展，透露占公司现有债务工具71.69%的持有人已加入重组支持协议。“五一”假期结束后，出险房企再迎喜讯。5月4日，融创中国再发公告称，占现有债务约85%的同意债权人已加入重组支持协议；5月5日，花样年控股亦披露最新数据，40亿美元境外债重组获得占债务工具76.44%的持有人支持，加入重组支持协议。研报指出，认知差和剪刀差有望推动地产板块跑出相对收益。首先，认知差存在于地产基本面，但数据持续验证对于2023年地产销售复苏的判断；其次，剪刀差存在于基本面与板块行情之间，即销售持续复苏但板块持续调整。看好认知差和剪刀差推动下地产板块跑出相对收益。（本文首发于钛媒体APP，作者|陈伟纳）
国内财经,员工不转朋友圈被罚1万且开除？法院判了……,中国青年报,2023年05月07日 13:32,近日，重庆市高级人民法院向社会发布一则因员工不转发公司广告至朋友圈被罚1万并开除的案例，引发关注。法院认定结果：朋友圈内容应个人自主决定，涉事单位赔偿损失。员工未转发朋友圈被开除综合重庆市第三中级人民法院消息，陈某于2013年11月16日到某妇产医院从事驾驶员工作。双方签订劳动合同。2017年6月，该妇产医院开展院内员工微信朋友圈推广活动，要求全体员工每日推广信息并对信息转发量进行考核，未达标者按照200元/人进行扣发薪酬。2017年7月至2021年8月期间，陈某因未按要求转发，医院共计扣除陈某10000元。2021年8月30日，某妇产医院向陈某发送了解除劳动合同通知，以陈某未在朋友圈转发推送相应链接、不遵守公司文件规定、未完成交办工作任务为由解除劳动合同。后陈某申请仲裁，请求该妇产医院支付其克扣工资、加班工资、违法解除劳动合同的赔偿金。劳动仲裁委审理后，裁决由妇产医院支付陈某违法解除劳动合同赔偿金和少发工资。双方不服仲裁裁决，诉至法院。法院：用人单位不应非法干预朋友圈一审法院审理后，判决该妇产医院补发陈某工资10000元并支付违法解除劳动合同赔偿金50809.6元。妇产医院不服该判决，提起上诉。重庆市第三中级人民法院审理认为，某妇产医院制定的微信链接推广活动，因涉及劳动者报酬和微信朋友圈的个人生活，属于直接涉及劳动者相关利益的制度，应当通过职工代表大会讨论通过。医院扣除员工报酬并据此解除劳动合同不具有合法性。遂判决驳回上诉，维持原判。法院提醒，劳动者在朋友圈发布的内容上享有自主决定的权利。用人单位不应混淆公私界限，并通过规章制度要求员工“夹带公货”，这无异于强制干涉员工的私域自由。责任编辑：王涵
产经,文化部原副部长周和平一行到访中国酒业协会,中国酒业协会,2023年05月07日 13:28,原标题：文化部原副部长周和平一行到访中国酒业协会5月6日，文化部原副部长、国家图书馆原馆长、名誉馆长周和平一行到访中国酒业协会，宋书玉理事长热情接待并进行座谈交流。文化部人事司原司长、中国非遗协会副会长兼秘书长张雅芳，全国政协委员、国家图书馆古籍馆馆长、二级研究员陈红彦，国家图书馆古籍馆经典文化推广组组长、副研究馆员赵大莹，国家图书馆副研究馆员、北京国图创新文化服务有限公司总经理兼北京国图创新文物保护科技有限公司董事长张立朝等随行到访。中国酒业协会秘书长何勇，文化工作委员会、文化遗产保护工作委员会秘书长任志宏，办公室主任赵婷，文化工作委员会、文化遗产保护工作委员会副秘书长张志刚等参加座谈。双方围绕中国酒文献的梳理、编撰等方面展开交流。宋书玉理事长首先表示了对周和平副部长一行到访的欢迎并指出，联合国家图书馆将中国历代古籍善本中关于酒和酒文化的文献汇编，共同编辑出版《中国酒典》，是中国酒业开先河的大事，也是基于双方优势的强强联合，对产业新文化建设具有重要意义、对弘扬中国传统文化、强化酒业精神文明建设、深化产业对酒文化认识、提升消费者对美酒价值认知具有积极意义。周和平副部长表示，中国酒业协会在业内具有突出权威性与影响力，在汇聚、整理中国酒文献方面具有深厚基础和鲜明优势。同时，《中国酒典》的编辑对引领产业发展、推进酒文化古为今用、提升文化影响力、增强产业凝聚力都具有重要作用，并就编撰方法、分类方向、分编类目等方面提出了针对性意见和建议。座谈会上，张雅芳司长从挖掘非遗文化内涵、挖掘品牌价值、深化与企业合作、提升文化氛围等方面进行分享；陈红彦馆长从文献典籍、拓片甲骨、酒票等方面分析了中国酒文献的溯源途径；赵大莹组长从礼器酒器、礼仪风俗、轶事趣闻、艺术门类等方面交流了编撰的分类方向；张立朝副研究馆员从文化溯源、文化营销、酒礼普及、服务生产等方面探讨了酒文化的表现方式和传播方法。宋书玉理事长强调，期待与国家图书馆展开更广范围、更深程度合作，共同助推酒类产业新文化建设达到新高度。《中国酒典》的汇编是对二十大精神和国家文化战略的忠实践行，是中国酒业新文化建设的责任担当，与国家图书馆的合作，将最大限度提升专业性、全面性、完善性，本次座谈为双方达成进一步合作奠定了共识基础。责任编辑：王蒙
国内财经,数据 | 4月末中国外汇储备32048亿美元，创14个月新高,界面新闻,2023年05月07日 13:24,
