板块名,标题,作者,日期,新闻内容
国际财经,洪灝｜美国又双叒没钱了,市场资讯,2023年04月23日 16:07,来源：洪灝的宏观策略现在，美国国债的收益率曲线的短端开始史无前例地陡峭化。也就是说，资金出于对债务上限和流动性的担忧，都聚集在美国国债的超短端，导致3个月—1个月的收益率曲线飙升至有史以来最高（图一）。这条陡峭的收益率曲线，与10年-2年、10年-3个月的倒挂形成了鲜明对比。值得注意的是，虽然最近几年的债务上限到期并没有引起美国市场恐慌，但是2022年和2008年这条曲线的剧震，都显示了当时的美国乃至全球市场都岌岌可危。这次不一样的地方，是美国财政部的现金存量已经下降到了历史最低水平之一（图二）。当然，美国财政部长耶伦依然大言不惭地说，“我们有钱，不会违约”。其实，如果那么有钱，又为什么要借呢？与此同时，市场对于美国政府违约的保险价格CDS，也飙升到了历史最高（图三）。当然，CDS是一剂制造恐慌的良药。曾记否，之前五百万美元的合约就可以把德银的CDS价格卖飞，造成德银身陷囹圄的假象，德银股价应声而落11%。之前的四次美国CDS飙升，都是市场岌岌可危的时刻。其实，这一次美国经济周期复苏和衰退的一个未解之谜，是美联储不断加息，美国经济的势能似乎并没有很快地衰竭，美国消费者的消费能力依然坚挺。专家们似乎并没有反思这个问题。其实，美国家庭的利率敏感型资产大约为17万亿美元，而利率敏感型的债务只有5万亿美元左右，因为美国90%的房贷都是固定利率的。因此，美联储加息反而丰厚了美国家庭的资产，而负债并没有受到什么影响。因此，加息反而增加了美国家庭的消费能力，而非减弱。美国家庭的这张资产负债表，解释了这一轮美国经济周期里美国消费的韧性那么加息的时候谁最受影响，就不言而喻了。那就是像美国政府这样负债累累的，还有像硅谷银行和它的客户的这种，靠低利率来赚取资本利得的食利阶层。因此，每当我听到一些人迫不及待地盼着美联储降息来梭哈一把的时候，我的心是分裂的。世界读书日愉快！洪灝责任编辑：刘万里SF014
国内财经,专家：二次感染新冠风险逐渐增加，症状会轻一些,环球网,2023年04月23日 16:06,原标题李侗曾：二次感染新冠风险逐渐增加，大部分免疫功能正常者症状会轻些近日，社交平台上多地网友发布自己抗原自测第二次阳性的照片，这是否意味着第二波高峰即将到来？首都医科大学附属北京佑安医院感染综合科主任医师李侗曾接受中新社@国是直通车采访时表示，随着大家感染后的时间延长，二次感染的风险也在增加。尤其到了下半年，病毒在变异，大家的抵抗力也在下降。“虽然二次感染的风险会逐渐增加，但也不会像第一次那样在短时间内出现大量人群感染。并且之后的疫情高峰也不会像此前那么明显，可能会呈现一个较缓的波峰”。李侗曾还表示，二次感染对于大部分免疫功能正常的人来说，症状会轻一些。所以无论是发生医疗资源挤兑还是重症高峰，都不会像此前的疫情那样严重了。（汪俐辰）责任编辑：王涵
美股,津巴布韦央行将推出以黄金为基础的数字货币,北京日报客户端,2023年04月23日 16:00,津巴布韦储备银行（央行）23日表示，作为稳定当地货币干预措施的一部分，央行将推出一种以黄金为基础的数字货币，作为津巴布韦的法定货币在该国进行交易。津巴布韦央行称，引入数字黄金货币，将是央行利用该国的黄金储备来使津巴布韦本国货币——津巴布韦元稳固的第一步。这项措施将允许持有少量津巴布韦元的人将他们的钱兑换成数字黄金货币这种代币，以实现价值储存并规避汇率波动风险。与此同时，央行表示还将继续发行更多的“雷鸣雨雾”金币，以抑制最近平行市场上津巴布韦元的贬值。2022年7月25日，津巴布韦央行开始发行重量为1盎司的“雷鸣雨雾”金币并将其作为储值手段引入市场。此后，央行又于同年11月15日开始发行重量较小的金币，分别为二分之一盎司、四分之一盎司和十分之一盎司，这四款金币均无面值。责任编辑：郭明煜
券商研究员调研淄博烧烤,国君淄博烧烤体验纪实：啤酒消费动销有望加速,市场资讯,2023年04月23日 15:57,核心结论随着线下消费场景的复苏，颇具特色的淄博烧烤自今年3月爆火出圈，热度持续升高，带动市内大小门店及周边购物/旅游客流屡创新高，目前淄博五一期间的酒店民宿均已订满，订单量为2019年同期的800%。淄博主流烧烤店客单价（不含酒水）基本在40-70元，消费者选择啤酒、饮料佐餐居多，也有部分食客自带白酒。据我们走访和当地居民反映，淄博地区烧烤消费佐餐以青啤居多，主要涵盖8-12元价位带（青啤经典8元、白啤10元、190310元、纯生12元），本地人单人单次消费2-5瓶不等，外地游客饮用量不定。1．淄博烧烤：体验式餐饮，氛围感拉满1）Why淄博烧烤？淄博烧烤自今年3月爆火出圈，热度不断升高。起初主要吸引周边地区大学生组团前来体验，后随着社交媒体广泛传播，游客络绎不绝。我们认为淄博烧烤大火主要源自良好的口碑和体验感，尤其是淄博地区特有的“方桌火炉小马扎，露天碳烤半自助”模式，对许多消费者来说是全新的体验，在线下消费场景复苏的背景下吸引了大量食客。2）What，蘸料包括但不限于辣酱/芝麻盐/辣椒面/花生碎/饼干碎等，小葱则用于解腻，通常以酒水/饮料佐餐，其中啤酒品牌主要为青啤等、也有食客自带白酒，青啤经典（8元）/白啤（10元）/1903（10元）/纯生（12元）各烧烤店单瓶售价基本一致。从定价来看，淄博烧烤价格较为实惠，不同烧烤店之间食材定价依分量而定，客单价（不含酒水）基本在40-70元。淄博当地有大量烧烤商家，淄博市烧烤协会会长陈强在接受南方周末采访时曾透露，目前淄博全市有1270+家烧烤店（营业执照数量口径），部分小店日营业额已突破10万元。据我们了解，淄博地区烧烤店之间的差异主要体现在肉质和腌制过程上，当地市民除了选择以上“网红店”，也会前往其他小店（如社区烧烤店）就餐，部分市民甚至会驾车半个多小时前往金岭回族镇吃烧烤（和市内用的圆形薄饼不同，金岭镇主要使用长形小饼、口感更韧）。大店中，以经营30余年的牧羊村总店为例，其单店规模较大（50+桌），凭借较高的名气带动周边几家烧烤店，形成“烧烤一条街”的集聚效应，许多游客即便排不上号也会来现场看看。4）When除全天营业的门店以外，淄博大部分的烧烤店下午4-5点开业，晚上10点左右停止接待新食客，最晚营业至凌晨12点以后。从排队等位情况来看：1）网红店排队时间较长：工作日午后到场排队花费1-2小时是常态；而到了周末、节假日等高峰期，许多食客为了抢到下午第一场、上午8-9点就已在现场等待。2）非网红小店排队时间通常较短，尤其是当地人居多的社区烧烤店等，晚餐时间相对不那么拥挤。据我们了解，许多淄博居民会以烧烤作为晚餐“第二场”，因此晚上6-7点这些烧烤店才进入营业高峰期。随着五一假期临近，后续各烧烤店排队时间预计将有所延长。5）Who淄博烧烤的消费人群以中青年为主，时间相对灵活的大学生群体往往选择工作日乘坐高铁前来打卡体验，周末不少游客也会自驾前来，从车牌来看包括但不限于山东其他地区、北京、天津、河北、河南、安徽等地。此外，在牧羊村这类门店面积和客流量较大的地方也有不少主播过来探店，淄博市政府出动了大量工作人员监督规范其行为，整体上网红直播并不影响其他游客的体验。6）How淄博的烧烤店常采用室内、室外结合，碳烤为主、部分电烤的模式。消费者前来用餐需：1）先领菜单占位（因此才会出现部分门店早上即排队的现象），2）点餐后排队结账，3）等待出餐。除个别烧烤店提供全生食材外，大部分门店会在烤至5-8分熟后提供给消费者，既保证了用餐体验，也提高了翻台率。2．烧烤周边：八大局“逛吃”、海岱楼观景……在烧烤的带动下，淄博的八大局街区、各个景点/商圈客流量都有了明显提升。以同为饮食消费的八大局为例：3月初时，大学生为主的年轻群体餐饮消费主要集中烧烤店，到3月末4月初时，淄博市内另一特色街区“八大局”紧跟着出圈。八大局是一条以纵向街道为主的小吃街，全长约680米，穿插两条供居民早市买菜的东西向街道，其中散落着大量售卖炒锅饼、紫米饼、牛奶棒等淄博特色小吃的门店，由于其价格实惠（以炒锅饼为例，街道内各门店统一售价6元/份），目前已是不少游客打卡的“必经之地”。据现场工作人员反映，八大局早市结束后7-8点就已有不少前来“逛吃”的游客，到晚上9-10点以后客流方才开始减少，预计五一假期客流将更为密集。3．配套措施到位，热度有望延续淄博烧烤走红的背后，当地政府采取了一系列措施保障和丰富游客体验，包括加开“烧烤专列”、开通烧烤公交专线、发布烧烤地图、旅游景区凭高铁票免票游览、提供青年驿站优惠价、严打恶意涨价等经营不诚信行为等等，同时成立烧烤协会专门规划运营淄博烧烤产业。在客流集中的烧烤门店，淄博政府派驻了大量工作人员（负责引导游客和监管商贩及网红行为，当地人称“红马甲”）、警察、城管、交警，高峰期甚至驻扎了消防车，因此尽管现场人员密集，但仍维持了较好的秩序。从交通设施来看，淄博市内通行较为便捷，自驾/打车/搭乘公交大巴等可达，热门餐饮/景点均设有志愿者，为游客提供交通和游玩指南。（热门餐饮/景点配套了交通设施）为进一步做大烧烤产业，淄博将于，集中展示淄博市烧烤名店、特色品种，辅以演出、啤酒展销等，为市民和游客提供优质烧烤产品，此外拟定3月-11月为“淄博烧烤季”，最大限度保证烧烤热度效应延续。目前淄博五一期间的酒店民宿均已订满，截至4月中旬的订单量为2019年同期的800%。本公众订阅号（微信号：gjretail）为证券研究所食品饮料/化妆品研究团队依法设立并运营的微信公众订阅号。本团队负责人訾猛具备证券投资咨询（分析师）执业资格，资格证书编号为S0880513120002。本订阅号不是国泰君安证券研究报告发布平台。本订阅号所载内容均来自于国泰君安证券研究所已正式发布的研究报告，如需了解详细的证券研究信息，请具体参见国泰君安证券研究所发布的完整报告。本订阅号推送的信息仅限完整报告发布当日有效，发布日后推送的信息受限于相关因素的更新而不再准确或者失效的，本订阅号不承担更新推送信息或另行通知义务，后续更新信息以国泰君安证券研究所正式发布的研究报告为准。本订阅号所载内容仅面向国泰君安证券研究服务签约客户。因本资料暂时无法设置访问限制，根据《证券期货投资者适当性管理办法》的要求，若您并非国泰君安证券研究服务签约客户，为控制投资风险，还请取消关注，请勿订阅、接收或使用本订阅号中的任何信息。如有不便，敬请谅解。市场有风险，投资需谨慎。在任何情况下，本订阅号中信息或所表述的意见均不构成对任何人的投资建议。在决定投资前，如有需要，投资者务必向专业人士咨询并谨慎决策。国泰君安证券及本订阅号运营团队不对任何人因使用本订阅号所载任何内容所引致的任何损失负任何责任。本订阅号所载内容版权仅为国泰君安证券所有。任何机构和个人未经书面许可不得以任何形式翻版、复制、转载、刊登、发表、篡改或者引用，如因侵权行为给国泰君安证券研究所造成任何直接或间接的损失，国泰君安证券研究所保留追究一切法律责任的权利。来源：猛哥看商业责任编辑：凌辰
2023中国绿公司论坛,火链科技CEO袁煜明：目前ChatGPT没有很好的盈利模式 一直在烧土豪们的钱,睿见Economy,2023年04月23日 15:56,2023中国绿公司论坛暨企业绿色发展研究院年会于4月22日-24日在海南举行。火链科技CEO、火链科技研究院院长袁煜明出席“人工智能的应用式创新”论坛并发表演讲。袁煜明表示，未来AI的应用越来越广泛，涉及到很多AI之间怎么样交互的问题，人之间用区块链可以更好的实现多方协作，但这并没有那么容易。因为人们之间本来就有现成的社会体系和规则流程，AI目前是没有的，所以通过区块链去建立这么一套体系反而效果更好。同时，区块链行业本身一定程度上也可以被AI进行改造，有个概念叫智能合约，智能合约并不是人工智能，只是名字这么叫而已，这个东西算是区块链领域相对复杂度比较高的。最后，袁煜明指出，toB怎么样更好的有盈利模式，这个问题在ChatGPT出来以后反而变得更严重了，相当于把很多饭碗给端了，其实它也没有很好的盈利模式，一直是在烧土豪们的钱，未来到底怎么样有目前不是很清晰。新浪声明：所有会议实录均为现场速记整理，未经演讲者审阅，新浪网登载此文出于传递更多信息之目的，并不意味着赞同其观点或证实其描述。责任编辑：邓健
2023中国绿公司论坛,博瀚智能CEO郭玮：如何把大模型以高效低成本方式落地到千行百业值得思考 而不是去“百模大战”,睿见Economy,2023年04月23日 15:56,2023中国绿公司论坛暨企业绿色发展研究院年会于4月22日-24日在海南举行。博瀚智能（深圳）有限公司创始人、CEO郭玮出席“人工智能的应用式创新”论坛并发表演讲。郭玮表示，ChatGPT过去两三个月里在AI行业掀起了一股新的热浪，ChatGPT带来的简直就是当年AlphaGo之后再次向产业整个行业证实了人工智能可能带来的能力以及具备的潜力，这一点它带来的意义是最大的。但ChatGPT毕竟是一个人工对话的机器，尽管它能力很大，但应用的场景有限。由此他指出，目前AI在落地过程中都会遇到两个很痛的问题，尤其在toB领域里，人工智能由于场景的碎片化导致了大量定制化开发不能被复用，直接原因是人模型泛化能力很差，针对不同的场景要开发不同的模型需要进行不同的适配。郭玮指出，AI在工业领域里有很大的发展前景包括在自动驾驶领域，为什么到今天很多企业需要AI技术的落地却落不进去？从两个方面来看，从客户的角度来看，AI是一个又贵又不好用的工具，开始落地的时候需要客户大量的配合和投入以及支持，投入了大量的人力好不容易把AI工具在某条产线上使用起来了，过了三个月，这个工具不好用了，精度开始下降了，一换产品根本不能用了，得重新弄模型，又把供应商叫过来从头再搞一遍。上线以后AI的运维成本太高，所以客户对它没有兴趣。从供应商角度来讲，作为AI公司自己也有很大的苦衷，双方在供需关系上已经产生差异了，这个问题解决不了的话没有办法把AI不管工业制造还是在自动驾驶还是其他行业里成功落地，自动驾驶存在非常类似的问题，怎么样解决这样的问题是作为一个AI技术供应商、AI企业、AI技术开发者应该深度思考的问题。大模型为什么对这方面有用？在他看来，大模型已试图解决AI落地过程中第一个环节的痛点问题，就是如何把开发的碎片化整合起来，通过一个模型去适配多个场景或通过一个模型快速迭代适配多个场景。大模型在这个领域里会产生巨大的作用，但就算有了大模型大家还要思考一个问题，大模型是需要大量的资源，是高高在上在云端的一个东西，如何把大模型的能力通过一个高效低成本的方式落地到千行百业中是今天真正应该好好思考的，而不是应该去百模大战。新浪声明：所有会议实录均为现场速记整理，未经演讲者审阅，新浪网登载此文出于传递更多信息之目的，并不意味着赞同其观点或证实其描述。责任编辑：邓健
2023中国绿公司论坛,盛景网联CEO刘燕：ChatGPT火起来以后，中国似乎出现了“百模大战”,睿见Economy,2023年04月23日 15:56,2023中国绿公司论坛暨企业绿色发展研究院年会于4月22日-24日在海南举行。盛景网联科技股份有限公司CEO刘燕出席“人工智能的应用式创新”论坛并发表演讲。刘燕表示，伴随着ChatGPT在中国好象出现了百模大战，五道口异常热闹，在大模型领域可能它有基础层、中间层和应用层，在技术领域大家现在在做更多的探讨，但是很多时候站在商业角度不仅要关注技术领域，可能还要关注于非技术领域，比如人文领域，人工智能所带来的不仅仅是技术问题而是带来了文化、心理等的引导，换句话说，它不仅是个技术，甚至是关于科技向善的一些事情。在刘燕看来，AI也好其他也罢，落实到垂直产业的时候，核心就是一定要解决产业的问题和痛点，不仅是解决效率问题更是解决人员的伤亡问题，对人类来说是很大的痛点，这里面有巨大的空间和场景，换句话说，做AI能不能赚钱，有没有人给你买单，当你真正去解决行业痛点的时候包括在去之前还说是不是无人驾驶降低成本更便宜，其实到了产业端不是成本问题，是人员伤亡问题，哪怕多X倍都愿意去买单。最后，刘燕指出，AI的另一个优势是强烈的横向扩张，它通过一张连起来的视觉网，一个大脑智能决策，N个应用就可以应用到很多场景里。新浪声明：所有会议实录均为现场速记整理，未经演讲者审阅，新浪网登载此文出于传递更多信息之目的，并不意味着赞同其观点或证实其描述。责任编辑：邓健
2023中国绿公司论坛,麒麟合盛集团张旭：现在很多公司在做大模型 但未来行业里或只剩两三家,睿见Economy,2023年04月23日 15:54,2023中国绿公司论坛暨企业绿色发展研究院年会于4月22日-24日在海南举行。麒麟合盛集团技术负责人张旭出席“人工智能的应用式创新”论坛并发表演讲。张旭表示，ChatGPT给世人展示了大模型具有这么强的泛化能力以后，今天大家看到千模大战。移动互联网刚出来的时候，操作系统有安卓、iPhone、塞班、IOS等一系列操作系统，但后来这些操作系统慢慢死掉了，最后行业竞争下来就剩下了安卓和IOS、鸿蒙。今天很多家都在做大模型，未来也会经过收敛的过程，最后行业里也许会剩下两到三家做大模型的公司，他们比拼的是能不能在这个大模型基础上把生态建起来更好的满足用户需求。谈到OPENAI，张旭称，OPENAI训练成本和推理成本很高，它有更长远的目标，现在有微软作后盾，对成本不用太考虑。但OPENAI还有个问题，它毕竟是美国公司，可能哪天美国政府出个什么政策可能就被掐断了。新浪声明：所有会议实录均为现场速记整理，未经演讲者审阅，新浪网登载此文出于传递更多信息之目的，并不意味着赞同其观点或证实其描述。责任编辑：邓健
美股,韩国本土航司一季度国际航班客运量同比增15倍,界面新闻,2023年04月23日 15:53,韩联社4月23日消息，韩国国土交通部23日发布的航空统计数据，今年第一季度本土航空公司的国际航班客运量达987.7577万人次，为去年同期（61.9204万人次）的16倍。大韩航空、韩亚航空等大型航空公司国际航线的客运量同比增加6.8倍，为447万人次，占整体国际航线客运量的45%。其余541万人次利用低成本航司，同比暴增约103倍，在国际航线总客运量中所占比重从去年的8.4%增加到今年的55%。据券商分析，由于被推迟三年多的出国游需求暴增，且旅游消费信心回升，低成本航司第一季度业绩有望创下历年同期最高记录。大韩航空和韩亚航空的情况则截然不同。有观点认为，虽然大韩航空去年业绩创下历史最高记录，但受货运费用和吞吐量双双下降的影响，今年第一季度业绩可能不太。另据分析，在今年第二季度之后，得力于货运销售额和国际航线客运量增加，大韩航空业绩有望得到改善。责任编辑：郭明煜
